,Tweets,id,date,likes,retweets,place
0,وزنه 20 كلغ.. إزالة ورم من ستينية تجنبت الفحوصات خوفاً من كورونا  ,1334487945261195264,2020-12-03 13:21:34,0,0,"Place(_api=<tweepy.api.API object at 0x7f603361e790>, id='001907e868d06e24', url='https://api.twitter.com/1.1/geo/id/001907e868d06e24.json', place_type='admin', name='Dubai', full_name='Dubai, United Arab Emirates', country_code='AE', country='United Arab Emirates', contained_within=[], bounding_box=BoundingBox(_api=<tweepy.api.API object at 0x7f603361e790>, type='Polygon', coordinates=[[[54.8939725, 24.6182526], [56.2083722, 24.6182526], [56.2083722, 25.3686719], [54.8939725, 25.3686719]]]), attributes={})"
1,الزعل المستمر واللوم المستمر يُميت لذة كل شيء وإن كان من غير قصد إمدحوا حسنات بعضكم وتجاوزوا عن الأخطاء فالكلام الجميل مثل المفاتيح تفتح به قلوب من حولك تغافل مره وتغابى مرتان فليس كل شيء يستحق الأهتمام لا تعطي الأمور أكبر من حجمها إن رأيت أمامك حجر ألقهِ خلفك وتقدم ,1334476717998522369,2020-12-03 12:36:57,10,1,"Place(_api=<tweepy.api.API object at 0x7f603361e790>, id='00f24ae701a1207b', url='https://api.twitter.com/1.1/geo/id/00f24ae701a1207b.json', place_type='admin', name='Abu Dhabi', full_name='Abu Dhabi, United Arab Emirates', country_code='AE', country='United Arab Emirates', contained_within=[], bounding_box=BoundingBox(_api=<tweepy.api.API object at 0x7f603361e790>, type='Polygon', coordinates=[[[51.2938738, 22.6261387], [56.0175464, 22.6261387], [56.0175464, 25.1639588], [51.2938738, 25.1639588]]]), attributes={})"
2,لقاح كورونا إفريقيا تحتاج لتلقيح 60% من سكانها ضد كورونا.. وإلا  ,1334471831449812993,2020-12-03 12:17:32,0,0,"Place(_api=<tweepy.api.API object at 0x7f603361e790>, id='001907e868d06e24', url='https://api.twitter.com/1.1/geo/id/001907e868d06e24.json', place_type='admin', name='Dubai', full_name='Dubai, United Arab Emirates', country_code='AE', country='United Arab Emirates', contained_within=[], bounding_box=BoundingBox(_api=<tweepy.api.API object at 0x7f603361e790>, type='Polygon', coordinates=[[[54.8939725, 24.6182526], [56.2083722, 24.6182526], [56.2083722, 25.3686719], [54.8939725, 25.3686719]]]), attributes={})"
3,"“الصحة” تجري 132,380 فحصا ضمن خططها لتوسيع نطاق الفحوصات وتكشف عن 1,317 إصابة جديدة بفيروس كورونا المستجد و655 حالة شفاء و5 حالات وفاة خلال الساعات ال…  ",1334448684587630595,2020-12-03 10:45:33,1,0,"Place(_api=<tweepy.api.API object at 0x7f603361e790>, id='001907e868d06e24', url='https://api.twitter.com/1.1/geo/id/001907e868d06e24.json', place_type='admin', name='Dubai', full_name='Dubai, United Arab Emirates', country_code='AE', country='United Arab Emirates', contained_within=[], bounding_box=BoundingBox(_api=<tweepy.api.API object at 0x7f603361e790>, type='Polygon', coordinates=[[[54.8939725, 24.6182526], [56.2083722, 24.6182526], [56.2083722, 25.3686719], [54.8939725, 25.3686719]]]), attributes={})"
4,“الصحة” تكشف عن 1317 إصابة جديدة بفيروس كورونا المستجد  ,1334448681236357121,2020-12-03 10:45:33,1,0,"Place(_api=<tweepy.api.API object at 0x7f603361e790>, id='001907e868d06e24', url='https://api.twitter.com/1.1/geo/id/001907e868d06e24.json', place_type='admin', name='Dubai', full_name='Dubai, United Arab Emirates', country_code='AE', country='United Arab Emirates', contained_within=[], bounding_box=BoundingBox(_api=<tweepy.api.API object at 0x7f603361e790>, type='Polygon', coordinates=[[[54.8939725, 24.6182526], [56.2083722, 24.6182526], [56.2083722, 25.3686719], [54.8939725, 25.3686719]]]), attributes={})"
5,الصين تجرب لقاحها ضد كورونا على 29 ألف شخص في العالم  ,1334439749570813954,2020-12-03 10:10:03,1,0,"Place(_api=<tweepy.api.API object at 0x7f603361e790>, id='001907e868d06e24', url='https://api.twitter.com/1.1/geo/id/001907e868d06e24.json', place_type='admin', name='Dubai', full_name='Dubai, United Arab Emirates', country_code='AE', country='United Arab Emirates', contained_within=[], bounding_box=BoundingBox(_api=<tweepy.api.API object at 0x7f603361e790>, type='Polygon', coordinates=[[[54.8939725, 24.6182526], [56.2083722, 24.6182526], [56.2083722, 25.3686719], [54.8939725, 25.3686719]]]), attributes={})"
6,لم تشملهن التجارب السريرية.. فهل يشكل لقاح كورونا خطراً على الحوامل؟  ,1334439745963769856,2020-12-03 10:10:02,1,0,"Place(_api=<tweepy.api.API object at 0x7f603361e790>, id='001907e868d06e24', url='https://api.twitter.com/1.1/geo/id/001907e868d06e24.json', place_type='admin', name='Dubai', full_name='Dubai, United Arab Emirates', country_code='AE', country='United Arab Emirates', contained_within=[], bounding_box=BoundingBox(_api=<tweepy.api.API object at 0x7f603361e790>, type='Polygon', coordinates=[[[54.8939725, 24.6182526], [56.2083722, 24.6182526], [56.2083722, 25.3686719], [54.8939725, 25.3686719]]]), attributes={})"
7,كورونا يتمدد في إيطاليا وفرنسا وألمانيا وبريطانيا  ,1334438876631367682,2020-12-03 10:06:35,2,0,"Place(_api=<tweepy.api.API object at 0x7f603361e790>, id='001907e868d06e24', url='https://api.twitter.com/1.1/geo/id/001907e868d06e24.json', place_type='admin', name='Dubai', full_name='Dubai, United Arab Emirates', country_code='AE', country='United Arab Emirates', contained_within=[], bounding_box=BoundingBox(_api=<tweepy.api.API object at 0x7f603361e790>, type='Polygon', coordinates=[[[54.8939725, 24.6182526], [56.2083722, 24.6182526], [56.2083722, 25.3686719], [54.8939725, 25.3686719]]]), attributes={})"
8,أوباما: على استعداد تام للتطعيم باللقاح ضد كورونا  ,1334435850604535809,2020-12-03 09:54:34,3,0,"Place(_api=<tweepy.api.API object at 0x7f603361e790>, id='001907e868d06e24', url='https://api.twitter.com/1.1/geo/id/001907e868d06e24.json', place_type='admin', name='Dubai', full_name='Dubai, United Arab Emirates', country_code='AE', country='United Arab Emirates', contained_within=[], bounding_box=BoundingBox(_api=<tweepy.api.API object at 0x7f603361e790>, type='Polygon', coordinates=[[[54.8939725, 24.6182526], [56.2083722, 24.6182526], [56.2083722, 25.3686719], [54.8939725, 25.3686719]]]), attributes={})"
9,كورونا حول العالم… 1.5 مليون وفاة و64.5 مليون إصابة  ,1334414969530552324,2020-12-03 08:31:35,1,1,"Place(_api=<tweepy.api.API object at 0x7f603361e790>, id='001907e868d06e24', url='https://api.twitter.com/1.1/geo/id/001907e868d06e24.json', place_type='admin', name='Dubai', full_name='Dubai, United Arab Emirates', country_code='AE', country='United Arab Emirates', contained_within=[], bounding_box=BoundingBox(_api=<tweepy.api.API object at 0x7f603361e790>, type='Polygon', coordinates=[[[54.8939725, 24.6182526], [56.2083722, 24.6182526], [56.2083722, 25.3686719], [54.8939725, 25.3686719]]]), attributes={})"
10,الوجهة الأولى من بعد كورونا  ,1334404418293346304,2020-12-03 07:49:40,0,0,"Place(_api=<tweepy.api.API object at 0x7f603361e790>, id='00f24ae701a1207b', url='https://api.twitter.com/1.1/geo/id/00f24ae701a1207b.json', place_type='admin', name='Abu Dhabi', full_name='Abu Dhabi, United Arab Emirates', country_code='AE', country='United Arab Emirates', contained_within=[], bounding_box=BoundingBox(_api=<tweepy.api.API object at 0x7f603361e790>, type='Polygon', coordinates=[[[51.2938738, 22.6261387], [56.0175464, 22.6261387], [56.0175464, 25.1639588], [51.2938738, 25.1639588]]]), attributes={})"
11,شعار هذه السنة لليوم العالمي للاشخاص ذوي الإعاقة ( إعادة البناء بشكل افضل بعد جائحة كوفيد -19 ) سيتم التركيز خلال الورشة على انشطة منزلية وذلك لزيادة الانتباه و التركيز للاطفال خصوصا اثناء التعليم عن بعد,1334394821792985088,2020-12-03 07:11:32,2,1,"Place(_api=<tweepy.api.API object at 0x7f603361e790>, id='001907e868d06e24', url='https://api.twitter.com/1.1/geo/id/001907e868d06e24.json', place_type='admin', name='Dubai', full_name='Dubai, United Arab Emirates', country_code='AE', country='United Arab Emirates', contained_within=[], bounding_box=BoundingBox(_api=<tweepy.api.API object at 0x7f603361e790>, type='Polygon', coordinates=[[[54.8939725, 24.6182526], [56.2083722, 24.6182526], [56.2083722, 25.3686719], [54.8939725, 25.3686719]]]), attributes={})"
12,إصابات كورونا في العالم تتجاوز 64.03 مليون والوفيات مليون و489276  ,1334392312265285632,2020-12-03 07:01:33,1,0,"Place(_api=<tweepy.api.API object at 0x7f603361e790>, id='001907e868d06e24', url='https://api.twitter.com/1.1/geo/id/001907e868d06e24.json', place_type='admin', name='Dubai', full_name='Dubai, United Arab Emirates', country_code='AE', country='United Arab Emirates', contained_within=[], bounding_box=BoundingBox(_api=<tweepy.api.API object at 0x7f603361e790>, type='Polygon', coordinates=[[[54.8939725, 24.6182526], [56.2083722, 24.6182526], [56.2083722, 25.3686719], [54.8939725, 25.3686719]]]), attributes={})"
13,مليار شخص مهددون بالفقر المدقع بسبب تداعيات “كورونا”  ,1334392308192538624,2020-12-03 07:01:32,1,0,"Place(_api=<tweepy.api.API object at 0x7f603361e790>, id='001907e868d06e24', url='https://api.twitter.com/1.1/geo/id/001907e868d06e24.json', place_type='admin', name='Dubai', full_name='Dubai, United Arab Emirates', country_code='AE', country='United Arab Emirates', contained_within=[], bounding_box=BoundingBox(_api=<tweepy.api.API object at 0x7f603361e790>, type='Polygon', coordinates=[[[54.8939725, 24.6182526], [56.2083722, 24.6182526], [56.2083722, 25.3686719], [54.8939725, 25.3686719]]]), attributes={})"
14,مليار شخص مهددون بالفقر المدقع بسبب تداعيات “كورونا” ,1334390674431492096,2020-12-03 06:55:03,2,0,"Place(_api=<tweepy.api.API object at 0x7f603361e790>, id='001907e868d06e24', url='https://api.twitter.com/1.1/geo/id/001907e868d06e24.json', place_type='admin', name='Dubai', full_name='Dubai, United Arab Emirates', country_code='AE', country='United Arab Emirates', contained_within=[], bounding_box=BoundingBox(_api=<tweepy.api.API object at 0x7f603361e790>, type='Polygon', coordinates=[[[54.8939725, 24.6182526], [56.2083722, 24.6182526], [56.2083722, 25.3686719], [54.8939725, 25.3686719]]]), attributes={})"
15,وول ستريت جورنال-كشفت اللجنه الأولمبية في اليابان عن خطة أولية للسلامة من فيروس كورونا لدورة ألعاب طوكيو 2020 ، والتي تم تأجيلها إلى يوليو 2021. ,1334383958826553345,2020-12-03 06:28:22,1,1,"Place(_api=<tweepy.api.API object at 0x7f603361e790>, id='01b984d319b42814', url='https://api.twitter.com/1.1/geo/id/01b984d319b42814.json', place_type='admin', name='Ras Al Khaimah', full_name='Ras Al Khaimah, United Arab Emirates', country_code='AE', country='United Arab Emirates', contained_within=[], bounding_box=BoundingBox(_api=<tweepy.api.API object at 0x7f603361e790>, type='Polygon', coordinates=[[[55.7414877, 24.8517657], [56.3489937, 24.8517657], [56.3489937, 26.0841599], [55.7414877, 26.0841599]]]), attributes={})"
16,وول ستريت جورنال- الاولى في العالم ، منحت بريطانيا تصريحًا طارئًا للقاح فيروس كورونا التابع لشركة فايزر يوم الأربعاء. بدأت المستشفيات في البلاد بالفعل في إرسال بريد إلكتروني إلى الموظفين لتحديد مواعيد التطعيمات ، مع إعطاء الجرعات الأولى في لندن الساعة 7 صباحًا يوم الاثنين. ,1334383095987003396,2020-12-03 06:24:56,6,1,"Place(_api=<tweepy.api.API object at 0x7f603361e790>, id='01b984d319b42814', url='https://api.twitter.com/1.1/geo/id/01b984d319b42814.json', place_type='admin', name='Ras Al Khaimah', full_name='Ras Al Khaimah, United Arab Emirates', country_code='AE', country='United Arab Emirates', contained_within=[], bounding_box=BoundingBox(_api=<tweepy.api.API object at 0x7f603361e790>, type='Polygon', coordinates=[[[55.7414877, 24.8517657], [56.3489937, 24.8517657], [56.3489937, 26.0841599], [55.7414877, 26.0841599]]]), attributes={})"
17,كورونا في أمريكا… 270 ألف وفاة و14 مليون إصابة  ,1334382495681323008,2020-12-03 06:22:33,1,0,"Place(_api=<tweepy.api.API object at 0x7f603361e790>, id='001907e868d06e24', url='https://api.twitter.com/1.1/geo/id/001907e868d06e24.json', place_type='admin', name='Dubai', full_name='Dubai, United Arab Emirates', country_code='AE', country='United Arab Emirates', contained_within=[], bounding_box=BoundingBox(_api=<tweepy.api.API object at 0x7f603361e790>, type='Polygon', coordinates=[[[54.8939725, 24.6182526], [56.2083722, 24.6182526], [56.2083722, 25.3686719], [54.8939725, 25.3686719]]]), attributes={})"
18,تبادل كورونا ,1334365762862129161,2020-12-03 05:16:03,1,0,"Place(_api=<tweepy.api.API object at 0x7f603361e790>, id='01b984d319b42814', url='https://api.twitter.com/1.1/geo/id/01b984d319b42814.json', place_type='admin', name='Ras Al Khaimah', full_name='Ras Al Khaimah, United Arab Emirates', country_code='AE', country='United Arab Emirates', contained_within=[], bounding_box=BoundingBox(_api=<tweepy.api.API object at 0x7f603361e790>, type='Polygon', coordinates=[[[55.7414877, 24.8517657], [56.3489937, 24.8517657], [56.3489937, 26.0841599], [55.7414877, 26.0841599]]]), attributes={})"
19,تأتي هذه الخطوة خلال موسم الأعياد عندما يعتمد تجار التجزئة بشكل متزايد على شركات التوصيل لنقل الطلبات عبر الإنترنت ، حيث انخفضت حركة التسوق المتاجر خلال وباء فيروس كورونا. رفعت UPS وشركة FedEx الأسعار وقالتا انهما ستقومان بإلزام التجار باتفاقيات الحجم.,1334362146940063744,2020-12-03 05:01:41,1,0,"Place(_api=<tweepy.api.API object at 0x7f603361e790>, id='01b984d319b42814', url='https://api.twitter.com/1.1/geo/id/01b984d319b42814.json', place_type='admin', name='Ras Al Khaimah', full_name='Ras Al Khaimah, United Arab Emirates', country_code='AE', country='United Arab Emirates', contained_within=[], bounding_box=BoundingBox(_api=<tweepy.api.API object at 0x7f603361e790>, type='Polygon', coordinates=[[[55.7414877, 24.8517657], [56.3489937, 24.8517657], [56.3489937, 26.0841599], [55.7414877, 26.0841599]]]), attributes={})"
20,سنغافورة - تحول دويتشه بنك إلى الاعتقاد بالاتجاه الهبوطي للذهب ، بعد شهور من وصول المعدن الثمين إلى مستويات قياسية. في أواخر يوليو ، ارتفعت أسعار المعدن الثمين إلى أعلى مستوياتها على الإطلاق وسط مخاوف من التداعيات الاقتصادية لوباء فيروس كورونا. ,1334356348381761536,2020-12-03 04:38:39,5,1,"Place(_api=<tweepy.api.API object at 0x7f603361e790>, id='01b984d319b42814', url='https://api.twitter.com/1.1/geo/id/01b984d319b42814.json', place_type='admin', name='Ras Al Khaimah', full_name='Ras Al Khaimah, United Arab Emirates', country_code='AE', country='United Arab Emirates', contained_within=[], bounding_box=BoundingBox(_api=<tweepy.api.API object at 0x7f603361e790>, type='Polygon', coordinates=[[[55.7414877, 24.8517657], [56.3489937, 24.8517657], [56.3489937, 26.0841599], [55.7414877, 26.0841599]]]), attributes={})"
21,تستأنف منظمة البلدان المصدرة للبترول (أوبك) وروسيا المناقشات اليوم الخميس للاتفاق على سياسات 2021 بعد أن لم تسفر المحادثات السابقة عن حل وسط بشأن كيفية معالجة ضعف الطلب على النفط وسط موجة جديدة من فيروس كورونا.,1334351802523766784,2020-12-03 04:20:35,3,0,"Place(_api=<tweepy.api.API object at 0x7f603361e790>, id='01b984d319b42814', url='https://api.twitter.com/1.1/geo/id/01b984d319b42814.json', place_type='admin', name='Ras Al Khaimah', full_name='Ras Al Khaimah, United Arab Emirates', country_code='AE', country='United Arab Emirates', contained_within=[], bounding_box=BoundingBox(_api=<tweepy.api.API object at 0x7f603361e790>, type='Polygon', coordinates=[[[55.7414877, 24.8517657], [56.3489937, 24.8517657], [56.3489937, 26.0841599], [55.7414877, 26.0841599]]]), attributes={})"
22,طوكيو (رويترز) - تراجعت أسعار النفط يوم الخميس مع خلاف بين منتجين من بينهم السعودية وروسيا بشأن الحاجة إلى تمديد تخفيضات الإنتاج القياسية التي تم وضعها في الموجة الأولى من جائحة كوفيد -19. ,1334351798031642624,2020-12-03 04:20:34,7,1,"Place(_api=<tweepy.api.API object at 0x7f603361e790>, id='01b984d319b42814', url='https://api.twitter.com/1.1/geo/id/01b984d319b42814.json', place_type='admin', name='Ras Al Khaimah', full_name='Ras Al Khaimah, United Arab Emirates', country_code='AE', country='United Arab Emirates', contained_within=[], bounding_box=BoundingBox(_api=<tweepy.api.API object at 0x7f603361e790>, type='Polygon', coordinates=[[[55.7414877, 24.8517657], [56.3489937, 24.8517657], [56.3489937, 26.0841599], [55.7414877, 26.0841599]]]), attributes={})"
23,لقاح كورونا تصريح محبط.. الصحة العالمية: لن تكون لدينا تطعيمات كافية  ,1334343358198599681,2020-12-03 03:47:02,2,1,"Place(_api=<tweepy.api.API object at 0x7f603361e790>, id='001907e868d06e24', url='https://api.twitter.com/1.1/geo/id/001907e868d06e24.json', place_type='admin', name='Dubai', full_name='Dubai, United Arab Emirates', country_code='AE', country='United Arab Emirates', contained_within=[], bounding_box=BoundingBox(_api=<tweepy.api.API object at 0x7f603361e790>, type='Polygon', coordinates=[[[54.8939725, 24.6182526], [56.2083722, 24.6182526], [56.2083722, 25.3686719], [54.8939725, 25.3686719]]]), attributes={})"
24,موريتانيا تغلق المدارس والجامعات للحدّ من تفشي كورونا  ,1334340348286390275,2020-12-03 03:35:04,1,0,"Place(_api=<tweepy.api.API object at 0x7f603361e790>, id='001907e868d06e24', url='https://api.twitter.com/1.1/geo/id/001907e868d06e24.json', place_type='admin', name='Dubai', full_name='Dubai, United Arab Emirates', country_code='AE', country='United Arab Emirates', contained_within=[], bounding_box=BoundingBox(_api=<tweepy.api.API object at 0x7f603361e790>, type='Polygon', coordinates=[[[54.8939725, 24.6182526], [56.2083722, 24.6182526], [56.2083722, 25.3686719], [54.8939725, 25.3686719]]]), attributes={})"
25,إصابات كورونا تتجاوز 63.9 مليون عالمياً والوفيات مليون و486179  ,1334340343450324993,2020-12-03 03:35:03,1,0,"Place(_api=<tweepy.api.API object at 0x7f603361e790>, id='001907e868d06e24', url='https://api.twitter.com/1.1/geo/id/001907e868d06e24.json', place_type='admin', name='Dubai', full_name='Dubai, United Arab Emirates', country_code='AE', country='United Arab Emirates', contained_within=[], bounding_box=BoundingBox(_api=<tweepy.api.API object at 0x7f603361e790>, type='Polygon', coordinates=[[[54.8939725, 24.6182526], [56.2083722, 24.6182526], [56.2083722, 25.3686719], [54.8939725, 25.3686719]]]), attributes={})"
26,يا سمرا ياللي عنيكي كدابيين.. والله لو بعشق حجر هايلين  Adham Seliman - Ya Samra (Official Video Clip) | أدهم سليمان - يا سمرا  via,1334319391035580417,2020-12-03 02:11:47,1,0,"Place(_api=<tweepy.api.API object at 0x7f603361e790>, id='00f24ae701a1207b', url='https://api.twitter.com/1.1/geo/id/00f24ae701a1207b.json', place_type='admin', name='Abu Dhabi', full_name='Abu Dhabi, United Arab Emirates', country_code='AE', country='United Arab Emirates', contained_within=[], bounding_box=BoundingBox(_api=<tweepy.api.API object at 0x7f603361e790>, type='Polygon', coordinates=[[[51.2938738, 22.6261387], [56.0175464, 22.6261387], [56.0175464, 25.1639588], [51.2938738, 25.1639588]]]), attributes={})"
27,بلدية دبي تنذر 15 مؤسسة لإهمال ضوابط «كورونا»  ,1334258440818999297,2020-12-02 22:09:36,0,0,"Place(_api=<tweepy.api.API object at 0x7f603361e790>, id='001907e868d06e24', url='https://api.twitter.com/1.1/geo/id/001907e868d06e24.json', place_type='admin', name='Dubai', full_name='Dubai, United Arab Emirates', country_code='AE', country='United Arab Emirates', contained_within=[], bounding_box=BoundingBox(_api=<tweepy.api.API object at 0x7f603361e790>, type='Polygon', coordinates=[[[54.8939725, 24.6182526], [56.2083722, 24.6182526], [56.2083722, 25.3686719], [54.8939725, 25.3686719]]]), attributes={})"
28,1285 إصابة جديدة بـ «كورونا».. و713 حالة شفاء  ,1334258437136367617,2020-12-02 22:09:35,0,0,"Place(_api=<tweepy.api.API object at 0x7f603361e790>, id='001907e868d06e24', url='https://api.twitter.com/1.1/geo/id/001907e868d06e24.json', place_type='admin', name='Dubai', full_name='Dubai, United Arab Emirates', country_code='AE', country='United Arab Emirates', contained_within=[], bounding_box=BoundingBox(_api=<tweepy.api.API object at 0x7f603361e790>, type='Polygon', coordinates=[[[54.8939725, 24.6182526], [56.2083722, 24.6182526], [56.2083722, 25.3686719], [54.8939725, 25.3686719]]]), attributes={})"
29,بريكست ساهم في تسريع الموافقة البريطانية على لقاح كورونا  ,1334245226773237760,2020-12-02 21:17:05,0,0,"Place(_api=<tweepy.api.API object at 0x7f603361e790>, id='001907e868d06e24', url='https://api.twitter.com/1.1/geo/id/001907e868d06e24.json', place_type='admin', name='Dubai', full_name='Dubai, United Arab Emirates', country_code='AE', country='United Arab Emirates', contained_within=[], bounding_box=BoundingBox(_api=<tweepy.api.API object at 0x7f603361e790>, type='Polygon', coordinates=[[[54.8939725, 24.6182526], [56.2083722, 24.6182526], [56.2083722, 25.3686719], [54.8939725, 25.3686719]]]), attributes={})"
30,12229 إجمالي وفيات كورونا في كندا  ,1334241835624005632,2020-12-02 21:03:37,0,0,"Place(_api=<tweepy.api.API object at 0x7f603361e790>, id='001907e868d06e24', url='https://api.twitter.com/1.1/geo/id/001907e868d06e24.json', place_type='admin', name='Dubai', full_name='Dubai, United Arab Emirates', country_code='AE', country='United Arab Emirates', contained_within=[], bounding_box=BoundingBox(_api=<tweepy.api.API object at 0x7f603361e790>, type='Polygon', coordinates=[[[54.8939725, 24.6182526], [56.2083722, 24.6182526], [56.2083722, 25.3686719], [54.8939725, 25.3686719]]]), attributes={})"
31,لبنان: إصابات كورونا تتجاوز الـ131 ألف حالة  ,1334241822936190976,2020-12-02 21:03:34,0,0,"Place(_api=<tweepy.api.API object at 0x7f603361e790>, id='001907e868d06e24', url='https://api.twitter.com/1.1/geo/id/001907e868d06e24.json', place_type='admin', name='Dubai', full_name='Dubai, United Arab Emirates', country_code='AE', country='United Arab Emirates', contained_within=[], bounding_box=BoundingBox(_api=<tweepy.api.API object at 0x7f603361e790>, type='Polygon', coordinates=[[[54.8939725, 24.6182526], [56.2083722, 24.6182526], [56.2083722, 25.3686719], [54.8939725, 25.3686719]]]), attributes={})"
32,أرشح على دعمه خلال جائحة كورونا، وعلى مساهمته في رفع المعنويات وروح التفاؤل بين أفراد المجتمع. ,1334228207915180035,2020-12-02 20:09:28,2,1,"Place(_api=<tweepy.api.API object at 0x7f603361e790>, id='00f24ae701a1207b', url='https://api.twitter.com/1.1/geo/id/00f24ae701a1207b.json', place_type='admin', name='Abu Dhabi', full_name='Abu Dhabi, United Arab Emirates', country_code='AE', country='United Arab Emirates', contained_within=[], bounding_box=BoundingBox(_api=<tweepy.api.API object at 0x7f603361e790>, type='Polygon', coordinates=[[[51.2938738, 22.6261387], [56.0175464, 22.6261387], [56.0175464, 25.1639588], [51.2938738, 25.1639588]]]), attributes={})"
33,أرشح على دعمه خلال جائحة كورونا، وعلى مساهمته في رفع المعنويات وروح التفاؤل بين أفراد المجتمع. ,1334227264599420932,2020-12-02 20:05:43,2,1,"Place(_api=<tweepy.api.API object at 0x7f603361e790>, id='00f24ae701a1207b', url='https://api.twitter.com/1.1/geo/id/00f24ae701a1207b.json', place_type='admin', name='Abu Dhabi', full_name='Abu Dhabi, United Arab Emirates', country_code='AE', country='United Arab Emirates', contained_within=[], bounding_box=BoundingBox(_api=<tweepy.api.API object at 0x7f603361e790>, type='Polygon', coordinates=[[[51.2938738, 22.6261387], [56.0175464, 22.6261387], [56.0175464, 25.1639588], [51.2938738, 25.1639588]]]), attributes={})"
