,Tweets,id,date,likes,retweets,place
0,وقال وكيل الوزارة إن معظم اللقاحات ستكون على جرعتين عدا لقاحٍ واحد، فلذلك فإن الهدف هو الوصول إلى أكبر عدد ممكن من السكان، وإن الوزارة تطمح أن تغطي لقاحات فيروس كورونا 70 % من سكان المملكة الذين لم يتعرضوا للفايروس بنهاية 2021.,1331102351483133952,2020-11-24 05:08:25,2,1,"Place(_api=<tweepy.api.API object at 0x7f5563963790>, id='001907e868d06e24', url='https://api.twitter.com/1.1/geo/id/001907e868d06e24.json', place_type='admin', name='Dubai', full_name='Dubai, United Arab Emirates', country_code='AE', country='United Arab Emirates', contained_within=[], bounding_box=BoundingBox(_api=<tweepy.api.API object at 0x7f5563963790>, type='Polygon', coordinates=[[[54.8939725, 24.6182526], [56.2083722, 24.6182526], [56.2083722, 25.3686719], [54.8939725, 25.3686719]]]), attributes={})"
1,أرقام/ الرياض -قال وكيل وزارة الصحة السعودية الدكتور عبدالله عسيري، إن لقاح فيروس كورونا سيكون متوفراً للجميع، وسيكون مجاناً. وأضاف في تصريح للإخبارية: أن اللقاح يعتبر من أغراض الصحة العامة وبالتالي لا يدخل فيه احتساب التكاليف. ,1331102349163696128,2020-11-24 05:08:25,2,1,"Place(_api=<tweepy.api.API object at 0x7f5563963790>, id='001907e868d06e24', url='https://api.twitter.com/1.1/geo/id/001907e868d06e24.json', place_type='admin', name='Dubai', full_name='Dubai, United Arab Emirates', country_code='AE', country='United Arab Emirates', contained_within=[], bounding_box=BoundingBox(_api=<tweepy.api.API object at 0x7f5563963790>, type='Polygon', coordinates=[[[54.8939725, 24.6182526], [56.2083722, 24.6182526], [56.2083722, 25.3686719], [54.8939725, 25.3686719]]]), attributes={})"
2,اللهم لاترد لنادعاء ولاتخيب لنارجاء ولاتسكن أجسادنا داء وأدفع عناكل وباء وبلاء ولاتشمت بنا الاعداء وتقبل مناالدعاء ياسامع النداء وباسط الأرض ورافع السماء ياواسع المغفرة والرجاء يامن في اسمه دواء وذكره شفاء أحينا حياة السعداء وأحشرنا في زمرة سيد الانبياء,1331080781712732162,2020-11-24 03:42:43,2,1,"Place(_api=<tweepy.api.API object at 0x7f5563963790>, id='00f24ae701a1207b', url='https://api.twitter.com/1.1/geo/id/00f24ae701a1207b.json', place_type='admin', name='Abu Dhabi', full_name='Abu Dhabi, United Arab Emirates', country_code='AE', country='United Arab Emirates', contained_within=[], bounding_box=BoundingBox(_api=<tweepy.api.API object at 0x7f5563963790>, type='Polygon', coordinates=[[[51.2938738, 22.6261387], [56.0175464, 22.6261387], [56.0175464, 25.1639588], [51.2938738, 25.1639588]]]), attributes={})"
3,طبعاً ما عندهم كورونا عادي يتقاربون  ,1330959243445407747,2020-11-23 19:39:46,4,0,"Place(_api=<tweepy.api.API object at 0x7f5563963790>, id='00f24ae701a1207b', url='https://api.twitter.com/1.1/geo/id/00f24ae701a1207b.json', place_type='admin', name='Abu Dhabi', full_name='Abu Dhabi, United Arab Emirates', country_code='AE', country='United Arab Emirates', contained_within=[], bounding_box=BoundingBox(_api=<tweepy.api.API object at 0x7f5563963790>, type='Polygon', coordinates=[[[51.2938738, 22.6261387], [56.0175464, 22.6261387], [56.0175464, 25.1639588], [51.2938738, 25.1639588]]]), attributes={})"
4,الا نا وين يطلعون غير كورونا ..,1330953866700001280,2020-11-23 19:18:24,2,0,"Place(_api=<tweepy.api.API object at 0x7f5563963790>, id='00f24ae701a1207b', url='https://api.twitter.com/1.1/geo/id/00f24ae701a1207b.json', place_type='admin', name='Abu Dhabi', full_name='Abu Dhabi, United Arab Emirates', country_code='AE', country='United Arab Emirates', contained_within=[], bounding_box=BoundingBox(_api=<tweepy.api.API object at 0x7f5563963790>, type='Polygon', coordinates=[[[51.2938738, 22.6261387], [56.0175464, 22.6261387], [56.0175464, 25.1639588], [51.2938738, 25.1639588]]]), attributes={})"
5,زعزع ثقتنا في كثير من الامور ,1330947336688836610,2020-11-23 18:52:27,0,0,"Place(_api=<tweepy.api.API object at 0x7f5563963790>, id='001907e868d06e24', url='https://api.twitter.com/1.1/geo/id/001907e868d06e24.json', place_type='admin', name='Dubai', full_name='Dubai, United Arab Emirates', country_code='AE', country='United Arab Emirates', contained_within=[], bounding_box=BoundingBox(_api=<tweepy.api.API object at 0x7f5563963790>, type='Polygon', coordinates=[[[54.8939725, 24.6182526], [56.2083722, 24.6182526], [56.2083722, 25.3686719], [54.8939725, 25.3686719]]]), attributes={})"
6,الشعب السوداني الزعلان على القرار ده مالكم؟؟ كل الدول فاتحه و باحراءات احترازية كمامة معقم اجهزة قياس الحراره قبل يخشو لاي مكان عام كورونا م حتخلص ف شهر و لا اتنين و يمكن تكون معانا سنين ف لازم نتعايش ب وعي و الله يرفع عن عبادو البلاء و الوباء يارب  ,1330938557624627200,2020-11-23 18:17:34,1,0,"Place(_api=<tweepy.api.API object at 0x7f5563963790>, id='001907e868d06e24', url='https://api.twitter.com/1.1/geo/id/001907e868d06e24.json', place_type='admin', name='Dubai', full_name='Dubai, United Arab Emirates', country_code='AE', country='United Arab Emirates', contained_within=[], bounding_box=BoundingBox(_api=<tweepy.api.API object at 0x7f5563963790>, type='Polygon', coordinates=[[[54.8939725, 24.6182526], [56.2083722, 24.6182526], [56.2083722, 25.3686719], [54.8939725, 25.3686719]]]), attributes={})"
7,فيك كورونا عيل,1330934385235857410,2020-11-23 18:00:59,0,0,"Place(_api=<tweepy.api.API object at 0x7f5563963790>, id='00f24ae701a1207b', url='https://api.twitter.com/1.1/geo/id/00f24ae701a1207b.json', place_type='admin', name='Abu Dhabi', full_name='Abu Dhabi, United Arab Emirates', country_code='AE', country='United Arab Emirates', contained_within=[], bounding_box=BoundingBox(_api=<tweepy.api.API object at 0x7f5563963790>, type='Polygon', coordinates=[[[51.2938738, 22.6261387], [56.0175464, 22.6261387], [56.0175464, 25.1639588], [51.2938738, 25.1639588]]]), attributes={})"
8,ما هو هدف في التحول إلى افتتاح متاجر فرعية صغيرة؟ وكيف بدأت بالتكيّف مع جائحة بخطوات جريئة؟ .. ,1330925155057606657,2020-11-23 17:24:19,2,4,"Place(_api=<tweepy.api.API object at 0x7f5563963790>, id='001907e868d06e24', url='https://api.twitter.com/1.1/geo/id/001907e868d06e24.json', place_type='admin', name='Dubai', full_name='Dubai, United Arab Emirates', country_code='AE', country='United Arab Emirates', contained_within=[], bounding_box=BoundingBox(_api=<tweepy.api.API object at 0x7f5563963790>, type='Polygon', coordinates=[[[54.8939725, 24.6182526], [56.2083722, 24.6182526], [56.2083722, 25.3686719], [54.8939725, 25.3686719]]]), attributes={})"
9,CNBC - تراجعت أسهم شركة الأدوية البريطانية العملاقة AstraZeneca بأكثر من 3٪ بعد أن قالت الشركة إن التجارب السريرية أظهرت أن لقاح فيروس كورونا لديه فعالية متوسطة تبلغ 70٪ في الوقاية من الفيروس. قال منافساها Pfizer و Moderna سابقًا إن لقاحهما فعال بنسبة تزيد عن 90 ٪. ,1330918860338458624,2020-11-23 16:59:18,4,1,"Place(_api=<tweepy.api.API object at 0x7f5563963790>, id='001907e868d06e24', url='https://api.twitter.com/1.1/geo/id/001907e868d06e24.json', place_type='admin', name='Dubai', full_name='Dubai, United Arab Emirates', country_code='AE', country='United Arab Emirates', contained_within=[], bounding_box=BoundingBox(_api=<tweepy.api.API object at 0x7f5563963790>, type='Polygon', coordinates=[[[54.8939725, 24.6182526], [56.2083722, 24.6182526], [56.2083722, 25.3686719], [54.8939725, 25.3686719]]]), attributes={})"
10,ترشيح المختبر البيطري التابع لهيئة ابوظبي للزراعة والسلامة الغذائية كأول مختبر بيطري على مستوى الدولة يدعم منظومة الاستجابة من خلال فحص العينات البشرية ضد جائحة كوفيد-19 بالتعاون مع الجهات الصحية,1330908896073043969,2020-11-23 16:19:42,1,0,"Place(_api=<tweepy.api.API object at 0x7f5563963790>, id='00f24ae701a1207b', url='https://api.twitter.com/1.1/geo/id/00f24ae701a1207b.json', place_type='admin', name='Abu Dhabi', full_name='Abu Dhabi, United Arab Emirates', country_code='AE', country='United Arab Emirates', contained_within=[], bounding_box=BoundingBox(_api=<tweepy.api.API object at 0x7f5563963790>, type='Polygon', coordinates=[[[51.2938738, 22.6261387], [56.0175464, 22.6261387], [56.0175464, 25.1639588], [51.2938738, 25.1639588]]]), attributes={})"
11,أرشح كليات التقنية العليا كأول مؤسسة تعليم عالي تبادر بطرح واعتماد نموذج التعليم الهجين خلال أزمة كورونا.,1330897537734225921,2020-11-23 15:34:34,2,0,"Place(_api=<tweepy.api.API object at 0x7f5563963790>, id='001907e868d06e24', url='https://api.twitter.com/1.1/geo/id/001907e868d06e24.json', place_type='admin', name='Dubai', full_name='Dubai, United Arab Emirates', country_code='AE', country='United Arab Emirates', contained_within=[], bounding_box=BoundingBox(_api=<tweepy.api.API object at 0x7f5563963790>, type='Polygon', coordinates=[[[54.8939725, 24.6182526], [56.2083722, 24.6182526], [56.2083722, 25.3686719], [54.8939725, 25.3686719]]]), attributes={})"
12,أكبر مركز مسح وطني لفحص فايروس كورونا . ,1330888796775329797,2020-11-23 14:59:50,4,1,"Place(_api=<tweepy.api.API object at 0x7f5563963790>, id='0031d9ac016e4e15', url='https://api.twitter.com/1.1/geo/id/0031d9ac016e4e15.json', place_type='admin', name='Umm Al Quwain', full_name='Umm Al Quwain, United Arab Emirates', country_code='AE', country='United Arab Emirates', contained_within=[], bounding_box=BoundingBox(_api=<tweepy.api.API object at 0x7f5563963790>, type='Polygon', coordinates=[[[55.5101233, 25.3405667], [55.8819732, 25.3405667], [55.8819732, 25.6559154], [55.5101233, 25.6559154]]]), attributes={})"
13,الشخصية ولا كورونا؟,1330888007751176195,2020-11-23 14:56:42,0,0,"Place(_api=<tweepy.api.API object at 0x7f5563963790>, id='00f24ae701a1207b', url='https://api.twitter.com/1.1/geo/id/00f24ae701a1207b.json', place_type='admin', name='Abu Dhabi', full_name='Abu Dhabi, United Arab Emirates', country_code='AE', country='United Arab Emirates', contained_within=[], bounding_box=BoundingBox(_api=<tweepy.api.API object at 0x7f5563963790>, type='Polygon', coordinates=[[[51.2938738, 22.6261387], [56.0175464, 22.6261387], [56.0175464, 25.1639588], [51.2938738, 25.1639588]]]), attributes={})"
14,خصم المخالفات افضل خبر يمكن تسمعه بعيد عن كورونا ,1330883859383250955,2020-11-23 14:40:13,0,0,"Place(_api=<tweepy.api.API object at 0x7f5563963790>, id='001907e868d06e24', url='https://api.twitter.com/1.1/geo/id/001907e868d06e24.json', place_type='admin', name='Dubai', full_name='Dubai, United Arab Emirates', country_code='AE', country='United Arab Emirates', contained_within=[], bounding_box=BoundingBox(_api=<tweepy.api.API object at 0x7f5563963790>, type='Polygon', coordinates=[[[54.8939725, 24.6182526], [56.2083722, 24.6182526], [56.2083722, 25.3686719], [54.8939725, 25.3686719]]]), attributes={})"
15,أقوى الحملات التطوعية في ظل كوفيد١٩ بمشاركة أكثر من ٥٥ الف من جميع فئات المجتمع تضماما مع الجهود الوطنية لمكافحة كورونا,1330876623856545796,2020-11-23 14:11:28,0,0,"Place(_api=<tweepy.api.API object at 0x7f5563963790>, id='00f24ae701a1207b', url='https://api.twitter.com/1.1/geo/id/00f24ae701a1207b.json', place_type='admin', name='Abu Dhabi', full_name='Abu Dhabi, United Arab Emirates', country_code='AE', country='United Arab Emirates', contained_within=[], bounding_box=BoundingBox(_api=<tweepy.api.API object at 0x7f5563963790>, type='Polygon', coordinates=[[[51.2938738, 22.6261387], [56.0175464, 22.6261387], [56.0175464, 25.1639588], [51.2938738, 25.1639588]]]), attributes={})"
16,نيويورك تايمز-في تحد لقواعد إغلاق الفيروس التاجي - وعلى الرغم من زارات المفتشين لتطبيق القانون - ظلت بعض مراكز اللياقة البدنية الإنجليزية مفتوحة مع تراجع الدعم للقيود الصارمة المتعلقة بفيروس كورونا. ,1330874458077360131,2020-11-23 14:02:51,6,3,"Place(_api=<tweepy.api.API object at 0x7f5563963790>, id='001907e868d06e24', url='https://api.twitter.com/1.1/geo/id/001907e868d06e24.json', place_type='admin', name='Dubai', full_name='Dubai, United Arab Emirates', country_code='AE', country='United Arab Emirates', contained_within=[], bounding_box=BoundingBox(_api=<tweepy.api.API object at 0x7f5563963790>, type='Polygon', coordinates=[[[54.8939725, 24.6182526], [56.2083722, 24.6182526], [56.2083722, 25.3686719], [54.8939725, 25.3686719]]]), attributes={})"
17,"لن ينسى التاريخ قائد كالشيخ محمد بن زايد عندما قال في بداية الجائحة "" الدواء و الغذاء خط احمر و ( لا تشيلون هم ابداً ) "". فبالطبع هو من الشخصيات الهامة التي جعلت الامارات نموذجاً في مكافحة جائحة كورونا .",1330844712308252673,2020-11-23 12:04:39,0,0,"Place(_api=<tweepy.api.API object at 0x7f5563963790>, id='00f24ae701a1207b', url='https://api.twitter.com/1.1/geo/id/00f24ae701a1207b.json', place_type='admin', name='Abu Dhabi', full_name='Abu Dhabi, United Arab Emirates', country_code='AE', country='United Arab Emirates', contained_within=[], bounding_box=BoundingBox(_api=<tweepy.api.API object at 0x7f5563963790>, type='Polygon', coordinates=[[[51.2938738, 22.6261387], [56.0175464, 22.6261387], [56.0175464, 25.1639588], [51.2938738, 25.1639588]]]), attributes={})"
18,"""الصحة"" تُجري 81,558 فحصاً ضمن خططها لتوسيع نطاق الفحوصات وتكشف عن 1,065 إصابة جديدة بـ المستجد و707 حالات شفاء، وحالتي وفاة خلال الساعات الـ 24 الماضية. | وام ",1330822350909153282,2020-11-23 10:35:48,2,2,"Place(_api=<tweepy.api.API object at 0x7f5563963790>, id='001907e868d06e24', url='https://api.twitter.com/1.1/geo/id/001907e868d06e24.json', place_type='admin', name='Dubai', full_name='Dubai, United Arab Emirates', country_code='AE', country='United Arab Emirates', contained_within=[], bounding_box=BoundingBox(_api=<tweepy.api.API object at 0x7f5563963790>, type='Polygon', coordinates=[[[54.8939725, 24.6182526], [56.2083722, 24.6182526], [56.2083722, 25.3686719], [54.8939725, 25.3686719]]]), attributes={})"
19,أرشح سعادة ضمن لجهوده التطوعية والخيرية والانسانية والمجتمعية خلال جائحة كوفيد 19. ,1330819801388883969,2020-11-23 10:25:40,0,0,"Place(_api=<tweepy.api.API object at 0x7f5563963790>, id='01a4aba930967a19', url='https://api.twitter.com/1.1/geo/id/01a4aba930967a19.json', place_type='admin', name='Ajman', full_name='Ajman, United Arab Emirates', country_code='AE', country='United Arab Emirates', contained_within=[], bounding_box=BoundingBox(_api=<tweepy.api.API object at 0x7f5563963790>, type='Polygon', coordinates=[[[55.4228459, 24.7422387], [56.1015028, 24.7422387], [56.1015028, 25.4513274], [55.4228459, 25.4513274]]]), attributes={})"
20,سنغافورة (رويترز) - ارتفعت أسعار النفط 1 بالمئة اليوم الاثنين لمواصلة مكاسبها حيث يتطلع التجار إلى تعافي الطلب على الخام بسبب التجارب الناجحة للقاح فيروس كورونا والمخاوف بشأن التوترات في الشرق الأوسط. ,1330801134315966464,2020-11-23 09:11:30,2,1,"Place(_api=<tweepy.api.API object at 0x7f5563963790>, id='001907e868d06e24', url='https://api.twitter.com/1.1/geo/id/001907e868d06e24.json', place_type='admin', name='Dubai', full_name='Dubai, United Arab Emirates', country_code='AE', country='United Arab Emirates', contained_within=[], bounding_box=BoundingBox(_api=<tweepy.api.API object at 0x7f5563963790>, type='Polygon', coordinates=[[[54.8939725, 24.6182526], [56.2083722, 24.6182526], [56.2083722, 25.3686719], [54.8939725, 25.3686719]]]), attributes={})"
21,".. قالت إحداهن ملخصة مايشعرون به في المخيمات ""برد الدنيا""~ ""برد قد ماقلت والله برد"" ""تحت الصفر توصل درجة الحرارة"" .. خففوا معاناتهم بتوفير أجهزة تدفئة، ساهموا معنا لشتاء دافئ: :  . ",1330793337083793408,2020-11-23 08:40:31,8,6,"Place(_api=<tweepy.api.API object at 0x7f5563963790>, id='00f24ae701a1207b', url='https://api.twitter.com/1.1/geo/id/00f24ae701a1207b.json', place_type='admin', name='Abu Dhabi', full_name='Abu Dhabi, United Arab Emirates', country_code='AE', country='United Arab Emirates', contained_within=[], bounding_box=BoundingBox(_api=<tweepy.api.API object at 0x7f5563963790>, type='Polygon', coordinates=[[[51.2938738, 22.6261387], [56.0175464, 22.6261387], [56.0175464, 25.1639588], [51.2938738, 25.1639588]]]), attributes={})"
