,Tweets,id,date,likes,retweets,place
0,مستشفى الإمارات التخصصي معاملتة تعيسه مع المرضى في الطوارئ ،، مريض فيه حرارة و مب معبرينه و لا معطينه أية اهتمام  و آخر شي يطلع فيه كورونا ,1325484160526524421,2020-11-08 17:03:44,1,1,"Place(_api=<tweepy.api.API object at 0x7fd05c1c7790>, id='001907e868d06e24', url='https://api.twitter.com/1.1/geo/id/001907e868d06e24.json', place_type='admin', name='Dubai', full_name='Dubai, United Arab Emirates', country_code='AE', country='United Arab Emirates', contained_within=[], bounding_box=BoundingBox(_api=<tweepy.api.API object at 0x7fd05c1c7790>, type='Polygon', coordinates=[[[54.8939725, 24.6182526], [56.2083722, 24.6182526], [56.2083722, 25.3686719], [54.8939725, 25.3686719]]]), attributes={})"
1,من الاخير بايدن شكل فريق ١٢ شخص عشان فيروس كورونا و الين اول السنه بيختفي كورونا و بيكون هو البطل العالمي و بيسوي مصيبه اكبر من كورونا الفلم القادم ٢٠٢١,1325480692755681280,2020-11-08 16:49:58,2,1,"Place(_api=<tweepy.api.API object at 0x7fd05c1c7790>, id='001907e868d06e24', url='https://api.twitter.com/1.1/geo/id/001907e868d06e24.json', place_type='admin', name='Dubai', full_name='Dubai, United Arab Emirates', country_code='AE', country='United Arab Emirates', contained_within=[], bounding_box=BoundingBox(_api=<tweepy.api.API object at 0x7fd05c1c7790>, type='Polygon', coordinates=[[[54.8939725, 24.6182526], [56.2083722, 24.6182526], [56.2083722, 25.3686719], [54.8939725, 25.3686719]]]), attributes={})"
2,منظمة الصحة: 6 دول أبلغت عن كورونا في مزارع حيوان المنك ,1325475310356357122,2020-11-08 16:28:34,0,0,"Place(_api=<tweepy.api.API object at 0x7fd05c1c7790>, id='001907e868d06e24', url='https://api.twitter.com/1.1/geo/id/001907e868d06e24.json', place_type='admin', name='Dubai', full_name='Dubai, United Arab Emirates', country_code='AE', country='United Arab Emirates', contained_within=[], bounding_box=BoundingBox(_api=<tweepy.api.API object at 0x7fd05c1c7790>, type='Polygon', coordinates=[[[54.8939725, 24.6182526], [56.2083722, 24.6182526], [56.2083722, 25.3686719], [54.8939725, 25.3686719]]]), attributes={})"
3,مؤشرات بكاء الايفانكيين ترتفع في بسبب خسارة نسيب كوشنر.. يلعب جولف وهم يئنون وا كوشنراه، وا نتنياهواه.. خسارة ترمب في 2020 عندهم أخطر وأسوأ من كورونا يا إخوان  ,1325474560418910211,2020-11-08 16:25:35,57,21,"Place(_api=<tweepy.api.API object at 0x7fd05c1c7790>, id='00f24ae701a1207b', url='https://api.twitter.com/1.1/geo/id/00f24ae701a1207b.json', place_type='admin', name='Abu Dhabi', full_name='Abu Dhabi, United Arab Emirates', country_code='AE', country='United Arab Emirates', contained_within=[], bounding_box=BoundingBox(_api=<tweepy.api.API object at 0x7fd05c1c7790>, type='Polygon', coordinates=[[[51.2938738, 22.6261387], [56.0175464, 22.6261387], [56.0175464, 25.1639588], [51.2938738, 25.1639588]]]), attributes={})"
4,بتوجيهات سمو الشيخ حمدان بن زايد آل نهيان، ممثل الحاكم في منطقة الظفرة، رئيس هيئة الهلال الأحمر الإماراتي وصلت العاصمة دمشق قافلة مساعدات برية تحمل 22 طنا من الأدوية والمواد الطبية، سيرتها الهيئة بالتنسيق مع جمعية الهلال الأحمر السورية للحد من تفشي جائحة كورونا. ,1325458367930904576,2020-11-08 15:21:15,16,7,"Place(_api=<tweepy.api.API object at 0x7fd05c1c7790>, id='00f24ae701a1207b', url='https://api.twitter.com/1.1/geo/id/00f24ae701a1207b.json', place_type='admin', name='Abu Dhabi', full_name='Abu Dhabi, United Arab Emirates', country_code='AE', country='United Arab Emirates', contained_within=[], bounding_box=BoundingBox(_api=<tweepy.api.API object at 0x7fd05c1c7790>, type='Polygon', coordinates=[[[51.2938738, 22.6261387], [56.0175464, 22.6261387], [56.0175464, 25.1639588], [51.2938738, 25.1639588]]]), attributes={})"
