,Tweets,id,date,likes,retweets,place
34,أرشح أخي عبيد العليلي من القيادة العامة لشرطة عجمان لجهوده مع زملائه خلال أزمة كورونا,1334215043781697540,2020-12-02 19:17:09,0,0,"Place(_api=<tweepy.api.API object at 0x7f603361e790>, id='001907e868d06e24', url='https://api.twitter.com/1.1/geo/id/001907e868d06e24.json', place_type='admin', name='Dubai', full_name='Dubai, United Arab Emirates', country_code='AE', country='United Arab Emirates', contained_within=[], bounding_box=BoundingBox(_api=<tweepy.api.API object at 0x7f603361e790>, type='Polygon', coordinates=[[[54.8939725, 24.6182526], [56.2083722, 24.6182526], [56.2083722, 25.3686719], [54.8939725, 25.3686719]]]), attributes={})"
35,WSJ-قامت المراكز الأمريكية لمكافحة الأمراض والوقاية منها بتقصير فترة الحجر الصحي الموصى بها من سبعة إلى 10 أيام للأشخاص في الولايات المتحدة الذين تعرضوا لفيروس كورونا الجديد ، وتحديث إرشاداتها لتعكس النتائج العلمية المستجدة حول الوقت الذي يستغرقه تطور العدوى. ,1334198849842405376,2020-12-02 18:12:48,4,1,"Place(_api=<tweepy.api.API object at 0x7f603361e790>, id='01b984d319b42814', url='https://api.twitter.com/1.1/geo/id/01b984d319b42814.json', place_type='admin', name='Ras Al Khaimah', full_name='Ras Al Khaimah, United Arab Emirates', country_code='AE', country='United Arab Emirates', contained_within=[], bounding_box=BoundingBox(_api=<tweepy.api.API object at 0x7f603361e790>, type='Polygon', coordinates=[[[55.7414877, 24.8517657], [56.3489937, 24.8517657], [56.3489937, 26.0841599], [55.7414877, 26.0841599]]]), attributes={})"
36,معالي محمد بن أحمد البواردي: نحتفل اليوم بذكرى اليوم الوطني وبنجاح الإمارات في صنع نموذج يحتذى في مواجهة أزمة جائحة كورونا حيث كانت سباقة في مواجهة هذه الجائحة على المستوى المحلي والإقليمي والدولي... ,1334196221502771202,2020-12-02 18:02:22,2,1,"Place(_api=<tweepy.api.API object at 0x7f603361e790>, id='00f24ae701a1207b', url='https://api.twitter.com/1.1/geo/id/00f24ae701a1207b.json', place_type='admin', name='Abu Dhabi', full_name='Abu Dhabi, United Arab Emirates', country_code='AE', country='United Arab Emirates', contained_within=[], bounding_box=BoundingBox(_api=<tweepy.api.API object at 0x7f603361e790>, type='Polygon', coordinates=[[[51.2938738, 22.6261387], [56.0175464, 22.6261387], [56.0175464, 25.1639588], [51.2938738, 25.1639588]]]), attributes={})"
37,الصحة العالمية: اللقاحات لن تمنع زيادة عدوى كورونا  ,1334195265436217345,2020-12-02 17:58:34,0,0,"Place(_api=<tweepy.api.API object at 0x7f603361e790>, id='001907e868d06e24', url='https://api.twitter.com/1.1/geo/id/001907e868d06e24.json', place_type='admin', name='Dubai', full_name='Dubai, United Arab Emirates', country_code='AE', country='United Arab Emirates', contained_within=[], bounding_box=BoundingBox(_api=<tweepy.api.API object at 0x7f603361e790>, type='Polygon', coordinates=[[[54.8939725, 24.6182526], [56.2083722, 24.6182526], [56.2083722, 25.3686719], [54.8939725, 25.3686719]]]), attributes={})"
38,الرئيس الألماني: أمصال كورونا “ضوء في نهاية النفق”  ,1334186985183821824,2020-12-02 17:25:39,0,0,"Place(_api=<tweepy.api.API object at 0x7f603361e790>, id='001907e868d06e24', url='https://api.twitter.com/1.1/geo/id/001907e868d06e24.json', place_type='admin', name='Dubai', full_name='Dubai, United Arab Emirates', country_code='AE', country='United Arab Emirates', contained_within=[], bounding_box=BoundingBox(_api=<tweepy.api.API object at 0x7f603361e790>, type='Polygon', coordinates=[[[54.8939725, 24.6182526], [56.2083722, 24.6182526], [56.2083722, 25.3686719], [54.8939725, 25.3686719]]]), attributes={})"
39,الأردن يسجل 52 وفاة و3591 إصابة جديدة بـ”كورونا”  ,1334186958789099521,2020-12-02 17:25:33,0,0,"Place(_api=<tweepy.api.API object at 0x7f603361e790>, id='001907e868d06e24', url='https://api.twitter.com/1.1/geo/id/001907e868d06e24.json', place_type='admin', name='Dubai', full_name='Dubai, United Arab Emirates', country_code='AE', country='United Arab Emirates', contained_within=[], bounding_box=BoundingBox(_api=<tweepy.api.API object at 0x7f603361e790>, type='Polygon', coordinates=[[[54.8939725, 24.6182526], [56.2083722, 24.6182526], [56.2083722, 25.3686719], [54.8939725, 25.3686719]]]), attributes={})"
40,الصج الصج، كورونا يصيح فـ زاوية فمهرجان الشيخ زايد، أنا فالبيت ومتنرفزة من الزحمه ,1334176608186458112,2020-12-02 16:44:25,9,0,"Place(_api=<tweepy.api.API object at 0x7f603361e790>, id='00f24ae701a1207b', url='https://api.twitter.com/1.1/geo/id/00f24ae701a1207b.json', place_type='admin', name='Abu Dhabi', full_name='Abu Dhabi, United Arab Emirates', country_code='AE', country='United Arab Emirates', contained_within=[], bounding_box=BoundingBox(_api=<tweepy.api.API object at 0x7f603361e790>, type='Polygon', coordinates=[[[51.2938738, 22.6261387], [56.0175464, 22.6261387], [56.0175464, 25.1639588], [51.2938738, 25.1639588]]]), attributes={})"
41,الجزائر: وزير الصحة ينفي توزيع أو شراء لقاح كورونا في يناير المقبل  ,1334170979006746625,2020-12-02 16:22:03,0,0,"Place(_api=<tweepy.api.API object at 0x7f603361e790>, id='001907e868d06e24', url='https://api.twitter.com/1.1/geo/id/001907e868d06e24.json', place_type='admin', name='Dubai', full_name='Dubai, United Arab Emirates', country_code='AE', country='United Arab Emirates', contained_within=[], bounding_box=BoundingBox(_api=<tweepy.api.API object at 0x7f603361e790>, type='Polygon', coordinates=[[[54.8939725, 24.6182526], [56.2083722, 24.6182526], [56.2083722, 25.3686719], [54.8939725, 25.3686719]]]), attributes={})"
42,مهرجان الشيخ زايد شدعوه هلون زحمته؟ ليش لا يكون مافي كورونا فالوثبة؟ ,1334167630001942530,2020-12-02 16:08:45,8,0,"Place(_api=<tweepy.api.API object at 0x7f603361e790>, id='00f24ae701a1207b', url='https://api.twitter.com/1.1/geo/id/00f24ae701a1207b.json', place_type='admin', name='Abu Dhabi', full_name='Abu Dhabi, United Arab Emirates', country_code='AE', country='United Arab Emirates', contained_within=[], bounding_box=BoundingBox(_api=<tweepy.api.API object at 0x7f603361e790>, type='Polygon', coordinates=[[[51.2938738, 22.6261387], [56.0175464, 22.6261387], [56.0175464, 25.1639588], [51.2938738, 25.1639588]]]), attributes={})"
43,في زمن .. توقّفت عجلة العالم بسبب الظروف الاستثنائية .. إلاّ أن كانت حاضرة بإنجازاتها ومشاريعها .. تنشر وتصنع المستقبل وتُؤكّد  ,1334167083903545344,2020-12-02 16:06:35,16,5,"Place(_api=<tweepy.api.API object at 0x7f603361e790>, id='001907e868d06e24', url='https://api.twitter.com/1.1/geo/id/001907e868d06e24.json', place_type='admin', name='Dubai', full_name='Dubai, United Arab Emirates', country_code='AE', country='United Arab Emirates', contained_within=[], bounding_box=BoundingBox(_api=<tweepy.api.API object at 0x7f603361e790>, type='Polygon', coordinates=[[[54.8939725, 24.6182526], [56.2083722, 24.6182526], [56.2083722, 25.3686719], [54.8939725, 25.3686719]]]), attributes={})"
44,بوتين يوجه ببدء التطعيم الشامل ضد كورونا الأسبوع المقبل  ,1334162800441081856,2020-12-02 15:49:33,1,0,"Place(_api=<tweepy.api.API object at 0x7f603361e790>, id='001907e868d06e24', url='https://api.twitter.com/1.1/geo/id/001907e868d06e24.json', place_type='admin', name='Dubai', full_name='Dubai, United Arab Emirates', country_code='AE', country='United Arab Emirates', contained_within=[], bounding_box=BoundingBox(_api=<tweepy.api.API object at 0x7f603361e790>, type='Polygon', coordinates=[[[54.8939725, 24.6182526], [56.2083722, 24.6182526], [56.2083722, 25.3686719], [54.8939725, 25.3686719]]]), attributes={})"
45,جو جميل و كانه ما فيه كورونا,1334160968922882051,2020-12-02 15:42:17,1,0,"Place(_api=<tweepy.api.API object at 0x7f603361e790>, id='10142bf29c947000', url='https://api.twitter.com/1.1/geo/id/10142bf29c947000.json', place_type='poi', name='The Dubai Mall', full_name='The Dubai Mall', country_code='AE', country='United Arab Emirates', contained_within=[], bounding_box=BoundingBox(_api=<tweepy.api.API object at 0x7f603361e790>, type='Polygon', coordinates=[[[55.27886867523193, 25.197388603252538], [55.27886867523193, 25.197388603252538], [55.27886867523193, 25.197388603252538], [55.27886867523193, 25.197388603252538]]]), attributes={})"
46,السعودية تسجل 12 وفاة و 249 إصابة جديدة بـ”كورونا”  ,1334149594230341633,2020-12-02 14:57:05,1,0,"Place(_api=<tweepy.api.API object at 0x7f603361e790>, id='001907e868d06e24', url='https://api.twitter.com/1.1/geo/id/001907e868d06e24.json', place_type='admin', name='Dubai', full_name='Dubai, United Arab Emirates', country_code='AE', country='United Arab Emirates', contained_within=[], bounding_box=BoundingBox(_api=<tweepy.api.API object at 0x7f603361e790>, type='Polygon', coordinates=[[[54.8939725, 24.6182526], [56.2083722, 24.6182526], [56.2083722, 25.3686719], [54.8939725, 25.3686719]]]), attributes={})"
47,يالسه افكر هذا ويا كورونا وجي الوضع بدون كورونا كيف بيكون,1334143765209108480,2020-12-02 14:33:55,0,0,"Place(_api=<tweepy.api.API object at 0x7f603361e790>, id='01bb72922e8454b4', url='https://api.twitter.com/1.1/geo/id/01bb72922e8454b4.json', place_type='admin', name='Fujairah', full_name='Fujairah, United Arab Emirates', country_code='AE', country='United Arab Emirates', contained_within=[], bounding_box=BoundingBox(_api=<tweepy.api.API object at 0x7f603361e790>, type='Polygon', coordinates=[[[55.9170692, 25.0871026], [56.3739998, 25.0871026], [56.3739998, 25.6625265], [55.9170692, 25.6625265]]]), attributes={})"
48,مصر تتعاقد على شراء 20 مليون جرعة من لقاحات كورونا  ,1334137260749385728,2020-12-02 14:08:04,1,0,"Place(_api=<tweepy.api.API object at 0x7f603361e790>, id='001907e868d06e24', url='https://api.twitter.com/1.1/geo/id/001907e868d06e24.json', place_type='admin', name='Dubai', full_name='Dubai, United Arab Emirates', country_code='AE', country='United Arab Emirates', contained_within=[], bounding_box=BoundingBox(_api=<tweepy.api.API object at 0x7f603361e790>, type='Polygon', coordinates=[[[54.8939725, 24.6182526], [56.2083722, 24.6182526], [56.2083722, 25.3686719], [54.8939725, 25.3686719]]]), attributes={})"
49,قبل كورونا. نعم شخصيا كنت ادفع ربع قيمة من لديك نفس عدد الاشجار. بسبب نظام الري الي لا يمكن للعمال تعديله او الخطأ فيه. من شهر ٤ و طالع. اصبحت الفواتير ٣ او ٤ مرات متوسط كل السنوات الماضية. ارتفاع ما اعتقد انه يساوي العائد الشجري. اذا استمر اظن سافكر بحل التحلية.,1334123527142838272,2020-12-02 13:13:30,0,0,"Place(_api=<tweepy.api.API object at 0x7f603361e790>, id='00f24ae701a1207b', url='https://api.twitter.com/1.1/geo/id/00f24ae701a1207b.json', place_type='admin', name='Abu Dhabi', full_name='Abu Dhabi, United Arab Emirates', country_code='AE', country='United Arab Emirates', contained_within=[], bounding_box=BoundingBox(_api=<tweepy.api.API object at 0x7f603361e790>, type='Polygon', coordinates=[[[51.2938738, 22.6261387], [56.0175464, 22.6261387], [56.0175464, 25.1639588], [51.2938738, 25.1639588]]]), attributes={})"
50,تحويل ملهى ألماني شهير إلى مركز لفحص كورونا  ,1334122919203536897,2020-12-02 13:11:05,0,0,"Place(_api=<tweepy.api.API object at 0x7f603361e790>, id='001907e868d06e24', url='https://api.twitter.com/1.1/geo/id/001907e868d06e24.json', place_type='admin', name='Dubai', full_name='Dubai, United Arab Emirates', country_code='AE', country='United Arab Emirates', contained_within=[], bounding_box=BoundingBox(_api=<tweepy.api.API object at 0x7f603361e790>, type='Polygon', coordinates=[[[54.8939725, 24.6182526], [56.2083722, 24.6182526], [56.2083722, 25.3686719], [54.8939725, 25.3686719]]]), attributes={})"
51,هرمنا من أجل هذه اللحظة في عام .. ,1334102704537432067,2020-12-02 11:50:45,8,1,"Place(_api=<tweepy.api.API object at 0x7f603361e790>, id='001907e868d06e24', url='https://api.twitter.com/1.1/geo/id/001907e868d06e24.json', place_type='admin', name='Dubai', full_name='Dubai, United Arab Emirates', country_code='AE', country='United Arab Emirates', contained_within=[], bounding_box=BoundingBox(_api=<tweepy.api.API object at 0x7f603361e790>, type='Polygon', coordinates=[[[54.8939725, 24.6182526], [56.2083722, 24.6182526], [56.2083722, 25.3686719], [54.8939725, 25.3686719]]]), attributes={})"
52,"""الصحة"" تجري 136,483 فحصاً ضمن خططها لتوسيع نطاق الفحوصات وتكشف عن 1,285 إصابة جديدة بفيروس المستجد و713 حالة شفاء و4 حالات وفاة خلال الساعات الـ 24 الماضية. | وام ",1334101434435072001,2020-12-02 11:45:43,1,1,"Place(_api=<tweepy.api.API object at 0x7f603361e790>, id='00ecb59b0dad186e', url='https://api.twitter.com/1.1/geo/id/00ecb59b0dad186e.json', place_type='admin', name='Sharjah', full_name='Sharjah, United Arab Emirates', country_code='AE', country='United Arab Emirates', contained_within=[], bounding_box=BoundingBox(_api=<tweepy.api.API object at 0x7f603361e790>, type='Polygon', coordinates=[[[55.0091271, 24.7328863], [56.3816989, 24.7328863], [56.3816989, 25.8997649], [55.0091271, 25.8997649]]]), attributes={})"
53,"” الصحة ” تجري 136,483 فحصا ضمن خططها لتوسيع نطاق الفحوصات و تكشف عن 1,285 إصابة جديدة بفيروس كورونا و713 حالة شفاء و4 حالات وفاة خلال الساعات الـ 24 …  ",1334088953570291713,2020-12-02 10:56:07,0,0,"Place(_api=<tweepy.api.API object at 0x7f603361e790>, id='001907e868d06e24', url='https://api.twitter.com/1.1/geo/id/001907e868d06e24.json', place_type='admin', name='Dubai', full_name='Dubai, United Arab Emirates', country_code='AE', country='United Arab Emirates', contained_within=[], bounding_box=BoundingBox(_api=<tweepy.api.API object at 0x7f603361e790>, type='Polygon', coordinates=[[[54.8939725, 24.6182526], [56.2083722, 24.6182526], [56.2083722, 25.3686719], [54.8939725, 25.3686719]]]), attributes={})"
54,ما هي اسباب تكون جلطات الدم لمرضي فيروس كورونا وكيف يمكن الوقاية منها  ,1334088935421579264,2020-12-02 10:56:03,0,0,"Place(_api=<tweepy.api.API object at 0x7f603361e790>, id='001907e868d06e24', url='https://api.twitter.com/1.1/geo/id/001907e868d06e24.json', place_type='admin', name='Dubai', full_name='Dubai, United Arab Emirates', country_code='AE', country='United Arab Emirates', contained_within=[], bounding_box=BoundingBox(_api=<tweepy.api.API object at 0x7f603361e790>, type='Polygon', coordinates=[[[54.8939725, 24.6182526], [56.2083722, 24.6182526], [56.2083722, 25.3686719], [54.8939725, 25.3686719]]]), attributes={})"
55,رغم التأجيل واستمرار كورونا… حفل أوسكار 2021 بحضور الجمهور  ,1334088558064275456,2020-12-02 10:54:33,0,0,"Place(_api=<tweepy.api.API object at 0x7f603361e790>, id='001907e868d06e24', url='https://api.twitter.com/1.1/geo/id/001907e868d06e24.json', place_type='admin', name='Dubai', full_name='Dubai, United Arab Emirates', country_code='AE', country='United Arab Emirates', contained_within=[], bounding_box=BoundingBox(_api=<tweepy.api.API object at 0x7f603361e790>, type='Polygon', coordinates=[[[54.8939725, 24.6182526], [56.2083722, 24.6182526], [56.2083722, 25.3686719], [54.8939725, 25.3686719]]]), attributes={})"
56,"“الصحة”: 1,285 إصابة جديدة بفيروس كورونا  ",1334085667383504897,2020-12-02 10:43:03,0,0,"Place(_api=<tweepy.api.API object at 0x7f603361e790>, id='001907e868d06e24', url='https://api.twitter.com/1.1/geo/id/001907e868d06e24.json', place_type='admin', name='Dubai', full_name='Dubai, United Arab Emirates', country_code='AE', country='United Arab Emirates', contained_within=[], bounding_box=BoundingBox(_api=<tweepy.api.API object at 0x7f603361e790>, type='Polygon', coordinates=[[[54.8939725, 24.6182526], [56.2083722, 24.6182526], [56.2083722, 25.3686719], [54.8939725, 25.3686719]]]), attributes={})"
57,"وافقت الحكومة البريطانية اليوم الأربعاء ، على استخدام اللقاح الذي تنتجه شركتا ""فايزر"" و""بيونتيك"" ضد فيروس المستجد بعد قبول توصية وكالة تنظيم الأدوية ومنتجات الرعاية الصحية، بحيث يتوفر اللقاح في أنحاء بريطانيا ابتداء من الأسبوع المقبل. ",1334068069841383425,2020-12-02 09:33:08,10,4,"Place(_api=<tweepy.api.API object at 0x7f603361e790>, id='001907e868d06e24', url='https://api.twitter.com/1.1/geo/id/001907e868d06e24.json', place_type='admin', name='Dubai', full_name='Dubai, United Arab Emirates', country_code='AE', country='United Arab Emirates', contained_within=[], bounding_box=BoundingBox(_api=<tweepy.api.API object at 0x7f603361e790>, type='Polygon', coordinates=[[[54.8939725, 24.6182526], [56.2083722, 24.6182526], [56.2083722, 25.3686719], [54.8939725, 25.3686719]]]), attributes={})"
58,حصيلة قياسية لوفيات كورونا في ألمانيا والإصابات في إيطاليا تتجاوز 1.62 مليون  ,1334062264081555459,2020-12-02 09:10:04,1,0,"Place(_api=<tweepy.api.API object at 0x7f603361e790>, id='001907e868d06e24', url='https://api.twitter.com/1.1/geo/id/001907e868d06e24.json', place_type='admin', name='Dubai', full_name='Dubai, United Arab Emirates', country_code='AE', country='United Arab Emirates', contained_within=[], bounding_box=BoundingBox(_api=<tweepy.api.API object at 0x7f603361e790>, type='Polygon', coordinates=[[[54.8939725, 24.6182526], [56.2083722, 24.6182526], [56.2083722, 25.3686719], [54.8939725, 25.3686719]]]), attributes={})"
59,أمريكا تبدأ التطعيم ضد كورونا في منتصف ديسمبر  ,1334062260981878784,2020-12-02 09:10:03,2,0,"Place(_api=<tweepy.api.API object at 0x7f603361e790>, id='001907e868d06e24', url='https://api.twitter.com/1.1/geo/id/001907e868d06e24.json', place_type='admin', name='Dubai', full_name='Dubai, United Arab Emirates', country_code='AE', country='United Arab Emirates', contained_within=[], bounding_box=BoundingBox(_api=<tweepy.api.API object at 0x7f603361e790>, type='Polygon', coordinates=[[[54.8939725, 24.6182526], [56.2083722, 24.6182526], [56.2083722, 25.3686719], [54.8939725, 25.3686719]]]), attributes={})"
60,طلب عاجل من «موديرنا» للحصول على ترخيص لقاح كورونا.. هل انتهت الأزمة ,1334059248410619906,2020-12-02 08:58:05,2,0,"Place(_api=<tweepy.api.API object at 0x7f603361e790>, id='001907e868d06e24', url='https://api.twitter.com/1.1/geo/id/001907e868d06e24.json', place_type='admin', name='Dubai', full_name='Dubai, United Arab Emirates', country_code='AE', country='United Arab Emirates', contained_within=[], bounding_box=BoundingBox(_api=<tweepy.api.API object at 0x7f603361e790>, type='Polygon', coordinates=[[[54.8939725, 24.6182526], [56.2083722, 24.6182526], [56.2083722, 25.3686719], [54.8939725, 25.3686719]]]), attributes={})"
61,أمل يلوح.. بخاخ أنفي قد يحمي من كورونا  ,1334057234406391811,2020-12-02 08:50:04,1,0,"Place(_api=<tweepy.api.API object at 0x7f603361e790>, id='001907e868d06e24', url='https://api.twitter.com/1.1/geo/id/001907e868d06e24.json', place_type='admin', name='Dubai', full_name='Dubai, United Arab Emirates', country_code='AE', country='United Arab Emirates', contained_within=[], bounding_box=BoundingBox(_api=<tweepy.api.API object at 0x7f603361e790>, type='Polygon', coordinates=[[[54.8939725, 24.6182526], [56.2083722, 24.6182526], [56.2083722, 25.3686719], [54.8939725, 25.3686719]]]), attributes={})"
62,خبر سار عن كورونا أخيراً.. لا داعي لـ 14 يوما من الحجر  ,1334057230736375809,2020-12-02 08:50:04,2,0,"Place(_api=<tweepy.api.API object at 0x7f603361e790>, id='001907e868d06e24', url='https://api.twitter.com/1.1/geo/id/001907e868d06e24.json', place_type='admin', name='Dubai', full_name='Dubai, United Arab Emirates', country_code='AE', country='United Arab Emirates', contained_within=[], bounding_box=BoundingBox(_api=<tweepy.api.API object at 0x7f603361e790>, type='Polygon', coordinates=[[[54.8939725, 24.6182526], [56.2083722, 24.6182526], [56.2083722, 25.3686719], [54.8939725, 25.3686719]]]), attributes={})"
63,بريطانيا توافق على استخدام لقاح فايزربيونتيك ضد كورونا  ,1334057227099938820,2020-12-02 08:50:03,0,0,"Place(_api=<tweepy.api.API object at 0x7f603361e790>, id='001907e868d06e24', url='https://api.twitter.com/1.1/geo/id/001907e868d06e24.json', place_type='admin', name='Dubai', full_name='Dubai, United Arab Emirates', country_code='AE', country='United Arab Emirates', contained_within=[], bounding_box=BoundingBox(_api=<tweepy.api.API object at 0x7f603361e790>, type='Polygon', coordinates=[[[54.8939725, 24.6182526], [56.2083722, 24.6182526], [56.2083722, 25.3686719], [54.8939725, 25.3686719]]]), attributes={})"
64,إصابات “كورونا” حول العالم تتجاوز 63.8 مليون حالة ,1334032686785064962,2020-12-02 07:12:32,2,0,"Place(_api=<tweepy.api.API object at 0x7f603361e790>, id='001907e868d06e24', url='https://api.twitter.com/1.1/geo/id/001907e868d06e24.json', place_type='admin', name='Dubai', full_name='Dubai, United Arab Emirates', country_code='AE', country='United Arab Emirates', contained_within=[], bounding_box=BoundingBox(_api=<tweepy.api.API object at 0x7f603361e790>, type='Polygon', coordinates=[[[54.8939725, 24.6182526], [56.2083722, 24.6182526], [56.2083722, 25.3686719], [54.8939725, 25.3686719]]]), attributes={})"
65,إصابات “كورونا” حول العالم تتجاوز 63.8 مليون حالة  ,1334031429508861953,2020-12-02 07:07:32,1,1,"Place(_api=<tweepy.api.API object at 0x7f603361e790>, id='001907e868d06e24', url='https://api.twitter.com/1.1/geo/id/001907e868d06e24.json', place_type='admin', name='Dubai', full_name='Dubai, United Arab Emirates', country_code='AE', country='United Arab Emirates', contained_within=[], bounding_box=BoundingBox(_api=<tweepy.api.API object at 0x7f603361e790>, type='Polygon', coordinates=[[[54.8939725, 24.6182526], [56.2083722, 24.6182526], [56.2083722, 25.3686719], [54.8939725, 25.3686719]]]), attributes={})"
66,كورونا حول العالم… 1.4 مليون وفاة و64 مليون إصابة  ,1334031309497196545,2020-12-02 07:07:03,0,0,"Place(_api=<tweepy.api.API object at 0x7f603361e790>, id='001907e868d06e24', url='https://api.twitter.com/1.1/geo/id/001907e868d06e24.json', place_type='admin', name='Dubai', full_name='Dubai, United Arab Emirates', country_code='AE', country='United Arab Emirates', contained_within=[], bounding_box=BoundingBox(_api=<tweepy.api.API object at 0x7f603361e790>, type='Polygon', coordinates=[[[54.8939725, 24.6182526], [56.2083722, 24.6182526], [56.2083722, 25.3686719], [54.8939725, 25.3686719]]]), attributes={})"
67,من قلب ووهان.. وثائق مسربة تفضح خفايا صادمة عن كورونا  ,1333928131867000832,2020-12-02 00:17:04,1,0,"Place(_api=<tweepy.api.API object at 0x7f603361e790>, id='001907e868d06e24', url='https://api.twitter.com/1.1/geo/id/001907e868d06e24.json', place_type='admin', name='Dubai', full_name='Dubai, United Arab Emirates', country_code='AE', country='United Arab Emirates', contained_within=[], bounding_box=BoundingBox(_api=<tweepy.api.API object at 0x7f603361e790>, type='Polygon', coordinates=[[[54.8939725, 24.6182526], [56.2083722, 24.6182526], [56.2083722, 25.3686719], [54.8939725, 25.3686719]]]), attributes={})"
68,إصابات كورونا عالمياً تتجاوز 63.33 مليون والوفيات مليون و474650  ,1333918603649765376,2020-12-01 23:39:12,1,0,"Place(_api=<tweepy.api.API object at 0x7f603361e790>, id='001907e868d06e24', url='https://api.twitter.com/1.1/geo/id/001907e868d06e24.json', place_type='admin', name='Dubai', full_name='Dubai, United Arab Emirates', country_code='AE', country='United Arab Emirates', contained_within=[], bounding_box=BoundingBox(_api=<tweepy.api.API object at 0x7f603361e790>, type='Polygon', coordinates=[[[54.8939725, 24.6182526], [56.2083722, 24.6182526], [56.2083722, 25.3686719], [54.8939725, 25.3686719]]]), attributes={})"
69,«كورونا» يرفع الاحتياجات الإنسانية إلى 35 مليار دولار  ,1333918591536697344,2020-12-01 23:39:09,1,0,"Place(_api=<tweepy.api.API object at 0x7f603361e790>, id='001907e868d06e24', url='https://api.twitter.com/1.1/geo/id/001907e868d06e24.json', place_type='admin', name='Dubai', full_name='Dubai, United Arab Emirates', country_code='AE', country='United Arab Emirates', contained_within=[], bounding_box=BoundingBox(_api=<tweepy.api.API object at 0x7f603361e790>, type='Polygon', coordinates=[[[54.8939725, 24.6182526], [56.2083722, 24.6182526], [56.2083722, 25.3686719], [54.8939725, 25.3686719]]]), attributes={})"
