,Tweets,id,date,likes,retweets,place
0,موديرنا تطالب الأوروبيين بالاستعجال للحصول على لقاح كورونا  ,1328762469829943296,2020-11-17 18:10:34,0,0,"Place(_api=<tweepy.api.API object at 0x7fc8ef8ac790>, id='001907e868d06e24', url='https://api.twitter.com/1.1/geo/id/001907e868d06e24.json', place_type='admin', name='Dubai', full_name='Dubai, United Arab Emirates', country_code='AE', country='United Arab Emirates', contained_within=[], bounding_box=BoundingBox(_api=<tweepy.api.API object at 0x7fc8ef8ac790>, type='Polygon', coordinates=[[[54.8939725, 24.6182526], [56.2083722, 24.6182526], [56.2083722, 25.3686719], [54.8939725, 25.3686719]]]), attributes={})"
1,هابي بيرثدي كورونا  ,1328756555160936448,2020-11-17 17:47:04,0,0,"Place(_api=<tweepy.api.API object at 0x7fc8ef8ac790>, id='00f24ae701a1207b', url='https://api.twitter.com/1.1/geo/id/00f24ae701a1207b.json', place_type='admin', name='Abu Dhabi', full_name='Abu Dhabi, United Arab Emirates', country_code='AE', country='United Arab Emirates', contained_within=[], bounding_box=BoundingBox(_api=<tweepy.api.API object at 0x7fc8ef8ac790>, type='Polygon', coordinates=[[[51.2938738, 22.6261387], [56.0175464, 22.6261387], [56.0175464, 25.1639588], [51.2938738, 25.1639588]]]), attributes={})"
2,قبل حلول الأعياد الوطنية.. الإمارات تشدد على الالتزام بتدابير “كورونا”  ,1328742598815584259,2020-11-17 16:51:37,1,0,"Place(_api=<tweepy.api.API object at 0x7fc8ef8ac790>, id='001907e868d06e24', url='https://api.twitter.com/1.1/geo/id/001907e868d06e24.json', place_type='admin', name='Dubai', full_name='Dubai, United Arab Emirates', country_code='AE', country='United Arab Emirates', contained_within=[], bounding_box=BoundingBox(_api=<tweepy.api.API object at 0x7fc8ef8ac790>, type='Polygon', coordinates=[[[54.8939725, 24.6182526], [56.2083722, 24.6182526], [56.2083722, 25.3686719], [54.8939725, 25.3686719]]]), attributes={})"
3,عندما يمنعك وباء كورونا من زيارة فإن الله سيرزقك بصديق مثل والذي سيحضر المعرض الى منزلك . ,1328740618097602561,2020-11-17 16:43:44,10,1,"Place(_api=<tweepy.api.API object at 0x7fc8ef8ac790>, id='00f24ae701a1207b', url='https://api.twitter.com/1.1/geo/id/00f24ae701a1207b.json', place_type='admin', name='Abu Dhabi', full_name='Abu Dhabi, United Arab Emirates', country_code='AE', country='United Arab Emirates', contained_within=[], bounding_box=BoundingBox(_api=<tweepy.api.API object at 0x7fc8ef8ac790>, type='Polygon', coordinates=[[[51.2938738, 22.6261387], [56.0175464, 22.6261387], [56.0175464, 25.1639588], [51.2938738, 25.1639588]]]), attributes={})"
4,بوتين يحث دول “بريكس” على إنتاج اللقاحين الروسيين ضد كورونا  ,1328737557048299521,2020-11-17 16:31:35,1,0,"Place(_api=<tweepy.api.API object at 0x7fc8ef8ac790>, id='001907e868d06e24', url='https://api.twitter.com/1.1/geo/id/001907e868d06e24.json', place_type='admin', name='Dubai', full_name='Dubai, United Arab Emirates', country_code='AE', country='United Arab Emirates', contained_within=[], bounding_box=BoundingBox(_api=<tweepy.api.API object at 0x7fc8ef8ac790>, type='Polygon', coordinates=[[[54.8939725, 24.6182526], [56.2083722, 24.6182526], [56.2083722, 25.3686719], [54.8939725, 25.3686719]]]), attributes={})"
5,حصيلة قياسية لإصابات كورونا اليومية في الأردن  ,1328734161352364033,2020-11-17 16:18:05,0,0,"Place(_api=<tweepy.api.API object at 0x7fc8ef8ac790>, id='001907e868d06e24', url='https://api.twitter.com/1.1/geo/id/001907e868d06e24.json', place_type='admin', name='Dubai', full_name='Dubai, United Arab Emirates', country_code='AE', country='United Arab Emirates', contained_within=[], bounding_box=BoundingBox(_api=<tweepy.api.API object at 0x7fc8ef8ac790>, type='Polygon', coordinates=[[[54.8939725, 24.6182526], [56.2083722, 24.6182526], [56.2083722, 25.3686719], [54.8939725, 25.3686719]]]), attributes={})"
