,Tweets,id,date,likes,retweets,place
107,جنه من وقف نصايح كورونا الشعب تحرى المرض خلص و الحالات مستوية اضعاف. يا رب ما يرجع الحظر، لأنه الوضع مب ناقص . ذس إز تو مج. ,1352968501011611650,2021-01-23 13:16:42,2,2,"Place(_api=<tweepy.api.API object at 0x7f370e9c0cd0>, id='001907e868d06e24', url='https://api.twitter.com/1.1/geo/id/001907e868d06e24.json', place_type='admin', name='Dubai', full_name='Dubai, United Arab Emirates', country_code='AE', country='United Arab Emirates', contained_within=[], bounding_box=BoundingBox(_api=<tweepy.api.API object at 0x7f370e9c0cd0>, type='Polygon', coordinates=[[[54.8939725, 24.6182526], [56.2083722, 24.6182526], [56.2083722, 25.3686719], [54.8939725, 25.3686719]]]), attributes={})"
108,هذا الترند ليس له قيمة، فملاك النادي FSG ورثوا تركة ثقيلة و انتشلوا النادي الذي كان يعاني مشاكل مالية في حينه، و أعادوه إلى الواجهة بالتعاقد مع كلوب. فليس من المعقول مطالبتهم بالصرف في ظل ظروف كورونا ,1352967642399830016,2021-01-23 13:13:17,2,0,"Place(_api=<tweepy.api.API object at 0x7f370e9c0cd0>, id='00f24ae701a1207b', url='https://api.twitter.com/1.1/geo/id/00f24ae701a1207b.json', place_type='admin', name='Abu Dhabi', full_name='Abu Dhabi, United Arab Emirates', country_code='AE', country='United Arab Emirates', contained_within=[], bounding_box=BoundingBox(_api=<tweepy.api.API object at 0x7f370e9c0cd0>, type='Polygon', coordinates=[[[51.2938738, 22.6261387], [56.0175464, 22.6261387], [56.0175464, 25.1639588], [51.2938738, 25.1639588]]]), attributes={})"
109,"الصحة تقدم 87,720 جرعة جديدة من لقاح كورونا  ",1352965068212690944,2021-01-23 13:03:03,0,0,"Place(_api=<tweepy.api.API object at 0x7f370e9c0cd0>, id='001907e868d06e24', url='https://api.twitter.com/1.1/geo/id/001907e868d06e24.json', place_type='admin', name='Dubai', full_name='Dubai, United Arab Emirates', country_code='AE', country='United Arab Emirates', contained_within=[], bounding_box=BoundingBox(_api=<tweepy.api.API object at 0x7f370e9c0cd0>, type='Polygon', coordinates=[[[54.8939725, 24.6182526], [56.2083722, 24.6182526], [56.2083722, 25.3686719], [54.8939725, 25.3686719]]]), attributes={})"
110,الجزء الثاني من “مكان هادئ” ينضم لقائمة الأفلام المؤجلة بسبب كورونا  ,1352962295794569216,2021-01-23 12:52:02,1,0,"Place(_api=<tweepy.api.API object at 0x7f370e9c0cd0>, id='001907e868d06e24', url='https://api.twitter.com/1.1/geo/id/001907e868d06e24.json', place_type='admin', name='Dubai', full_name='Dubai, United Arab Emirates', country_code='AE', country='United Arab Emirates', contained_within=[], bounding_box=BoundingBox(_api=<tweepy.api.API object at 0x7f370e9c0cd0>, type='Polygon', coordinates=[[[54.8939725, 24.6182526], [56.2083722, 24.6182526], [56.2083722, 25.3686719], [54.8939725, 25.3686719]]]), attributes={})"
111,اختتام ورشة “التخطيط للتعافي من كورونا ” بالشارقة  ,1352961811008548864,2021-01-23 12:50:07,2,0,"Place(_api=<tweepy.api.API object at 0x7f370e9c0cd0>, id='001907e868d06e24', url='https://api.twitter.com/1.1/geo/id/001907e868d06e24.json', place_type='admin', name='Dubai', full_name='Dubai, United Arab Emirates', country_code='AE', country='United Arab Emirates', contained_within=[], bounding_box=BoundingBox(_api=<tweepy.api.API object at 0x7f370e9c0cd0>, type='Polygon', coordinates=[[[54.8939725, 24.6182526], [56.2083722, 24.6182526], [56.2083722, 25.3686719], [54.8939725, 25.3686719]]]), attributes={})"
