,Tweets,id,date,likes,retweets,place
284,اعتماد إنشاء المركز الخليجي للوقاية من الأمراض ومكافحتها لمواجهة كورونا  ,1346794661067702272,2021-01-06 12:24:04,0,0,"Place(_api=<tweepy.api.API object at 0x7f0ca5bdbcd0>, id='001907e868d06e24', url='https://api.twitter.com/1.1/geo/id/001907e868d06e24.json', place_type='admin', name='Dubai', full_name='Dubai, United Arab Emirates', country_code='AE', country='United Arab Emirates', contained_within=[], bounding_box=BoundingBox(_api=<tweepy.api.API object at 0x7f0ca5bdbcd0>, type='Polygon', coordinates=[[[54.8939725, 24.6182526], [56.2083722, 24.6182526], [56.2083722, 25.3686719], [54.8939725, 25.3686719]]]), attributes={})"
285,لقاح كورونا وكالة الأدوية الأوروبية تدرس اعتماد لقاح موديرنا ضد كورونا  ,1346793671430086657,2021-01-06 12:20:08,0,0,"Place(_api=<tweepy.api.API object at 0x7f0ca5bdbcd0>, id='001907e868d06e24', url='https://api.twitter.com/1.1/geo/id/001907e868d06e24.json', place_type='admin', name='Dubai', full_name='Dubai, United Arab Emirates', country_code='AE', country='United Arab Emirates', contained_within=[], bounding_box=BoundingBox(_api=<tweepy.api.API object at 0x7f0ca5bdbcd0>, type='Polygon', coordinates=[[[54.8939725, 24.6182526], [56.2083722, 24.6182526], [56.2083722, 25.3686719], [54.8939725, 25.3686719]]]), attributes={})"
286,فحص كورونا جديد يعطي النتيجة خلال 5 دقائق  ,1346793668238217219,2021-01-06 12:20:07,0,0,"Place(_api=<tweepy.api.API object at 0x7f0ca5bdbcd0>, id='001907e868d06e24', url='https://api.twitter.com/1.1/geo/id/001907e868d06e24.json', place_type='admin', name='Dubai', full_name='Dubai, United Arab Emirates', country_code='AE', country='United Arab Emirates', contained_within=[], bounding_box=BoundingBox(_api=<tweepy.api.API object at 0x7f0ca5bdbcd0>, type='Polygon', coordinates=[[[54.8939725, 24.6182526], [56.2083722, 24.6182526], [56.2083722, 25.3686719], [54.8939725, 25.3686719]]]), attributes={})"
287,مشروب يحارب كورونا والزهايمر والسرطان ما هو  ,1346793654891864065,2021-01-06 12:20:04,0,0,"Place(_api=<tweepy.api.API object at 0x7f0ca5bdbcd0>, id='001907e868d06e24', url='https://api.twitter.com/1.1/geo/id/001907e868d06e24.json', place_type='admin', name='Dubai', full_name='Dubai, United Arab Emirates', country_code='AE', country='United Arab Emirates', contained_within=[], bounding_box=BoundingBox(_api=<tweepy.api.API object at 0x7f0ca5bdbcd0>, type='Polygon', coordinates=[[[54.8939725, 24.6182526], [56.2083722, 24.6182526], [56.2083722, 25.3686719], [54.8939725, 25.3686719]]]), attributes={})"
288,الفرقة الناجية الي ما تزوجوا و لا جاهم كورونا و لسا في الحجر.,1346791941099433984,2021-01-06 12:13:15,1,0,"Place(_api=<tweepy.api.API object at 0x7f0ca5bdbcd0>, id='00f24ae701a1207b', url='https://api.twitter.com/1.1/geo/id/00f24ae701a1207b.json', place_type='admin', name='Abu Dhabi', full_name='Abu Dhabi, United Arab Emirates', country_code='AE', country='United Arab Emirates', contained_within=[], bounding_box=BoundingBox(_api=<tweepy.api.API object at 0x7f0ca5bdbcd0>, type='Polygon', coordinates=[[[51.2938738, 22.6261387], [56.0175464, 22.6261387], [56.0175464, 25.1639588], [51.2938738, 25.1639588]]]), attributes={})"
289,أكبر دولة إسلامية تتطلع لإصدار فتوى بإباحة لقاح كورونا  ,1346786233486176257,2021-01-06 11:50:34,0,0,"Place(_api=<tweepy.api.API object at 0x7f0ca5bdbcd0>, id='001907e868d06e24', url='https://api.twitter.com/1.1/geo/id/001907e868d06e24.json', place_type='admin', name='Dubai', full_name='Dubai, United Arab Emirates', country_code='AE', country='United Arab Emirates', contained_within=[], bounding_box=BoundingBox(_api=<tweepy.api.API object at 0x7f0ca5bdbcd0>, type='Polygon', coordinates=[[[54.8939725, 24.6182526], [56.2083722, 24.6182526], [56.2083722, 25.3686719], [54.8939725, 25.3686719]]]), attributes={})"
290,الامارات العين ابو ظبي دبي 0555554976 ,1346773245077450753,2021-01-06 10:58:58,0,0,"Place(_api=<tweepy.api.API object at 0x7f0ca5bdbcd0>, id='001907e868d06e24', url='https://api.twitter.com/1.1/geo/id/001907e868d06e24.json', place_type='admin', name='Dubai', full_name='Dubai, United Arab Emirates', country_code='AE', country='United Arab Emirates', contained_within=[], bounding_box=BoundingBox(_api=<tweepy.api.API object at 0x7f0ca5bdbcd0>, type='Polygon', coordinates=[[[54.8939725, 24.6182526], [56.2083722, 24.6182526], [56.2083722, 25.3686719], [54.8939725, 25.3686719]]]), attributes={})"
291,هذا كل ما يجب أن تعرفه عن إجراءات لقاح “كورونا” في الإمارات  ,1346767732520280069,2021-01-06 10:37:03,0,0,"Place(_api=<tweepy.api.API object at 0x7f0ca5bdbcd0>, id='001907e868d06e24', url='https://api.twitter.com/1.1/geo/id/001907e868d06e24.json', place_type='admin', name='Dubai', full_name='Dubai, United Arab Emirates', country_code='AE', country='United Arab Emirates', contained_within=[], bounding_box=BoundingBox(_api=<tweepy.api.API object at 0x7f0ca5bdbcd0>, type='Polygon', coordinates=[[[54.8939725, 24.6182526], [56.2083722, 24.6182526], [56.2083722, 25.3686719], [54.8939725, 25.3686719]]]), attributes={})"
292,(رويترز) -أظهر مسح إحصائي أن النشاط الاقتصادي في منطقة اليورو قد انكمش بشكل أكثر حدة مما كان يعتقد في نهاية عام 2020 ، وقد يزداد هذا الانكماش سوءًا مع تجدد قيود الإغلاق المفروضة لاحتواء فيروس كورونا على قطاع الخدمات بالذات وهو القطاع المهيمن في الاتحاد. ,1346754895421046785,2021-01-06 09:46:03,7,2,"Place(_api=<tweepy.api.API object at 0x7f0ca5bdbcd0>, id='001907e868d06e24', url='https://api.twitter.com/1.1/geo/id/001907e868d06e24.json', place_type='admin', name='Dubai', full_name='Dubai, United Arab Emirates', country_code='AE', country='United Arab Emirates', contained_within=[], bounding_box=BoundingBox(_api=<tweepy.api.API object at 0x7f0ca5bdbcd0>, type='Polygon', coordinates=[[[54.8939725, 24.6182526], [56.2083722, 24.6182526], [56.2083722, 25.3686719], [54.8939725, 25.3686719]]]), attributes={})"
293,بريطانيا: وفيات كورونا تصل إلى 76.4 ألفاً والإصابات 2.78 مليون  ,1346754014893932544,2021-01-06 09:42:33,0,0,"Place(_api=<tweepy.api.API object at 0x7f0ca5bdbcd0>, id='001907e868d06e24', url='https://api.twitter.com/1.1/geo/id/001907e868d06e24.json', place_type='admin', name='Dubai', full_name='Dubai, United Arab Emirates', country_code='AE', country='United Arab Emirates', contained_within=[], bounding_box=BoundingBox(_api=<tweepy.api.API object at 0x7f0ca5bdbcd0>, type='Polygon', coordinates=[[[54.8939725, 24.6182526], [56.2083722, 24.6182526], [56.2083722, 25.3686719], [54.8939725, 25.3686719]]]), attributes={})"
294,لقاح كورونا وكالة الأدوية الأوروبية تدرس اعتماد لقاح موديرنا ضد كورونا  ,1346748476948766720,2021-01-06 09:20:32,1,0,"Place(_api=<tweepy.api.API object at 0x7f0ca5bdbcd0>, id='001907e868d06e24', url='https://api.twitter.com/1.1/geo/id/001907e868d06e24.json', place_type='admin', name='Dubai', full_name='Dubai, United Arab Emirates', country_code='AE', country='United Arab Emirates', contained_within=[], bounding_box=BoundingBox(_api=<tweepy.api.API object at 0x7f0ca5bdbcd0>, type='Polygon', coordinates=[[[54.8939725, 24.6182526], [56.2083722, 24.6182526], [56.2083722, 25.3686719], [54.8939725, 25.3686719]]]), attributes={})"
295,إسبانيا: إصابات كورونا تصل إلى 1.98 مليون حالة  ,1346747237775286272,2021-01-06 09:15:37,0,0,"Place(_api=<tweepy.api.API object at 0x7f0ca5bdbcd0>, id='001907e868d06e24', url='https://api.twitter.com/1.1/geo/id/001907e868d06e24.json', place_type='admin', name='Dubai', full_name='Dubai, United Arab Emirates', country_code='AE', country='United Arab Emirates', contained_within=[], bounding_box=BoundingBox(_api=<tweepy.api.API object at 0x7f0ca5bdbcd0>, type='Polygon', coordinates=[[[54.8939725, 24.6182526], [56.2083722, 24.6182526], [56.2083722, 25.3686719], [54.8939725, 25.3686719]]]), attributes={})"
296,لقاح كورونا.. مرحلة هامة في الإمارات تدفع بالجائحة إلى دائرة السيطرة  ,1346743076706926594,2021-01-06 08:59:05,0,0,"Place(_api=<tweepy.api.API object at 0x7f0ca5bdbcd0>, id='001907e868d06e24', url='https://api.twitter.com/1.1/geo/id/001907e868d06e24.json', place_type='admin', name='Dubai', full_name='Dubai, United Arab Emirates', country_code='AE', country='United Arab Emirates', contained_within=[], bounding_box=BoundingBox(_api=<tweepy.api.API object at 0x7f0ca5bdbcd0>, type='Polygon', coordinates=[[[54.8939725, 24.6182526], [56.2083722, 24.6182526], [56.2083722, 25.3686719], [54.8939725, 25.3686719]]]), attributes={})"
297,1019 وفاة و21.2 ألف إصابة جديدة بفيروس كورونا في ألمانيا  ,1346739192882024450,2021-01-06 08:43:39,0,0,"Place(_api=<tweepy.api.API object at 0x7f0ca5bdbcd0>, id='001907e868d06e24', url='https://api.twitter.com/1.1/geo/id/001907e868d06e24.json', place_type='admin', name='Dubai', full_name='Dubai, United Arab Emirates', country_code='AE', country='United Arab Emirates', contained_within=[], bounding_box=BoundingBox(_api=<tweepy.api.API object at 0x7f0ca5bdbcd0>, type='Polygon', coordinates=[[[54.8939725, 24.6182526], [56.2083722, 24.6182526], [56.2083722, 25.3686719], [54.8939725, 25.3686719]]]), attributes={})"
298,منظمة العفو الدولية تدعو إسرائيل إلى توفير لقاح كورونا للفلسطينيين  ,1346739172443230208,2021-01-06 08:43:34,0,0,"Place(_api=<tweepy.api.API object at 0x7f0ca5bdbcd0>, id='001907e868d06e24', url='https://api.twitter.com/1.1/geo/id/001907e868d06e24.json', place_type='admin', name='Dubai', full_name='Dubai, United Arab Emirates', country_code='AE', country='United Arab Emirates', contained_within=[], bounding_box=BoundingBox(_api=<tweepy.api.API object at 0x7f0ca5bdbcd0>, type='Polygon', coordinates=[[[54.8939725, 24.6182526], [56.2083722, 24.6182526], [56.2083722, 25.3686719], [54.8939725, 25.3686719]]]), attributes={})"
299,الصين تكثف إجراءات مكافحة كورونا بعد تزايد الإصابات المحلية  ,1346730989230297088,2021-01-06 08:11:03,1,1,"Place(_api=<tweepy.api.API object at 0x7f0ca5bdbcd0>, id='001907e868d06e24', url='https://api.twitter.com/1.1/geo/id/001907e868d06e24.json', place_type='admin', name='Dubai', full_name='Dubai, United Arab Emirates', country_code='AE', country='United Arab Emirates', contained_within=[], bounding_box=BoundingBox(_api=<tweepy.api.API object at 0x7f0ca5bdbcd0>, type='Polygon', coordinates=[[[54.8939725, 24.6182526], [56.2083722, 24.6182526], [56.2083722, 25.3686719], [54.8939725, 25.3686719]]]), attributes={})"
300,“صحة دبي”: اختصار مدة “الحجر” لبعض حالات “كورونا”  ,1346723694370983942,2021-01-06 07:42:04,1,2,"Place(_api=<tweepy.api.API object at 0x7f0ca5bdbcd0>, id='001907e868d06e24', url='https://api.twitter.com/1.1/geo/id/001907e868d06e24.json', place_type='admin', name='Dubai', full_name='Dubai, United Arab Emirates', country_code='AE', country='United Arab Emirates', contained_within=[], bounding_box=BoundingBox(_api=<tweepy.api.API object at 0x7f0ca5bdbcd0>, type='Polygon', coordinates=[[[54.8939725, 24.6182526], [56.2083722, 24.6182526], [56.2083722, 25.3686719], [54.8939725, 25.3686719]]]), attributes={})"
301,كورونا حول العالم.. 1.86 مليون وفاة والإصابات تقترب من 86.4 مليون  ,1346714881806880769,2021-01-06 07:07:03,1,1,"Place(_api=<tweepy.api.API object at 0x7f0ca5bdbcd0>, id='001907e868d06e24', url='https://api.twitter.com/1.1/geo/id/001907e868d06e24.json', place_type='admin', name='Dubai', full_name='Dubai, United Arab Emirates', country_code='AE', country='United Arab Emirates', contained_within=[], bounding_box=BoundingBox(_api=<tweepy.api.API object at 0x7f0ca5bdbcd0>, type='Polygon', coordinates=[[[54.8939725, 24.6182526], [56.2083722, 24.6182526], [56.2083722, 25.3686719], [54.8939725, 25.3686719]]]), attributes={})"
302,القبض على فتاة في سويسرا زورت نتيجة تحليل كورونا  ,1346706837865779200,2021-01-06 06:35:05,0,1,"Place(_api=<tweepy.api.API object at 0x7f0ca5bdbcd0>, id='001907e868d06e24', url='https://api.twitter.com/1.1/geo/id/001907e868d06e24.json', place_type='admin', name='Dubai', full_name='Dubai, United Arab Emirates', country_code='AE', country='United Arab Emirates', contained_within=[], bounding_box=BoundingBox(_api=<tweepy.api.API object at 0x7f0ca5bdbcd0>, type='Polygon', coordinates=[[[54.8939725, 24.6182526], [56.2083722, 24.6182526], [56.2083722, 25.3686719], [54.8939725, 25.3686719]]]), attributes={})"
303,إسرائيل تشدد قيود الإغلاق مع تصاعد إصابات كورونا  ,1346698282601385984,2021-01-06 06:01:05,1,1,"Place(_api=<tweepy.api.API object at 0x7f0ca5bdbcd0>, id='001907e868d06e24', url='https://api.twitter.com/1.1/geo/id/001907e868d06e24.json', place_type='admin', name='Dubai', full_name='Dubai, United Arab Emirates', country_code='AE', country='United Arab Emirates', contained_within=[], bounding_box=BoundingBox(_api=<tweepy.api.API object at 0x7f0ca5bdbcd0>, type='Polygon', coordinates=[[[54.8939725, 24.6182526], [56.2083722, 24.6182526], [56.2083722, 25.3686719], [54.8939725, 25.3686719]]]), attributes={})"
304,«البيان» تستضيف اليوم رئيسة قسم التحصين في «الصحة» للإجابة عن أسئلة الجمهور حول لقاحات كورونا  ,1346695125506801668,2021-01-06 05:48:32,2,1,"Place(_api=<tweepy.api.API object at 0x7f0ca5bdbcd0>, id='001907e868d06e24', url='https://api.twitter.com/1.1/geo/id/001907e868d06e24.json', place_type='admin', name='Dubai', full_name='Dubai, United Arab Emirates', country_code='AE', country='United Arab Emirates', contained_within=[], bounding_box=BoundingBox(_api=<tweepy.api.API object at 0x7f0ca5bdbcd0>, type='Polygon', coordinates=[[[54.8939725, 24.6182526], [56.2083722, 24.6182526], [56.2083722, 25.3686719], [54.8939725, 25.3686719]]]), attributes={})"
305,أكبر مهزلة صارت في زمن كورونا ان المدارس الخاصة تاخذ نفس الرسوم بالرغم من أن ٩٠٪ الطلاب في البيوت ,1346692491286876161,2021-01-06 05:38:04,4,0,"Place(_api=<tweepy.api.API object at 0x7f0ca5bdbcd0>, id='01b984d319b42814', url='https://api.twitter.com/1.1/geo/id/01b984d319b42814.json', place_type='admin', name='Ras Al Khaimah', full_name='Ras Al Khaimah, United Arab Emirates', country_code='AE', country='United Arab Emirates', contained_within=[], bounding_box=BoundingBox(_api=<tweepy.api.API object at 0x7f0ca5bdbcd0>, type='Polygon', coordinates=[[[55.7414877, 24.8517657], [56.3489937, 24.8517657], [56.3489937, 26.0841599], [55.7414877, 26.0841599]]]), attributes={})"
306,«البيان» تستضيف رئيسة قسم التحصين في «الصحة» للإجابة عن أسئلة الجمهور حول لقاحات كورونا  ,1346676884730351621,2021-01-06 04:36:04,0,0,"Place(_api=<tweepy.api.API object at 0x7f0ca5bdbcd0>, id='001907e868d06e24', url='https://api.twitter.com/1.1/geo/id/001907e868d06e24.json', place_type='admin', name='Dubai', full_name='Dubai, United Arab Emirates', country_code='AE', country='United Arab Emirates', contained_within=[], bounding_box=BoundingBox(_api=<tweepy.api.API object at 0x7f0ca5bdbcd0>, type='Polygon', coordinates=[[[54.8939725, 24.6182526], [56.2083722, 24.6182526], [56.2083722, 25.3686719], [54.8939725, 25.3686719]]]), attributes={})"
307,الصين تسجل 32 إصابة جديدة بفيروس كورونا  ,1346671856862969856,2021-01-06 04:16:05,0,0,"Place(_api=<tweepy.api.API object at 0x7f0ca5bdbcd0>, id='001907e868d06e24', url='https://api.twitter.com/1.1/geo/id/001907e868d06e24.json', place_type='admin', name='Dubai', full_name='Dubai, United Arab Emirates', country_code='AE', country='United Arab Emirates', contained_within=[], bounding_box=BoundingBox(_api=<tweepy.api.API object at 0x7f0ca5bdbcd0>, type='Polygon', coordinates=[[[54.8939725, 24.6182526], [56.2083722, 24.6182526], [56.2083722, 25.3686719], [54.8939725, 25.3686719]]]), attributes={})"
308,تحذير: سلالة كورونا الجديدة قد لا تنفع معها اللقاحات الحالية  ,1346610191945461761,2021-01-06 00:11:03,1,1,"Place(_api=<tweepy.api.API object at 0x7f0ca5bdbcd0>, id='001907e868d06e24', url='https://api.twitter.com/1.1/geo/id/001907e868d06e24.json', place_type='admin', name='Dubai', full_name='Dubai, United Arab Emirates', country_code='AE', country='United Arab Emirates', contained_within=[], bounding_box=BoundingBox(_api=<tweepy.api.API object at 0x7f0ca5bdbcd0>, type='Polygon', coordinates=[[[54.8939725, 24.6182526], [56.2083722, 24.6182526], [56.2083722, 25.3686719], [54.8939725, 25.3686719]]]), attributes={})"
309,«ذا بيونيير» الهندية تشيد بنجاح دبي في احتواء «كورونا»  ,1346593987759538176,2021-01-05 23:06:39,0,0,"Place(_api=<tweepy.api.API object at 0x7f0ca5bdbcd0>, id='001907e868d06e24', url='https://api.twitter.com/1.1/geo/id/001907e868d06e24.json', place_type='admin', name='Dubai', full_name='Dubai, United Arab Emirates', country_code='AE', country='United Arab Emirates', contained_within=[], bounding_box=BoundingBox(_api=<tweepy.api.API object at 0x7f0ca5bdbcd0>, type='Polygon', coordinates=[[[54.8939725, 24.6182526], [56.2083722, 24.6182526], [56.2083722, 25.3686719], [54.8939725, 25.3686719]]]), attributes={})"
310,الحجر والعزل 10 أيام لحالات معينة من المصابين بـ«كورونا» والمخالطين بدبي  ,1346593979509293062,2021-01-05 23:06:37,0,0,"Place(_api=<tweepy.api.API object at 0x7f0ca5bdbcd0>, id='001907e868d06e24', url='https://api.twitter.com/1.1/geo/id/001907e868d06e24.json', place_type='admin', name='Dubai', full_name='Dubai, United Arab Emirates', country_code='AE', country='United Arab Emirates', contained_within=[], bounding_box=BoundingBox(_api=<tweepy.api.API object at 0x7f0ca5bdbcd0>, type='Polygon', coordinates=[[[54.8939725, 24.6182526], [56.2083722, 24.6182526], [56.2083722, 25.3686719], [54.8939725, 25.3686719]]]), attributes={})"
311,القطامي: الإجراءات الصحية وتوفير لقاح «كورونا» مكنت دبي من سرعة التعافي  ,1346580631489187840,2021-01-05 22:13:35,0,0,"Place(_api=<tweepy.api.API object at 0x7f0ca5bdbcd0>, id='001907e868d06e24', url='https://api.twitter.com/1.1/geo/id/001907e868d06e24.json', place_type='admin', name='Dubai', full_name='Dubai, United Arab Emirates', country_code='AE', country='United Arab Emirates', contained_within=[], bounding_box=BoundingBox(_api=<tweepy.api.API object at 0x7f0ca5bdbcd0>, type='Polygon', coordinates=[[[54.8939725, 24.6182526], [56.2083722, 24.6182526], [56.2083722, 25.3686719], [54.8939725, 25.3686719]]]), attributes={})"
312,قفزة في أعداد إصابات كورونا في فرنسا  ,1346565911998697473,2021-01-05 21:15:06,0,0,"Place(_api=<tweepy.api.API object at 0x7f0ca5bdbcd0>, id='001907e868d06e24', url='https://api.twitter.com/1.1/geo/id/001907e868d06e24.json', place_type='admin', name='Dubai', full_name='Dubai, United Arab Emirates', country_code='AE', country='United Arab Emirates', contained_within=[], bounding_box=BoundingBox(_api=<tweepy.api.API object at 0x7f0ca5bdbcd0>, type='Polygon', coordinates=[[[54.8939725, 24.6182526], [56.2083722, 24.6182526], [56.2083722, 25.3686719], [54.8939725, 25.3686719]]]), attributes={})"
313,تحبي حد يدعي على والدك يجيه كورونا و يموت؟,1346563869393743874,2021-01-05 21:06:59,0,0,"Place(_api=<tweepy.api.API object at 0x7f0ca5bdbcd0>, id='00ecb59b0dad186e', url='https://api.twitter.com/1.1/geo/id/00ecb59b0dad186e.json', place_type='admin', name='Sharjah', full_name='Sharjah, United Arab Emirates', country_code='AE', country='United Arab Emirates', contained_within=[], bounding_box=BoundingBox(_api=<tweepy.api.API object at 0x7f0ca5bdbcd0>, type='Polygon', coordinates=[[[55.0091271, 24.7328863], [56.3816989, 24.7328863], [56.3816989, 25.8997649], [55.0091271, 25.8997649]]]), attributes={})"
314,الكويت تسجل 312 إصابة جديدة ب/كورونا/  ,1346562632405270528,2021-01-05 21:02:04,0,0,"Place(_api=<tweepy.api.API object at 0x7f0ca5bdbcd0>, id='001907e868d06e24', url='https://api.twitter.com/1.1/geo/id/001907e868d06e24.json', place_type='admin', name='Dubai', full_name='Dubai, United Arab Emirates', country_code='AE', country='United Arab Emirates', contained_within=[], bounding_box=BoundingBox(_api=<tweepy.api.API object at 0x7f0ca5bdbcd0>, type='Polygon', coordinates=[[[54.8939725, 24.6182526], [56.2083722, 24.6182526], [56.2083722, 25.3686719], [54.8939725, 25.3686719]]]), attributes={})"
315,جونسون يعتزم مطالبة الزوار الأجانب بفحص كورونا  ,1346549431147974657,2021-01-05 20:09:36,0,0,"Place(_api=<tweepy.api.API object at 0x7f0ca5bdbcd0>, id='001907e868d06e24', url='https://api.twitter.com/1.1/geo/id/001907e868d06e24.json', place_type='admin', name='Dubai', full_name='Dubai, United Arab Emirates', country_code='AE', country='United Arab Emirates', contained_within=[], bounding_box=BoundingBox(_api=<tweepy.api.API object at 0x7f0ca5bdbcd0>, type='Polygon', coordinates=[[[54.8939725, 24.6182526], [56.2083722, 24.6182526], [56.2083722, 25.3686719], [54.8939725, 25.3686719]]]), attributes={})"
316,مدير الصحة العالمية مستاء لعدم سماح الصين بدخول خبراء كورونا  ,1346541112945639424,2021-01-05 19:36:33,0,0,"Place(_api=<tweepy.api.API object at 0x7f0ca5bdbcd0>, id='001907e868d06e24', url='https://api.twitter.com/1.1/geo/id/001907e868d06e24.json', place_type='admin', name='Dubai', full_name='Dubai, United Arab Emirates', country_code='AE', country='United Arab Emirates', contained_within=[], bounding_box=BoundingBox(_api=<tweepy.api.API object at 0x7f0ca5bdbcd0>, type='Polygon', coordinates=[[[54.8939725, 24.6182526], [56.2083722, 24.6182526], [56.2083722, 25.3686719], [54.8939725, 25.3686719]]]), attributes={})"
317,تنسيني الهموم الي فيا...ريحت بلادي منها تفوح عندما يبتسم المخيم تعبس المدن الكبيره,1346538922281750530,2021-01-05 19:27:51,2,0,"Place(_api=<tweepy.api.API object at 0x7f0ca5bdbcd0>, id='00f24ae701a1207b', url='https://api.twitter.com/1.1/geo/id/00f24ae701a1207b.json', place_type='admin', name='Abu Dhabi', full_name='Abu Dhabi, United Arab Emirates', country_code='AE', country='United Arab Emirates', contained_within=[], bounding_box=BoundingBox(_api=<tweepy.api.API object at 0x7f0ca5bdbcd0>, type='Polygon', coordinates=[[[51.2938738, 22.6261387], [56.0175464, 22.6261387], [56.0175464, 25.1639588], [51.2938738, 25.1639588]]]), attributes={})"
318,باجر بيينا كورونا  ,1346523042583863298,2021-01-05 18:24:45,0,0,"Place(_api=<tweepy.api.API object at 0x7f0ca5bdbcd0>, id='00f24ae701a1207b', url='https://api.twitter.com/1.1/geo/id/00f24ae701a1207b.json', place_type='admin', name='Abu Dhabi', full_name='Abu Dhabi, United Arab Emirates', country_code='AE', country='United Arab Emirates', contained_within=[], bounding_box=BoundingBox(_api=<tweepy.api.API object at 0x7f0ca5bdbcd0>, type='Polygon', coordinates=[[[51.2938738, 22.6261387], [56.0175464, 22.6261387], [56.0175464, 25.1639588], [51.2938738, 25.1639588]]]), attributes={})"
319,صداااع، يارب مايطلع كورونا,1346519002525429761,2021-01-05 18:08:41,0,0,"Place(_api=<tweepy.api.API object at 0x7f0ca5bdbcd0>, id='00f24ae701a1207b', url='https://api.twitter.com/1.1/geo/id/00f24ae701a1207b.json', place_type='admin', name='Abu Dhabi', full_name='Abu Dhabi, United Arab Emirates', country_code='AE', country='United Arab Emirates', contained_within=[], bounding_box=BoundingBox(_api=<tweepy.api.API object at 0x7f0ca5bdbcd0>, type='Polygon', coordinates=[[[51.2938738, 22.6261387], [56.0175464, 22.6261387], [56.0175464, 25.1639588], [51.2938738, 25.1639588]]]), attributes={})"
320,اعادة / خلال الإحاطة الإعلامية الدورية حول فيروس كورونا المستجد ..إعطاء أكثر من 800 ألف جرعة لقاح والهدف هو تطعيم أكثر من 50% من السكان خلال الربع الأ…  ,1346510166112444416,2021-01-05 17:33:35,0,1,"Place(_api=<tweepy.api.API object at 0x7f0ca5bdbcd0>, id='001907e868d06e24', url='https://api.twitter.com/1.1/geo/id/001907e868d06e24.json', place_type='admin', name='Dubai', full_name='Dubai, United Arab Emirates', country_code='AE', country='United Arab Emirates', contained_within=[], bounding_box=BoundingBox(_api=<tweepy.api.API object at 0x7f0ca5bdbcd0>, type='Polygon', coordinates=[[[54.8939725, 24.6182526], [56.2083722, 24.6182526], [56.2083722, 25.3686719], [54.8939725, 25.3686719]]]), attributes={})"
