,Tweets,id,date,likes,retweets,place
0,يالس اتمصخر على اربيعي لانه فيه كورونا طلع انا بعد فيني كورونا,1387435101265416194,2021-04-28 15:54:40,1,0,"Place(_api=<tweepy.api.API object at 0x7f4a2afa77f0>, id='00f24ae701a1207b', url='https://api.twitter.com/1.1/geo/id/00f24ae701a1207b.json', place_type='admin', name='Abu Dhabi', full_name='Abu Dhabi, United Arab Emirates', country_code='AE', country='United Arab Emirates', contained_within=[], bounding_box=BoundingBox(_api=<tweepy.api.API object at 0x7f4a2afa77f0>, type='Polygon', coordinates=[[[51.2938738, 22.6261387], [56.0175464, 22.6261387], [56.0175464, 25.1639588], [51.2938738, 25.1639588]]]), attributes={})"
1,•• ~ هدية العطاء.. إهدِ أحبابك مشروعي خيري عبر موقع الهلال الأحمر الإماراتي وساهم عنه بفرحة طفل في العيد ~  . . ,1387433333802606602,2021-04-28 15:47:38,1,2,"Place(_api=<tweepy.api.API object at 0x7f4a2afa77f0>, id='00f24ae701a1207b', url='https://api.twitter.com/1.1/geo/id/00f24ae701a1207b.json', place_type='admin', name='Abu Dhabi', full_name='Abu Dhabi, United Arab Emirates', country_code='AE', country='United Arab Emirates', contained_within=[], bounding_box=BoundingBox(_api=<tweepy.api.API object at 0x7f4a2afa77f0>, type='Polygon', coordinates=[[[51.2938738, 22.6261387], [56.0175464, 22.6261387], [56.0175464, 25.1639588], [51.2938738, 25.1639588]]]), attributes={})"
2,تونس تمدد تعليق الدراسة وتفرض حجراً إجبارياً على الوافدين بسبب كورونا  ,1387425788182421507,2021-04-28 15:17:39,0,0,"Place(_api=<tweepy.api.API object at 0x7f4a2afa77f0>, id='001907e868d06e24', url='https://api.twitter.com/1.1/geo/id/001907e868d06e24.json', place_type='admin', name='Dubai', full_name='Dubai, United Arab Emirates', country_code='AE', country='United Arab Emirates', contained_within=[], bounding_box=BoundingBox(_api=<tweepy.api.API object at 0x7f4a2afa77f0>, type='Polygon', coordinates=[[[54.8939725, 24.6182526], [56.2083722, 24.6182526], [56.2083722, 25.3686719], [54.8939725, 25.3686719]]]), attributes={})"
3,ماكرون يقدم خطة تخفيف قيود كورونا يوم الجمعة  ,1387425779361800192,2021-04-28 15:17:37,0,0,"Place(_api=<tweepy.api.API object at 0x7f4a2afa77f0>, id='001907e868d06e24', url='https://api.twitter.com/1.1/geo/id/001907e868d06e24.json', place_type='admin', name='Dubai', full_name='Dubai, United Arab Emirates', country_code='AE', country='United Arab Emirates', contained_within=[], bounding_box=BoundingBox(_api=<tweepy.api.API object at 0x7f4a2afa77f0>, type='Polygon', coordinates=[[[54.8939725, 24.6182526], [56.2083722, 24.6182526], [56.2083722, 25.3686719], [54.8939725, 25.3686719]]]), attributes={})"
4,تسجيل 13 حالة وفاة و1062 إصابة جديدة بفيروس كورونا في السعودية  ,1387408538511675392,2021-04-28 14:09:07,0,0,"Place(_api=<tweepy.api.API object at 0x7f4a2afa77f0>, id='001907e868d06e24', url='https://api.twitter.com/1.1/geo/id/001907e868d06e24.json', place_type='admin', name='Dubai', full_name='Dubai, United Arab Emirates', country_code='AE', country='United Arab Emirates', contained_within=[], bounding_box=BoundingBox(_api=<tweepy.api.API object at 0x7f4a2afa77f0>, type='Polygon', coordinates=[[[54.8939725, 24.6182526], [56.2083722, 24.6182526], [56.2083722, 25.3686719], [54.8939725, 25.3686719]]]), attributes={})"
5,كورونا من آيات الله فضيلة الشيخ الدكتور ,1387408044821254151,2021-04-28 14:07:09,14,7,"Place(_api=<tweepy.api.API object at 0x7f4a2afa77f0>, id='001907e868d06e24', url='https://api.twitter.com/1.1/geo/id/001907e868d06e24.json', place_type='admin', name='Dubai', full_name='Dubai, United Arab Emirates', country_code='AE', country='United Arab Emirates', contained_within=[], bounding_box=BoundingBox(_api=<tweepy.api.API object at 0x7f4a2afa77f0>, type='Polygon', coordinates=[[[54.8939725, 24.6182526], [56.2083722, 24.6182526], [56.2083722, 25.3686719], [54.8939725, 25.3686719]]]), attributes={})"
6,الإمارات تقدم 71558 جرعة من لقاح كورونا ,1387391917906743302,2021-04-28 13:03:04,0,0,"Place(_api=<tweepy.api.API object at 0x7f4a2afa77f0>, id='001907e868d06e24', url='https://api.twitter.com/1.1/geo/id/001907e868d06e24.json', place_type='admin', name='Dubai', full_name='Dubai, United Arab Emirates', country_code='AE', country='United Arab Emirates', contained_within=[], bounding_box=BoundingBox(_api=<tweepy.api.API object at 0x7f4a2afa77f0>, type='Polygon', coordinates=[[[54.8939725, 24.6182526], [56.2083722, 24.6182526], [56.2083722, 25.3686719], [54.8939725, 25.3686719]]]), attributes={})"
7,كورونا مش بتيجي لأي حد منزل استوريز اغنية الجسمي رمضان في مصر حاجه تانيه,1387386914508992518,2021-04-28 12:43:11,13,0,"Place(_api=<tweepy.api.API object at 0x7f4a2afa77f0>, id='001907e868d06e24', url='https://api.twitter.com/1.1/geo/id/001907e868d06e24.json', place_type='admin', name='Dubai', full_name='Dubai, United Arab Emirates', country_code='AE', country='United Arab Emirates', contained_within=[], bounding_box=BoundingBox(_api=<tweepy.api.API object at 0x7f4a2afa77f0>, type='Polygon', coordinates=[[[54.8939725, 24.6182526], [56.2083722, 24.6182526], [56.2083722, 25.3686719], [54.8939725, 25.3686719]]]), attributes={})"
8,فيروس كورونا قد يستخدم خلايا الحبل الشوكي العصبية للوصول إلى الدماغ  ,1387385763398971398,2021-04-28 12:38:37,0,0,"Place(_api=<tweepy.api.API object at 0x7f4a2afa77f0>, id='001907e868d06e24', url='https://api.twitter.com/1.1/geo/id/001907e868d06e24.json', place_type='admin', name='Dubai', full_name='Dubai, United Arab Emirates', country_code='AE', country='United Arab Emirates', contained_within=[], bounding_box=BoundingBox(_api=<tweepy.api.API object at 0x7f4a2afa77f0>, type='Polygon', coordinates=[[[54.8939725, 24.6182526], [56.2083722, 24.6182526], [56.2083722, 25.3686719], [54.8939725, 25.3686719]]]), attributes={})"
9,"“الصحة” تعلن تقديم 71,558 جرعة من لقاح “كوفيد-19” خلال الـ 24 ساعة الماضية.. والإجمالي حتى اليوم 10,407,782  ",1387384252702941188,2021-04-28 12:32:36,0,0,"Place(_api=<tweepy.api.API object at 0x7f4a2afa77f0>, id='001907e868d06e24', url='https://api.twitter.com/1.1/geo/id/001907e868d06e24.json', place_type='admin', name='Dubai', full_name='Dubai, United Arab Emirates', country_code='AE', country='United Arab Emirates', contained_within=[], bounding_box=BoundingBox(_api=<tweepy.api.API object at 0x7f4a2afa77f0>, type='Polygon', coordinates=[[[54.8939725, 24.6182526], [56.2083722, 24.6182526], [56.2083722, 25.3686719], [54.8939725, 25.3686719]]]), attributes={})"
10,"“الصحة” تعلن تقديم 71,558 جرعة من لقاح “كوفيد-19” خلال الـ 24 ساعة الماضية.. والإجمالي حتى اليوم 10,407,782  ",1387380362351845379,2021-04-28 12:17:09,0,0,"Place(_api=<tweepy.api.API object at 0x7f4a2afa77f0>, id='001907e868d06e24', url='https://api.twitter.com/1.1/geo/id/001907e868d06e24.json', place_type='admin', name='Dubai', full_name='Dubai, United Arab Emirates', country_code='AE', country='United Arab Emirates', contained_within=[], bounding_box=BoundingBox(_api=<tweepy.api.API object at 0x7f4a2afa77f0>, type='Polygon', coordinates=[[[54.8939725, 24.6182526], [56.2083722, 24.6182526], [56.2083722, 25.3686719], [54.8939725, 25.3686719]]]), attributes={})"
11,لقاح كورونا هيئة الدواء البريطانية: لقاح فايزر آمن ولا يتسبب بمشاكل في …  ,1387373052615217153,2021-04-28 11:48:06,0,0,"Place(_api=<tweepy.api.API object at 0x7f4a2afa77f0>, id='001907e868d06e24', url='https://api.twitter.com/1.1/geo/id/001907e868d06e24.json', place_type='admin', name='Dubai', full_name='Dubai, United Arab Emirates', country_code='AE', country='United Arab Emirates', contained_within=[], bounding_box=BoundingBox(_api=<tweepy.api.API object at 0x7f4a2afa77f0>, type='Polygon', coordinates=[[[54.8939725, 24.6182526], [56.2083722, 24.6182526], [56.2083722, 25.3686719], [54.8939725, 25.3686719]]]), attributes={})"
12,"“الصحة” تجري 195,166 فحصا ضمن خططها لتوسيع نطاق الفحوصات وتكشف عن 1,710 إصابات جديدة بفيروس كورونا المستجد و1,551 حالة شفاء وحالتي وفاة خلال الساعات ا…  ",1387362357865713665,2021-04-28 11:05:36,0,0,"Place(_api=<tweepy.api.API object at 0x7f4a2afa77f0>, id='001907e868d06e24', url='https://api.twitter.com/1.1/geo/id/001907e868d06e24.json', place_type='admin', name='Dubai', full_name='Dubai, United Arab Emirates', country_code='AE', country='United Arab Emirates', contained_within=[], bounding_box=BoundingBox(_api=<tweepy.api.API object at 0x7f4a2afa77f0>, type='Polygon', coordinates=[[[54.8939725, 24.6182526], [56.2083722, 24.6182526], [56.2083722, 25.3686719], [54.8939725, 25.3686719]]]), attributes={})"
13,"“الصحة”: 1,710 إصابة جديدة بفيروس كورونا و1,551 حالة شفاء  ",1387354444908535812,2021-04-28 10:34:10,0,0,"Place(_api=<tweepy.api.API object at 0x7f4a2afa77f0>, id='001907e868d06e24', url='https://api.twitter.com/1.1/geo/id/001907e868d06e24.json', place_type='admin', name='Dubai', full_name='Dubai, United Arab Emirates', country_code='AE', country='United Arab Emirates', contained_within=[], bounding_box=BoundingBox(_api=<tweepy.api.API object at 0x7f4a2afa77f0>, type='Polygon', coordinates=[[[54.8939725, 24.6182526], [56.2083722, 24.6182526], [56.2083722, 25.3686719], [54.8939725, 25.3686719]]]), attributes={})"
14,الإمارات تسجل 1710 إصابات جديدة بفيروس كورونا و1551 حالة شفاء ,1387354430673068033,2021-04-28 10:34:06,0,0,"Place(_api=<tweepy.api.API object at 0x7f4a2afa77f0>, id='001907e868d06e24', url='https://api.twitter.com/1.1/geo/id/001907e868d06e24.json', place_type='admin', name='Dubai', full_name='Dubai, United Arab Emirates', country_code='AE', country='United Arab Emirates', contained_within=[], bounding_box=BoundingBox(_api=<tweepy.api.API object at 0x7f4a2afa77f0>, type='Polygon', coordinates=[[[54.8939725, 24.6182526], [56.2083722, 24.6182526], [56.2083722, 25.3686719], [54.8939725, 25.3686719]]]), attributes={})"
15,مافيها شي السؤال وليش التحسس؟؟ الواحد يتحذر من الاماكن ومايفرط بالاجراءات، مافيها احتقار ولكن يتحذرون ع عمارهم، واللي ياهم كورونا لين شهر ما يستقبلون حد ببيتهم وخلصنا,1387346690294751236,2021-04-28 10:03:21,1,0,"Place(_api=<tweepy.api.API object at 0x7f4a2afa77f0>, id='00f24ae701a1207b', url='https://api.twitter.com/1.1/geo/id/00f24ae701a1207b.json', place_type='admin', name='Abu Dhabi', full_name='Abu Dhabi, United Arab Emirates', country_code='AE', country='United Arab Emirates', contained_within=[], bounding_box=BoundingBox(_api=<tweepy.api.API object at 0x7f4a2afa77f0>, type='Polygon', coordinates=[[[51.2938738, 22.6261387], [56.0175464, 22.6261387], [56.0175464, 25.1639588], [51.2938738, 25.1639588]]]), attributes={})"
16,إصابات كورونا حول العالم تسجل 148.7 مليوناً وتوزيع 1.062 مليار جرعة لقاح  ,1387333658248314883,2021-04-28 09:11:34,0,0,"Place(_api=<tweepy.api.API object at 0x7f4a2afa77f0>, id='001907e868d06e24', url='https://api.twitter.com/1.1/geo/id/001907e868d06e24.json', place_type='admin', name='Dubai', full_name='Dubai, United Arab Emirates', country_code='AE', country='United Arab Emirates', contained_within=[], bounding_box=BoundingBox(_api=<tweepy.api.API object at 0x7f4a2afa77f0>, type='Polygon', coordinates=[[[54.8939725, 24.6182526], [56.2083722, 24.6182526], [56.2083722, 25.3686719], [54.8939725, 25.3686719]]]), attributes={})"
17,تنذكر ولا تعاد هل دواء كورونا ينهي هذه الأزمة ويصبح أكثر أهمية من اللقاحات؟ ,1387326768051363842,2021-04-28 08:44:11,21,6,"Place(_api=<tweepy.api.API object at 0x7f4a2afa77f0>, id='001907e868d06e24', url='https://api.twitter.com/1.1/geo/id/001907e868d06e24.json', place_type='admin', name='Dubai', full_name='Dubai, United Arab Emirates', country_code='AE', country='United Arab Emirates', contained_within=[], bounding_box=BoundingBox(_api=<tweepy.api.API object at 0x7f4a2afa77f0>, type='Polygon', coordinates=[[[54.8939725, 24.6182526], [56.2083722, 24.6182526], [56.2083722, 25.3686719], [54.8939725, 25.3686719]]]), attributes={})"
18,"°° ~ مساهمتك.. يتجهز لها جنود الإنسانية وتنملئ بها سلل غذائية وتعد بها سفرة رمضانية "" ضغطة زر كفيلة بتغيير الكثير"" كن_التغيير_في_رمضان ، لتروي ظمأهم، وتفرح أطفالهم، وتعين كبارهم :  . ",1387324733767704577,2021-04-28 08:36:06,1,1,"Place(_api=<tweepy.api.API object at 0x7f4a2afa77f0>, id='00f24ae701a1207b', url='https://api.twitter.com/1.1/geo/id/00f24ae701a1207b.json', place_type='admin', name='Abu Dhabi', full_name='Abu Dhabi, United Arab Emirates', country_code='AE', country='United Arab Emirates', contained_within=[], bounding_box=BoundingBox(_api=<tweepy.api.API object at 0x7f4a2afa77f0>, type='Polygon', coordinates=[[[51.2938738, 22.6261387], [56.0175464, 22.6261387], [56.0175464, 25.1639588], [51.2938738, 25.1639588]]]), attributes={})"
19,توزيع 25.9 مليون جرعة من لقاحات كورونا في ألمانيا  ,1387324610463424519,2021-04-28 08:35:37,0,1,"Place(_api=<tweepy.api.API object at 0x7f4a2afa77f0>, id='001907e868d06e24', url='https://api.twitter.com/1.1/geo/id/001907e868d06e24.json', place_type='admin', name='Dubai', full_name='Dubai, United Arab Emirates', country_code='AE', country='United Arab Emirates', contained_within=[], bounding_box=BoundingBox(_api=<tweepy.api.API object at 0x7f4a2afa77f0>, type='Polygon', coordinates=[[[54.8939725, 24.6182526], [56.2083722, 24.6182526], [56.2083722, 25.3686719], [54.8939725, 25.3686719]]]), attributes={})"
20,فرنسا توزع 20.5 مليون جرعة من لقاحات كورونا حتى الآن  ,1387308135572860936,2021-04-28 07:30:09,0,0,"Place(_api=<tweepy.api.API object at 0x7f4a2afa77f0>, id='001907e868d06e24', url='https://api.twitter.com/1.1/geo/id/001907e868d06e24.json', place_type='admin', name='Dubai', full_name='Dubai, United Arab Emirates', country_code='AE', country='United Arab Emirates', contained_within=[], bounding_box=BoundingBox(_api=<tweepy.api.API object at 0x7f4a2afa77f0>, type='Polygon', coordinates=[[[54.8939725, 24.6182526], [56.2083722, 24.6182526], [56.2083722, 25.3686719], [54.8939725, 25.3686719]]]), attributes={})"
21,إصابات “كورونا” حول العالم تتجاوز 148.19 مليون حالة  ,1387308116522332165,2021-04-28 07:30:04,0,0,"Place(_api=<tweepy.api.API object at 0x7f4a2afa77f0>, id='001907e868d06e24', url='https://api.twitter.com/1.1/geo/id/001907e868d06e24.json', place_type='admin', name='Dubai', full_name='Dubai, United Arab Emirates', country_code='AE', country='United Arab Emirates', contained_within=[], bounding_box=BoundingBox(_api=<tweepy.api.API object at 0x7f4a2afa77f0>, type='Polygon', coordinates=[[[54.8939725, 24.6182526], [56.2083722, 24.6182526], [56.2083722, 25.3686719], [54.8939725, 25.3686719]]]), attributes={})"
22,البرتغال تعلن انتهاء حالة الطوارئ الجمعة مع انخفاض إصابات كورونا  ,1387292404726648834,2021-04-28 06:27:38,0,0,"Place(_api=<tweepy.api.API object at 0x7f4a2afa77f0>, id='001907e868d06e24', url='https://api.twitter.com/1.1/geo/id/001907e868d06e24.json', place_type='admin', name='Dubai', full_name='Dubai, United Arab Emirates', country_code='AE', country='United Arab Emirates', contained_within=[], bounding_box=BoundingBox(_api=<tweepy.api.API object at 0x7f4a2afa77f0>, type='Polygon', coordinates=[[[54.8939725, 24.6182526], [56.2083722, 24.6182526], [56.2083722, 25.3686719], [54.8939725, 25.3686719]]]), attributes={})"
23,نحن ف كورونا ياختي مب كرة قدم ,1387232831617785862,2021-04-28 02:30:55,0,0,"Place(_api=<tweepy.api.API object at 0x7f4a2afa77f0>, id='001907e868d06e24', url='https://api.twitter.com/1.1/geo/id/001907e868d06e24.json', place_type='admin', name='Dubai', full_name='Dubai, United Arab Emirates', country_code='AE', country='United Arab Emirates', contained_within=[], bounding_box=BoundingBox(_api=<tweepy.api.API object at 0x7f4a2afa77f0>, type='Polygon', coordinates=[[[54.8939725, 24.6182526], [56.2083722, 24.6182526], [56.2083722, 25.3686719], [54.8939725, 25.3686719]]]), attributes={})"
24,طيران الإمارات تسمح لبعض المسافرين من الإمارات بتقديم سجلات كورونا عبر الإنترنت  ,1387215533175566336,2021-04-28 01:22:10,2,0,"Place(_api=<tweepy.api.API object at 0x7f4a2afa77f0>, id='001907e868d06e24', url='https://api.twitter.com/1.1/geo/id/001907e868d06e24.json', place_type='admin', name='Dubai', full_name='Dubai, United Arab Emirates', country_code='AE', country='United Arab Emirates', contained_within=[], bounding_box=BoundingBox(_api=<tweepy.api.API object at 0x7f4a2afa77f0>, type='Polygon', coordinates=[[[54.8939725, 24.6182526], [56.2083722, 24.6182526], [56.2083722, 25.3686719], [54.8939725, 25.3686719]]]), attributes={})"
25,الدول العربية.. تفاوت في مواجهة «كورونا» ,1387162158765539329,2021-04-27 21:50:05,0,0,"Place(_api=<tweepy.api.API object at 0x7f4a2afa77f0>, id='001907e868d06e24', url='https://api.twitter.com/1.1/geo/id/001907e868d06e24.json', place_type='admin', name='Dubai', full_name='Dubai, United Arab Emirates', country_code='AE', country='United Arab Emirates', contained_within=[], bounding_box=BoundingBox(_api=<tweepy.api.API object at 0x7f4a2afa77f0>, type='Polygon', coordinates=[[[54.8939725, 24.6182526], [56.2083722, 24.6182526], [56.2083722, 25.3686719], [54.8939725, 25.3686719]]]), attributes={})"
26,مع لأن انا شخصياً وايد تبهدلت بدايات كورونا مع دوائر معينة الموظف يرد بعد عشرين اتصال و فوقها مبين انه نايم و ما يعرف وين الله حاطه الصراحة ينفع لحالات الطوارىء مثلما قال و التعليم كذلك الأطفال قدرات و مستويات وايد طلاب مب فاهمين شيء و وايد طلبة امهاتهم يشتغلن مافي متابعة للأسف,1387154414637510656,2021-04-27 21:19:19,1,0,"Place(_api=<tweepy.api.API object at 0x7f4a2afa77f0>, id='001907e868d06e24', url='https://api.twitter.com/1.1/geo/id/001907e868d06e24.json', place_type='admin', name='Dubai', full_name='Dubai, United Arab Emirates', country_code='AE', country='United Arab Emirates', contained_within=[], bounding_box=BoundingBox(_api=<tweepy.api.API object at 0x7f4a2afa77f0>, type='Polygon', coordinates=[[[54.8939725, 24.6182526], [56.2083722, 24.6182526], [56.2083722, 25.3686719], [54.8939725, 25.3686719]]]), attributes={})"
27,تحسن مؤشرات كورونا في فرنسا  ,1387153225002852354,2021-04-27 21:14:35,0,0,"Place(_api=<tweepy.api.API object at 0x7f4a2afa77f0>, id='001907e868d06e24', url='https://api.twitter.com/1.1/geo/id/001907e868d06e24.json', place_type='admin', name='Dubai', full_name='Dubai, United Arab Emirates', country_code='AE', country='United Arab Emirates', contained_within=[], bounding_box=BoundingBox(_api=<tweepy.api.API object at 0x7f4a2afa77f0>, type='Polygon', coordinates=[[[54.8939725, 24.6182526], [56.2083722, 24.6182526], [56.2083722, 25.3686719], [54.8939725, 25.3686719]]]), attributes={})"
28,في عز الكورونا والطفرات، مصر مفهاش كورونا ويفطروا عالبحر وعايشين حياتهم  ,1387146589815332867,2021-04-27 20:48:13,0,0,"Place(_api=<tweepy.api.API object at 0x7f4a2afa77f0>, id='00ecb59b0dad186e', url='https://api.twitter.com/1.1/geo/id/00ecb59b0dad186e.json', place_type='admin', name='Sharjah', full_name='Sharjah, United Arab Emirates', country_code='AE', country='United Arab Emirates', contained_within=[], bounding_box=BoundingBox(_api=<tweepy.api.API object at 0x7f4a2afa77f0>, type='Polygon', coordinates=[[[55.0091271, 24.7328863], [56.3816989, 24.7328863], [56.3816989, 25.8997649], [55.0091271, 25.8997649]]]), attributes={})"
29,الإمارات الثامنة عالمياً على مؤشر “بلومبيرغ” لأفضل الدول تعاملاً مع كورونا  ,1387140638995451904,2021-04-27 20:24:34,0,0,"Place(_api=<tweepy.api.API object at 0x7f4a2afa77f0>, id='001907e868d06e24', url='https://api.twitter.com/1.1/geo/id/001907e868d06e24.json', place_type='admin', name='Dubai', full_name='Dubai, United Arab Emirates', country_code='AE', country='United Arab Emirates', contained_within=[], bounding_box=BoundingBox(_api=<tweepy.api.API object at 0x7f4a2afa77f0>, type='Polygon', coordinates=[[[54.8939725, 24.6182526], [56.2083722, 24.6182526], [56.2083722, 25.3686719], [54.8939725, 25.3686719]]]), attributes={})"
30,تمديد إجراءات مواجهة تفشي كورونا في غزة  ,1387126681714925569,2021-04-27 19:29:07,0,1,"Place(_api=<tweepy.api.API object at 0x7f4a2afa77f0>, id='001907e868d06e24', url='https://api.twitter.com/1.1/geo/id/001907e868d06e24.json', place_type='admin', name='Dubai', full_name='Dubai, United Arab Emirates', country_code='AE', country='United Arab Emirates', contained_within=[], bounding_box=BoundingBox(_api=<tweepy.api.API object at 0x7f4a2afa77f0>, type='Polygon', coordinates=[[[54.8939725, 24.6182526], [56.2083722, 24.6182526], [56.2083722, 25.3686719], [54.8939725, 25.3686719]]]), attributes={})"
31,بايدن يشيد بتقدم مكافحة كورونا في أمريكا  ,1387126676467769345,2021-04-27 19:29:05,0,0,"Place(_api=<tweepy.api.API object at 0x7f4a2afa77f0>, id='001907e868d06e24', url='https://api.twitter.com/1.1/geo/id/001907e868d06e24.json', place_type='admin', name='Dubai', full_name='Dubai, United Arab Emirates', country_code='AE', country='United Arab Emirates', contained_within=[], bounding_box=BoundingBox(_api=<tweepy.api.API object at 0x7f4a2afa77f0>, type='Polygon', coordinates=[[[54.8939725, 24.6182526], [56.2083722, 24.6182526], [56.2083722, 25.3686719], [54.8939725, 25.3686719]]]), attributes={})"
32,ما علاقة صحة الفم بالإصابة بفيروس كورونا  ,1387105657896128514,2021-04-27 18:05:34,1,2,"Place(_api=<tweepy.api.API object at 0x7f4a2afa77f0>, id='001907e868d06e24', url='https://api.twitter.com/1.1/geo/id/001907e868d06e24.json', place_type='admin', name='Dubai', full_name='Dubai, United Arab Emirates', country_code='AE', country='United Arab Emirates', contained_within=[], bounding_box=BoundingBox(_api=<tweepy.api.API object at 0x7f4a2afa77f0>, type='Polygon', coordinates=[[[54.8939725, 24.6182526], [56.2083722, 24.6182526], [56.2083722, 25.3686719], [54.8939725, 25.3686719]]]), attributes={})"
33,مجلس ابن حم الرمضاني يستعرض جهود الدولة الاستثنائية في توزيع لقاح كورونا ,1387090563036377088,2021-04-27 17:05:35,1,0,"Place(_api=<tweepy.api.API object at 0x7f4a2afa77f0>, id='001907e868d06e24', url='https://api.twitter.com/1.1/geo/id/001907e868d06e24.json', place_type='admin', name='Dubai', full_name='Dubai, United Arab Emirates', country_code='AE', country='United Arab Emirates', contained_within=[], bounding_box=BoundingBox(_api=<tweepy.api.API object at 0x7f4a2afa77f0>, type='Polygon', coordinates=[[[54.8939725, 24.6182526], [56.2083722, 24.6182526], [56.2083722, 25.3686719], [54.8939725, 25.3686719]]]), attributes={})"
34,اعلنوا امتحاناتهم بتكون فالجامعة صاروا كلهم ميتين من الخوف وبييهم كورونا لو امتحنوا فالجامعة، لكن المولات والكوفيات والتجمعات ما ايي منهم كورونا. ناس ما تقدر عليهم ,1387087983216582660,2021-04-27 16:55:20,0,0,"Place(_api=<tweepy.api.API object at 0x7f4a2afa77f0>, id='00f24ae701a1207b', url='https://api.twitter.com/1.1/geo/id/00f24ae701a1207b.json', place_type='admin', name='Abu Dhabi', full_name='Abu Dhabi, United Arab Emirates', country_code='AE', country='United Arab Emirates', contained_within=[], bounding_box=BoundingBox(_api=<tweepy.api.API object at 0x7f4a2afa77f0>, type='Polygon', coordinates=[[[51.2938738, 22.6261387], [56.0175464, 22.6261387], [56.0175464, 25.1639588], [51.2938738, 25.1639588]]]), attributes={})"
35,لقد تشرفت مرة أخرى بالانضمام إلى سعادة الشيخ مسلم بن حم العامري في مجلسه الرمضاني عن بعد، حيث كان دعم الجهود العالمية لتوفير للجميع موضوع الحديث الشيق. شكرا جزيلا على حسن ضيافتك  ,1387084496369971205,2021-04-27 16:41:29,16,7,"Place(_api=<tweepy.api.API object at 0x7f4a2afa77f0>, id='00f24ae701a1207b', url='https://api.twitter.com/1.1/geo/id/00f24ae701a1207b.json', place_type='admin', name='Abu Dhabi', full_name='Abu Dhabi, United Arab Emirates', country_code='AE', country='United Arab Emirates', contained_within=[], bounding_box=BoundingBox(_api=<tweepy.api.API object at 0x7f4a2afa77f0>, type='Polygon', coordinates=[[[51.2938738, 22.6261387], [56.0175464, 22.6261387], [56.0175464, 25.1639588], [51.2938738, 25.1639588]]]), attributes={})"
