,Tweets,id,date,likes,retweets,place
0,الرئيس الجزائري يُعلن تصنيع اللقاح الروسي ضد كورونا في بلاده  ,1362509462527897603,2021-02-18 21:09:04,0,0,"Place(_api=<tweepy.api.API object at 0x7f1c6254bcd0>, id='001907e868d06e24', url='https://api.twitter.com/1.1/geo/id/001907e868d06e24.json', place_type='admin', name='Dubai', full_name='Dubai, United Arab Emirates', country_code='AE', country='United Arab Emirates', contained_within=[], bounding_box=BoundingBox(_api=<tweepy.api.API object at 0x7f1c6254bcd0>, type='Polygon', coordinates=[[[54.8939725, 24.6182526], [56.2083722, 24.6182526], [56.2083722, 25.3686719], [54.8939725, 25.3686719]]]), attributes={})"
1,هبة صينية للجزائر بـ 200 ألف جرعة من اللقاح ضد كورونا  ,1362502923700363267,2021-02-18 20:43:05,1,0,"Place(_api=<tweepy.api.API object at 0x7f1c6254bcd0>, id='001907e868d06e24', url='https://api.twitter.com/1.1/geo/id/001907e868d06e24.json', place_type='admin', name='Dubai', full_name='Dubai, United Arab Emirates', country_code='AE', country='United Arab Emirates', contained_within=[], bounding_box=BoundingBox(_api=<tweepy.api.API object at 0x7f1c6254bcd0>, type='Polygon', coordinates=[[[54.8939725, 24.6182526], [56.2083722, 24.6182526], [56.2083722, 25.3686719], [54.8939725, 25.3686719]]]), attributes={})"
2,تسلَم ولا كورونا  واحد مخالط 13 مصاب و حالة طاعون ,1362493297156120579,2021-02-18 20:04:50,1,0,"Place(_api=<tweepy.api.API object at 0x7f1c6254bcd0>, id='001907e868d06e24', url='https://api.twitter.com/1.1/geo/id/001907e868d06e24.json', place_type='admin', name='Dubai', full_name='Dubai, United Arab Emirates', country_code='AE', country='United Arab Emirates', contained_within=[], bounding_box=BoundingBox(_api=<tweepy.api.API object at 0x7f1c6254bcd0>, type='Polygon', coordinates=[[[54.8939725, 24.6182526], [56.2083722, 24.6182526], [56.2083722, 25.3686719], [54.8939725, 25.3686719]]]), attributes={})"
3,مطلوب بنت تكون حبيبتي بس بدون حب عشان ما نجرح بعض بس لين ما يخلص كورونا يعني حاقه friends with benefits زي كذا من مميزاتي اعرف كل اغاني الحب من طلال مداح لين Ali gatie,1362489083285676033,2021-02-18 19:48:05,0,0,"Place(_api=<tweepy.api.API object at 0x7f1c6254bcd0>, id='001907e868d06e24', url='https://api.twitter.com/1.1/geo/id/001907e868d06e24.json', place_type='admin', name='Dubai', full_name='Dubai, United Arab Emirates', country_code='AE', country='United Arab Emirates', contained_within=[], bounding_box=BoundingBox(_api=<tweepy.api.API object at 0x7f1c6254bcd0>, type='Polygon', coordinates=[[[54.8939725, 24.6182526], [56.2083722, 24.6182526], [56.2083722, 25.3686719], [54.8939725, 25.3686719]]]), attributes={})"
4,البيت الأبيض: بايدن سيركز على كورونا والصين في اجتماع مجموعة السبع  ,1362484681917173761,2021-02-18 19:30:36,1,0,"Place(_api=<tweepy.api.API object at 0x7f1c6254bcd0>, id='001907e868d06e24', url='https://api.twitter.com/1.1/geo/id/001907e868d06e24.json', place_type='admin', name='Dubai', full_name='Dubai, United Arab Emirates', country_code='AE', country='United Arab Emirates', contained_within=[], bounding_box=BoundingBox(_api=<tweepy.api.API object at 0x7f1c6254bcd0>, type='Polygon', coordinates=[[[54.8939725, 24.6182526], [56.2083722, 24.6182526], [56.2083722, 25.3686719], [54.8939725, 25.3686719]]]), attributes={})"
5,48 % انخفاضاً في حالات «كورونا» النشطة منذ بداية فبراير  ,1362479386918674434,2021-02-18 19:09:34,1,1,"Place(_api=<tweepy.api.API object at 0x7f1c6254bcd0>, id='001907e868d06e24', url='https://api.twitter.com/1.1/geo/id/001907e868d06e24.json', place_type='admin', name='Dubai', full_name='Dubai, United Arab Emirates', country_code='AE', country='United Arab Emirates', contained_within=[], bounding_box=BoundingBox(_api=<tweepy.api.API object at 0x7f1c6254bcd0>, type='Polygon', coordinates=[[[54.8939725, 24.6182526], [56.2083722, 24.6182526], [56.2083722, 25.3686719], [54.8939725, 25.3686719]]]), attributes={})"
