,Tweets,id,date,likes,retweets,place
145,ذكرت الشركة من خلال بيانها الصحفي للنتائج المالية، أن سبب تسجيلها للخسائر خلال العام الحالي، نتيجة أخذ مخصصات وانخفاض القيمة العادلة لأصول الشركة، فيما أرجعت سبب انخفاض الإيرادات بنسبة 32 % مقارنة بنفس الفترة من عام 2019، لتأثيرات جائحة كورونا على قطاع العقار والضيافة والسياحة.,1361218356209147905,2021-02-15 07:38:40,1,0,"Place(_api=<tweepy.api.API object at 0x7f841aa03cd0>, id='001907e868d06e24', url='https://api.twitter.com/1.1/geo/id/001907e868d06e24.json', place_type='admin', name='Dubai', full_name='Dubai, United Arab Emirates', country_code='AE', country='United Arab Emirates', contained_within=[], bounding_box=BoundingBox(_api=<tweepy.api.API object at 0x7f841aa03cd0>, type='Polygon', coordinates=[[[54.8939725, 24.6182526], [56.2083722, 24.6182526], [56.2083722, 25.3686719], [54.8939725, 25.3686719]]]), attributes={})"
146,تحذير من هلاك الأرض.. بيل غيتس يكشف تحديات ما بعد كورونا  ,1361212534418665474,2021-02-15 07:15:32,1,1,"Place(_api=<tweepy.api.API object at 0x7f841aa03cd0>, id='001907e868d06e24', url='https://api.twitter.com/1.1/geo/id/001907e868d06e24.json', place_type='admin', name='Dubai', full_name='Dubai, United Arab Emirates', country_code='AE', country='United Arab Emirates', contained_within=[], bounding_box=BoundingBox(_api=<tweepy.api.API object at 0x7f841aa03cd0>, type='Polygon', coordinates=[[[54.8939725, 24.6182526], [56.2083722, 24.6182526], [56.2083722, 25.3686719], [54.8939725, 25.3686719]]]), attributes={})"
147,انا قبل لا اروح اي كافتريا افحص كورونا لعيونهو ,1361206332523749377,2021-02-15 06:50:54,0,0,"Place(_api=<tweepy.api.API object at 0x7f841aa03cd0>, id='00f24ae701a1207b', url='https://api.twitter.com/1.1/geo/id/00f24ae701a1207b.json', place_type='admin', name='Abu Dhabi', full_name='Abu Dhabi, United Arab Emirates', country_code='AE', country='United Arab Emirates', contained_within=[], bounding_box=BoundingBox(_api=<tweepy.api.API object at 0x7f841aa03cd0>, type='Polygon', coordinates=[[[51.2938738, 22.6261387], [56.0175464, 22.6261387], [56.0175464, 25.1639588], [51.2938738, 25.1639588]]]), attributes={})"
148,استقالة وزيرة خارجية بيرو بعد تلقيح مسؤولين قبل المواطنين ضد كورونا  ,1361199448345374720,2021-02-15 06:23:33,1,0,"Place(_api=<tweepy.api.API object at 0x7f841aa03cd0>, id='001907e868d06e24', url='https://api.twitter.com/1.1/geo/id/001907e868d06e24.json', place_type='admin', name='Dubai', full_name='Dubai, United Arab Emirates', country_code='AE', country='United Arab Emirates', contained_within=[], bounding_box=BoundingBox(_api=<tweepy.api.API object at 0x7f841aa03cd0>, type='Polygon', coordinates=[[[54.8939725, 24.6182526], [56.2083722, 24.6182526], [56.2083722, 25.3686719], [54.8939725, 25.3686719]]]), attributes={})"
149,صباح الخير هل فحص كورونا لاصحاب الهمم مجانا ؟؟؟؟؟ لاني يوم الخميس رحت فحصت في احدى المراكز .... و دفعوني,1361186503951605761,2021-02-15 05:32:06,1,1,"Place(_api=<tweepy.api.API object at 0x7f841aa03cd0>, id='001907e868d06e24', url='https://api.twitter.com/1.1/geo/id/001907e868d06e24.json', place_type='admin', name='Dubai', full_name='Dubai, United Arab Emirates', country_code='AE', country='United Arab Emirates', contained_within=[], bounding_box=BoundingBox(_api=<tweepy.api.API object at 0x7f841aa03cd0>, type='Polygon', coordinates=[[[54.8939725, 24.6182526], [56.2083722, 24.6182526], [56.2083722, 25.3686719], [54.8939725, 25.3686719]]]), attributes={})"
150,وكانت هيئة الأوراق المالية والسلع قد اتخذت قراراً في 17 مارس 2020، بتقليص الحد الأقصى لانخفاض سعر السهم في يوم التداول الواحد إلى (- 5 %) من سعر الإقفال السابق، وذلك في أعقاب التراجع الحاد للأسواق والأسهم إثر بدء تفشي جائحة كورونا والاتجاه نحو الإغلاق.,1361183301361401856,2021-02-15 05:19:23,6,1,"Place(_api=<tweepy.api.API object at 0x7f841aa03cd0>, id='01b984d319b42814', url='https://api.twitter.com/1.1/geo/id/01b984d319b42814.json', place_type='admin', name='Ras Al Khaimah', full_name='Ras Al Khaimah, United Arab Emirates', country_code='AE', country='United Arab Emirates', contained_within=[], bounding_box=BoundingBox(_api=<tweepy.api.API object at 0x7f841aa03cd0>, type='Polygon', coordinates=[[[55.7414877, 24.8517657], [56.3489937, 24.8517657], [56.3489937, 26.0841599], [55.7414877, 26.0841599]]]), attributes={})"
151,وقد ساعدت الآمال في المزيد من التحفيز الأمريكي وتخفيف عمليات الإغلاق بسبب فيروس كورونا في دعم الارتفاع ، بعد أن ارتفعت الأسعار بنحو 5٪ الأسبوع الماضي.,1361181978775744513,2021-02-15 05:14:07,1,0,"Place(_api=<tweepy.api.API object at 0x7f841aa03cd0>, id='01b984d319b42814', url='https://api.twitter.com/1.1/geo/id/01b984d319b42814.json', place_type='admin', name='Ras Al Khaimah', full_name='Ras Al Khaimah, United Arab Emirates', country_code='AE', country='United Arab Emirates', contained_within=[], bounding_box=BoundingBox(_api=<tweepy.api.API object at 0x7f841aa03cd0>, type='Polygon', coordinates=[[[55.7414877, 24.8517657], [56.3489937, 24.8517657], [56.3489937, 26.0841599], [55.7414877, 26.0841599]]]), attributes={})"
152,بايدن يبحث جائحة كورونا والاقتصاد والصين في لقاء مجموعة السبع  ,1361181585916063745,2021-02-15 05:12:34,0,1,"Place(_api=<tweepy.api.API object at 0x7f841aa03cd0>, id='001907e868d06e24', url='https://api.twitter.com/1.1/geo/id/001907e868d06e24.json', place_type='admin', name='Dubai', full_name='Dubai, United Arab Emirates', country_code='AE', country='United Arab Emirates', contained_within=[], bounding_box=BoundingBox(_api=<tweepy.api.API object at 0x7f841aa03cd0>, type='Polygon', coordinates=[[[54.8939725, 24.6182526], [56.2083722, 24.6182526], [56.2083722, 25.3686719], [54.8939725, 25.3686719]]]), attributes={})"
153,سباق مع الزمن.. 13 سلالة من كورونا قبل أول ظهور  ,1361180198452953088,2021-02-15 05:07:03,1,1,"Place(_api=<tweepy.api.API object at 0x7f841aa03cd0>, id='001907e868d06e24', url='https://api.twitter.com/1.1/geo/id/001907e868d06e24.json', place_type='admin', name='Dubai', full_name='Dubai, United Arab Emirates', country_code='AE', country='United Arab Emirates', contained_within=[], bounding_box=BoundingBox(_api=<tweepy.api.API object at 0x7f841aa03cd0>, type='Polygon', coordinates=[[[54.8939725, 24.6182526], [56.2083722, 24.6182526], [56.2083722, 25.3686719], [54.8939725, 25.3686719]]]), attributes={})"
154,إيطاليا تلغي إعادة فتح منتجعات التزلج مع تشديد قيود كورونا  ,1361172020189274114,2021-02-15 04:34:33,0,1,"Place(_api=<tweepy.api.API object at 0x7f841aa03cd0>, id='001907e868d06e24', url='https://api.twitter.com/1.1/geo/id/001907e868d06e24.json', place_type='admin', name='Dubai', full_name='Dubai, United Arab Emirates', country_code='AE', country='United Arab Emirates', contained_within=[], bounding_box=BoundingBox(_api=<tweepy.api.API object at 0x7f841aa03cd0>, type='Polygon', coordinates=[[[54.8939725, 24.6182526], [56.2083722, 24.6182526], [56.2083722, 25.3686719], [54.8939725, 25.3686719]]]), attributes={})"
155,الجزائر تخفف قيود كورونا  ,1361054501155741697,2021-02-14 20:47:34,1,0,"Place(_api=<tweepy.api.API object at 0x7f841aa03cd0>, id='001907e868d06e24', url='https://api.twitter.com/1.1/geo/id/001907e868d06e24.json', place_type='admin', name='Dubai', full_name='Dubai, United Arab Emirates', country_code='AE', country='United Arab Emirates', contained_within=[], bounding_box=BoundingBox(_api=<tweepy.api.API object at 0x7f841aa03cd0>, type='Polygon', coordinates=[[[54.8939725, 24.6182526], [56.2083722, 24.6182526], [56.2083722, 25.3686719], [54.8939725, 25.3686719]]]), attributes={})"
156,تركيا تسجل طفرات جديدة بفيروس كورونا  ,1361037392765882372,2021-02-14 19:39:35,0,0,"Place(_api=<tweepy.api.API object at 0x7f841aa03cd0>, id='001907e868d06e24', url='https://api.twitter.com/1.1/geo/id/001907e868d06e24.json', place_type='admin', name='Dubai', full_name='Dubai, United Arab Emirates', country_code='AE', country='United Arab Emirates', contained_within=[], bounding_box=BoundingBox(_api=<tweepy.api.API object at 0x7f841aa03cd0>, type='Polygon', coordinates=[[[54.8939725, 24.6182526], [56.2083722, 24.6182526], [56.2083722, 25.3686719], [54.8939725, 25.3686719]]]), attributes={})"
157,التشيك تعلن حالة الطوارئ مجدداً لمكافحة كورونا  ,1361037389922144257,2021-02-14 19:39:35,0,0,"Place(_api=<tweepy.api.API object at 0x7f841aa03cd0>, id='001907e868d06e24', url='https://api.twitter.com/1.1/geo/id/001907e868d06e24.json', place_type='admin', name='Dubai', full_name='Dubai, United Arab Emirates', country_code='AE', country='United Arab Emirates', contained_within=[], bounding_box=BoundingBox(_api=<tweepy.api.API object at 0x7f841aa03cd0>, type='Polygon', coordinates=[[[54.8939725, 24.6182526], [56.2083722, 24.6182526], [56.2083722, 25.3686719], [54.8939725, 25.3686719]]]), attributes={})"
158,كورونا ماشي شغل ,1361031360203419653,2021-02-14 19:15:37,0,0,"Place(_api=<tweepy.api.API object at 0x7f841aa03cd0>, id='00ecb59b0dad186e', url='https://api.twitter.com/1.1/geo/id/00ecb59b0dad186e.json', place_type='admin', name='Sharjah', full_name='Sharjah, United Arab Emirates', country_code='AE', country='United Arab Emirates', contained_within=[], bounding_box=BoundingBox(_api=<tweepy.api.API object at 0x7f841aa03cd0>, type='Polygon', coordinates=[[[55.0091271, 24.7328863], [56.3816989, 24.7328863], [56.3816989, 25.8997649], [55.0091271, 25.8997649]]]), attributes={})"
159,طفرة في أعداد إصابات كورونا في الأردن  ,1361017888572809226,2021-02-14 18:22:05,0,0,"Place(_api=<tweepy.api.API object at 0x7f841aa03cd0>, id='001907e868d06e24', url='https://api.twitter.com/1.1/geo/id/001907e868d06e24.json', place_type='admin', name='Dubai', full_name='Dubai, United Arab Emirates', country_code='AE', country='United Arab Emirates', contained_within=[], bounding_box=BoundingBox(_api=<tweepy.api.API object at 0x7f841aa03cd0>, type='Polygon', coordinates=[[[54.8939725, 24.6182526], [56.2083722, 24.6182526], [56.2083722, 25.3686719], [54.8939725, 25.3686719]]]), attributes={})"
160,«إنتو كابتال»: فرص جديدة بمنطقة الخليج بعد جائحة كورونا  ,1361005681252335616,2021-02-14 17:33:35,0,1,"Place(_api=<tweepy.api.API object at 0x7f841aa03cd0>, id='001907e868d06e24', url='https://api.twitter.com/1.1/geo/id/001907e868d06e24.json', place_type='admin', name='Dubai', full_name='Dubai, United Arab Emirates', country_code='AE', country='United Arab Emirates', contained_within=[], bounding_box=BoundingBox(_api=<tweepy.api.API object at 0x7f841aa03cd0>, type='Polygon', coordinates=[[[54.8939725, 24.6182526], [56.2083722, 24.6182526], [56.2083722, 25.3686719], [54.8939725, 25.3686719]]]), attributes={})"
161,اهلاً كورونا,1361004563722084352,2021-02-14 17:29:08,0,0,"Place(_api=<tweepy.api.API object at 0x7f841aa03cd0>, id='001907e868d06e24', url='https://api.twitter.com/1.1/geo/id/001907e868d06e24.json', place_type='admin', name='Dubai', full_name='Dubai, United Arab Emirates', country_code='AE', country='United Arab Emirates', contained_within=[], bounding_box=BoundingBox(_api=<tweepy.api.API object at 0x7f841aa03cd0>, type='Polygon', coordinates=[[[54.8939725, 24.6182526], [56.2083722, 24.6182526], [56.2083722, 25.3686719], [54.8939725, 25.3686719]]]), attributes={})"
162,«كورونا».. ارتفاع كبير في التعافي وفق بروتوكول العلاج المصري  ,1361002154576683012,2021-02-14 17:19:34,0,0,"Place(_api=<tweepy.api.API object at 0x7f841aa03cd0>, id='001907e868d06e24', url='https://api.twitter.com/1.1/geo/id/001907e868d06e24.json', place_type='admin', name='Dubai', full_name='Dubai, United Arab Emirates', country_code='AE', country='United Arab Emirates', contained_within=[], bounding_box=BoundingBox(_api=<tweepy.api.API object at 0x7f841aa03cd0>, type='Polygon', coordinates=[[[54.8939725, 24.6182526], [56.2083722, 24.6182526], [56.2083722, 25.3686719], [54.8939725, 25.3686719]]]), attributes={})"
163,شركة الطيران العماني تتخلى عن خططها التوسعية بسبب تداعيات كورونا  ,1360998010369413124,2021-02-14 17:03:06,0,0,"Place(_api=<tweepy.api.API object at 0x7f841aa03cd0>, id='001907e868d06e24', url='https://api.twitter.com/1.1/geo/id/001907e868d06e24.json', place_type='admin', name='Dubai', full_name='Dubai, United Arab Emirates', country_code='AE', country='United Arab Emirates', contained_within=[], bounding_box=BoundingBox(_api=<tweepy.api.API object at 0x7f841aa03cd0>, type='Polygon', coordinates=[[[54.8939725, 24.6182526], [56.2083722, 24.6182526], [56.2083722, 25.3686719], [54.8939725, 25.3686719]]]), attributes={})"
164,هكذا دافع خبير بريطاني عن الصين بشأن «كورونا»  ,1360992730650877957,2021-02-14 16:42:07,0,1,"Place(_api=<tweepy.api.API object at 0x7f841aa03cd0>, id='001907e868d06e24', url='https://api.twitter.com/1.1/geo/id/001907e868d06e24.json', place_type='admin', name='Dubai', full_name='Dubai, United Arab Emirates', country_code='AE', country='United Arab Emirates', contained_within=[], bounding_box=BoundingBox(_api=<tweepy.api.API object at 0x7f841aa03cd0>, type='Polygon', coordinates=[[[54.8939725, 24.6182526], [56.2083722, 24.6182526], [56.2083722, 25.3686719], [54.8939725, 25.3686719]]]), attributes={})"
165,السعودية تستأنف التطعيم وتمدد قيود «كورونا»  ,1360992727207342081,2021-02-14 16:42:06,0,0,"Place(_api=<tweepy.api.API object at 0x7f841aa03cd0>, id='001907e868d06e24', url='https://api.twitter.com/1.1/geo/id/001907e868d06e24.json', place_type='admin', name='Dubai', full_name='Dubai, United Arab Emirates', country_code='AE', country='United Arab Emirates', contained_within=[], bounding_box=BoundingBox(_api=<tweepy.api.API object at 0x7f841aa03cd0>, type='Polygon', coordinates=[[[54.8939725, 24.6182526], [56.2083722, 24.6182526], [56.2083722, 25.3686719], [54.8939725, 25.3686719]]]), attributes={})"
166,ماليزيا: 2464 إصابة جديدة بفيروس كورونا  ,1360942652540088321,2021-02-14 13:23:08,1,0,"Place(_api=<tweepy.api.API object at 0x7f841aa03cd0>, id='001907e868d06e24', url='https://api.twitter.com/1.1/geo/id/001907e868d06e24.json', place_type='admin', name='Dubai', full_name='Dubai, United Arab Emirates', country_code='AE', country='United Arab Emirates', contained_within=[], bounding_box=BoundingBox(_api=<tweepy.api.API object at 0x7f841aa03cd0>, type='Polygon', coordinates=[[[54.8939725, 24.6182526], [56.2083722, 24.6182526], [56.2083722, 25.3686719], [54.8939725, 25.3686719]]]), attributes={})"
167,بريطانيا تطلق مرحلة جديدة من حملة التلقيح ضد فيروس كورونا  ,1360942649495101443,2021-02-14 13:23:07,0,0,"Place(_api=<tweepy.api.API object at 0x7f841aa03cd0>, id='001907e868d06e24', url='https://api.twitter.com/1.1/geo/id/001907e868d06e24.json', place_type='admin', name='Dubai', full_name='Dubai, United Arab Emirates', country_code='AE', country='United Arab Emirates', contained_within=[], bounding_box=BoundingBox(_api=<tweepy.api.API object at 0x7f841aa03cd0>, type='Polygon', coordinates=[[[54.8939725, 24.6182526], [56.2083722, 24.6182526], [56.2083722, 25.3686719], [54.8939725, 25.3686719]]]), attributes={})"
168,بريطانيا تشاطر أمريكا مخاوفها على عمل بعثة دولية تتحرى منشأ كورونا في الصين  ,1360942646412255235,2021-02-14 13:23:06,1,0,"Place(_api=<tweepy.api.API object at 0x7f841aa03cd0>, id='001907e868d06e24', url='https://api.twitter.com/1.1/geo/id/001907e868d06e24.json', place_type='admin', name='Dubai', full_name='Dubai, United Arab Emirates', country_code='AE', country='United Arab Emirates', contained_within=[], bounding_box=BoundingBox(_api=<tweepy.api.API object at 0x7f841aa03cd0>, type='Polygon', coordinates=[[[54.8939725, 24.6182526], [56.2083722, 24.6182526], [56.2083722, 25.3686719], [54.8939725, 25.3686719]]]), attributes={})"
169,موفضة أوروبية: استراتيجية الاتحاد في توفير لقاح كورونا تعد “نجاحاً”  ,1360942632042524673,2021-02-14 13:23:03,0,0,"Place(_api=<tweepy.api.API object at 0x7f841aa03cd0>, id='001907e868d06e24', url='https://api.twitter.com/1.1/geo/id/001907e868d06e24.json', place_type='admin', name='Dubai', full_name='Dubai, United Arab Emirates', country_code='AE', country='United Arab Emirates', contained_within=[], bounding_box=BoundingBox(_api=<tweepy.api.API object at 0x7f841aa03cd0>, type='Polygon', coordinates=[[[54.8939725, 24.6182526], [56.2083722, 24.6182526], [56.2083722, 25.3686719], [54.8939725, 25.3686719]]]), attributes={})"
170,"الإمارات تقدم 49,967 جرعة من لقاح كورونا خلال 24 ساعة  ",1360942132568104964,2021-02-14 13:21:04,0,0,"Place(_api=<tweepy.api.API object at 0x7f841aa03cd0>, id='001907e868d06e24', url='https://api.twitter.com/1.1/geo/id/001907e868d06e24.json', place_type='admin', name='Dubai', full_name='Dubai, United Arab Emirates', country_code='AE', country='United Arab Emirates', contained_within=[], bounding_box=BoundingBox(_api=<tweepy.api.API object at 0x7f841aa03cd0>, type='Polygon', coordinates=[[[54.8939725, 24.6182526], [56.2083722, 24.6182526], [56.2083722, 25.3686719], [54.8939725, 25.3686719]]]), attributes={})"
171,الصحة: تقديم أكثر من 49 ألف جرعة من لقاح كورونا خلال 24 ساعة  ,1360938989549547528,2021-02-14 13:08:34,0,0,"Place(_api=<tweepy.api.API object at 0x7f841aa03cd0>, id='001907e868d06e24', url='https://api.twitter.com/1.1/geo/id/001907e868d06e24.json', place_type='admin', name='Dubai', full_name='Dubai, United Arab Emirates', country_code='AE', country='United Arab Emirates', contained_within=[], bounding_box=BoundingBox(_api=<tweepy.api.API object at 0x7f841aa03cd0>, type='Polygon', coordinates=[[[54.8939725, 24.6182526], [56.2083722, 24.6182526], [56.2083722, 25.3686719], [54.8939725, 25.3686719]]]), attributes={})"
172,- بيروت (رويترز) - بدأ لبنان حملته للتطعيم ضد فيروس كورونا الجديد (كوفيد -19) يوم الأحد بتلقيح رئيس قسم الرعاية الحرجة في أكبر مستشفياته العامة تلاه الممثل والكوميدي اللبناني الشهير صلاح تيزاني البالغ من العمر 93 عاما. ,1360936689322049540,2021-02-14 12:59:26,5,2,"Place(_api=<tweepy.api.API object at 0x7f841aa03cd0>, id='01b984d319b42814', url='https://api.twitter.com/1.1/geo/id/01b984d319b42814.json', place_type='admin', name='Ras Al Khaimah', full_name='Ras Al Khaimah, United Arab Emirates', country_code='AE', country='United Arab Emirates', contained_within=[], bounding_box=BoundingBox(_api=<tweepy.api.API object at 0x7f841aa03cd0>, type='Polygon', coordinates=[[[55.7414877, 24.8517657], [56.3489937, 24.8517657], [56.3489937, 26.0841599], [55.7414877, 26.0841599]]]), attributes={})"
173,“صحة دبي” تحدد إجراءات جديدة لتدريب طلبة الجامعات خلال جائحة “كورونا”  ,1360935853057482754,2021-02-14 12:56:06,0,1,"Place(_api=<tweepy.api.API object at 0x7f841aa03cd0>, id='001907e868d06e24', url='https://api.twitter.com/1.1/geo/id/001907e868d06e24.json', place_type='admin', name='Dubai', full_name='Dubai, United Arab Emirates', country_code='AE', country='United Arab Emirates', contained_within=[], bounding_box=BoundingBox(_api=<tweepy.api.API object at 0x7f841aa03cd0>, type='Polygon', coordinates=[[[54.8939725, 24.6182526], [56.2083722, 24.6182526], [56.2083722, 25.3686719], [54.8939725, 25.3686719]]]), attributes={})"
174,الإمارات تقدم 49967 جرعة جديدة من لقاح كورونا  ,1360935845880979460,2021-02-14 12:56:05,1,0,"Place(_api=<tweepy.api.API object at 0x7f841aa03cd0>, id='001907e868d06e24', url='https://api.twitter.com/1.1/geo/id/001907e868d06e24.json', place_type='admin', name='Dubai', full_name='Dubai, United Arab Emirates', country_code='AE', country='United Arab Emirates', contained_within=[], bounding_box=BoundingBox(_api=<tweepy.api.API object at 0x7f841aa03cd0>, type='Polygon', coordinates=[[[54.8939725, 24.6182526], [56.2083722, 24.6182526], [56.2083722, 25.3686719], [54.8939725, 25.3686719]]]), attributes={})"
175,اليابان تعلن الموافقة على استخدام لقاح فايزر المضاد لفيروس كورونا  ,1360909541131513858,2021-02-14 11:11:33,0,0,"Place(_api=<tweepy.api.API object at 0x7f841aa03cd0>, id='001907e868d06e24', url='https://api.twitter.com/1.1/geo/id/001907e868d06e24.json', place_type='admin', name='Dubai', full_name='Dubai, United Arab Emirates', country_code='AE', country='United Arab Emirates', contained_within=[], bounding_box=BoundingBox(_api=<tweepy.api.API object at 0x7f841aa03cd0>, type='Polygon', coordinates=[[[54.8939725, 24.6182526], [56.2083722, 24.6182526], [56.2083722, 25.3686719], [54.8939725, 25.3686719]]]), attributes={})"
176,“الصحة”: 3167 إصابة جديدة بفيروس كورونا  ,1360907404112629761,2021-02-14 11:03:04,0,0,"Place(_api=<tweepy.api.API object at 0x7f841aa03cd0>, id='001907e868d06e24', url='https://api.twitter.com/1.1/geo/id/001907e868d06e24.json', place_type='admin', name='Dubai', full_name='Dubai, United Arab Emirates', country_code='AE', country='United Arab Emirates', contained_within=[], bounding_box=BoundingBox(_api=<tweepy.api.API object at 0x7f841aa03cd0>, type='Polygon', coordinates=[[[54.8939725, 24.6182526], [56.2083722, 24.6182526], [56.2083722, 25.3686719], [54.8939725, 25.3686719]]]), attributes={})"
177,يا ويلي شكلهم مب عايشين بزمن كورونا ,1360902473913929729,2021-02-14 10:43:28,0,0,"Place(_api=<tweepy.api.API object at 0x7f841aa03cd0>, id='00f24ae701a1207b', url='https://api.twitter.com/1.1/geo/id/00f24ae701a1207b.json', place_type='admin', name='Abu Dhabi', full_name='Abu Dhabi, United Arab Emirates', country_code='AE', country='United Arab Emirates', contained_within=[], bounding_box=BoundingBox(_api=<tweepy.api.API object at 0x7f841aa03cd0>, type='Polygon', coordinates=[[[51.2938738, 22.6261387], [56.0175464, 22.6261387], [56.0175464, 25.1639588], [51.2938738, 25.1639588]]]), attributes={})"
178,هل فيروس كورونا يؤدي الي ارتفاع نسبة السكر في الدم  ,1360900991701319681,2021-02-14 10:37:35,0,0,"Place(_api=<tweepy.api.API object at 0x7f841aa03cd0>, id='001907e868d06e24', url='https://api.twitter.com/1.1/geo/id/001907e868d06e24.json', place_type='admin', name='Dubai', full_name='Dubai, United Arab Emirates', country_code='AE', country='United Arab Emirates', contained_within=[], bounding_box=BoundingBox(_api=<tweepy.api.API object at 0x7f841aa03cd0>, type='Polygon', coordinates=[[[54.8939725, 24.6182526], [56.2083722, 24.6182526], [56.2083722, 25.3686719], [54.8939725, 25.3686719]]]), attributes={})"
179,"“الصحة”: 3,167 إصابة جديدة بـ فيروس كورونا  ",1360900240212041730,2021-02-14 10:34:36,1,0,"Place(_api=<tweepy.api.API object at 0x7f841aa03cd0>, id='001907e868d06e24', url='https://api.twitter.com/1.1/geo/id/001907e868d06e24.json', place_type='admin', name='Dubai', full_name='Dubai, United Arab Emirates', country_code='AE', country='United Arab Emirates', contained_within=[], bounding_box=BoundingBox(_api=<tweepy.api.API object at 0x7f841aa03cd0>, type='Polygon', coordinates=[[[54.8939725, 24.6182526], [56.2083722, 24.6182526], [56.2083722, 25.3686719], [54.8939725, 25.3686719]]]), attributes={})"
180,الإمارات تسجل 3167 إصابة جديدة بفيروس كورونا  ,1360900230254714883,2021-02-14 10:34:33,0,0,"Place(_api=<tweepy.api.API object at 0x7f841aa03cd0>, id='001907e868d06e24', url='https://api.twitter.com/1.1/geo/id/001907e868d06e24.json', place_type='admin', name='Dubai', full_name='Dubai, United Arab Emirates', country_code='AE', country='United Arab Emirates', contained_within=[], bounding_box=BoundingBox(_api=<tweepy.api.API object at 0x7f841aa03cd0>, type='Polygon', coordinates=[[[54.8939725, 24.6182526], [56.2083722, 24.6182526], [56.2083722, 25.3686719], [54.8939725, 25.3686719]]]), attributes={})"
181,جونسون متفائل بإمكانية تخفيف قيود كورونا قريبا  ,1360897590737264640,2021-02-14 10:24:04,0,0,"Place(_api=<tweepy.api.API object at 0x7f841aa03cd0>, id='001907e868d06e24', url='https://api.twitter.com/1.1/geo/id/001907e868d06e24.json', place_type='admin', name='Dubai', full_name='Dubai, United Arab Emirates', country_code='AE', country='United Arab Emirates', contained_within=[], bounding_box=BoundingBox(_api=<tweepy.api.API object at 0x7f841aa03cd0>, type='Polygon', coordinates=[[[54.8939725, 24.6182526], [56.2083722, 24.6182526], [56.2083722, 25.3686719], [54.8939725, 25.3686719]]]), attributes={})"
