,Tweets,id,date,likes,retweets,place
72,منظمة الصحة: مليون وفاة بسبب كورونا في الأمريكتين  ,1354534027156307969,2021-01-27 20:57:32,0,0,"Place(_api=<tweepy.api.API object at 0x7f9eb81bdcd0>, id='001907e868d06e24', url='https://api.twitter.com/1.1/geo/id/001907e868d06e24.json', place_type='admin', name='Dubai', full_name='Dubai, United Arab Emirates', country_code='AE', country='United Arab Emirates', contained_within=[], bounding_box=BoundingBox(_api=<tweepy.api.API object at 0x7f9eb81bdcd0>, type='Polygon', coordinates=[[[54.8939725, 24.6182526], [56.2083722, 24.6182526], [56.2083722, 25.3686719], [54.8939725, 25.3686719]]]), attributes={})"
73,حد يعرف مراكز فحص كورونا pcr في دبي شغاله ٢٤ ساعه والنتيجة تطلع بسرعه؟,1354531921854947328,2021-01-27 20:49:10,0,0,"Place(_api=<tweepy.api.API object at 0x7f9eb81bdcd0>, id='001907e868d06e24', url='https://api.twitter.com/1.1/geo/id/001907e868d06e24.json', place_type='admin', name='Dubai', full_name='Dubai, United Arab Emirates', country_code='AE', country='United Arab Emirates', contained_within=[], bounding_box=BoundingBox(_api=<tweepy.api.API object at 0x7f9eb81bdcd0>, type='Polygon', coordinates=[[[54.8939725, 24.6182526], [56.2083722, 24.6182526], [56.2083722, 25.3686719], [54.8939725, 25.3686719]]]), attributes={})"
74,انا تقريباً وصلت ٧٠ فحص من بداية كورونا  ,1354531322321129473,2021-01-27 20:46:47,1,1,"Place(_api=<tweepy.api.API object at 0x7f9eb81bdcd0>, id='00f24ae701a1207b', url='https://api.twitter.com/1.1/geo/id/00f24ae701a1207b.json', place_type='admin', name='Abu Dhabi', full_name='Abu Dhabi, United Arab Emirates', country_code='AE', country='United Arab Emirates', contained_within=[], bounding_box=BoundingBox(_api=<tweepy.api.API object at 0x7f9eb81bdcd0>, type='Polygon', coordinates=[[[51.2938738, 22.6261387], [56.0175464, 22.6261387], [56.0175464, 25.1639588], [51.2938738, 25.1639588]]]), attributes={})"
75,الدولار ٩٠٠٠ البنوك سرقتنا الدواء مقطوع المواد الغذائية مفقودة التهريب عل الحدود فساد بادارة الدولة وباء كورونا خرج عن السيطرة بفضل هبل الحكومة و اذا نزلت الناس تتظاهر بيطلع مسؤول بإلك في حدن عم بحرك الشارع  في اهبل ووقاحة اكتر من هيك ما تواخذني يا مسؤول الموت قليل عليكن,1354525107276939269,2021-01-27 20:22:06,0,0,"Place(_api=<tweepy.api.API object at 0x7f9eb81bdcd0>, id='001907e868d06e24', url='https://api.twitter.com/1.1/geo/id/001907e868d06e24.json', place_type='admin', name='Dubai', full_name='Dubai, United Arab Emirates', country_code='AE', country='United Arab Emirates', contained_within=[], bounding_box=BoundingBox(_api=<tweepy.api.API object at 0x7f9eb81bdcd0>, type='Polygon', coordinates=[[[54.8939725, 24.6182526], [56.2083722, 24.6182526], [56.2083722, 25.3686719], [54.8939725, 25.3686719]]]), attributes={})"
76,%100 نسبة وقاية التطعيم الصيني من مضاعفات «كورونا»  ,1354524273314992128,2021-01-27 20:18:47,1,0,"Place(_api=<tweepy.api.API object at 0x7f9eb81bdcd0>, id='001907e868d06e24', url='https://api.twitter.com/1.1/geo/id/001907e868d06e24.json', place_type='admin', name='Dubai', full_name='Dubai, United Arab Emirates', country_code='AE', country='United Arab Emirates', contained_within=[], bounding_box=BoundingBox(_api=<tweepy.api.API object at 0x7f9eb81bdcd0>, type='Polygon', coordinates=[[[54.8939725, 24.6182526], [56.2083722, 24.6182526], [56.2083722, 25.3686719], [54.8939725, 25.3686719]]]), attributes={})"
77,ما اعرف الإدارة كيف اتفكر يابوطحنون بس اتوقع انهم خايفين في ضل جائحة كورونا ما تعرف شو يصير لقدام الدوري في حال استمرار زيادة الحالات يوقف او ينلغي لان الأرقام في ازدياد خوفك تدفع واخر شي الدوري ينلغي,1354523307559821312,2021-01-27 20:14:57,0,0,"Place(_api=<tweepy.api.API object at 0x7f9eb81bdcd0>, id='00f24ae701a1207b', url='https://api.twitter.com/1.1/geo/id/00f24ae701a1207b.json', place_type='admin', name='Abu Dhabi', full_name='Abu Dhabi, United Arab Emirates', country_code='AE', country='United Arab Emirates', contained_within=[], bounding_box=BoundingBox(_api=<tweepy.api.API object at 0x7f9eb81bdcd0>, type='Polygon', coordinates=[[[51.2938738, 22.6261387], [56.0175464, 22.6261387], [56.0175464, 25.1639588], [51.2938738, 25.1639588]]]), attributes={})"
78,تحديث تدابير التصدي لفيروس كورونا بالمنشآت الصحية في دبي  ,1354520826679226371,2021-01-27 20:05:05,0,0,"Place(_api=<tweepy.api.API object at 0x7f9eb81bdcd0>, id='001907e868d06e24', url='https://api.twitter.com/1.1/geo/id/001907e868d06e24.json', place_type='admin', name='Dubai', full_name='Dubai, United Arab Emirates', country_code='AE', country='United Arab Emirates', contained_within=[], bounding_box=BoundingBox(_api=<tweepy.api.API object at 0x7f9eb81bdcd0>, type='Polygon', coordinates=[[[54.8939725, 24.6182526], [56.2083722, 24.6182526], [56.2083722, 25.3686719], [54.8939725, 25.3686719]]]), attributes={})"
79,البيت الابيض يطالب بتحقيق دولي واضح ومعمق حول منشأ كورونا  ,1354510754716610560,2021-01-27 19:25:04,0,0,"Place(_api=<tweepy.api.API object at 0x7f9eb81bdcd0>, id='001907e868d06e24', url='https://api.twitter.com/1.1/geo/id/001907e868d06e24.json', place_type='admin', name='Dubai', full_name='Dubai, United Arab Emirates', country_code='AE', country='United Arab Emirates', contained_within=[], bounding_box=BoundingBox(_api=<tweepy.api.API object at 0x7f9eb81bdcd0>, type='Polygon', coordinates=[[[54.8939725, 24.6182526], [56.2083722, 24.6182526], [56.2083722, 25.3686719], [54.8939725, 25.3686719]]]), attributes={})"
80,أنوّي وصالك في كل يوم وليله ولا تذكرت حجر گروونا منّك هونت .,1354508302785392645,2021-01-27 19:15:19,45,11,"Place(_api=<tweepy.api.API object at 0x7f9eb81bdcd0>, id='00f24ae701a1207b', url='https://api.twitter.com/1.1/geo/id/00f24ae701a1207b.json', place_type='admin', name='Abu Dhabi', full_name='Abu Dhabi, United Arab Emirates', country_code='AE', country='United Arab Emirates', contained_within=[], bounding_box=BoundingBox(_api=<tweepy.api.API object at 0x7f9eb81bdcd0>, type='Polygon', coordinates=[[[51.2938738, 22.6261387], [56.0175464, 22.6261387], [56.0175464, 25.1639588], [51.2938738, 25.1639588]]]), attributes={})"
81,“صحة دبي” تُحدّث تدابير كورونا في المنشآت الصحية الخاصة  ,1354507480907190272,2021-01-27 19:12:03,0,0,"Place(_api=<tweepy.api.API object at 0x7f9eb81bdcd0>, id='001907e868d06e24', url='https://api.twitter.com/1.1/geo/id/001907e868d06e24.json', place_type='admin', name='Dubai', full_name='Dubai, United Arab Emirates', country_code='AE', country='United Arab Emirates', contained_within=[], bounding_box=BoundingBox(_api=<tweepy.api.API object at 0x7f9eb81bdcd0>, type='Polygon', coordinates=[[[54.8939725, 24.6182526], [56.2083722, 24.6182526], [56.2083722, 25.3686719], [54.8939725, 25.3686719]]]), attributes={})"
82,نتانياهو: إسرائيل بوسعها أن تكون معمل اختبار للعالم في مواجهة كورونا  ,1354504088335990785,2021-01-27 18:58:34,1,1,"Place(_api=<tweepy.api.API object at 0x7f9eb81bdcd0>, id='001907e868d06e24', url='https://api.twitter.com/1.1/geo/id/001907e868d06e24.json', place_type='admin', name='Dubai', full_name='Dubai, United Arab Emirates', country_code='AE', country='United Arab Emirates', contained_within=[], bounding_box=BoundingBox(_api=<tweepy.api.API object at 0x7f9eb81bdcd0>, type='Polygon', coordinates=[[[54.8939725, 24.6182526], [56.2083722, 24.6182526], [56.2083722, 25.3686719], [54.8939725, 25.3686719]]]), attributes={})"
83,الكويت تسجل 580 إصابة جديدة بـ”كورونا”  ,1354495788726906880,2021-01-27 18:25:36,0,0,"Place(_api=<tweepy.api.API object at 0x7f9eb81bdcd0>, id='001907e868d06e24', url='https://api.twitter.com/1.1/geo/id/001907e868d06e24.json', place_type='admin', name='Dubai', full_name='Dubai, United Arab Emirates', country_code='AE', country='United Arab Emirates', contained_within=[], bounding_box=BoundingBox(_api=<tweepy.api.API object at 0x7f9eb81bdcd0>, type='Polygon', coordinates=[[[54.8939725, 24.6182526], [56.2083722, 24.6182526], [56.2083722, 25.3686719], [54.8939725, 25.3686719]]]), attributes={})"
84,السلالة البريطانية المتحورة من كورونا منتشرة في 70 بلداً  ,1354495665926103041,2021-01-27 18:25:06,0,0,"Place(_api=<tweepy.api.API object at 0x7f9eb81bdcd0>, id='001907e868d06e24', url='https://api.twitter.com/1.1/geo/id/001907e868d06e24.json', place_type='admin', name='Dubai', full_name='Dubai, United Arab Emirates', country_code='AE', country='United Arab Emirates', contained_within=[], bounding_box=BoundingBox(_api=<tweepy.api.API object at 0x7f9eb81bdcd0>, type='Polygon', coordinates=[[[54.8939725, 24.6182526], [56.2083722, 24.6182526], [56.2083722, 25.3686719], [54.8939725, 25.3686719]]]), attributes={})"
85,مصابو كورونا بسلالة بريطانيا يسعلون أكثر لكن حاسة الشم عندهم أقل تأثراً  ,1354485078085095424,2021-01-27 17:43:02,1,0,"Place(_api=<tweepy.api.API object at 0x7f9eb81bdcd0>, id='001907e868d06e24', url='https://api.twitter.com/1.1/geo/id/001907e868d06e24.json', place_type='admin', name='Dubai', full_name='Dubai, United Arab Emirates', country_code='AE', country='United Arab Emirates', contained_within=[], bounding_box=BoundingBox(_api=<tweepy.api.API object at 0x7f9eb81bdcd0>, type='Polygon', coordinates=[[[54.8939725, 24.6182526], [56.2083722, 24.6182526], [56.2083722, 25.3686719], [54.8939725, 25.3686719]]]), attributes={})"
86,شراكة بين موانئ دبي العالمية واليونيسف لدعم التلقيح ضد كورونا  ,1354482322565787649,2021-01-27 17:32:05,1,0,"Place(_api=<tweepy.api.API object at 0x7f9eb81bdcd0>, id='001907e868d06e24', url='https://api.twitter.com/1.1/geo/id/001907e868d06e24.json', place_type='admin', name='Dubai', full_name='Dubai, United Arab Emirates', country_code='AE', country='United Arab Emirates', contained_within=[], bounding_box=BoundingBox(_api=<tweepy.api.API object at 0x7f9eb81bdcd0>, type='Polygon', coordinates=[[[54.8939725, 24.6182526], [56.2083722, 24.6182526], [56.2083722, 25.3686719], [54.8939725, 25.3686719]]]), attributes={})"
87,علاج روسي جديد لـ «كورونا»  ,1354481691637608448,2021-01-27 17:29:34,1,0,"Place(_api=<tweepy.api.API object at 0x7f9eb81bdcd0>, id='001907e868d06e24', url='https://api.twitter.com/1.1/geo/id/001907e868d06e24.json', place_type='admin', name='Dubai', full_name='Dubai, United Arab Emirates', country_code='AE', country='United Arab Emirates', contained_within=[], bounding_box=BoundingBox(_api=<tweepy.api.API object at 0x7f9eb81bdcd0>, type='Polygon', coordinates=[[[54.8939725, 24.6182526], [56.2083722, 24.6182526], [56.2083722, 25.3686719], [54.8939725, 25.3686719]]]), attributes={})"
88,روسيا.. بوادر إيجابية في تراجع تفشي كورونا  ,1354481688655523842,2021-01-27 17:29:34,1,0,"Place(_api=<tweepy.api.API object at 0x7f9eb81bdcd0>, id='001907e868d06e24', url='https://api.twitter.com/1.1/geo/id/001907e868d06e24.json', place_type='admin', name='Dubai', full_name='Dubai, United Arab Emirates', country_code='AE', country='United Arab Emirates', contained_within=[], bounding_box=BoundingBox(_api=<tweepy.api.API object at 0x7f9eb81bdcd0>, type='Polygon', coordinates=[[[54.8939725, 24.6182526], [56.2083722, 24.6182526], [56.2083722, 25.3686719], [54.8939725, 25.3686719]]]), attributes={})"
89,أنا أقول خذوا اللقاح وفكوا أعماركم ولا تضيعون كل اللي حميتوه طول العمر بسبة كورونا  ,1354479497576402944,2021-01-27 17:20:51,12,4,"Place(_api=<tweepy.api.API object at 0x7f9eb81bdcd0>, id='00f24ae701a1207b', url='https://api.twitter.com/1.1/geo/id/00f24ae701a1207b.json', place_type='admin', name='Abu Dhabi', full_name='Abu Dhabi, United Arab Emirates', country_code='AE', country='United Arab Emirates', contained_within=[], bounding_box=BoundingBox(_api=<tweepy.api.API object at 0x7f9eb81bdcd0>, type='Polygon', coordinates=[[[51.2938738, 22.6261387], [56.0175464, 22.6261387], [56.0175464, 25.1639588], [51.2938738, 25.1639588]]]), attributes={})"
90,"“الصحة” تجري 174,016 فحصا ضمن خططها لتوسيع نطاق الفحوصات وتكشف عن 3,939 إصابة جديدة بفيروس كورونا المستجد و4,536 حالة شفاء و6 حالات وفاة خلال الـ 24 س…  ",1354479044566237184,2021-01-27 17:19:03,0,1,"Place(_api=<tweepy.api.API object at 0x7f9eb81bdcd0>, id='001907e868d06e24', url='https://api.twitter.com/1.1/geo/id/001907e868d06e24.json', place_type='admin', name='Dubai', full_name='Dubai, United Arab Emirates', country_code='AE', country='United Arab Emirates', contained_within=[], bounding_box=BoundingBox(_api=<tweepy.api.API object at 0x7f9eb81bdcd0>, type='Polygon', coordinates=[[[54.8939725, 24.6182526], [56.2083722, 24.6182526], [56.2083722, 25.3686719], [54.8939725, 25.3686719]]]), attributes={})"
91,“الصحة” تسجل 3939 إصابة جديدة بفيروس كورونا  ,1354478965470072833,2021-01-27 17:18:45,0,1,"Place(_api=<tweepy.api.API object at 0x7f9eb81bdcd0>, id='001907e868d06e24', url='https://api.twitter.com/1.1/geo/id/001907e868d06e24.json', place_type='admin', name='Dubai', full_name='Dubai, United Arab Emirates', country_code='AE', country='United Arab Emirates', contained_within=[], bounding_box=BoundingBox(_api=<tweepy.api.API object at 0x7f9eb81bdcd0>, type='Polygon', coordinates=[[[54.8939725, 24.6182526], [56.2083722, 24.6182526], [56.2083722, 25.3686719], [54.8939725, 25.3686719]]]), attributes={})"
92,بعد حظر الرحلات الجوية .. إسرائيل تغلق حدودها البرية لمكافحة كورونا  ,1354478559054548998,2021-01-27 17:17:08,0,1,"Place(_api=<tweepy.api.API object at 0x7f9eb81bdcd0>, id='001907e868d06e24', url='https://api.twitter.com/1.1/geo/id/001907e868d06e24.json', place_type='admin', name='Dubai', full_name='Dubai, United Arab Emirates', country_code='AE', country='United Arab Emirates', contained_within=[], bounding_box=BoundingBox(_api=<tweepy.api.API object at 0x7f9eb81bdcd0>, type='Polygon', coordinates=[[[54.8939725, 24.6182526], [56.2083722, 24.6182526], [56.2083722, 25.3686719], [54.8939725, 25.3686719]]]), attributes={})"
93,إنذار بوجود قنبلة في مصنع للقاحات ضد كورونا في بريطانيا  ,1354478555954987008,2021-01-27 17:17:07,0,2,"Place(_api=<tweepy.api.API object at 0x7f9eb81bdcd0>, id='001907e868d06e24', url='https://api.twitter.com/1.1/geo/id/001907e868d06e24.json', place_type='admin', name='Dubai', full_name='Dubai, United Arab Emirates', country_code='AE', country='United Arab Emirates', contained_within=[], bounding_box=BoundingBox(_api=<tweepy.api.API object at 0x7f9eb81bdcd0>, type='Polygon', coordinates=[[[54.8939725, 24.6182526], [56.2083722, 24.6182526], [56.2083722, 25.3686719], [54.8939725, 25.3686719]]]), attributes={})"
94,هل نخلط لقاحات كورونا؟ توضيح مهم من الصحة العالمية  ,1354478553169948677,2021-01-27 17:17:06,0,1,"Place(_api=<tweepy.api.API object at 0x7f9eb81bdcd0>, id='001907e868d06e24', url='https://api.twitter.com/1.1/geo/id/001907e868d06e24.json', place_type='admin', name='Dubai', full_name='Dubai, United Arab Emirates', country_code='AE', country='United Arab Emirates', contained_within=[], bounding_box=BoundingBox(_api=<tweepy.api.API object at 0x7f9eb81bdcd0>, type='Polygon', coordinates=[[[54.8939725, 24.6182526], [56.2083722, 24.6182526], [56.2083722, 25.3686719], [54.8939725, 25.3686719]]]), attributes={})"
95,اصابات كورونا وصلت الي قرابة ال 4 الاف اصابة  في احدث احصائية ، ولكن ما يدعونا للتفاؤل زيادة حالات الشفاء التي تجاوزت ال 4.5 الاف حالة شفاء،وبإذن الله مع زيادة حالات أخذ اللقاح بالوصول الي اكثر من نصف سكان الدولة والحرص علي الالتزام بالاحترازية سيتم حصار الجائحة والسيطرة عليها,1354477161869144064,2021-01-27 17:11:35,0,0,"Place(_api=<tweepy.api.API object at 0x7f9eb81bdcd0>, id='001907e868d06e24', url='https://api.twitter.com/1.1/geo/id/001907e868d06e24.json', place_type='admin', name='Dubai', full_name='Dubai, United Arab Emirates', country_code='AE', country='United Arab Emirates', contained_within=[], bounding_box=BoundingBox(_api=<tweepy.api.API object at 0x7f9eb81bdcd0>, type='Polygon', coordinates=[[[54.8939725, 24.6182526], [56.2083722, 24.6182526], [56.2083722, 25.3686719], [54.8939725, 25.3686719]]]), attributes={})"
96,الصين تبدأ بإستخدام المسحات الشرجية لفحص سكانها من كورونا، وهي طريقة يقول الخبراء إنها أكثر دقة وتزيد من فرص اكتشاف الفيروس  تقريبا كدة احنا نولع فيهم و نخلص الي يشوف واحد صيني يموته ,1354475332871581696,2021-01-27 17:04:18,0,1,"Place(_api=<tweepy.api.API object at 0x7f9eb81bdcd0>, id='001907e868d06e24', url='https://api.twitter.com/1.1/geo/id/001907e868d06e24.json', place_type='admin', name='Dubai', full_name='Dubai, United Arab Emirates', country_code='AE', country='United Arab Emirates', contained_within=[], bounding_box=BoundingBox(_api=<tweepy.api.API object at 0x7f9eb81bdcd0>, type='Polygon', coordinates=[[[54.8939725, 24.6182526], [56.2083722, 24.6182526], [56.2083722, 25.3686719], [54.8939725, 25.3686719]]]), attributes={})"
97,قبرص تخفف تدريجاً القيود المفروضة بسبب كورونا مطلع فبراير  ,1354470365985034245,2021-01-27 16:44:34,0,0,"Place(_api=<tweepy.api.API object at 0x7f9eb81bdcd0>, id='001907e868d06e24', url='https://api.twitter.com/1.1/geo/id/001907e868d06e24.json', place_type='admin', name='Dubai', full_name='Dubai, United Arab Emirates', country_code='AE', country='United Arab Emirates', contained_within=[], bounding_box=BoundingBox(_api=<tweepy.api.API object at 0x7f9eb81bdcd0>, type='Polygon', coordinates=[[[54.8939725, 24.6182526], [56.2083722, 24.6182526], [56.2083722, 25.3686719], [54.8939725, 25.3686719]]]), attributes={})"
98,مطار القاهرة يستقبل أول طائرة كويتية منذ التعليق بسبب كورونا  ,1354462316754923523,2021-01-27 16:12:35,0,0,"Place(_api=<tweepy.api.API object at 0x7f9eb81bdcd0>, id='001907e868d06e24', url='https://api.twitter.com/1.1/geo/id/001907e868d06e24.json', place_type='admin', name='Dubai', full_name='Dubai, United Arab Emirates', country_code='AE', country='United Arab Emirates', contained_within=[], bounding_box=BoundingBox(_api=<tweepy.api.API object at 0x7f9eb81bdcd0>, type='Polygon', coordinates=[[[54.8939725, 24.6182526], [56.2083722, 24.6182526], [56.2083722, 25.3686719], [54.8939725, 25.3686719]]]), attributes={})"
99,أقارب لضحايا كورونا في ووهان يتهمون السلطات بإسكاتهم  ,1354462313827373061,2021-01-27 16:12:34,0,0,"Place(_api=<tweepy.api.API object at 0x7f9eb81bdcd0>, id='001907e868d06e24', url='https://api.twitter.com/1.1/geo/id/001907e868d06e24.json', place_type='admin', name='Dubai', full_name='Dubai, United Arab Emirates', country_code='AE', country='United Arab Emirates', contained_within=[], bounding_box=BoundingBox(_api=<tweepy.api.API object at 0x7f9eb81bdcd0>, type='Polygon', coordinates=[[[54.8939725, 24.6182526], [56.2083722, 24.6182526], [56.2083722, 25.3686719], [54.8939725, 25.3686719]]]), attributes={})"
100,اضطراب المريء يجعل التقاط كورونا عبر الطعام أكثر احتمالاً  ,1354462311017140229,2021-01-27 16:12:34,0,0,"Place(_api=<tweepy.api.API object at 0x7f9eb81bdcd0>, id='001907e868d06e24', url='https://api.twitter.com/1.1/geo/id/001907e868d06e24.json', place_type='admin', name='Dubai', full_name='Dubai, United Arab Emirates', country_code='AE', country='United Arab Emirates', contained_within=[], bounding_box=BoundingBox(_api=<tweepy.api.API object at 0x7f9eb81bdcd0>, type='Polygon', coordinates=[[[54.8939725, 24.6182526], [56.2083722, 24.6182526], [56.2083722, 25.3686719], [54.8939725, 25.3686719]]]), attributes={})"
101,شيئان ضروريان يجب القيام بهما قبل تلقي لقاح كورونا  ,1354462308173373441,2021-01-27 16:12:33,0,0,"Place(_api=<tweepy.api.API object at 0x7f9eb81bdcd0>, id='001907e868d06e24', url='https://api.twitter.com/1.1/geo/id/001907e868d06e24.json', place_type='admin', name='Dubai', full_name='Dubai, United Arab Emirates', country_code='AE', country='United Arab Emirates', contained_within=[], bounding_box=BoundingBox(_api=<tweepy.api.API object at 0x7f9eb81bdcd0>, type='Polygon', coordinates=[[[54.8939725, 24.6182526], [56.2083722, 24.6182526], [56.2083722, 25.3686719], [54.8939725, 25.3686719]]]), attributes={})"
102,البحرين تواجه «كورونا» باللقاحات والقيود على المطاعم والتعليم  ,1354442173253472258,2021-01-27 14:52:33,0,0,"Place(_api=<tweepy.api.API object at 0x7f9eb81bdcd0>, id='001907e868d06e24', url='https://api.twitter.com/1.1/geo/id/001907e868d06e24.json', place_type='admin', name='Dubai', full_name='Dubai, United Arab Emirates', country_code='AE', country='United Arab Emirates', contained_within=[], bounding_box=BoundingBox(_api=<tweepy.api.API object at 0x7f9eb81bdcd0>, type='Polygon', coordinates=[[[54.8939725, 24.6182526], [56.2083722, 24.6182526], [56.2083722, 25.3686719], [54.8939725, 25.3686719]]]), attributes={})"
103,كيف تضاعف الوقاية من كورونا باستخدام كمامتين؟  ,1354423300785508352,2021-01-27 13:37:33,0,0,"Place(_api=<tweepy.api.API object at 0x7f9eb81bdcd0>, id='001907e868d06e24', url='https://api.twitter.com/1.1/geo/id/001907e868d06e24.json', place_type='admin', name='Dubai', full_name='Dubai, United Arab Emirates', country_code='AE', country='United Arab Emirates', contained_within=[], bounding_box=BoundingBox(_api=<tweepy.api.API object at 0x7f9eb81bdcd0>, type='Polygon', coordinates=[[[54.8939725, 24.6182526], [56.2083722, 24.6182526], [56.2083722, 25.3686719], [54.8939725, 25.3686719]]]), attributes={})"
104,الإمارات قد تقر تطعيم كورونا كتطعيم سنوي  ,1354419926161780738,2021-01-27 13:24:08,0,0,"Place(_api=<tweepy.api.API object at 0x7f9eb81bdcd0>, id='001907e868d06e24', url='https://api.twitter.com/1.1/geo/id/001907e868d06e24.json', place_type='admin', name='Dubai', full_name='Dubai, United Arab Emirates', country_code='AE', country='United Arab Emirates', contained_within=[], bounding_box=BoundingBox(_api=<tweepy.api.API object at 0x7f9eb81bdcd0>, type='Polygon', coordinates=[[[54.8939725, 24.6182526], [56.2083722, 24.6182526], [56.2083722, 25.3686719], [54.8939725, 25.3686719]]]), attributes={})"
105,ودي اعرف ليش الصين تخفي عدد الاصابات و عدد الفحوصات لفايروس كورونا من بداية الازمة ,1354395278615392258,2021-01-27 11:46:12,0,0,"Place(_api=<tweepy.api.API object at 0x7f9eb81bdcd0>, id='001907e868d06e24', url='https://api.twitter.com/1.1/geo/id/001907e868d06e24.json', place_type='admin', name='Dubai', full_name='Dubai, United Arab Emirates', country_code='AE', country='United Arab Emirates', contained_within=[], bounding_box=BoundingBox(_api=<tweepy.api.API object at 0x7f9eb81bdcd0>, type='Polygon', coordinates=[[[54.8939725, 24.6182526], [56.2083722, 24.6182526], [56.2083722, 25.3686719], [54.8939725, 25.3686719]]]), attributes={})"
106,إنشاء وتجهيز مستشفى ميداني للحالات الطارئة لمصابي “كورونا” في بالشارقة خلال شهر  ,1354394254328680450,2021-01-27 11:42:08,0,0,"Place(_api=<tweepy.api.API object at 0x7f9eb81bdcd0>, id='001907e868d06e24', url='https://api.twitter.com/1.1/geo/id/001907e868d06e24.json', place_type='admin', name='Dubai', full_name='Dubai, United Arab Emirates', country_code='AE', country='United Arab Emirates', contained_within=[], bounding_box=BoundingBox(_api=<tweepy.api.API object at 0x7f9eb81bdcd0>, type='Polygon', coordinates=[[[54.8939725, 24.6182526], [56.2083722, 24.6182526], [56.2083722, 25.3686719], [54.8939725, 25.3686719]]]), attributes={})"
107,مستشفى ميداني للحالات الطارئة لمصابي كورونا في الزاهية بالشارقة  ,1354387958711816192,2021-01-27 11:17:07,0,0,"Place(_api=<tweepy.api.API object at 0x7f9eb81bdcd0>, id='001907e868d06e24', url='https://api.twitter.com/1.1/geo/id/001907e868d06e24.json', place_type='admin', name='Dubai', full_name='Dubai, United Arab Emirates', country_code='AE', country='United Arab Emirates', contained_within=[], bounding_box=BoundingBox(_api=<tweepy.api.API object at 0x7f9eb81bdcd0>, type='Polygon', coordinates=[[[54.8939725, 24.6182526], [56.2083722, 24.6182526], [56.2083722, 25.3686719], [54.8939725, 25.3686719]]]), attributes={})"
