,Tweets,id,date,likes,retweets,place
0,شركة “سيلتريون” الكورية الجنوبية تؤكد فعالية علاجها ضد كورونا  ,1349387762726629380,2021-01-13 16:08:07,0,0,"Place(_api=<tweepy.api.API object at 0x7f63a7f65cd0>, id='001907e868d06e24', url='https://api.twitter.com/1.1/geo/id/001907e868d06e24.json', place_type='admin', name='Dubai', full_name='Dubai, United Arab Emirates', country_code='AE', country='United Arab Emirates', contained_within=[], bounding_box=BoundingBox(_api=<tweepy.api.API object at 0x7f63a7f65cd0>, type='Polygon', coordinates=[[[54.8939725, 24.6182526], [56.2083722, 24.6182526], [56.2083722, 25.3686719], [54.8939725, 25.3686719]]]), attributes={})"
1,ملك وملكة النرويج يتلقيان لقاح كورونا  ,1349387239499788288,2021-01-13 16:06:02,0,0,"Place(_api=<tweepy.api.API object at 0x7f63a7f65cd0>, id='001907e868d06e24', url='https://api.twitter.com/1.1/geo/id/001907e868d06e24.json', place_type='admin', name='Dubai', full_name='Dubai, United Arab Emirates', country_code='AE', country='United Arab Emirates', contained_within=[], bounding_box=BoundingBox(_api=<tweepy.api.API object at 0x7f63a7f65cd0>, type='Polygon', coordinates=[[[54.8939725, 24.6182526], [56.2083722, 24.6182526], [56.2083722, 25.3686719], [54.8939725, 25.3686719]]]), attributes={})"
2,كيفك تختلف أعراض كورونا لدى الأطفال عن أعراض البالغين؟  ,1349379573285224448,2021-01-13 15:35:35,0,1,"Place(_api=<tweepy.api.API object at 0x7f63a7f65cd0>, id='001907e868d06e24', url='https://api.twitter.com/1.1/geo/id/001907e868d06e24.json', place_type='admin', name='Dubai', full_name='Dubai, United Arab Emirates', country_code='AE', country='United Arab Emirates', contained_within=[], bounding_box=BoundingBox(_api=<tweepy.api.API object at 0x7f63a7f65cd0>, type='Polygon', coordinates=[[[54.8939725, 24.6182526], [56.2083722, 24.6182526], [56.2083722, 25.3686719], [54.8939725, 25.3686719]]]), attributes={})"
3,وزير الصحة: ألمانيا تشهد واحدة من أصعب مراحل جائحة كورونا  ,1349379570428829697,2021-01-13 15:35:34,0,1,"Place(_api=<tweepy.api.API object at 0x7f63a7f65cd0>, id='001907e868d06e24', url='https://api.twitter.com/1.1/geo/id/001907e868d06e24.json', place_type='admin', name='Dubai', full_name='Dubai, United Arab Emirates', country_code='AE', country='United Arab Emirates', contained_within=[], bounding_box=BoundingBox(_api=<tweepy.api.API object at 0x7f63a7f65cd0>, type='Polygon', coordinates=[[[54.8939725, 24.6182526], [56.2083722, 24.6182526], [56.2083722, 25.3686719], [54.8939725, 25.3686719]]]), attributes={})"
4,الصحة العالمية: السلالة المتحوّرة من كورونا انتشرت في عشرات البلدان  ,1349379218698694658,2021-01-13 15:34:10,0,1,"Place(_api=<tweepy.api.API object at 0x7f63a7f65cd0>, id='001907e868d06e24', url='https://api.twitter.com/1.1/geo/id/001907e868d06e24.json', place_type='admin', name='Dubai', full_name='Dubai, United Arab Emirates', country_code='AE', country='United Arab Emirates', contained_within=[], bounding_box=BoundingBox(_api=<tweepy.api.API object at 0x7f63a7f65cd0>, type='Polygon', coordinates=[[[54.8939725, 24.6182526], [56.2083722, 24.6182526], [56.2083722, 25.3686719], [54.8939725, 25.3686719]]]), attributes={})"
5,فريدريكسن تعرب عن رغبتها في تمديد قيود كورونا في الدنمارك  ,1349379199363018757,2021-01-13 15:34:06,0,1,"Place(_api=<tweepy.api.API object at 0x7f63a7f65cd0>, id='001907e868d06e24', url='https://api.twitter.com/1.1/geo/id/001907e868d06e24.json', place_type='admin', name='Dubai', full_name='Dubai, United Arab Emirates', country_code='AE', country='United Arab Emirates', contained_within=[], bounding_box=BoundingBox(_api=<tweepy.api.API object at 0x7f63a7f65cd0>, type='Polygon', coordinates=[[[54.8939725, 24.6182526], [56.2083722, 24.6182526], [56.2083722, 25.3686719], [54.8939725, 25.3686719]]]), attributes={})"
6,كورونا حرمني من الدلع مع الاسف ,1349378649477308425,2021-01-13 15:31:54,1,0,"Place(_api=<tweepy.api.API object at 0x7f63a7f65cd0>, id='001907e868d06e24', url='https://api.twitter.com/1.1/geo/id/001907e868d06e24.json', place_type='admin', name='Dubai', full_name='Dubai, United Arab Emirates', country_code='AE', country='United Arab Emirates', contained_within=[], bounding_box=BoundingBox(_api=<tweepy.api.API object at 0x7f63a7f65cd0>, type='Polygon', coordinates=[[[54.8939725, 24.6182526], [56.2083722, 24.6182526], [56.2083722, 25.3686719], [54.8939725, 25.3686719]]]), attributes={})"
7,معلومات عن التطعيم ضد كورونا في الامارات وعن الفئات المستهدفة  ,1349374668268978178,2021-01-13 15:16:05,0,1,"Place(_api=<tweepy.api.API object at 0x7f63a7f65cd0>, id='001907e868d06e24', url='https://api.twitter.com/1.1/geo/id/001907e868d06e24.json', place_type='admin', name='Dubai', full_name='Dubai, United Arab Emirates', country_code='AE', country='United Arab Emirates', contained_within=[], bounding_box=BoundingBox(_api=<tweepy.api.API object at 0x7f63a7f65cd0>, type='Polygon', coordinates=[[[54.8939725, 24.6182526], [56.2083722, 24.6182526], [56.2083722, 25.3686719], [54.8939725, 25.3686719]]]), attributes={})"
