,Tweets,id,date,likes,retweets,place
70,فيروس كورونا اليابان تكتشف سلالة جديدة من كورونا في وافدين من البرازيل  ,1348274658676670468,2021-01-10 14:25:03,0,0,"Place(_api=<tweepy.api.API object at 0x7f0ca5bdbcd0>, id='001907e868d06e24', url='https://api.twitter.com/1.1/geo/id/001907e868d06e24.json', place_type='admin', name='Dubai', full_name='Dubai, United Arab Emirates', country_code='AE', country='United Arab Emirates', contained_within=[], bounding_box=BoundingBox(_api=<tweepy.api.API object at 0x7f0ca5bdbcd0>, type='Polygon', coordinates=[[[54.8939725, 24.6182526], [56.2083722, 24.6182526], [56.2083722, 25.3686719], [54.8939725, 25.3686719]]]), attributes={})"
71,“أغلبهم عن كورونا”.. مليونا مكالمة تلقاها مركز الاتصال بصحة دبي خلال 2020  ,1348270777175445504,2021-01-10 14:09:37,0,0,"Place(_api=<tweepy.api.API object at 0x7f0ca5bdbcd0>, id='001907e868d06e24', url='https://api.twitter.com/1.1/geo/id/001907e868d06e24.json', place_type='admin', name='Dubai', full_name='Dubai, United Arab Emirates', country_code='AE', country='United Arab Emirates', contained_within=[], bounding_box=BoundingBox(_api=<tweepy.api.API object at 0x7f0ca5bdbcd0>, type='Polygon', coordinates=[[[54.8939725, 24.6182526], [56.2083722, 24.6182526], [56.2083722, 25.3686719], [54.8939725, 25.3686719]]]), attributes={})"
72,الصحة: تقديم 66 ألف جرعة من لقاح كورونا خلال 24 ساعة  ,1348270770867236866,2021-01-10 14:09:36,0,0,"Place(_api=<tweepy.api.API object at 0x7f0ca5bdbcd0>, id='001907e868d06e24', url='https://api.twitter.com/1.1/geo/id/001907e868d06e24.json', place_type='admin', name='Dubai', full_name='Dubai, United Arab Emirates', country_code='AE', country='United Arab Emirates', contained_within=[], bounding_box=BoundingBox(_api=<tweepy.api.API object at 0x7f0ca5bdbcd0>, type='Polygon', coordinates=[[[54.8939725, 24.6182526], [56.2083722, 24.6182526], [56.2083722, 25.3686719], [54.8939725, 25.3686719]]]), attributes={})"
73,السعودية : 5 وفيات و117 إصابة جديدة بفيروس كورونا  ,1348268750911414273,2021-01-10 14:01:34,0,0,"Place(_api=<tweepy.api.API object at 0x7f0ca5bdbcd0>, id='001907e868d06e24', url='https://api.twitter.com/1.1/geo/id/001907e868d06e24.json', place_type='admin', name='Dubai', full_name='Dubai, United Arab Emirates', country_code='AE', country='United Arab Emirates', contained_within=[], bounding_box=BoundingBox(_api=<tweepy.api.API object at 0x7f0ca5bdbcd0>, type='Polygon', coordinates=[[[54.8939725, 24.6182526], [56.2083722, 24.6182526], [56.2083722, 25.3686719], [54.8939725, 25.3686719]]]), attributes={})"
74,يوم اسمع و اقرأ عن الناس اللي متخوفه من لقاح كورونا احس اني بطل لأني تطوعت في التجارب السريرية للقاح  ما الناس ما عندها حس بالمسؤولية أو جبن  لا و منهم من يتكلم عن مؤامرات خف علينا يا رومل ,1348268600239542272,2021-01-10 14:00:58,7,3,"Place(_api=<tweepy.api.API object at 0x7f0ca5bdbcd0>, id='00f24ae701a1207b', url='https://api.twitter.com/1.1/geo/id/00f24ae701a1207b.json', place_type='admin', name='Abu Dhabi', full_name='Abu Dhabi, United Arab Emirates', country_code='AE', country='United Arab Emirates', contained_within=[], bounding_box=BoundingBox(_api=<tweepy.api.API object at 0x7f0ca5bdbcd0>, type='Polygon', coordinates=[[[51.2938738, 22.6261387], [56.0175464, 22.6261387], [56.0175464, 25.1639588], [51.2938738, 25.1639588]]]), attributes={})"
75,20 وفاة و699 إصابة جديدة بـ” كورونا” في فلسطين  ,1348266109653315585,2021-01-10 13:51:04,1,0,"Place(_api=<tweepy.api.API object at 0x7f0ca5bdbcd0>, id='001907e868d06e24', url='https://api.twitter.com/1.1/geo/id/001907e868d06e24.json', place_type='admin', name='Dubai', full_name='Dubai, United Arab Emirates', country_code='AE', country='United Arab Emirates', contained_within=[], bounding_box=BoundingBox(_api=<tweepy.api.API object at 0x7f0ca5bdbcd0>, type='Polygon', coordinates=[[[54.8939725, 24.6182526], [56.2083722, 24.6182526], [56.2083722, 25.3686719], [54.8939725, 25.3686719]]]), attributes={})"
76,تسييس الجائحة يُعقد إمكانية معرفة حقيقة نشأة كورونا  ,1348260692747448322,2021-01-10 13:29:33,0,0,"Place(_api=<tweepy.api.API object at 0x7f0ca5bdbcd0>, id='001907e868d06e24', url='https://api.twitter.com/1.1/geo/id/001907e868d06e24.json', place_type='admin', name='Dubai', full_name='Dubai, United Arab Emirates', country_code='AE', country='United Arab Emirates', contained_within=[], bounding_box=BoundingBox(_api=<tweepy.api.API object at 0x7f0ca5bdbcd0>, type='Polygon', coordinates=[[[54.8939725, 24.6182526], [56.2083722, 24.6182526], [56.2083722, 25.3686719], [54.8939725, 25.3686719]]]), attributes={})"
77,لقاح كورونا عن كورونا المتحور واللقاح.. الصحة العالمية تجيب عن أسئلة محيّرة  ,1348260193151242240,2021-01-10 13:27:34,0,0,"Place(_api=<tweepy.api.API object at 0x7f0ca5bdbcd0>, id='001907e868d06e24', url='https://api.twitter.com/1.1/geo/id/001907e868d06e24.json', place_type='admin', name='Dubai', full_name='Dubai, United Arab Emirates', country_code='AE', country='United Arab Emirates', contained_within=[], bounding_box=BoundingBox(_api=<tweepy.api.API object at 0x7f0ca5bdbcd0>, type='Polygon', coordinates=[[[54.8939725, 24.6182526], [56.2083722, 24.6182526], [56.2083722, 25.3686719], [54.8939725, 25.3686719]]]), attributes={})"
78,أمريكا: إجمالي إصابات كورونا يتجاوز 22 مليوناً  ,1348252776325812226,2021-01-10 12:58:05,1,0,"Place(_api=<tweepy.api.API object at 0x7f0ca5bdbcd0>, id='001907e868d06e24', url='https://api.twitter.com/1.1/geo/id/001907e868d06e24.json', place_type='admin', name='Dubai', full_name='Dubai, United Arab Emirates', country_code='AE', country='United Arab Emirates', contained_within=[], bounding_box=BoundingBox(_api=<tweepy.api.API object at 0x7f0ca5bdbcd0>, type='Polygon', coordinates=[[[54.8939725, 24.6182526], [56.2083722, 24.6182526], [56.2083722, 25.3686719], [54.8939725, 25.3686719]]]), attributes={})"
79,الإمارات تمضي يداً بيد نحو التعافي من كورونا  ,1348248490233585669,2021-01-10 12:41:03,1,0,"Place(_api=<tweepy.api.API object at 0x7f0ca5bdbcd0>, id='001907e868d06e24', url='https://api.twitter.com/1.1/geo/id/001907e868d06e24.json', place_type='admin', name='Dubai', full_name='Dubai, United Arab Emirates', country_code='AE', country='United Arab Emirates', contained_within=[], bounding_box=BoundingBox(_api=<tweepy.api.API object at 0x7f0ca5bdbcd0>, type='Polygon', coordinates=[[[54.8939725, 24.6182526], [56.2083722, 24.6182526], [56.2083722, 25.3686719], [54.8939725, 25.3686719]]]), attributes={})"
80,وزير الصحة: بريطانيا في طريقها لتحقيق هدفها المتعلق بلقاح ضد كورونا  ,1348243079329771521,2021-01-10 12:19:33,0,0,"Place(_api=<tweepy.api.API object at 0x7f0ca5bdbcd0>, id='001907e868d06e24', url='https://api.twitter.com/1.1/geo/id/001907e868d06e24.json', place_type='admin', name='Dubai', full_name='Dubai, United Arab Emirates', country_code='AE', country='United Arab Emirates', contained_within=[], bounding_box=BoundingBox(_api=<tweepy.api.API object at 0x7f0ca5bdbcd0>, type='Polygon', coordinates=[[[54.8939725, 24.6182526], [56.2083722, 24.6182526], [56.2083722, 25.3686719], [54.8939725, 25.3686719]]]), attributes={})"
81,هذا ما حققته الإمارات في دعم وتطوير لقاح ضد كورونا  ,1348240189852815368,2021-01-10 12:08:05,0,0,"Place(_api=<tweepy.api.API object at 0x7f0ca5bdbcd0>, id='001907e868d06e24', url='https://api.twitter.com/1.1/geo/id/001907e868d06e24.json', place_type='admin', name='Dubai', full_name='Dubai, United Arab Emirates', country_code='AE', country='United Arab Emirates', contained_within=[], bounding_box=BoundingBox(_api=<tweepy.api.API object at 0x7f0ca5bdbcd0>, type='Polygon', coordinates=[[[54.8939725, 24.6182526], [56.2083722, 24.6182526], [56.2083722, 25.3686719], [54.8939725, 25.3686719]]]), attributes={})"
82,"مجلة الهلال في أسبوع العدد ""20"" يتضمن العدد موجزاً لأهم أخبار هيئة الهلال الأحمر الإماراتي خلال الأسبوع الماضي، أهمها بتوجيهات محمد بن زايد.. الإمارات تقدم مساعدات عاجلة للمتأثرين من الفيضانات في ولاية بهانج بماليزيا. ",1348234535998283777,2021-01-10 11:45:37,9,3,"Place(_api=<tweepy.api.API object at 0x7f0ca5bdbcd0>, id='00f24ae701a1207b', url='https://api.twitter.com/1.1/geo/id/00f24ae701a1207b.json', place_type='admin', name='Abu Dhabi', full_name='Abu Dhabi, United Arab Emirates', country_code='AE', country='United Arab Emirates', contained_within=[], bounding_box=BoundingBox(_api=<tweepy.api.API object at 0x7f0ca5bdbcd0>, type='Polygon', coordinates=[[[51.2938738, 22.6261387], [56.0175464, 22.6261387], [56.0175464, 25.1639588], [51.2938738, 25.1639588]]]), attributes={})"
83,لقاح كورونا بريطانيا تسابق الزمن.. تطعيم 200 ألف بلقاح كورونا يوميا  ,1348226469692985344,2021-01-10 11:13:33,0,0,"Place(_api=<tweepy.api.API object at 0x7f0ca5bdbcd0>, id='001907e868d06e24', url='https://api.twitter.com/1.1/geo/id/001907e868d06e24.json', place_type='admin', name='Dubai', full_name='Dubai, United Arab Emirates', country_code='AE', country='United Arab Emirates', contained_within=[], bounding_box=BoundingBox(_api=<tweepy.api.API object at 0x7f0ca5bdbcd0>, type='Polygon', coordinates=[[[54.8939725, 24.6182526], [56.2083722, 24.6182526], [56.2083722, 25.3686719], [54.8939725, 25.3686719]]]), attributes={})"
84,مع إجراءات كورونا الاحترازية… اتبع هذه النصائح لإنقاص وزنك  ,1348226466249465858,2021-01-10 11:13:33,0,0,"Place(_api=<tweepy.api.API object at 0x7f0ca5bdbcd0>, id='001907e868d06e24', url='https://api.twitter.com/1.1/geo/id/001907e868d06e24.json', place_type='admin', name='Dubai', full_name='Dubai, United Arab Emirates', country_code='AE', country='United Arab Emirates', contained_within=[], bounding_box=BoundingBox(_api=<tweepy.api.API object at 0x7f0ca5bdbcd0>, type='Polygon', coordinates=[[[54.8939725, 24.6182526], [56.2083722, 24.6182526], [56.2083722, 25.3686719], [54.8939725, 25.3686719]]]), attributes={})"
85,حاكم أم القيوين يتلقى الجرعة الأولى من لقاح كورونا  ,1348222079187906562,2021-01-10 10:56:07,1,0,"Place(_api=<tweepy.api.API object at 0x7f0ca5bdbcd0>, id='001907e868d06e24', url='https://api.twitter.com/1.1/geo/id/001907e868d06e24.json', place_type='admin', name='Dubai', full_name='Dubai, United Arab Emirates', country_code='AE', country='United Arab Emirates', contained_within=[], bounding_box=BoundingBox(_api=<tweepy.api.API object at 0x7f0ca5bdbcd0>, type='Polygon', coordinates=[[[54.8939725, 24.6182526], [56.2083722, 24.6182526], [56.2083722, 25.3686719], [54.8939725, 25.3686719]]]), attributes={})"
86, الأحداثُ تنتهي … وتبقى الدُروس والعِبر ...,1348215781776121856,2021-01-10 10:31:05,3,2,"Place(_api=<tweepy.api.API object at 0x7f0ca5bdbcd0>, id='001907e868d06e24', url='https://api.twitter.com/1.1/geo/id/001907e868d06e24.json', place_type='admin', name='Dubai', full_name='Dubai, United Arab Emirates', country_code='AE', country='United Arab Emirates', contained_within=[], bounding_box=BoundingBox(_api=<tweepy.api.API object at 0x7f0ca5bdbcd0>, type='Polygon', coordinates=[[[54.8939725, 24.6182526], [56.2083722, 24.6182526], [56.2083722, 25.3686719], [54.8939725, 25.3686719]]]), attributes={})"
87,مقارنة بين 3 لقاحات لفيروس كورونا  ,1348213507636908032,2021-01-10 10:22:03,0,0,"Place(_api=<tweepy.api.API object at 0x7f0ca5bdbcd0>, id='001907e868d06e24', url='https://api.twitter.com/1.1/geo/id/001907e868d06e24.json', place_type='admin', name='Dubai', full_name='Dubai, United Arab Emirates', country_code='AE', country='United Arab Emirates', contained_within=[], bounding_box=BoundingBox(_api=<tweepy.api.API object at 0x7f0ca5bdbcd0>, type='Polygon', coordinates=[[[54.8939725, 24.6182526], [56.2083722, 24.6182526], [56.2083722, 25.3686719], [54.8939725, 25.3686719]]]), attributes={})"
88,"“الصحة” تجري 171,951 فحصا ضمن خططها لتوسيع نطاق الفحوصات وتكشف عن 2,876 إصابة جديدة بفيروس كورونا المستجد و2,454 حالة شفاء و6 حالات وفاة خلال الساعات…  ",1348212512659935232,2021-01-10 10:18:06,0,0,"Place(_api=<tweepy.api.API object at 0x7f0ca5bdbcd0>, id='001907e868d06e24', url='https://api.twitter.com/1.1/geo/id/001907e868d06e24.json', place_type='admin', name='Dubai', full_name='Dubai, United Arab Emirates', country_code='AE', country='United Arab Emirates', contained_within=[], bounding_box=BoundingBox(_api=<tweepy.api.API object at 0x7f0ca5bdbcd0>, type='Polygon', coordinates=[[[54.8939725, 24.6182526], [56.2083722, 24.6182526], [56.2083722, 25.3686719], [54.8939725, 25.3686719]]]), attributes={})"
89,الإمارات تسجل 2876 إصابة جديدة بفيروس كورونا و2454 حالة شفاء  ,1348212508088127491,2021-01-10 10:18:05,0,0,"Place(_api=<tweepy.api.API object at 0x7f0ca5bdbcd0>, id='001907e868d06e24', url='https://api.twitter.com/1.1/geo/id/001907e868d06e24.json', place_type='admin', name='Dubai', full_name='Dubai, United Arab Emirates', country_code='AE', country='United Arab Emirates', contained_within=[], bounding_box=BoundingBox(_api=<tweepy.api.API object at 0x7f0ca5bdbcd0>, type='Polygon', coordinates=[[[54.8939725, 24.6182526], [56.2083722, 24.6182526], [56.2083722, 25.3686719], [54.8939725, 25.3686719]]]), attributes={})"
90,صحة دبي تتوسع في عملية تقديم لقاح كورونا وتؤكد مجانيته  ,1348208981072769024,2021-01-10 10:04:04,5,2,"Place(_api=<tweepy.api.API object at 0x7f0ca5bdbcd0>, id='001907e868d06e24', url='https://api.twitter.com/1.1/geo/id/001907e868d06e24.json', place_type='admin', name='Dubai', full_name='Dubai, United Arab Emirates', country_code='AE', country='United Arab Emirates', contained_within=[], bounding_box=BoundingBox(_api=<tweepy.api.API object at 0x7f0ca5bdbcd0>, type='Polygon', coordinates=[[[54.8939725, 24.6182526], [56.2083722, 24.6182526], [56.2083722, 25.3686719], [54.8939725, 25.3686719]]]), attributes={})"
91,هل شرب الماء بكثرة يفيد في الحماية من فيروس كورونا الجديد  ,1348208978061262848,2021-01-10 10:04:03,2,0,"Place(_api=<tweepy.api.API object at 0x7f0ca5bdbcd0>, id='001907e868d06e24', url='https://api.twitter.com/1.1/geo/id/001907e868d06e24.json', place_type='admin', name='Dubai', full_name='Dubai, United Arab Emirates', country_code='AE', country='United Arab Emirates', contained_within=[], bounding_box=BoundingBox(_api=<tweepy.api.API object at 0x7f0ca5bdbcd0>, type='Polygon', coordinates=[[[54.8939725, 24.6182526], [56.2083722, 24.6182526], [56.2083722, 25.3686719], [54.8939725, 25.3686719]]]), attributes={})"
92,مختصون : اللقاح بريق أمل وقفزة كبيرة للقضاء على كورونا  ,1348196026444730368,2021-01-10 09:12:35,0,0,"Place(_api=<tweepy.api.API object at 0x7f0ca5bdbcd0>, id='001907e868d06e24', url='https://api.twitter.com/1.1/geo/id/001907e868d06e24.json', place_type='admin', name='Dubai', full_name='Dubai, United Arab Emirates', country_code='AE', country='United Arab Emirates', contained_within=[], bounding_box=BoundingBox(_api=<tweepy.api.API object at 0x7f0ca5bdbcd0>, type='Polygon', coordinates=[[[54.8939725, 24.6182526], [56.2083722, 24.6182526], [56.2083722, 25.3686719], [54.8939725, 25.3686719]]]), attributes={})"
93,هل تعود حياة المتعافين من كورونا لما كانت عليه قبل إصابتهم؟  ,1348196016965738496,2021-01-10 09:12:33,0,0,"Place(_api=<tweepy.api.API object at 0x7f0ca5bdbcd0>, id='001907e868d06e24', url='https://api.twitter.com/1.1/geo/id/001907e868d06e24.json', place_type='admin', name='Dubai', full_name='Dubai, United Arab Emirates', country_code='AE', country='United Arab Emirates', contained_within=[], bounding_box=BoundingBox(_api=<tweepy.api.API object at 0x7f0ca5bdbcd0>, type='Polygon', coordinates=[[[54.8939725, 24.6182526], [56.2083722, 24.6182526], [56.2083722, 25.3686719], [54.8939725, 25.3686719]]]), attributes={})"
94,بريطانيا: إصابات كورونا تتجاوز 3 ملايين  ,1348191363410509824,2021-01-10 08:54:03,0,1,"Place(_api=<tweepy.api.API object at 0x7f0ca5bdbcd0>, id='001907e868d06e24', url='https://api.twitter.com/1.1/geo/id/001907e868d06e24.json', place_type='admin', name='Dubai', full_name='Dubai, United Arab Emirates', country_code='AE', country='United Arab Emirates', contained_within=[], bounding_box=BoundingBox(_api=<tweepy.api.API object at 0x7f0ca5bdbcd0>, type='Polygon', coordinates=[[[54.8939725, 24.6182526], [56.2083722, 24.6182526], [56.2083722, 25.3686719], [54.8939725, 25.3686719]]]), attributes={})"
95,إصابات كورونا تقترب من 90 مليوناً  ,1348173617863946241,2021-01-10 07:43:33,0,1,"Place(_api=<tweepy.api.API object at 0x7f0ca5bdbcd0>, id='001907e868d06e24', url='https://api.twitter.com/1.1/geo/id/001907e868d06e24.json', place_type='admin', name='Dubai', full_name='Dubai, United Arab Emirates', country_code='AE', country='United Arab Emirates', contained_within=[], bounding_box=BoundingBox(_api=<tweepy.api.API object at 0x7f0ca5bdbcd0>, type='Polygon', coordinates=[[[54.8939725, 24.6182526], [56.2083722, 24.6182526], [56.2083722, 25.3686719], [54.8939725, 25.3686719]]]), attributes={})"
96,هافانا (رويترز) - قالت كوبا التي يقودها الشيوعيون في وقت متأخر يوم الجمعة إنها وقعت اتفاقا مع إيران لنقل التكنولوجيا لمرشحها الأكثر تقدما للقاح فيروس كورونا وإجراء تجارب إكلينيكية في المرحلة الأخيرة من اللقاح في الجمهورية الإسلامية. ,1348148810023903233,2021-01-10 06:04:58,6,1,"Place(_api=<tweepy.api.API object at 0x7f0ca5bdbcd0>, id='001907e868d06e24', url='https://api.twitter.com/1.1/geo/id/001907e868d06e24.json', place_type='admin', name='Dubai', full_name='Dubai, United Arab Emirates', country_code='AE', country='United Arab Emirates', contained_within=[], bounding_box=BoundingBox(_api=<tweepy.api.API object at 0x7f0ca5bdbcd0>, type='Polygon', coordinates=[[[54.8939725, 24.6182526], [56.2083722, 24.6182526], [56.2083722, 25.3686719], [54.8939725, 25.3686719]]]), attributes={})"
97,"الإمارات: تطعيم 78,793 شخصاً باللقاح ضد كورونا في الساعات ا الماضية  ",1348133101214470144,2021-01-10 05:02:33,0,1,"Place(_api=<tweepy.api.API object at 0x7f0ca5bdbcd0>, id='001907e868d06e24', url='https://api.twitter.com/1.1/geo/id/001907e868d06e24.json', place_type='admin', name='Dubai', full_name='Dubai, United Arab Emirates', country_code='AE', country='United Arab Emirates', contained_within=[], bounding_box=BoundingBox(_api=<tweepy.api.API object at 0x7f0ca5bdbcd0>, type='Polygon', coordinates=[[[54.8939725, 24.6182526], [56.2083722, 24.6182526], [56.2083722, 25.3686719], [54.8939725, 25.3686719]]]), attributes={})"
98,المكسيك تسجل 1135 وفاة جديدة بفيروس كورونا  ,1348129074904928256,2021-01-10 04:46:33,0,1,"Place(_api=<tweepy.api.API object at 0x7f0ca5bdbcd0>, id='001907e868d06e24', url='https://api.twitter.com/1.1/geo/id/001907e868d06e24.json', place_type='admin', name='Dubai', full_name='Dubai, United Arab Emirates', country_code='AE', country='United Arab Emirates', contained_within=[], bounding_box=BoundingBox(_api=<tweepy.api.API object at 0x7f0ca5bdbcd0>, type='Polygon', coordinates=[[[54.8939725, 24.6182526], [56.2083722, 24.6182526], [56.2083722, 25.3686719], [54.8939725, 25.3686719]]]), attributes={})"
99,لقاح كورونا عن كورونا المتحور واللقاح.. الصحة العالمية تجيب عن أسئلة مح…  ,1348118629259177986,2021-01-10 04:05:02,0,1,"Place(_api=<tweepy.api.API object at 0x7f0ca5bdbcd0>, id='001907e868d06e24', url='https://api.twitter.com/1.1/geo/id/001907e868d06e24.json', place_type='admin', name='Dubai', full_name='Dubai, United Arab Emirates', country_code='AE', country='United Arab Emirates', contained_within=[], bounding_box=BoundingBox(_api=<tweepy.api.API object at 0x7f0ca5bdbcd0>, type='Polygon', coordinates=[[[54.8939725, 24.6182526], [56.2083722, 24.6182526], [56.2083722, 25.3686719], [54.8939725, 25.3686719]]]), attributes={})"
100,يمكن أن يخدع الاختبار ويراوغ.. تحذير من كورونا الجديد  ,1348110073013313537,2021-01-10 03:31:02,0,1,"Place(_api=<tweepy.api.API object at 0x7f0ca5bdbcd0>, id='001907e868d06e24', url='https://api.twitter.com/1.1/geo/id/001907e868d06e24.json', place_type='admin', name='Dubai', full_name='Dubai, United Arab Emirates', country_code='AE', country='United Arab Emirates', contained_within=[], bounding_box=BoundingBox(_api=<tweepy.api.API object at 0x7f0ca5bdbcd0>, type='Polygon', coordinates=[[[54.8939725, 24.6182526], [56.2083722, 24.6182526], [56.2083722, 25.3686719], [54.8939725, 25.3686719]]]), attributes={})"
101,«هبّة» اللقاحات المسمار الأخير في نعش «كورونا»  ,1348052218289610753,2021-01-09 23:41:09,0,0,"Place(_api=<tweepy.api.API object at 0x7f0ca5bdbcd0>, id='001907e868d06e24', url='https://api.twitter.com/1.1/geo/id/001907e868d06e24.json', place_type='admin', name='Dubai', full_name='Dubai, United Arab Emirates', country_code='AE', country='United Arab Emirates', contained_within=[], bounding_box=BoundingBox(_api=<tweepy.api.API object at 0x7f0ca5bdbcd0>, type='Polygon', coordinates=[[[54.8939725, 24.6182526], [56.2083722, 24.6182526], [56.2083722, 25.3686719], [54.8939725, 25.3686719]]]), attributes={})"
102,يمكن أن يخدع الاختبار ويرواغ.. تحذير من كورونا الجديد  ,1348051816496304128,2021-01-09 23:39:33,1,0,"Place(_api=<tweepy.api.API object at 0x7f0ca5bdbcd0>, id='001907e868d06e24', url='https://api.twitter.com/1.1/geo/id/001907e868d06e24.json', place_type='admin', name='Dubai', full_name='Dubai, United Arab Emirates', country_code='AE', country='United Arab Emirates', contained_within=[], bounding_box=BoundingBox(_api=<tweepy.api.API object at 0x7f0ca5bdbcd0>, type='Polygon', coordinates=[[[54.8939725, 24.6182526], [56.2083722, 24.6182526], [56.2083722, 25.3686719], [54.8939725, 25.3686719]]]), attributes={})"
103,وجه كورونا وكمل عليها والله .. يعني الواحد كان بيسافر وبيروح ويجي .. اهو بنحاول نعوض بالمكالمات الفيديو ,1348035225008410625,2021-01-09 22:33:37,0,0,"Place(_api=<tweepy.api.API object at 0x7f0ca5bdbcd0>, id='00ecb59b0dad186e', url='https://api.twitter.com/1.1/geo/id/00ecb59b0dad186e.json', place_type='admin', name='Sharjah', full_name='Sharjah, United Arab Emirates', country_code='AE', country='United Arab Emirates', contained_within=[], bounding_box=BoundingBox(_api=<tweepy.api.API object at 0x7f0ca5bdbcd0>, type='Polygon', coordinates=[[[55.0091271, 24.7328863], [56.3816989, 24.7328863], [56.3816989, 25.8997649], [55.0091271, 25.8997649]]]), attributes={})"
104,9 مراكز تقدّم لقاح «كورونا» في المنطقة الشرقية  ,1348032827225374721,2021-01-09 22:24:05,0,0,"Place(_api=<tweepy.api.API object at 0x7f0ca5bdbcd0>, id='001907e868d06e24', url='https://api.twitter.com/1.1/geo/id/001907e868d06e24.json', place_type='admin', name='Dubai', full_name='Dubai, United Arab Emirates', country_code='AE', country='United Arab Emirates', contained_within=[], bounding_box=BoundingBox(_api=<tweepy.api.API object at 0x7f0ca5bdbcd0>, type='Polygon', coordinates=[[[54.8939725, 24.6182526], [56.2083722, 24.6182526], [56.2083722, 25.3686719], [54.8939725, 25.3686719]]]), attributes={})"
105,مدارس خاصة: نتحوّل إلى التعليم عن بُعد حال وجود إصابات بـ «كورونا»  ,1348032814315229186,2021-01-09 22:24:02,0,0,"Place(_api=<tweepy.api.API object at 0x7f0ca5bdbcd0>, id='001907e868d06e24', url='https://api.twitter.com/1.1/geo/id/001907e868d06e24.json', place_type='admin', name='Dubai', full_name='Dubai, United Arab Emirates', country_code='AE', country='United Arab Emirates', contained_within=[], bounding_box=BoundingBox(_api=<tweepy.api.API object at 0x7f0ca5bdbcd0>, type='Polygon', coordinates=[[[54.8939725, 24.6182526], [56.2083722, 24.6182526], [56.2083722, 25.3686719], [54.8939725, 25.3686719]]]), attributes={})"
106,“الصحة”: قدمنا 78793 جرعة من لقاح كورونا بالـ24 ساعة الماضية  ,1348027924352356352,2021-01-09 22:04:36,1,0,"Place(_api=<tweepy.api.API object at 0x7f0ca5bdbcd0>, id='001907e868d06e24', url='https://api.twitter.com/1.1/geo/id/001907e868d06e24.json', place_type='admin', name='Dubai', full_name='Dubai, United Arab Emirates', country_code='AE', country='United Arab Emirates', contained_within=[], bounding_box=BoundingBox(_api=<tweepy.api.API object at 0x7f0ca5bdbcd0>, type='Polygon', coordinates=[[[54.8939725, 24.6182526], [56.2083722, 24.6182526], [56.2083722, 25.3686719], [54.8939725, 25.3686719]]]), attributes={})"
