,Tweets,id,date,likes,retweets,place
0,حجر معسل ,1379492130197008392,2021-04-06 17:52:08,0,0,"Place(_api=<tweepy.api.API object at 0x7f1d47d437f0>, id='001907e868d06e24', url='https://api.twitter.com/1.1/geo/id/001907e868d06e24.json', place_type='admin', name='Dubai', full_name='Dubai, United Arab Emirates', country_code='AE', country='United Arab Emirates', contained_within=[], bounding_box=BoundingBox(_api=<tweepy.api.API object at 0x7f1d47d437f0>, type='Polygon', coordinates=[[[54.8939725, 24.6182526], [56.2083722, 24.6182526], [56.2083722, 25.3686719], [54.8939725, 25.3686719]]]), attributes={})"
1,جائحة,1379484781197549571,2021-04-06 17:22:56,0,0,"Place(_api=<tweepy.api.API object at 0x7f1d47d437f0>, id='001907e868d06e24', url='https://api.twitter.com/1.1/geo/id/001907e868d06e24.json', place_type='admin', name='Dubai', full_name='Dubai, United Arab Emirates', country_code='AE', country='United Arab Emirates', contained_within=[], bounding_box=BoundingBox(_api=<tweepy.api.API object at 0x7f1d47d437f0>, type='Polygon', coordinates=[[[54.8939725, 24.6182526], [56.2083722, 24.6182526], [56.2083722, 25.3686719], [54.8939725, 25.3686719]]]), attributes={})"
2,أبوظبي تتصدر مدن العالم في الاستجابة لجائحة كورونا - البيان ,1379460033130336258,2021-04-06 15:44:35,17,3,"Place(_api=<tweepy.api.API object at 0x7f1d47d437f0>, id='001907e868d06e24', url='https://api.twitter.com/1.1/geo/id/001907e868d06e24.json', place_type='admin', name='Dubai', full_name='Dubai, United Arab Emirates', country_code='AE', country='United Arab Emirates', contained_within=[], bounding_box=BoundingBox(_api=<tweepy.api.API object at 0x7f1d47d437f0>, type='Polygon', coordinates=[[[54.8939725, 24.6182526], [56.2083722, 24.6182526], [56.2083722, 25.3686719], [54.8939725, 25.3686719]]]), attributes={})"
3,انزين قنابري توهم اعلنو فيه كورونا بيغيب وفوقهم ليفا ماشوف الصياح الا في العاصمه المدريديه,1379456262480494593,2021-04-06 15:29:36,0,0,"Place(_api=<tweepy.api.API object at 0x7f1d47d437f0>, id='00f24ae701a1207b', url='https://api.twitter.com/1.1/geo/id/00f24ae701a1207b.json', place_type='admin', name='Abu Dhabi', full_name='Abu Dhabi, United Arab Emirates', country_code='AE', country='United Arab Emirates', contained_within=[], bounding_box=BoundingBox(_api=<tweepy.api.API object at 0x7f1d47d437f0>, type='Polygon', coordinates=[[[51.2938738, 22.6261387], [56.0175464, 22.6261387], [56.0175464, 25.1639588], [51.2938738, 25.1639588]]]), attributes={})"
4,°° ~ كن جزءاً في توفير وجبة إفطار صائم لتقيم صلبه في الشهر الفضيل ، لتروي ظمأهم، وتفرح أطفالهم، وتعين كبارهم :  . . ,1379447674810691589,2021-04-06 14:55:29,5,3,"Place(_api=<tweepy.api.API object at 0x7f1d47d437f0>, id='00f24ae701a1207b', url='https://api.twitter.com/1.1/geo/id/00f24ae701a1207b.json', place_type='admin', name='Abu Dhabi', full_name='Abu Dhabi, United Arab Emirates', country_code='AE', country='United Arab Emirates', contained_within=[], bounding_box=BoundingBox(_api=<tweepy.api.API object at 0x7f1d47d437f0>, type='Polygon', coordinates=[[[51.2938738, 22.6261387], [56.0175464, 22.6261387], [56.0175464, 25.1639588], [51.2938738, 25.1639588]]]), attributes={})"
5,قائمة أفضل مدن العالم في مجابهة الوباء.. أبوظبي تتصدر ,1379437761044811783,2021-04-06 14:16:05,1,0,"Place(_api=<tweepy.api.API object at 0x7f1d47d437f0>, id='00f24ae701a1207b', url='https://api.twitter.com/1.1/geo/id/00f24ae701a1207b.json', place_type='admin', name='Abu Dhabi', full_name='Abu Dhabi, United Arab Emirates', country_code='AE', country='United Arab Emirates', contained_within=[], bounding_box=BoundingBox(_api=<tweepy.api.API object at 0x7f1d47d437f0>, type='Polygon', coordinates=[[[51.2938738, 22.6261387], [56.0175464, 22.6261387], [56.0175464, 25.1639588], [51.2938738, 25.1639588]]]), attributes={})"
6,مبروك ..  حصول إمارة على المركز الأول عالمياً في تصنيف المدن الأكثر أماناً من كوفيد 19 في عام 2021 ,1379409416596942852,2021-04-06 12:23:27,0,2,"Place(_api=<tweepy.api.API object at 0x7f1d47d437f0>, id='00f24ae701a1207b', url='https://api.twitter.com/1.1/geo/id/00f24ae701a1207b.json', place_type='admin', name='Abu Dhabi', full_name='Abu Dhabi, United Arab Emirates', country_code='AE', country='United Arab Emirates', contained_within=[], bounding_box=BoundingBox(_api=<tweepy.api.API object at 0x7f1d47d437f0>, type='Polygon', coordinates=[[[51.2938738, 22.6261387], [56.0175464, 22.6261387], [56.0175464, 25.1639588], [51.2938738, 25.1639588]]]), attributes={})"
7,راموس غياب فاران كورونا ، فرصة ليفربول كبيره ,1379397181166157831,2021-04-06 11:34:50,0,0,"Place(_api=<tweepy.api.API object at 0x7f1d47d437f0>, id='3f63906fc8aa5a7d', url='https://api.twitter.com/1.1/geo/id/3f63906fc8aa5a7d.json', place_type='country', name='United Arab Emirates', full_name='United Arab Emirates', country_code='AE', country='United Arab Emirates', contained_within=[], bounding_box=BoundingBox(_api=<tweepy.api.API object at 0x7f1d47d437f0>, type='Polygon', coordinates=[[[51.2938738, 22.6261387], [56.3816989, 22.6261387], [56.3816989, 26.2823697], [51.2938738, 26.2823697]]]), attributes={})"
8,يطلعون ويسوون كل شي بس يوم عليهم مخالفات تجديد الاقامة يقولون السبب كورونا   حطوا كل شي على كورونا ,1379348190365802497,2021-04-06 08:20:10,0,0,"Place(_api=<tweepy.api.API object at 0x7f1d47d437f0>, id='001907e868d06e24', url='https://api.twitter.com/1.1/geo/id/001907e868d06e24.json', place_type='admin', name='Dubai', full_name='Dubai, United Arab Emirates', country_code='AE', country='United Arab Emirates', contained_within=[], bounding_box=BoundingBox(_api=<tweepy.api.API object at 0x7f1d47d437f0>, type='Polygon', coordinates=[[[54.8939725, 24.6182526], [56.2083722, 24.6182526], [56.2083722, 25.3686719], [54.8939725, 25.3686719]]]), attributes={})"
9,"ماذا لو شامبليون فك رموز حجر رشيد غلط وان يكون معنى الكلام ده بالهيروغلوفي "" اللي تلمحوه في المعركه مرجحوه""  ",1379340776455471104,2021-04-06 07:50:42,0,0,"Place(_api=<tweepy.api.API object at 0x7f1d47d437f0>, id='001907e868d06e24', url='https://api.twitter.com/1.1/geo/id/001907e868d06e24.json', place_type='admin', name='Dubai', full_name='Dubai, United Arab Emirates', country_code='AE', country='United Arab Emirates', contained_within=[], bounding_box=BoundingBox(_api=<tweepy.api.API object at 0x7f1d47d437f0>, type='Polygon', coordinates=[[[54.8939725, 24.6182526], [56.2083722, 24.6182526], [56.2083722, 25.3686719], [54.8939725, 25.3686719]]]), attributes={})"
10,كورونا,1379319232748392450,2021-04-06 06:25:06,0,0,"Place(_api=<tweepy.api.API object at 0x7f1d47d437f0>, id='001907e868d06e24', url='https://api.twitter.com/1.1/geo/id/001907e868d06e24.json', place_type='admin', name='Dubai', full_name='Dubai, United Arab Emirates', country_code='AE', country='United Arab Emirates', contained_within=[], bounding_box=BoundingBox(_api=<tweepy.api.API object at 0x7f1d47d437f0>, type='Polygon', coordinates=[[[54.8939725, 24.6182526], [56.2083722, 24.6182526], [56.2083722, 25.3686719], [54.8939725, 25.3686719]]]), attributes={})"
11,بعد سنة كاملة من الاغلاق التام و منع السفر من و الى استراليا، سيتم السماح بالسفر الى نيوزيلاند. معلومة على الهامش: هناك آلاف من الاستراليين العالقين في الخارج و لم يُسمح لهم لهذه اللحظة بالعودة الى استراليا بسبب الاغلاق و منع السفر لاكثر من عام ,1379295668649537536,2021-04-06 04:51:28,5,0,"Place(_api=<tweepy.api.API object at 0x7f1d47d437f0>, id='001907e868d06e24', url='https://api.twitter.com/1.1/geo/id/001907e868d06e24.json', place_type='admin', name='Dubai', full_name='Dubai, United Arab Emirates', country_code='AE', country='United Arab Emirates', contained_within=[], bounding_box=BoundingBox(_api=<tweepy.api.API object at 0x7f1d47d437f0>, type='Polygon', coordinates=[[[54.8939725, 24.6182526], [56.2083722, 24.6182526], [56.2083722, 25.3686719], [54.8939725, 25.3686719]]]), attributes={})"
12,تيجي نعفر حجر معسل في حته بعيده,1379213333891588099,2021-04-05 23:24:18,1,0,"Place(_api=<tweepy.api.API object at 0x7f1d47d437f0>, id='001907e868d06e24', url='https://api.twitter.com/1.1/geo/id/001907e868d06e24.json', place_type='admin', name='Dubai', full_name='Dubai, United Arab Emirates', country_code='AE', country='United Arab Emirates', contained_within=[], bounding_box=BoundingBox(_api=<tweepy.api.API object at 0x7f1d47d437f0>, type='Polygon', coordinates=[[[54.8939725, 24.6182526], [56.2083722, 24.6182526], [56.2083722, 25.3686719], [54.8939725, 25.3686719]]]), attributes={})"
