,Tweets,id,date,likes,retweets,place
0,2404 إصابات جديدة بـ «كورونا»  ,1348754574581006336,2021-01-11 22:12:03,0,0,"Place(_api=<tweepy.api.API object at 0x7f0ca5bdbcd0>, id='001907e868d06e24', url='https://api.twitter.com/1.1/geo/id/001907e868d06e24.json', place_type='admin', name='Dubai', full_name='Dubai, United Arab Emirates', country_code='AE', country='United Arab Emirates', contained_within=[], bounding_box=BoundingBox(_api=<tweepy.api.API object at 0x7f0ca5bdbcd0>, type='Polygon', coordinates=[[[54.8939725, 24.6182526], [56.2083722, 24.6182526], [56.2083722, 25.3686719], [54.8939725, 25.3686719]]]), attributes={})"
1,الحمد لله تم اخذ تطعيم ,1348730606218338306,2021-01-11 20:36:49,1,1,"Place(_api=<tweepy.api.API object at 0x7f0ca5bdbcd0>, id='01bb72922e8454b4', url='https://api.twitter.com/1.1/geo/id/01bb72922e8454b4.json', place_type='admin', name='Fujairah', full_name='Fujairah, United Arab Emirates', country_code='AE', country='United Arab Emirates', contained_within=[], bounding_box=BoundingBox(_api=<tweepy.api.API object at 0x7f0ca5bdbcd0>, type='Polygon', coordinates=[[[55.9170692, 25.0871026], [56.3739998, 25.0871026], [56.3739998, 25.6625265], [55.9170692, 25.6625265]]]), attributes={})"
2,كورونا حبيبي روح افحص.,1348714875648946180,2021-01-11 19:34:18,0,0,"Place(_api=<tweepy.api.API object at 0x7f0ca5bdbcd0>, id='00f24ae701a1207b', url='https://api.twitter.com/1.1/geo/id/00f24ae701a1207b.json', place_type='admin', name='Abu Dhabi', full_name='Abu Dhabi, United Arab Emirates', country_code='AE', country='United Arab Emirates', contained_within=[], bounding_box=BoundingBox(_api=<tweepy.api.API object at 0x7f0ca5bdbcd0>, type='Polygon', coordinates=[[[51.2938738, 22.6261387], [56.0175464, 22.6261387], [56.0175464, 25.1639588], [51.2938738, 25.1639588]]]), attributes={})"
3,لبنان يعلن الطوارئ الصحية لمواجهة ارتفاع إصابات كورونا  ,1348701847779897345,2021-01-11 18:42:32,1,0,"Place(_api=<tweepy.api.API object at 0x7f0ca5bdbcd0>, id='001907e868d06e24', url='https://api.twitter.com/1.1/geo/id/001907e868d06e24.json', place_type='admin', name='Dubai', full_name='Dubai, United Arab Emirates', country_code='AE', country='United Arab Emirates', contained_within=[], bounding_box=BoundingBox(_api=<tweepy.api.API object at 0x7f0ca5bdbcd0>, type='Polygon', coordinates=[[[54.8939725, 24.6182526], [56.2083722, 24.6182526], [56.2083722, 25.3686719], [54.8939725, 25.3686719]]]), attributes={})"
4,كيف يفكني من كورونا,1348693853134606338,2021-01-11 18:10:46,0,0,"Place(_api=<tweepy.api.API object at 0x7f0ca5bdbcd0>, id='00f24ae701a1207b', url='https://api.twitter.com/1.1/geo/id/00f24ae701a1207b.json', place_type='admin', name='Abu Dhabi', full_name='Abu Dhabi, United Arab Emirates', country_code='AE', country='United Arab Emirates', contained_within=[], bounding_box=BoundingBox(_api=<tweepy.api.API object at 0x7f0ca5bdbcd0>, type='Polygon', coordinates=[[[51.2938738, 22.6261387], [56.0175464, 22.6261387], [56.0175464, 25.1639588], [51.2938738, 25.1639588]]]), attributes={})"
5,"صلاة الماضية تحت الثلوج الكثيفة المتساقطة في مدينة ساراتوف الروسية اللهم أعز الإسلام أعرف مجموعة لين الحين ماتصلي تخاف من وهم ما تركوا ""مول"" او مهرجان او حدث فيها تجمعات إلا وهم أول الناس فيها  ""وَاسْتعينوا بالصبر والصلاة وَإِنَّها لكبيرة إلا على الخاشعين"" ",1348683867096543238,2021-01-11 17:31:05,7,7,"Place(_api=<tweepy.api.API object at 0x7f0ca5bdbcd0>, id='00f24ae701a1207b', url='https://api.twitter.com/1.1/geo/id/00f24ae701a1207b.json', place_type='admin', name='Abu Dhabi', full_name='Abu Dhabi, United Arab Emirates', country_code='AE', country='United Arab Emirates', contained_within=[], bounding_box=BoundingBox(_api=<tweepy.api.API object at 0x7f0ca5bdbcd0>, type='Polygon', coordinates=[[[51.2938738, 22.6261387], [56.0175464, 22.6261387], [56.0175464, 25.1639588], [51.2938738, 25.1639588]]]), attributes={})"
6,"صحيفة سبق / ""بخاخ أنف"" يقتل ""كورونا"" قبل وصوله إلى الرئة.. والفاعلية 99,9% - عبر نبض ",1348681535411642369,2021-01-11 17:21:49,0,0,"Place(_api=<tweepy.api.API object at 0x7f0ca5bdbcd0>, id='001907e868d06e24', url='https://api.twitter.com/1.1/geo/id/001907e868d06e24.json', place_type='admin', name='Dubai', full_name='Dubai, United Arab Emirates', country_code='AE', country='United Arab Emirates', contained_within=[], bounding_box=BoundingBox(_api=<tweepy.api.API object at 0x7f0ca5bdbcd0>, type='Polygon', coordinates=[[[54.8939725, 24.6182526], [56.2083722, 24.6182526], [56.2083722, 25.3686719], [54.8939725, 25.3686719]]]), attributes={})"
7,الكويت تسجل 527 إصابة جديدة بـ “كورونا”  ,1348672160752050176,2021-01-11 16:44:34,0,0,"Place(_api=<tweepy.api.API object at 0x7f0ca5bdbcd0>, id='001907e868d06e24', url='https://api.twitter.com/1.1/geo/id/001907e868d06e24.json', place_type='admin', name='Dubai', full_name='Dubai, United Arab Emirates', country_code='AE', country='United Arab Emirates', contained_within=[], bounding_box=BoundingBox(_api=<tweepy.api.API object at 0x7f0ca5bdbcd0>, type='Polygon', coordinates=[[[54.8939725, 24.6182526], [56.2083722, 24.6182526], [56.2083722, 25.3686719], [54.8939725, 25.3686719]]]), attributes={})"
8,محمد بن زايد يبحث مع الرئيس العراقي مرحلة ما بعد “كورونا”  ,1348668766306004992,2021-01-11 16:31:05,1,0,"Place(_api=<tweepy.api.API object at 0x7f0ca5bdbcd0>, id='001907e868d06e24', url='https://api.twitter.com/1.1/geo/id/001907e868d06e24.json', place_type='admin', name='Dubai', full_name='Dubai, United Arab Emirates', country_code='AE', country='United Arab Emirates', contained_within=[], bounding_box=BoundingBox(_api=<tweepy.api.API object at 0x7f0ca5bdbcd0>, type='Polygon', coordinates=[[[54.8939725, 24.6182526], [56.2083722, 24.6182526], [56.2083722, 25.3686719], [54.8939725, 25.3686719]]]), attributes={})"
9,محمد بن زايد يبحث مع رئيس ليبيريا التنسيق الدولي لمواجهة “كورونا”  ,1348668761906139141,2021-01-11 16:31:04,3,2,"Place(_api=<tweepy.api.API object at 0x7f0ca5bdbcd0>, id='001907e868d06e24', url='https://api.twitter.com/1.1/geo/id/001907e868d06e24.json', place_type='admin', name='Dubai', full_name='Dubai, United Arab Emirates', country_code='AE', country='United Arab Emirates', contained_within=[], bounding_box=BoundingBox(_api=<tweepy.api.API object at 0x7f0ca5bdbcd0>, type='Polygon', coordinates=[[[54.8939725, 24.6182526], [56.2083722, 24.6182526], [56.2083722, 25.3686719], [54.8939725, 25.3686719]]]), attributes={})"
10,انتحار طبيبة طواريء بسبب زيادة الضغط النفسي والجسدي أثناء جائحة كورونا. رسالة إلى صناع القرار الذي يتخذون الطب كمكان لتحصيل الأموال حاله حال أي مركز تجاري: الطاقم الطبي يتعب وليسوا آلات لتحصيل الأموال  تأكدوا من حصولهم على وقت مخصص للراحة وانتبهوا لنفسياتهم ,1348666680910753795,2021-01-11 16:22:48,6,3,"Place(_api=<tweepy.api.API object at 0x7f0ca5bdbcd0>, id='00f24ae701a1207b', url='https://api.twitter.com/1.1/geo/id/00f24ae701a1207b.json', place_type='admin', name='Abu Dhabi', full_name='Abu Dhabi, United Arab Emirates', country_code='AE', country='United Arab Emirates', contained_within=[], bounding_box=BoundingBox(_api=<tweepy.api.API object at 0x7f0ca5bdbcd0>, type='Polygon', coordinates=[[[51.2938738, 22.6261387], [56.0175464, 22.6261387], [56.0175464, 25.1639588], [51.2938738, 25.1639588]]]), attributes={})"
11,ببلد متل لبنان كان لازم هيدي الحالة تعلن من سنة وقت ما تسجل اول حالة كورونا ,1348663831975886849,2021-01-11 16:11:29,2,0,"Place(_api=<tweepy.api.API object at 0x7f0ca5bdbcd0>, id='001907e868d06e24', url='https://api.twitter.com/1.1/geo/id/001907e868d06e24.json', place_type='admin', name='Dubai', full_name='Dubai, United Arab Emirates', country_code='AE', country='United Arab Emirates', contained_within=[], bounding_box=BoundingBox(_api=<tweepy.api.API object at 0x7f0ca5bdbcd0>, type='Polygon', coordinates=[[[54.8939725, 24.6182526], [56.2083722, 24.6182526], [56.2083722, 25.3686719], [54.8939725, 25.3686719]]]), attributes={})"
12,السعودية تسجل 140 إصابة جديدة بـ”كورونا” و4 حالات وفاة  ,1348658316415692803,2021-01-11 15:49:34,1,0,"Place(_api=<tweepy.api.API object at 0x7f0ca5bdbcd0>, id='001907e868d06e24', url='https://api.twitter.com/1.1/geo/id/001907e868d06e24.json', place_type='admin', name='Dubai', full_name='Dubai, United Arab Emirates', country_code='AE', country='United Arab Emirates', contained_within=[], bounding_box=BoundingBox(_api=<tweepy.api.API object at 0x7f0ca5bdbcd0>, type='Polygon', coordinates=[[[54.8939725, 24.6182526], [56.2083722, 24.6182526], [56.2083722, 25.3686719], [54.8939725, 25.3686719]]]), attributes={})"
13,حياكم الله اهلنا وعزوتنا في بلدكم البحرين جسر الملك فهد: إلغاء خدمة فحص فيروس كورونا PCR عند الوصول للجسر لجميع المسافرين القادمين إلى البحرين من مواطنين ومقيمين وزائرين,1348644591315116033,2021-01-11 14:55:01,4,3,"Place(_api=<tweepy.api.API object at 0x7f0ca5bdbcd0>, id='00f24ae701a1207b', url='https://api.twitter.com/1.1/geo/id/00f24ae701a1207b.json', place_type='admin', name='Abu Dhabi', full_name='Abu Dhabi, United Arab Emirates', country_code='AE', country='United Arab Emirates', contained_within=[], bounding_box=BoundingBox(_api=<tweepy.api.API object at 0x7f0ca5bdbcd0>, type='Polygon', coordinates=[[[51.2938738, 22.6261387], [56.0175464, 22.6261387], [56.0175464, 25.1639588], [51.2938738, 25.1639588]]]), attributes={})"
14,بعد عام من إعلان أول وفاة به في الصين.. وباء كورونا يتسارع عالمياً  ,1348628368623734784,2021-01-11 13:50:34,0,0,"Place(_api=<tweepy.api.API object at 0x7f0ca5bdbcd0>, id='001907e868d06e24', url='https://api.twitter.com/1.1/geo/id/001907e868d06e24.json', place_type='admin', name='Dubai', full_name='Dubai, United Arab Emirates', country_code='AE', country='United Arab Emirates', contained_within=[], bounding_box=BoundingBox(_api=<tweepy.api.API object at 0x7f0ca5bdbcd0>, type='Polygon', coordinates=[[[54.8939725, 24.6182526], [56.2083722, 24.6182526], [56.2083722, 25.3686719], [54.8939725, 25.3686719]]]), attributes={})"
15,من يمكنه الحصول على لقاح كورونا ومن لا يستطيع ذلك؟  ,1348622464541093889,2021-01-11 13:27:06,2,1,"Place(_api=<tweepy.api.API object at 0x7f0ca5bdbcd0>, id='001907e868d06e24', url='https://api.twitter.com/1.1/geo/id/001907e868d06e24.json', place_type='admin', name='Dubai', full_name='Dubai, United Arab Emirates', country_code='AE', country='United Arab Emirates', contained_within=[], bounding_box=BoundingBox(_api=<tweepy.api.API object at 0x7f0ca5bdbcd0>, type='Polygon', coordinates=[[[54.8939725, 24.6182526], [56.2083722, 24.6182526], [56.2083722, 25.3686719], [54.8939725, 25.3686719]]]), attributes={})"
16,"زيادة بمقدار ١٤،٠٠٠ جرعة في ال٢٤ ساعة الماضية . . ""الإمارات.. تقديم أكثر من 80 ألف جرعة من لقاح «كورونا» خلال الـ 24 ساعة الماضية""  ",1348618945419489282,2021-01-11 13:13:07,0,1,"Place(_api=<tweepy.api.API object at 0x7f0ca5bdbcd0>, id='001907e868d06e24', url='https://api.twitter.com/1.1/geo/id/001907e868d06e24.json', place_type='admin', name='Dubai', full_name='Dubai, United Arab Emirates', country_code='AE', country='United Arab Emirates', contained_within=[], bounding_box=BoundingBox(_api=<tweepy.api.API object at 0x7f0ca5bdbcd0>, type='Polygon', coordinates=[[[54.8939725, 24.6182526], [56.2083722, 24.6182526], [56.2083722, 25.3686719], [54.8939725, 25.3686719]]]), attributes={})"
17,الإمارات: أكثر من 133 ألف فحص تكشف 2404 إصابات جديدة بـ«كورونا» و2252 حالة شفاء و3 وفيات ,1348617591397502979,2021-01-11 13:07:44,12,1,"Place(_api=<tweepy.api.API object at 0x7f0ca5bdbcd0>, id='001907e868d06e24', url='https://api.twitter.com/1.1/geo/id/001907e868d06e24.json', place_type='admin', name='Dubai', full_name='Dubai, United Arab Emirates', country_code='AE', country='United Arab Emirates', contained_within=[], bounding_box=BoundingBox(_api=<tweepy.api.API object at 0x7f0ca5bdbcd0>, type='Polygon', coordinates=[[[54.8939725, 24.6182526], [56.2083722, 24.6182526], [56.2083722, 25.3686719], [54.8939725, 25.3686719]]]), attributes={})"
18,قائد شرطة رأس الخيمة يتلقى الجرعة الأولى من لقاح كورونا  ,1348617570346143750,2021-01-11 13:07:39,0,0,"Place(_api=<tweepy.api.API object at 0x7f0ca5bdbcd0>, id='001907e868d06e24', url='https://api.twitter.com/1.1/geo/id/001907e868d06e24.json', place_type='admin', name='Dubai', full_name='Dubai, United Arab Emirates', country_code='AE', country='United Arab Emirates', contained_within=[], bounding_box=BoundingBox(_api=<tweepy.api.API object at 0x7f0ca5bdbcd0>, type='Polygon', coordinates=[[[54.8939725, 24.6182526], [56.2083722, 24.6182526], [56.2083722, 25.3686719], [54.8939725, 25.3686719]]]), attributes={})"
19,تقديم 80 ألف جرعة من لقاح كورونا خلال الـ24 ساعة الماضية  ,1348617549664059395,2021-01-11 13:07:34,2,0,"Place(_api=<tweepy.api.API object at 0x7f0ca5bdbcd0>, id='001907e868d06e24', url='https://api.twitter.com/1.1/geo/id/001907e868d06e24.json', place_type='admin', name='Dubai', full_name='Dubai, United Arab Emirates', country_code='AE', country='United Arab Emirates', contained_within=[], bounding_box=BoundingBox(_api=<tweepy.api.API object at 0x7f0ca5bdbcd0>, type='Polygon', coordinates=[[[54.8939725, 24.6182526], [56.2083722, 24.6182526], [56.2083722, 25.3686719], [54.8939725, 25.3686719]]]), attributes={})"
20,الإمارات.. تقديم أكثر من 80 ألف جرعة من لقاح «كورونا» خلال الـ 24 ساعة الماضية ,1348617545805410312,2021-01-11 13:07:33,19,0,"Place(_api=<tweepy.api.API object at 0x7f0ca5bdbcd0>, id='001907e868d06e24', url='https://api.twitter.com/1.1/geo/id/001907e868d06e24.json', place_type='admin', name='Dubai', full_name='Dubai, United Arab Emirates', country_code='AE', country='United Arab Emirates', contained_within=[], bounding_box=BoundingBox(_api=<tweepy.api.API object at 0x7f0ca5bdbcd0>, type='Polygon', coordinates=[[[54.8939725, 24.6182526], [56.2083722, 24.6182526], [56.2083722, 25.3686719], [54.8939725, 25.3686719]]]), attributes={})"
21,إحراءات حظر مشددة في ألمانيا لتطويق تفشي “كورونا”  ,1348614302534569985,2021-01-11 12:54:40,1,1,"Place(_api=<tweepy.api.API object at 0x7f0ca5bdbcd0>, id='001907e868d06e24', url='https://api.twitter.com/1.1/geo/id/001907e868d06e24.json', place_type='admin', name='Dubai', full_name='Dubai, United Arab Emirates', country_code='AE', country='United Arab Emirates', contained_within=[], bounding_box=BoundingBox(_api=<tweepy.api.API object at 0x7f0ca5bdbcd0>, type='Polygon', coordinates=[[[54.8939725, 24.6182526], [56.2083722, 24.6182526], [56.2083722, 25.3686719], [54.8939725, 25.3686719]]]), attributes={})"
22,تسجيل 12 وفاة و928 إصابة جديدة بـ” كورونا” في فلسطين  ,1348614299112009730,2021-01-11 12:54:39,0,0,"Place(_api=<tweepy.api.API object at 0x7f0ca5bdbcd0>, id='001907e868d06e24', url='https://api.twitter.com/1.1/geo/id/001907e868d06e24.json', place_type='admin', name='Dubai', full_name='Dubai, United Arab Emirates', country_code='AE', country='United Arab Emirates', contained_within=[], bounding_box=BoundingBox(_api=<tweepy.api.API object at 0x7f0ca5bdbcd0>, type='Polygon', coordinates=[[[54.8939725, 24.6182526], [56.2083722, 24.6182526], [56.2083722, 25.3686719], [54.8939725, 25.3686719]]]), attributes={})"
23,عام على أول وفاة بفيروس كورونا في ووهان..المدينة الأكثر أماناً الآن في العالم  ,1348614279952404480,2021-01-11 12:54:35,0,0,"Place(_api=<tweepy.api.API object at 0x7f0ca5bdbcd0>, id='001907e868d06e24', url='https://api.twitter.com/1.1/geo/id/001907e868d06e24.json', place_type='admin', name='Dubai', full_name='Dubai, United Arab Emirates', country_code='AE', country='United Arab Emirates', contained_within=[], bounding_box=BoundingBox(_api=<tweepy.api.API object at 0x7f0ca5bdbcd0>, type='Polygon', coordinates=[[[54.8939725, 24.6182526], [56.2083722, 24.6182526], [56.2083722, 25.3686719], [54.8939725, 25.3686719]]]), attributes={})"
24,ما حقيقة العلاقة بين نسبة فيتامين د في الجسم و وفيات فيروس كورونا الجديد  ,1348614276991250433,2021-01-11 12:54:34,0,0,"Place(_api=<tweepy.api.API object at 0x7f0ca5bdbcd0>, id='001907e868d06e24', url='https://api.twitter.com/1.1/geo/id/001907e868d06e24.json', place_type='admin', name='Dubai', full_name='Dubai, United Arab Emirates', country_code='AE', country='United Arab Emirates', contained_within=[], bounding_box=BoundingBox(_api=<tweepy.api.API object at 0x7f0ca5bdbcd0>, type='Polygon', coordinates=[[[54.8939725, 24.6182526], [56.2083722, 24.6182526], [56.2083722, 25.3686719], [54.8939725, 25.3686719]]]), attributes={})"
25,كيف يحمي مرضى السرطان أنفسهم من كورونا وما أهمية ذلك؟  ,1348614273803587587,2021-01-11 12:54:33,0,0,"Place(_api=<tweepy.api.API object at 0x7f0ca5bdbcd0>, id='001907e868d06e24', url='https://api.twitter.com/1.1/geo/id/001907e868d06e24.json', place_type='admin', name='Dubai', full_name='Dubai, United Arab Emirates', country_code='AE', country='United Arab Emirates', contained_within=[], bounding_box=BoundingBox(_api=<tweepy.api.API object at 0x7f0ca5bdbcd0>, type='Polygon', coordinates=[[[54.8939725, 24.6182526], [56.2083722, 24.6182526], [56.2083722, 25.3686719], [54.8939725, 25.3686719]]]), attributes={})"
26,بكرة ان شاء الله هاخد ماما واوديها تطعم ضد كورونا .. من دلوقتي متوترة جدا وقلبي بيدق بسرعه وحاسة بضغط  بابا سلمته تسليم أهالي من غير اي قلق .. بس ماما لا حاسة بحالة توتر مش طبيعية .. يارب يحميها في ودائعه ويعديها على خير .. مهما حصل التطعيم هيكون اهون بكتير من الاصابه بالفيروس,1348612548925521920,2021-01-11 12:47:42,0,1,"Place(_api=<tweepy.api.API object at 0x7f0ca5bdbcd0>, id='00ecb59b0dad186e', url='https://api.twitter.com/1.1/geo/id/00ecb59b0dad186e.json', place_type='admin', name='Sharjah', full_name='Sharjah, United Arab Emirates', country_code='AE', country='United Arab Emirates', contained_within=[], bounding_box=BoundingBox(_api=<tweepy.api.API object at 0x7f0ca5bdbcd0>, type='Polygon', coordinates=[[[55.0091271, 24.7328863], [56.3816989, 24.7328863], [56.3816989, 25.8997649], [55.0091271, 25.8997649]]]), attributes={})"
27,الصحة تعلن تقديم 80683 جرعة لقاح كورونا خلال الـ 24 ساعة الماضية  ,1348611001407528961,2021-01-11 12:41:33,0,0,"Place(_api=<tweepy.api.API object at 0x7f0ca5bdbcd0>, id='001907e868d06e24', url='https://api.twitter.com/1.1/geo/id/001907e868d06e24.json', place_type='admin', name='Dubai', full_name='Dubai, United Arab Emirates', country_code='AE', country='United Arab Emirates', contained_within=[], bounding_box=BoundingBox(_api=<tweepy.api.API object at 0x7f0ca5bdbcd0>, type='Polygon', coordinates=[[[54.8939725, 24.6182526], [56.2083722, 24.6182526], [56.2083722, 25.3686719], [54.8939725, 25.3686719]]]), attributes={})"
28,مسؤولون يتلقون الجرعات الأولى من اللقاح المضاد لـ كورونا بأم القيوين ورأس الخيمة  ,1348607732941615106,2021-01-11 12:28:34,0,0,"Place(_api=<tweepy.api.API object at 0x7f0ca5bdbcd0>, id='001907e868d06e24', url='https://api.twitter.com/1.1/geo/id/001907e868d06e24.json', place_type='admin', name='Dubai', full_name='Dubai, United Arab Emirates', country_code='AE', country='United Arab Emirates', contained_within=[], bounding_box=BoundingBox(_api=<tweepy.api.API object at 0x7f0ca5bdbcd0>, type='Polygon', coordinates=[[[54.8939725, 24.6182526], [56.2083722, 24.6182526], [56.2083722, 25.3686719], [54.8939725, 25.3686719]]]), attributes={})"
29,انخفاض ملحوظ في الإصابات بأمراض معدية بخلاف كورونا في ألمانيا  ,1348600821580132352,2021-01-11 12:01:06,0,0,"Place(_api=<tweepy.api.API object at 0x7f0ca5bdbcd0>, id='001907e868d06e24', url='https://api.twitter.com/1.1/geo/id/001907e868d06e24.json', place_type='admin', name='Dubai', full_name='Dubai, United Arab Emirates', country_code='AE', country='United Arab Emirates', contained_within=[], bounding_box=BoundingBox(_api=<tweepy.api.API object at 0x7f0ca5bdbcd0>, type='Polygon', coordinates=[[[54.8939725, 24.6182526], [56.2083722, 24.6182526], [56.2083722, 25.3686719], [54.8939725, 25.3686719]]]), attributes={})"
30,هو للاسف كورونا يعتبر فيروس مجهول لحد دلوقتي .. واحنا بنوصف ادوية بس عشان نعالج اعراضه المعروفة .. محدش لسه عارف حاجه حتى الادوية بيحصل فيه تبديل وحاجات كتير .. منا فاهمه انك بتفكري بصوت عالي  بالعكس كويس ان الناس بتدور وتحلل وتفكر لسلامتها بدل الاستهتار .. ربنا يعافينا,1348599119011577858,2021-01-11 11:54:20,0,0,"Place(_api=<tweepy.api.API object at 0x7f0ca5bdbcd0>, id='00ecb59b0dad186e', url='https://api.twitter.com/1.1/geo/id/00ecb59b0dad186e.json', place_type='admin', name='Sharjah', full_name='Sharjah, United Arab Emirates', country_code='AE', country='United Arab Emirates', contained_within=[], bounding_box=BoundingBox(_api=<tweepy.api.API object at 0x7f0ca5bdbcd0>, type='Polygon', coordinates=[[[55.0091271, 24.7328863], [56.3816989, 24.7328863], [56.3816989, 25.8997649], [55.0091271, 25.8997649]]]), attributes={})"
31,لا مش صح .. ١) فيه ناس رجع لهم بعد ٣ اسابيع .. وفيه ناس بعد ٦ شهور ٢) الجلطة لا يمكن تتعالج منزليا لازم تدخلي طبي فورا ٣) كلامك صح المرة التانية بتكون اصعب والتالته اصعب واصعب .. لان كورونا بيسيب الجسم منهك اصلا ٤) الحالة الوحيدة اللي تخفف من اعراض كورونا هو اللقاح ,1348597511041273859,2021-01-11 11:47:57,1,0,"Place(_api=<tweepy.api.API object at 0x7f0ca5bdbcd0>, id='00ecb59b0dad186e', url='https://api.twitter.com/1.1/geo/id/00ecb59b0dad186e.json', place_type='admin', name='Sharjah', full_name='Sharjah, United Arab Emirates', country_code='AE', country='United Arab Emirates', contained_within=[], bounding_box=BoundingBox(_api=<tweepy.api.API object at 0x7f0ca5bdbcd0>, type='Polygon', coordinates=[[[55.0091271, 24.7328863], [56.3816989, 24.7328863], [56.3816989, 25.8997649], [55.0091271, 25.8997649]]]), attributes={})"
32,قبل كورونا : كنت متمردة ومش عاجبني الحال المايل بعد كورونا : الحمدلله اللي اكرمني وسترني أنا واهلي من المرض وحفظ مصدر رزقنا الشغل نعمة أيا يكن هو ايه سواء حكومي ولا خاص واعمال حرة .. مهما كان الحمدلله اننا مستوريين وقوت يومنا موجود ,1348593645155463169,2021-01-11 11:32:35,0,1,"Place(_api=<tweepy.api.API object at 0x7f0ca5bdbcd0>, id='00ecb59b0dad186e', url='https://api.twitter.com/1.1/geo/id/00ecb59b0dad186e.json', place_type='admin', name='Sharjah', full_name='Sharjah, United Arab Emirates', country_code='AE', country='United Arab Emirates', contained_within=[], bounding_box=BoundingBox(_api=<tweepy.api.API object at 0x7f0ca5bdbcd0>, type='Polygon', coordinates=[[[55.0091271, 24.7328863], [56.3816989, 24.7328863], [56.3816989, 25.8997649], [55.0091271, 25.8997649]]]), attributes={})"
33,"“الصحة” تجري 133,458 فحصا ضمن خططها لتوسيع نطاق الفحوصات وتكشف عن 2,404 إصابات جديدة بفيروس كورونا المستجد و 2,252 حالة شفاء و3 حالات وفاة خلال الساعا…  ",1348585839060684800,2021-01-11 11:01:34,0,0,"Place(_api=<tweepy.api.API object at 0x7f0ca5bdbcd0>, id='001907e868d06e24', url='https://api.twitter.com/1.1/geo/id/001907e868d06e24.json', place_type='admin', name='Dubai', full_name='Dubai, United Arab Emirates', country_code='AE', country='United Arab Emirates', contained_within=[], bounding_box=BoundingBox(_api=<tweepy.api.API object at 0x7f0ca5bdbcd0>, type='Polygon', coordinates=[[[54.8939725, 24.6182526], [56.2083722, 24.6182526], [56.2083722, 25.3686719], [54.8939725, 25.3686719]]]), attributes={})"
