,Tweets,id,date,likes,retweets,place
108,ما هي اعراض طفرتي المملكة المتحدة والبرازيل لفيروس كورونا؟  ,1366741112329674761,2021-03-02 13:24:08,0,1,"Place(_api=<tweepy.api.API object at 0x7f42f4d1bcd0>, id='001907e868d06e24', url='https://api.twitter.com/1.1/geo/id/001907e868d06e24.json', place_type='admin', name='Dubai', full_name='Dubai, United Arab Emirates', country_code='AE', country='United Arab Emirates', contained_within=[], bounding_box=BoundingBox(_api=<tweepy.api.API object at 0x7f42f4d1bcd0>, type='Polygon', coordinates=[[[54.8939725, 24.6182526], [56.2083722, 24.6182526], [56.2083722, 25.3686719], [54.8939725, 25.3686719]]]), attributes={})"
109,لقاح كورونا أقل فعالية لدى الأشخاص المصابين بالسمنة  ,1366741095724445700,2021-03-02 13:24:04,1,2,"Place(_api=<tweepy.api.API object at 0x7f42f4d1bcd0>, id='001907e868d06e24', url='https://api.twitter.com/1.1/geo/id/001907e868d06e24.json', place_type='admin', name='Dubai', full_name='Dubai, United Arab Emirates', country_code='AE', country='United Arab Emirates', contained_within=[], bounding_box=BoundingBox(_api=<tweepy.api.API object at 0x7f42f4d1bcd0>, type='Polygon', coordinates=[[[54.8939725, 24.6182526], [56.2083722, 24.6182526], [56.2083722, 25.3686719], [54.8939725, 25.3686719]]]), attributes={})"
110,إلزام مؤسسات محددة بإجراء فحص “كورونا” أسبوعيا في عجمان  ,1366732916240179201,2021-03-02 12:51:34,2,1,"Place(_api=<tweepy.api.API object at 0x7f42f4d1bcd0>, id='001907e868d06e24', url='https://api.twitter.com/1.1/geo/id/001907e868d06e24.json', place_type='admin', name='Dubai', full_name='Dubai, United Arab Emirates', country_code='AE', country='United Arab Emirates', contained_within=[], bounding_box=BoundingBox(_api=<tweepy.api.API object at 0x7f42f4d1bcd0>, type='Polygon', coordinates=[[[54.8939725, 24.6182526], [56.2083722, 24.6182526], [56.2083722, 25.3686719], [54.8939725, 25.3686719]]]), attributes={})"
111,هل يمكن أن ينتشر كورونا من لحوم الحيوانات البرية المجمدة؟  ,1366722720046538753,2021-03-02 12:11:03,0,1,"Place(_api=<tweepy.api.API object at 0x7f42f4d1bcd0>, id='001907e868d06e24', url='https://api.twitter.com/1.1/geo/id/001907e868d06e24.json', place_type='admin', name='Dubai', full_name='Dubai, United Arab Emirates', country_code='AE', country='United Arab Emirates', contained_within=[], bounding_box=BoundingBox(_api=<tweepy.api.API object at 0x7f42f4d1bcd0>, type='Polygon', coordinates=[[[54.8939725, 24.6182526], [56.2083722, 24.6182526], [56.2083722, 25.3686719], [54.8939725, 25.3686719]]]), attributes={})"
112,العراق يبدأ التطعيم ضد كورونا في بغداد  ,1366712787750191105,2021-03-02 11:31:35,0,0,"Place(_api=<tweepy.api.API object at 0x7f42f4d1bcd0>, id='001907e868d06e24', url='https://api.twitter.com/1.1/geo/id/001907e868d06e24.json', place_type='admin', name='Dubai', full_name='Dubai, United Arab Emirates', country_code='AE', country='United Arab Emirates', contained_within=[], bounding_box=BoundingBox(_api=<tweepy.api.API object at 0x7f42f4d1bcd0>, type='Polygon', coordinates=[[[54.8939725, 24.6182526], [56.2083722, 24.6182526], [56.2083722, 25.3686719], [54.8939725, 25.3686719]]]), attributes={})"
113,دراسة: السلالة البرازيلية لفيروس كورونا قادرة على التهرب من جهاز المناعة  ,1366712407964348418,2021-03-02 11:30:05,1,0,"Place(_api=<tweepy.api.API object at 0x7f42f4d1bcd0>, id='001907e868d06e24', url='https://api.twitter.com/1.1/geo/id/001907e868d06e24.json', place_type='admin', name='Dubai', full_name='Dubai, United Arab Emirates', country_code='AE', country='United Arab Emirates', contained_within=[], bounding_box=BoundingBox(_api=<tweepy.api.API object at 0x7f42f4d1bcd0>, type='Polygon', coordinates=[[[54.8939725, 24.6182526], [56.2083722, 24.6182526], [56.2083722, 25.3686719], [54.8939725, 25.3686719]]]), attributes={})"
114,"“الصحة” تجري 225,159 فحصا ضمن خططها لتوسيع نطاق الفحوصات وتكشف عن2,721 إصابة جديدة بفيروس كورونا المستجد و1,666حالة شفاء و15 حالة وفاة خلال الساعات ا…  ",1366705389367009280,2021-03-02 11:02:11,0,0,"Place(_api=<tweepy.api.API object at 0x7f42f4d1bcd0>, id='001907e868d06e24', url='https://api.twitter.com/1.1/geo/id/001907e868d06e24.json', place_type='admin', name='Dubai', full_name='Dubai, United Arab Emirates', country_code='AE', country='United Arab Emirates', contained_within=[], bounding_box=BoundingBox(_api=<tweepy.api.API object at 0x7f42f4d1bcd0>, type='Polygon', coordinates=[[[54.8939725, 24.6182526], [56.2083722, 24.6182526], [56.2083722, 25.3686719], [54.8939725, 25.3686719]]]), attributes={})"
115,عجمان تلزم هذه المؤسسات بإجراء فحص كورونا أسبوعياً  ,1366705368844308480,2021-03-02 11:02:06,1,0,"Place(_api=<tweepy.api.API object at 0x7f42f4d1bcd0>, id='001907e868d06e24', url='https://api.twitter.com/1.1/geo/id/001907e868d06e24.json', place_type='admin', name='Dubai', full_name='Dubai, United Arab Emirates', country_code='AE', country='United Arab Emirates', contained_within=[], bounding_box=BoundingBox(_api=<tweepy.api.API object at 0x7f42f4d1bcd0>, type='Polygon', coordinates=[[[54.8939725, 24.6182526], [56.2083722, 24.6182526], [56.2083722, 25.3686719], [54.8939725, 25.3686719]]]), attributes={})"
116,“الصحة”: 2721 إصابة جديدة بـ “كورونا المستجد”  ,1366696821762887680,2021-03-02 10:28:08,1,0,"Place(_api=<tweepy.api.API object at 0x7f42f4d1bcd0>, id='001907e868d06e24', url='https://api.twitter.com/1.1/geo/id/001907e868d06e24.json', place_type='admin', name='Dubai', full_name='Dubai, United Arab Emirates', country_code='AE', country='United Arab Emirates', contained_within=[], bounding_box=BoundingBox(_api=<tweepy.api.API object at 0x7f42f4d1bcd0>, type='Polygon', coordinates=[[[54.8939725, 24.6182526], [56.2083722, 24.6182526], [56.2083722, 25.3686719], [54.8939725, 25.3686719]]]), attributes={})"
117,الإمارات تسجل 2721 إصابة جديدة بـفيروس كورونا و1666 حالة شفاء  ,1366696811952410625,2021-03-02 10:28:06,2,0,"Place(_api=<tweepy.api.API object at 0x7f42f4d1bcd0>, id='001907e868d06e24', url='https://api.twitter.com/1.1/geo/id/001907e868d06e24.json', place_type='admin', name='Dubai', full_name='Dubai, United Arab Emirates', country_code='AE', country='United Arab Emirates', contained_within=[], bounding_box=BoundingBox(_api=<tweepy.api.API object at 0x7f42f4d1bcd0>, type='Polygon', coordinates=[[[54.8939725, 24.6182526], [56.2083722, 24.6182526], [56.2083722, 25.3686719], [54.8939725, 25.3686719]]]), attributes={})"
118,توزيع 21.1 مليون جرعة لقاح ضد كورونا في بريطانيا  ,1366695793525026817,2021-03-02 10:24:03,1,0,"Place(_api=<tweepy.api.API object at 0x7f42f4d1bcd0>, id='001907e868d06e24', url='https://api.twitter.com/1.1/geo/id/001907e868d06e24.json', place_type='admin', name='Dubai', full_name='Dubai, United Arab Emirates', country_code='AE', country='United Arab Emirates', contained_within=[], bounding_box=BoundingBox(_api=<tweepy.api.API object at 0x7f42f4d1bcd0>, type='Polygon', coordinates=[[[54.8939725, 24.6182526], [56.2083722, 24.6182526], [56.2083722, 25.3686719], [54.8939725, 25.3686719]]]), attributes={})"
119,الحمدالله لله تم شفائي من فيروس  كورونا بعد ١٤ يوم معاناة اللهم لك الحمد و الشكر,1366694451981279233,2021-03-02 10:18:43,1,0,"Place(_api=<tweepy.api.API object at 0x7f42f4d1bcd0>, id='01b984d319b42814', url='https://api.twitter.com/1.1/geo/id/01b984d319b42814.json', place_type='admin', name='Ras Al Khaimah', full_name='Ras Al Khaimah, United Arab Emirates', country_code='AE', country='United Arab Emirates', contained_within=[], bounding_box=BoundingBox(_api=<tweepy.api.API object at 0x7f42f4d1bcd0>, type='Polygon', coordinates=[[[55.7414877, 24.8517657], [56.3489937, 24.8517657], [56.3489937, 26.0841599], [55.7414877, 26.0841599]]]), attributes={})"
120,"واصلتني نتيجة فحص كورونا امس الظهر ,, ولين الحين مانزلت فالحصن مع ان فاحص ف عيادة حكوميه",1366682570008707073,2021-03-02 09:31:31,0,0,"Place(_api=<tweepy.api.API object at 0x7f42f4d1bcd0>, id='00f24ae701a1207b', url='https://api.twitter.com/1.1/geo/id/00f24ae701a1207b.json', place_type='admin', name='Abu Dhabi', full_name='Abu Dhabi, United Arab Emirates', country_code='AE', country='United Arab Emirates', contained_within=[], bounding_box=BoundingBox(_api=<tweepy.api.API object at 0x7f42f4d1bcd0>, type='Polygon', coordinates=[[[51.2938738, 22.6261387], [56.0175464, 22.6261387], [56.0175464, 25.1639588], [51.2938738, 25.1639588]]]), attributes={})"
121,توزيع 6.17 ملايين جرعة من اللقاحات ضد كورونا في ألمانيا  ,1366680958250872832,2021-03-02 09:25:06,0,0,"Place(_api=<tweepy.api.API object at 0x7f42f4d1bcd0>, id='001907e868d06e24', url='https://api.twitter.com/1.1/geo/id/001907e868d06e24.json', place_type='admin', name='Dubai', full_name='Dubai, United Arab Emirates', country_code='AE', country='United Arab Emirates', contained_within=[], bounding_box=BoundingBox(_api=<tweepy.api.API object at 0x7f42f4d1bcd0>, type='Polygon', coordinates=[[[54.8939725, 24.6182526], [56.2083722, 24.6182526], [56.2083722, 25.3686719], [54.8939725, 25.3686719]]]), attributes={})"
122,“بلدية دبي” تغلق 6 مؤسسات وتخالف 7 لم تلتزم بتدابير “كورونا”  ,1366678808414146560,2021-03-02 09:16:34,0,0,"Place(_api=<tweepy.api.API object at 0x7f42f4d1bcd0>, id='001907e868d06e24', url='https://api.twitter.com/1.1/geo/id/001907e868d06e24.json', place_type='admin', name='Dubai', full_name='Dubai, United Arab Emirates', country_code='AE', country='United Arab Emirates', contained_within=[], bounding_box=BoundingBox(_api=<tweepy.api.API object at 0x7f42f4d1bcd0>, type='Polygon', coordinates=[[[54.8939725, 24.6182526], [56.2083722, 24.6182526], [56.2083722, 25.3686719], [54.8939725, 25.3686719]]]), attributes={})"
123,بلدية دبي” تغلق 6 مؤسسات خالف إجراءات مواجهة “كورونا”  ,1366672148899667970,2021-03-02 08:50:06,1,0,"Place(_api=<tweepy.api.API object at 0x7f42f4d1bcd0>, id='001907e868d06e24', url='https://api.twitter.com/1.1/geo/id/001907e868d06e24.json', place_type='admin', name='Dubai', full_name='Dubai, United Arab Emirates', country_code='AE', country='United Arab Emirates', contained_within=[], bounding_box=BoundingBox(_api=<tweepy.api.API object at 0x7f42f4d1bcd0>, type='Polygon', coordinates=[[[54.8939725, 24.6182526], [56.2083722, 24.6182526], [56.2083722, 25.3686719], [54.8939725, 25.3686719]]]), attributes={})"
124,اخر شي خليتها قالو بتعمل  هسي بقت كده؟؟ دكوة ولا كورونا دي بتطور براها ,1366671548929564672,2021-03-02 08:47:43,3,0,"Place(_api=<tweepy.api.API object at 0x7f42f4d1bcd0>, id='00f24ae701a1207b', url='https://api.twitter.com/1.1/geo/id/00f24ae701a1207b.json', place_type='admin', name='Abu Dhabi', full_name='Abu Dhabi, United Arab Emirates', country_code='AE', country='United Arab Emirates', contained_within=[], bounding_box=BoundingBox(_api=<tweepy.api.API object at 0x7f42f4d1bcd0>, type='Polygon', coordinates=[[[51.2938738, 22.6261387], [56.0175464, 22.6261387], [56.0175464, 25.1639588], [51.2938738, 25.1639588]]]), attributes={})"
125,توزيع 4.35 ملايين جرعة من اللقاح ضد كورونا في إيطاليا  ,1366671523021422596,2021-03-02 08:47:37,2,0,"Place(_api=<tweepy.api.API object at 0x7f42f4d1bcd0>, id='001907e868d06e24', url='https://api.twitter.com/1.1/geo/id/001907e868d06e24.json', place_type='admin', name='Dubai', full_name='Dubai, United Arab Emirates', country_code='AE', country='United Arab Emirates', contained_within=[], bounding_box=BoundingBox(_api=<tweepy.api.API object at 0x7f42f4d1bcd0>, type='Polygon', coordinates=[[[54.8939725, 24.6182526], [56.2083722, 24.6182526], [56.2083722, 25.3686719], [54.8939725, 25.3686719]]]), attributes={})"
126,العراق يتسلم أول شحنة من اللقاح الصيني ضد كورونا  ,1366671519963705344,2021-03-02 08:47:36,0,0,"Place(_api=<tweepy.api.API object at 0x7f42f4d1bcd0>, id='001907e868d06e24', url='https://api.twitter.com/1.1/geo/id/001907e868d06e24.json', place_type='admin', name='Dubai', full_name='Dubai, United Arab Emirates', country_code='AE', country='United Arab Emirates', contained_within=[], bounding_box=BoundingBox(_api=<tweepy.api.API object at 0x7f42f4d1bcd0>, type='Polygon', coordinates=[[[54.8939725, 24.6182526], [56.2083722, 24.6182526], [56.2083722, 25.3686719], [54.8939725, 25.3686719]]]), attributes={})"
127,كورونا حول العالم…2.5 مليون وفاة و114.4 مليون إصابة وتوزيع 246 مليون لقاح  ,1366663072203509761,2021-03-02 08:14:02,1,0,"Place(_api=<tweepy.api.API object at 0x7f42f4d1bcd0>, id='001907e868d06e24', url='https://api.twitter.com/1.1/geo/id/001907e868d06e24.json', place_type='admin', name='Dubai', full_name='Dubai, United Arab Emirates', country_code='AE', country='United Arab Emirates', contained_within=[], bounding_box=BoundingBox(_api=<tweepy.api.API object at 0x7f42f4d1bcd0>, type='Polygon', coordinates=[[[54.8939725, 24.6182526], [56.2083722, 24.6182526], [56.2083722, 25.3686719], [54.8939725, 25.3686719]]]), attributes={})"
128,إصابات “كورونا” حول العالم تتجاوز 114.37 مليون حالة  ,1366638164538912769,2021-03-02 06:35:03,0,0,"Place(_api=<tweepy.api.API object at 0x7f42f4d1bcd0>, id='001907e868d06e24', url='https://api.twitter.com/1.1/geo/id/001907e868d06e24.json', place_type='admin', name='Dubai', full_name='Dubai, United Arab Emirates', country_code='AE', country='United Arab Emirates', contained_within=[], bounding_box=BoundingBox(_api=<tweepy.api.API object at 0x7f42f4d1bcd0>, type='Polygon', coordinates=[[[54.8939725, 24.6182526], [56.2083722, 24.6182526], [56.2083722, 25.3686719], [54.8939725, 25.3686719]]]), attributes={})"
129,الرئيس الجزائري: لن أستقيل والقمة العربية مؤجلة بسبب كورونا  ,1366636778539524102,2021-03-02 06:29:33,1,0,"Place(_api=<tweepy.api.API object at 0x7f42f4d1bcd0>, id='001907e868d06e24', url='https://api.twitter.com/1.1/geo/id/001907e868d06e24.json', place_type='admin', name='Dubai', full_name='Dubai, United Arab Emirates', country_code='AE', country='United Arab Emirates', contained_within=[], bounding_box=BoundingBox(_api=<tweepy.api.API object at 0x7f42f4d1bcd0>, type='Polygon', coordinates=[[[54.8939725, 24.6182526], [56.2083722, 24.6182526], [56.2083722, 25.3686719], [54.8939725, 25.3686719]]]), attributes={})"
130,لقاح كورونا فاوتشي: على أميركا الاستمرار في خطة الجرعتين للقاحي فايزر وموديرنا  ,1366613497166004225,2021-03-02 04:57:02,0,1,"Place(_api=<tweepy.api.API object at 0x7f42f4d1bcd0>, id='001907e868d06e24', url='https://api.twitter.com/1.1/geo/id/001907e868d06e24.json', place_type='admin', name='Dubai', full_name='Dubai, United Arab Emirates', country_code='AE', country='United Arab Emirates', contained_within=[], bounding_box=BoundingBox(_api=<tweepy.api.API object at 0x7f42f4d1bcd0>, type='Polygon', coordinates=[[[54.8939725, 24.6182526], [56.2083722, 24.6182526], [56.2083722, 25.3686719], [54.8939725, 25.3686719]]]), attributes={})"
131,ترامب وزوجته حصلا على اللقاح ضد كورونا في يناير الماضي  ,1366612244570599428,2021-03-02 04:52:04,3,1,"Place(_api=<tweepy.api.API object at 0x7f42f4d1bcd0>, id='001907e868d06e24', url='https://api.twitter.com/1.1/geo/id/001907e868d06e24.json', place_type='admin', name='Dubai', full_name='Dubai, United Arab Emirates', country_code='AE', country='United Arab Emirates', contained_within=[], bounding_box=BoundingBox(_api=<tweepy.api.API object at 0x7f42f4d1bcd0>, type='Polygon', coordinates=[[[54.8939725, 24.6182526], [56.2083722, 24.6182526], [56.2083722, 25.3686719], [54.8939725, 25.3686719]]]), attributes={})"
132,النمسا تعتزم تخفيف قيود كورونا تدريجياً  ,1366594761801433091,2021-03-02 03:42:35,0,1,"Place(_api=<tweepy.api.API object at 0x7f42f4d1bcd0>, id='001907e868d06e24', url='https://api.twitter.com/1.1/geo/id/001907e868d06e24.json', place_type='admin', name='Dubai', full_name='Dubai, United Arab Emirates', country_code='AE', country='United Arab Emirates', contained_within=[], bounding_box=BoundingBox(_api=<tweepy.api.API object at 0x7f42f4d1bcd0>, type='Polygon', coordinates=[[[54.8939725, 24.6182526], [56.2083722, 24.6182526], [56.2083722, 25.3686719], [54.8939725, 25.3686719]]]), attributes={})"
133,وفيات كورونا في المكسيك تتجاوز 186 ألفاً  ,1366594758789922818,2021-03-02 03:42:35,0,1,"Place(_api=<tweepy.api.API object at 0x7f42f4d1bcd0>, id='001907e868d06e24', url='https://api.twitter.com/1.1/geo/id/001907e868d06e24.json', place_type='admin', name='Dubai', full_name='Dubai, United Arab Emirates', country_code='AE', country='United Arab Emirates', contained_within=[], bounding_box=BoundingBox(_api=<tweepy.api.API object at 0x7f42f4d1bcd0>, type='Polygon', coordinates=[[[54.8939725, 24.6182526], [56.2083722, 24.6182526], [56.2083722, 25.3686719], [54.8939725, 25.3686719]]]), attributes={})"
134,"المفروض انكم تراجعون حالات الإصابة بكورونا من دون اخذ اللقاح و تشوفون كيف تحصل الوفاة في الكثير من المرضى... تراها نفس الشيء الفشل كلوي.. أو تسمم الدم ""sepsis"" أو السكتة القلبية.. كلها تحصل نتيجة كورونا و بالذات لو مسك في الرئتين بشكل شديد. ",1366516096002646019,2021-03-01 22:30:00,1,0,"Place(_api=<tweepy.api.API object at 0x7f42f4d1bcd0>, id='01a4aba930967a19', url='https://api.twitter.com/1.1/geo/id/01a4aba930967a19.json', place_type='admin', name='Ajman', full_name='Ajman, United Arab Emirates', country_code='AE', country='United Arab Emirates', contained_within=[], bounding_box=BoundingBox(_api=<tweepy.api.API object at 0x7f42f4d1bcd0>, type='Polygon', coordinates=[[[55.4228459, 24.7422387], [56.1015028, 24.7422387], [56.1015028, 25.4513274], [55.4228459, 25.4513274]]]), attributes={})"
135,«طبيب لكل مواطن» تقدم 7000 استشارة طبية لمرضى «كورونا»  ,1366511211823521792,2021-03-01 22:10:36,0,1,"Place(_api=<tweepy.api.API object at 0x7f42f4d1bcd0>, id='001907e868d06e24', url='https://api.twitter.com/1.1/geo/id/001907e868d06e24.json', place_type='admin', name='Dubai', full_name='Dubai, United Arab Emirates', country_code='AE', country='United Arab Emirates', contained_within=[], bounding_box=BoundingBox(_api=<tweepy.api.API object at 0x7f42f4d1bcd0>, type='Polygon', coordinates=[[[54.8939725, 24.6182526], [56.2083722, 24.6182526], [56.2083722, 25.3686719], [54.8939725, 25.3686719]]]), attributes={})"
136,إسرائيل تبدأ تطعيم المتعافين من كورونا  ,1366484647538880515,2021-03-01 20:25:02,0,0,"Place(_api=<tweepy.api.API object at 0x7f42f4d1bcd0>, id='001907e868d06e24', url='https://api.twitter.com/1.1/geo/id/001907e868d06e24.json', place_type='admin', name='Dubai', full_name='Dubai, United Arab Emirates', country_code='AE', country='United Arab Emirates', contained_within=[], bounding_box=BoundingBox(_api=<tweepy.api.API object at 0x7f42f4d1bcd0>, type='Polygon', coordinates=[[[54.8939725, 24.6182526], [56.2083722, 24.6182526], [56.2083722, 25.3686719], [54.8939725, 25.3686719]]]), attributes={})"
137,كورونا ما خلا حد .. كلهم بايعين بخساره,1366481198457970689,2021-03-01 20:11:20,0,0,"Place(_api=<tweepy.api.API object at 0x7f42f4d1bcd0>, id='00f24ae701a1207b', url='https://api.twitter.com/1.1/geo/id/00f24ae701a1207b.json', place_type='admin', name='Abu Dhabi', full_name='Abu Dhabi, United Arab Emirates', country_code='AE', country='United Arab Emirates', contained_within=[], bounding_box=BoundingBox(_api=<tweepy.api.API object at 0x7f42f4d1bcd0>, type='Polygon', coordinates=[[[51.2938738, 22.6261387], [56.0175464, 22.6261387], [56.0175464, 25.1639588], [51.2938738, 25.1639588]]]), attributes={})"
138,“الصحة العالمية” تحذر من التسرع بتخفيف الإجراءات والرهان على اللقاحات لمواجهة “كورونا”  ,1366464644177518593,2021-03-01 19:05:33,1,0,"Place(_api=<tweepy.api.API object at 0x7f42f4d1bcd0>, id='001907e868d06e24', url='https://api.twitter.com/1.1/geo/id/001907e868d06e24.json', place_type='admin', name='Dubai', full_name='Dubai, United Arab Emirates', country_code='AE', country='United Arab Emirates', contained_within=[], bounding_box=BoundingBox(_api=<tweepy.api.API object at 0x7f42f4d1bcd0>, type='Polygon', coordinates=[[[54.8939725, 24.6182526], [56.2083722, 24.6182526], [56.2083722, 25.3686719], [54.8939725, 25.3686719]]]), attributes={})"
139,زيادة إصابات كورونا لأول مرة منذ 7 أسابيع  ,1366450311141810177,2021-03-01 18:08:36,0,0,"Place(_api=<tweepy.api.API object at 0x7f42f4d1bcd0>, id='001907e868d06e24', url='https://api.twitter.com/1.1/geo/id/001907e868d06e24.json', place_type='admin', name='Dubai', full_name='Dubai, United Arab Emirates', country_code='AE', country='United Arab Emirates', contained_within=[], bounding_box=BoundingBox(_api=<tweepy.api.API object at 0x7f42f4d1bcd0>, type='Polygon', coordinates=[[[54.8939725, 24.6182526], [56.2083722, 24.6182526], [56.2083722, 25.3686719], [54.8939725, 25.3686719]]]), attributes={})"
140,فاتح بس اوروبا دخولها مب سهل، وعندنا حجر عشر ايام بعد السفر، و طبعا بدون راتب، بعدها الامور معقدة للموظفين,1366449906492141570,2021-03-01 18:06:59,0,0,"Place(_api=<tweepy.api.API object at 0x7f42f4d1bcd0>, id='00f24ae701a1207b', url='https://api.twitter.com/1.1/geo/id/00f24ae701a1207b.json', place_type='admin', name='Abu Dhabi', full_name='Abu Dhabi, United Arab Emirates', country_code='AE', country='United Arab Emirates', contained_within=[], bounding_box=BoundingBox(_api=<tweepy.api.API object at 0x7f42f4d1bcd0>, type='Polygon', coordinates=[[[51.2938738, 22.6261387], [56.0175464, 22.6261387], [56.0175464, 25.1639588], [51.2938738, 25.1639588]]]), attributes={})"
141,جنوب إفريقيا تتنفّس بعد التراجع الهائل في إصابات «كورونا»  ,1366441373239447553,2021-03-01 17:33:05,0,0,"Place(_api=<tweepy.api.API object at 0x7f42f4d1bcd0>, id='001907e868d06e24', url='https://api.twitter.com/1.1/geo/id/001907e868d06e24.json', place_type='admin', name='Dubai', full_name='Dubai, United Arab Emirates', country_code='AE', country='United Arab Emirates', contained_within=[], bounding_box=BoundingBox(_api=<tweepy.api.API object at 0x7f42f4d1bcd0>, type='Polygon', coordinates=[[[54.8939725, 24.6182526], [56.2083722, 24.6182526], [56.2083722, 25.3686719], [54.8939725, 25.3686719]]]), attributes={})"
142,فقزة كبيرة بإصابات كورونا في الأردن  ,1366432807883403270,2021-03-01 16:59:03,0,0,"Place(_api=<tweepy.api.API object at 0x7f42f4d1bcd0>, id='001907e868d06e24', url='https://api.twitter.com/1.1/geo/id/001907e868d06e24.json', place_type='admin', name='Dubai', full_name='Dubai, United Arab Emirates', country_code='AE', country='United Arab Emirates', contained_within=[], bounding_box=BoundingBox(_api=<tweepy.api.API object at 0x7f42f4d1bcd0>, type='Polygon', coordinates=[[[54.8939725, 24.6182526], [56.2083722, 24.6182526], [56.2083722, 25.3686719], [54.8939725, 25.3686719]]]), attributes={})"
143,ورشة تثقيفية لأعضاء البرلمان الإماراتي للطفل حول آلية العمل في ظل «كورونا»  ,1366432063117692930,2021-03-01 16:56:05,0,0,"Place(_api=<tweepy.api.API object at 0x7f42f4d1bcd0>, id='001907e868d06e24', url='https://api.twitter.com/1.1/geo/id/001907e868d06e24.json', place_type='admin', name='Dubai', full_name='Dubai, United Arab Emirates', country_code='AE', country='United Arab Emirates', contained_within=[], bounding_box=BoundingBox(_api=<tweepy.api.API object at 0x7f42f4d1bcd0>, type='Polygon', coordinates=[[[54.8939725, 24.6182526], [56.2083722, 24.6182526], [56.2083722, 25.3686719], [54.8939725, 25.3686719]]]), attributes={})"
144,«بلومبيرغ»: 22 % تراجع إصابات «كورونا» في الإمارات من ذروة يناير  ,1366432058994663425,2021-03-01 16:56:04,0,0,"Place(_api=<tweepy.api.API object at 0x7f42f4d1bcd0>, id='001907e868d06e24', url='https://api.twitter.com/1.1/geo/id/001907e868d06e24.json', place_type='admin', name='Dubai', full_name='Dubai, United Arab Emirates', country_code='AE', country='United Arab Emirates', contained_within=[], bounding_box=BoundingBox(_api=<tweepy.api.API object at 0x7f42f4d1bcd0>, type='Polygon', coordinates=[[[54.8939725, 24.6182526], [56.2083722, 24.6182526], [56.2083722, 25.3686719], [54.8939725, 25.3686719]]]), attributes={})"
