,Tweets,id,date,likes,retweets,place
72,إيطاليا:توزيع 39.2 مليون جرعة من لقاحات كورونا حتى الآن  ,1402542770217111552,2021-06-09 08:27:09,1,0,"Place(_api=<tweepy.api.API object at 0x7f1d122177f0>, id='001907e868d06e24', url='https://api.twitter.com/1.1/geo/id/001907e868d06e24.json', place_type='admin', name='Dubai', full_name='Dubai, United Arab Emirates', country_code='AE', country='United Arab Emirates', contained_within=[], bounding_box=BoundingBox(_api=<tweepy.api.API object at 0x7f1d122177f0>, type='Polygon', coordinates=[[[54.8939725, 24.6182526], [56.2083722, 24.6182526], [56.2083722, 25.3686719], [54.8939725, 25.3686719]]]), attributes={})"
73,الإمارات ترسل 11 ألف جرعة من لقاح كورونا إلى بيلاروسيا  ,1402537608022876160,2021-06-09 08:06:38,0,0,"Place(_api=<tweepy.api.API object at 0x7f1d122177f0>, id='001907e868d06e24', url='https://api.twitter.com/1.1/geo/id/001907e868d06e24.json', place_type='admin', name='Dubai', full_name='Dubai, United Arab Emirates', country_code='AE', country='United Arab Emirates', contained_within=[], bounding_box=BoundingBox(_api=<tweepy.api.API object at 0x7f1d122177f0>, type='Polygon', coordinates=[[[54.8939725, 24.6182526], [56.2083722, 24.6182526], [56.2083722, 25.3686719], [54.8939725, 25.3686719]]]), attributes={})"
74,بعد التحري والبحث وأخذ عينات من رواد الاصنصيرات تبين الآتي : البعض مُصر إنه يقضي على فايرس كورونا بريحته ويقضي علينا معاه هذا نفسه اللي يقول كورونا بيموت وبينتهي فالصيف وهذا ثاني صيف لنا معاه، لذا عزيزي/عزيزتي الانسان تسبح وحط مزيل العرق لا بارك الله بريحتك اللي تدخل فالكمام,1402522284250828800,2021-06-09 07:05:44,22,0,"Place(_api=<tweepy.api.API object at 0x7f1d122177f0>, id='00f24ae701a1207b', url='https://api.twitter.com/1.1/geo/id/00f24ae701a1207b.json', place_type='admin', name='Abu Dhabi', full_name='Abu Dhabi, United Arab Emirates', country_code='AE', country='United Arab Emirates', contained_within=[], bounding_box=BoundingBox(_api=<tweepy.api.API object at 0x7f1d122177f0>, type='Polygon', coordinates=[[[51.2938738, 22.6261387], [56.0175464, 22.6261387], [56.0175464, 25.1639588], [51.2938738, 25.1639588]]]), attributes={})"
75,فيروس كورونا متحور “دلتا” يقلق بريطانيا.. هل اللقاحات قادرة على التعرف عليه؟  ,1402518721680216070,2021-06-09 06:51:35,1,0,"Place(_api=<tweepy.api.API object at 0x7f1d122177f0>, id='001907e868d06e24', url='https://api.twitter.com/1.1/geo/id/001907e868d06e24.json', place_type='admin', name='Dubai', full_name='Dubai, United Arab Emirates', country_code='AE', country='United Arab Emirates', contained_within=[], bounding_box=BoundingBox(_api=<tweepy.api.API object at 0x7f1d122177f0>, type='Polygon', coordinates=[[[54.8939725, 24.6182526], [56.2083722, 24.6182526], [56.2083722, 25.3686719], [54.8939725, 25.3686719]]]), attributes={})"
76,"وكالة (نبض) للأنباء للكاتب الإماراتي أحمد إبراهيم/  ● كورونا وأخوات الرضاعة,, ",1402517039202418692,2021-06-09 06:44:54,0,0,"Place(_api=<tweepy.api.API object at 0x7f1d122177f0>, id='001907e868d06e24', url='https://api.twitter.com/1.1/geo/id/001907e868d06e24.json', place_type='admin', name='Dubai', full_name='Dubai, United Arab Emirates', country_code='AE', country='United Arab Emirates', contained_within=[], bounding_box=BoundingBox(_api=<tweepy.api.API object at 0x7f1d122177f0>, type='Polygon', coordinates=[[[54.8939725, 24.6182526], [56.2083722, 24.6182526], [56.2083722, 25.3686719], [54.8939725, 25.3686719]]]), attributes={})"
77,الإمارات ترسل شحنة من لقاح كورونا إلى بيلاروسيا  ,1402509787808428037,2021-06-09 06:16:05,2,2,"Place(_api=<tweepy.api.API object at 0x7f1d122177f0>, id='001907e868d06e24', url='https://api.twitter.com/1.1/geo/id/001907e868d06e24.json', place_type='admin', name='Dubai', full_name='Dubai, United Arab Emirates', country_code='AE', country='United Arab Emirates', contained_within=[], bounding_box=BoundingBox(_api=<tweepy.api.API object at 0x7f1d122177f0>, type='Polygon', coordinates=[[[54.8939725, 24.6182526], [56.2083722, 24.6182526], [56.2083722, 25.3686719], [54.8939725, 25.3686719]]]), attributes={})"
78,مستعد امسح كل تغريده انتقدتكم وانتقدت اداء معاليه فيما يتعلق ب كورونا و واقلبها مدح وتطبيل بس دزوا لي مسج ,1402502809732501511,2021-06-09 05:48:21,0,0,"Place(_api=<tweepy.api.API object at 0x7f1d122177f0>, id='001907e868d06e24', url='https://api.twitter.com/1.1/geo/id/001907e868d06e24.json', place_type='admin', name='Dubai', full_name='Dubai, United Arab Emirates', country_code='AE', country='United Arab Emirates', contained_within=[], bounding_box=BoundingBox(_api=<tweepy.api.API object at 0x7f1d122177f0>, type='Polygon', coordinates=[[[54.8939725, 24.6182526], [56.2083722, 24.6182526], [56.2083722, 25.3686719], [54.8939725, 25.3686719]]]), attributes={})"
79,يعني فوق ما الاقتصاد دمران بسبت كورونا تبون اتزيدونا بارج الله فيكم خلوا الناس تسترزق ويوم يقوم الاقتصاد سوو الي تبونه ,1402497064219463681,2021-06-09 05:25:31,0,0,"Place(_api=<tweepy.api.API object at 0x7f1d122177f0>, id='00ecb59b0dad186e', url='https://api.twitter.com/1.1/geo/id/00ecb59b0dad186e.json', place_type='admin', name='Sharjah', full_name='Sharjah, United Arab Emirates', country_code='AE', country='United Arab Emirates', contained_within=[], bounding_box=BoundingBox(_api=<tweepy.api.API object at 0x7f1d122177f0>, type='Polygon', coordinates=[[[55.0091271, 24.7328863], [56.3816989, 24.7328863], [56.3816989, 25.8997649], [55.0091271, 25.8997649]]]), attributes={})"
