,Tweets,id,date,likes,retweets,place
0,توظيف .. «العالمي للهجرة»: تجربة الإمارات مع العمالة خلال «كورونا» استثنائية  ,1354917952991031298,2021-01-28 22:23:07,0,0,"Place(_api=<tweepy.api.API object at 0x7f9eb81bdcd0>, id='001907e868d06e24', url='https://api.twitter.com/1.1/geo/id/001907e868d06e24.json', place_type='admin', name='Dubai', full_name='Dubai, United Arab Emirates', country_code='AE', country='United Arab Emirates', contained_within=[], bounding_box=BoundingBox(_api=<tweepy.api.API object at 0x7f9eb81bdcd0>, type='Polygon', coordinates=[[[54.8939725, 24.6182526], [56.2083722, 24.6182526], [56.2083722, 25.3686719], [54.8939725, 25.3686719]]]), attributes={})"
1,سيف بن زايد: الإمارات الأولى عالمياً في حملة التلقيح ضد «كورونا»  ,1354917936821981185,2021-01-28 22:23:03,1,0,"Place(_api=<tweepy.api.API object at 0x7f9eb81bdcd0>, id='001907e868d06e24', url='https://api.twitter.com/1.1/geo/id/001907e868d06e24.json', place_type='admin', name='Dubai', full_name='Dubai, United Arab Emirates', country_code='AE', country='United Arab Emirates', contained_within=[], bounding_box=BoundingBox(_api=<tweepy.api.API object at 0x7f9eb81bdcd0>, type='Polygon', coordinates=[[[54.8939725, 24.6182526], [56.2083722, 24.6182526], [56.2083722, 25.3686719], [54.8939725, 25.3686719]]]), attributes={})"
2,الإمارات: ملتزمون بالجهود العالمية الموحدة لمكافحة «كورونا»  ,1354917840051081217,2021-01-28 22:22:40,0,0,"Place(_api=<tweepy.api.API object at 0x7f9eb81bdcd0>, id='001907e868d06e24', url='https://api.twitter.com/1.1/geo/id/001907e868d06e24.json', place_type='admin', name='Dubai', full_name='Dubai, United Arab Emirates', country_code='AE', country='United Arab Emirates', contained_within=[], bounding_box=BoundingBox(_api=<tweepy.api.API object at 0x7f9eb81bdcd0>, type='Polygon', coordinates=[[[54.8939725, 24.6182526], [56.2083722, 24.6182526], [56.2083722, 25.3686719], [54.8939725, 25.3686719]]]), attributes={})"
3,إجراءات فرنسية إضافية حيال انتشار سلالات جديدة متحورة من كورونا  ,1354917709713010691,2021-01-28 22:22:09,0,0,"Place(_api=<tweepy.api.API object at 0x7f9eb81bdcd0>, id='001907e868d06e24', url='https://api.twitter.com/1.1/geo/id/001907e868d06e24.json', place_type='admin', name='Dubai', full_name='Dubai, United Arab Emirates', country_code='AE', country='United Arab Emirates', contained_within=[], bounding_box=BoundingBox(_api=<tweepy.api.API object at 0x7f9eb81bdcd0>, type='Polygon', coordinates=[[[54.8939725, 24.6182526], [56.2083722, 24.6182526], [56.2083722, 25.3686719], [54.8939725, 25.3686719]]]), attributes={})"
4,قطر تحذر من سلالة جديدة من كورونا  ,1354901587039150082,2021-01-28 21:18:05,0,0,"Place(_api=<tweepy.api.API object at 0x7f9eb81bdcd0>, id='001907e868d06e24', url='https://api.twitter.com/1.1/geo/id/001907e868d06e24.json', place_type='admin', name='Dubai', full_name='Dubai, United Arab Emirates', country_code='AE', country='United Arab Emirates', contained_within=[], bounding_box=BoundingBox(_api=<tweepy.api.API object at 0x7f9eb81bdcd0>, type='Polygon', coordinates=[[[54.8939725, 24.6182526], [56.2083722, 24.6182526], [56.2083722, 25.3686719], [54.8939725, 25.3686719]]]), attributes={})"
5,المغرب يبدأ حملة التطعيم ضد كورونا  ,1354876563049725953,2021-01-28 19:38:39,0,0,"Place(_api=<tweepy.api.API object at 0x7f9eb81bdcd0>, id='001907e868d06e24', url='https://api.twitter.com/1.1/geo/id/001907e868d06e24.json', place_type='admin', name='Dubai', full_name='Dubai, United Arab Emirates', country_code='AE', country='United Arab Emirates', contained_within=[], bounding_box=BoundingBox(_api=<tweepy.api.API object at 0x7f9eb81bdcd0>, type='Polygon', coordinates=[[[54.8939725, 24.6182526], [56.2083722, 24.6182526], [56.2083722, 25.3686719], [54.8939725, 25.3686719]]]), attributes={})"
6,في بيتنا كورونا والحمد لله انا والزميله سالي باقي يومين بنخلص الحجر الصحي ما حبيت احكيلكم حتى ما ازعجكم ومعانا ليث مخالط وسالي الصغيره بحكم الامر الواقع اما كريم الي اصلا اصيب وعبود فتم نفيهم لبيت خالهم،نراكم بعد كمن يوم. بفضل الله الاعراض خفيفه جدا ديرو بالكم على انفسكم ,1354864779123445761,2021-01-28 18:51:50,8,2,"Place(_api=<tweepy.api.API object at 0x7f9eb81bdcd0>, id='001907e868d06e24', url='https://api.twitter.com/1.1/geo/id/001907e868d06e24.json', place_type='admin', name='Dubai', full_name='Dubai, United Arab Emirates', country_code='AE', country='United Arab Emirates', contained_within=[], bounding_box=BoundingBox(_api=<tweepy.api.API object at 0x7f9eb81bdcd0>, type='Polygon', coordinates=[[[54.8939725, 24.6182526], [56.2083722, 24.6182526], [56.2083722, 25.3686719], [54.8939725, 25.3686719]]]), attributes={})"
7,غوتيريش: لقاحات كورونا “اختبار أخلاقي” للعالم  ,1354859562138890245,2021-01-28 18:31:06,1,1,"Place(_api=<tweepy.api.API object at 0x7f9eb81bdcd0>, id='001907e868d06e24', url='https://api.twitter.com/1.1/geo/id/001907e868d06e24.json', place_type='admin', name='Dubai', full_name='Dubai, United Arab Emirates', country_code='AE', country='United Arab Emirates', contained_within=[], bounding_box=BoundingBox(_api=<tweepy.api.API object at 0x7f9eb81bdcd0>, type='Polygon', coordinates=[[[54.8939725, 24.6182526], [56.2083722, 24.6182526], [56.2083722, 25.3686719], [54.8939725, 25.3686719]]]), attributes={})"
8,بريطانيا: توقيف رجل بعد إرسال طرد مشبوه إلى مصنع لقاحات كورونا  ,1354859556266864643,2021-01-28 18:31:04,2,1,"Place(_api=<tweepy.api.API object at 0x7f9eb81bdcd0>, id='001907e868d06e24', url='https://api.twitter.com/1.1/geo/id/001907e868d06e24.json', place_type='admin', name='Dubai', full_name='Dubai, United Arab Emirates', country_code='AE', country='United Arab Emirates', contained_within=[], bounding_box=BoundingBox(_api=<tweepy.api.API object at 0x7f9eb81bdcd0>, type='Polygon', coordinates=[[[54.8939725, 24.6182526], [56.2083722, 24.6182526], [56.2083722, 25.3686719], [54.8939725, 25.3686719]]]), attributes={})"
9,جائحة كورونا مازالت ترعب العالم ومازالت آثارها مستمرة وتحاول الدول التغلب عليها من خلال معايشة الوضع ، المرحلة المقبلة حاسمة وتتطلب المزيد من التحوط وفي نفس الوقت معايشة الوضع من اجل سرعة التعافي #,1354853925585903618,2021-01-28 18:08:42,0,0,"Place(_api=<tweepy.api.API object at 0x7f9eb81bdcd0>, id='00f24ae701a1207b', url='https://api.twitter.com/1.1/geo/id/00f24ae701a1207b.json', place_type='admin', name='Abu Dhabi', full_name='Abu Dhabi, United Arab Emirates', country_code='AE', country='United Arab Emirates', contained_within=[], bounding_box=BoundingBox(_api=<tweepy.api.API object at 0x7f9eb81bdcd0>, type='Polygon', coordinates=[[[51.2938738, 22.6261387], [56.0175464, 22.6261387], [56.0175464, 25.1639588], [51.2938738, 25.1639588]]]), attributes={})"
10,سيف بن زايد: الإمارات الأولى عربياً والثانية عالمياً في حملة التلقيح ضد كورونا  ,1354851507242295296,2021-01-28 17:59:05,0,0,"Place(_api=<tweepy.api.API object at 0x7f9eb81bdcd0>, id='001907e868d06e24', url='https://api.twitter.com/1.1/geo/id/001907e868d06e24.json', place_type='admin', name='Dubai', full_name='Dubai, United Arab Emirates', country_code='AE', country='United Arab Emirates', contained_within=[], bounding_box=BoundingBox(_api=<tweepy.api.API object at 0x7f9eb81bdcd0>, type='Polygon', coordinates=[[[54.8939725, 24.6182526], [56.2083722, 24.6182526], [56.2083722, 25.3686719], [54.8939725, 25.3686719]]]), attributes={})"
11,عبدالله بن زايد والعويس يؤكدان لنظيريهما الدنماركيين التزام الإمارات ببروتوكولات فحوصات كورونا  ,1354844456365645827,2021-01-28 17:31:04,0,0,"Place(_api=<tweepy.api.API object at 0x7f9eb81bdcd0>, id='001907e868d06e24', url='https://api.twitter.com/1.1/geo/id/001907e868d06e24.json', place_type='admin', name='Dubai', full_name='Dubai, United Arab Emirates', country_code='AE', country='United Arab Emirates', contained_within=[], bounding_box=BoundingBox(_api=<tweepy.api.API object at 0x7f9eb81bdcd0>, type='Polygon', coordinates=[[[54.8939725, 24.6182526], [56.2083722, 24.6182526], [56.2083722, 25.3686719], [54.8939725, 25.3686719]]]), attributes={})"
12,الجزائر تبدأ التطعيم ضد كورونا السبت  ,1354844335477415940,2021-01-28 17:30:36,2,0,"Place(_api=<tweepy.api.API object at 0x7f9eb81bdcd0>, id='001907e868d06e24', url='https://api.twitter.com/1.1/geo/id/001907e868d06e24.json', place_type='admin', name='Dubai', full_name='Dubai, United Arab Emirates', country_code='AE', country='United Arab Emirates', contained_within=[], bounding_box=BoundingBox(_api=<tweepy.api.API object at 0x7f9eb81bdcd0>, type='Polygon', coordinates=[[[54.8939725, 24.6182526], [56.2083722, 24.6182526], [56.2083722, 25.3686719], [54.8939725, 25.3686719]]]), attributes={})"
13,نسبة وقاية اللقاح الصيني من مضاعفات كورونا 100 %  ,1354832875632226305,2021-01-28 16:45:03,2,1,"Place(_api=<tweepy.api.API object at 0x7f9eb81bdcd0>, id='001907e868d06e24', url='https://api.twitter.com/1.1/geo/id/001907e868d06e24.json', place_type='admin', name='Dubai', full_name='Dubai, United Arab Emirates', country_code='AE', country='United Arab Emirates', contained_within=[], bounding_box=BoundingBox(_api=<tweepy.api.API object at 0x7f9eb81bdcd0>, type='Polygon', coordinates=[[[54.8939725, 24.6182526], [56.2083722, 24.6182526], [56.2083722, 25.3686719], [54.8939725, 25.3686719]]]), attributes={})"
14,خرائط جوجل ستعرض لك قريبًا مواقع لقاح كوفيد 19 “كورونا”  ,1354828475639582723,2021-01-28 16:27:34,0,0,"Place(_api=<tweepy.api.API object at 0x7f9eb81bdcd0>, id='001907e868d06e24', url='https://api.twitter.com/1.1/geo/id/001907e868d06e24.json', place_type='admin', name='Dubai', full_name='Dubai, United Arab Emirates', country_code='AE', country='United Arab Emirates', contained_within=[], bounding_box=BoundingBox(_api=<tweepy.api.API object at 0x7f9eb81bdcd0>, type='Polygon', coordinates=[[[54.8939725, 24.6182526], [56.2083722, 24.6182526], [56.2083722, 25.3686719], [54.8939725, 25.3686719]]]), attributes={})"
15,عبدالله بن زايد والعويس يجتمعان مع نظيريهما الدنماركيين لتأكيد التزام الإمارات ببروتوكولات فحوصات كورونا  ,1354818281241157637,2021-01-28 15:47:04,1,0,"Place(_api=<tweepy.api.API object at 0x7f9eb81bdcd0>, id='001907e868d06e24', url='https://api.twitter.com/1.1/geo/id/001907e868d06e24.json', place_type='admin', name='Dubai', full_name='Dubai, United Arab Emirates', country_code='AE', country='United Arab Emirates', contained_within=[], bounding_box=BoundingBox(_api=<tweepy.api.API object at 0x7f9eb81bdcd0>, type='Polygon', coordinates=[[[54.8939725, 24.6182526], [56.2083722, 24.6182526], [56.2083722, 25.3686719], [54.8939725, 25.3686719]]]), attributes={})"
16,العاهل الأردني ينتقد عدم توفير إسرائيل لقاحات للفلسطينيين ضد كورونا  ,1354808847131545610,2021-01-28 15:09:34,0,0,"Place(_api=<tweepy.api.API object at 0x7f9eb81bdcd0>, id='001907e868d06e24', url='https://api.twitter.com/1.1/geo/id/001907e868d06e24.json', place_type='admin', name='Dubai', full_name='Dubai, United Arab Emirates', country_code='AE', country='United Arab Emirates', contained_within=[], bounding_box=BoundingBox(_api=<tweepy.api.API object at 0x7f9eb81bdcd0>, type='Polygon', coordinates=[[[54.8939725, 24.6182526], [56.2083722, 24.6182526], [56.2083722, 25.3686719], [54.8939725, 25.3686719]]]), attributes={})"
17,زيادة جرائم الاغتصاب في فرنسا خلال جائحة كورونا  ,1354808843264434197,2021-01-28 15:09:34,1,0,"Place(_api=<tweepy.api.API object at 0x7f9eb81bdcd0>, id='001907e868d06e24', url='https://api.twitter.com/1.1/geo/id/001907e868d06e24.json', place_type='admin', name='Dubai', full_name='Dubai, United Arab Emirates', country_code='AE', country='United Arab Emirates', contained_within=[], bounding_box=BoundingBox(_api=<tweepy.api.API object at 0x7f9eb81bdcd0>, type='Polygon', coordinates=[[[54.8939725, 24.6182526], [56.2083722, 24.6182526], [56.2083722, 25.3686719], [54.8939725, 25.3686719]]]), attributes={})"
18,اذا عندك رجلين ويدين وخشم و٥ اصابع برجلك يعني فيك كورونا امتحنتونا خلاص ,1354801173123932162,2021-01-28 14:39:05,0,0,"Place(_api=<tweepy.api.API object at 0x7f9eb81bdcd0>, id='00f24ae701a1207b', url='https://api.twitter.com/1.1/geo/id/00f24ae701a1207b.json', place_type='admin', name='Abu Dhabi', full_name='Abu Dhabi, United Arab Emirates', country_code='AE', country='United Arab Emirates', contained_within=[], bounding_box=BoundingBox(_api=<tweepy.api.API object at 0x7f9eb81bdcd0>, type='Polygon', coordinates=[[[51.2938738, 22.6261387], [56.0175464, 22.6261387], [56.0175464, 25.1639588], [51.2938738, 25.1639588]]]), attributes={})"
19,كورونا بيندم انه دخل جسمه ,1354796568948273154,2021-01-28 14:20:47,0,0,"Place(_api=<tweepy.api.API object at 0x7f9eb81bdcd0>, id='00f24ae701a1207b', url='https://api.twitter.com/1.1/geo/id/00f24ae701a1207b.json', place_type='admin', name='Abu Dhabi', full_name='Abu Dhabi, United Arab Emirates', country_code='AE', country='United Arab Emirates', contained_within=[], bounding_box=BoundingBox(_api=<tweepy.api.API object at 0x7f9eb81bdcd0>, type='Polygon', coordinates=[[[51.2938738, 22.6261387], [56.0175464, 22.6261387], [56.0175464, 25.1639588], [51.2938738, 25.1639588]]]), attributes={})"
20,دراسة: البرازيل أسوأ دولة في إدارة أزمة كورونا ونيوزيلندا الأفضل  ,1354795635208122368,2021-01-28 14:17:04,0,1,"Place(_api=<tweepy.api.API object at 0x7f9eb81bdcd0>, id='001907e868d06e24', url='https://api.twitter.com/1.1/geo/id/001907e868d06e24.json', place_type='admin', name='Dubai', full_name='Dubai, United Arab Emirates', country_code='AE', country='United Arab Emirates', contained_within=[], bounding_box=BoundingBox(_api=<tweepy.api.API object at 0x7f9eb81bdcd0>, type='Polygon', coordinates=[[[54.8939725, 24.6182526], [56.2083722, 24.6182526], [56.2083722, 25.3686719], [54.8939725, 25.3686719]]]), attributes={})"
21,الثانية عالميا لجهة الدول الأكثر تطعيما لسكانها بلقاحات .. شكرا لدولة الامارات  ,1354788760815333381,2021-01-28 13:49:45,14,2,"Place(_api=<tweepy.api.API object at 0x7f9eb81bdcd0>, id='001907e868d06e24', url='https://api.twitter.com/1.1/geo/id/001907e868d06e24.json', place_type='admin', name='Dubai', full_name='Dubai, United Arab Emirates', country_code='AE', country='United Arab Emirates', contained_within=[], bounding_box=BoundingBox(_api=<tweepy.api.API object at 0x7f9eb81bdcd0>, type='Polygon', coordinates=[[[54.8939725, 24.6182526], [56.2083722, 24.6182526], [56.2083722, 25.3686719], [54.8939725, 25.3686719]]]), attributes={})"
22,المكتب الإعلامي لحكومة رأس الخيمة يحذر من تداول الشائعات حول كورونا  ,1354788602417274881,2021-01-28 13:49:08,0,0,"Place(_api=<tweepy.api.API object at 0x7f9eb81bdcd0>, id='001907e868d06e24', url='https://api.twitter.com/1.1/geo/id/001907e868d06e24.json', place_type='admin', name='Dubai', full_name='Dubai, United Arab Emirates', country_code='AE', country='United Arab Emirates', contained_within=[], bounding_box=BoundingBox(_api=<tweepy.api.API object at 0x7f9eb81bdcd0>, type='Polygon', coordinates=[[[54.8939725, 24.6182526], [56.2083722, 24.6182526], [56.2083722, 25.3686719], [54.8939725, 25.3686719]]]), attributes={})"
23,7400 مستفيد بتطعيم لقاح كورونا بمركز جمعية عجمان للتنمية الاجتماعية  ,1354788597916831745,2021-01-28 13:49:07,0,0,"Place(_api=<tweepy.api.API object at 0x7f9eb81bdcd0>, id='001907e868d06e24', url='https://api.twitter.com/1.1/geo/id/001907e868d06e24.json', place_type='admin', name='Dubai', full_name='Dubai, United Arab Emirates', country_code='AE', country='United Arab Emirates', contained_within=[], bounding_box=BoundingBox(_api=<tweepy.api.API object at 0x7f9eb81bdcd0>, type='Polygon', coordinates=[[[54.8939725, 24.6182526], [56.2083722, 24.6182526], [56.2083722, 25.3686719], [54.8939725, 25.3686719]]]), attributes={})"
24,تلقيت اليوم الجرعة الاولى من لقاح كورونا .... الحمد لله على نعمة الامارات  ,1354782748041506816,2021-01-28 13:25:52,13,0,"Place(_api=<tweepy.api.API object at 0x7f9eb81bdcd0>, id='001907e868d06e24', url='https://api.twitter.com/1.1/geo/id/001907e868d06e24.json', place_type='admin', name='Dubai', full_name='Dubai, United Arab Emirates', country_code='AE', country='United Arab Emirates', contained_within=[], bounding_box=BoundingBox(_api=<tweepy.api.API object at 0x7f9eb81bdcd0>, type='Polygon', coordinates=[[[54.8939725, 24.6182526], [56.2083722, 24.6182526], [56.2083722, 25.3686719], [54.8939725, 25.3686719]]]), attributes={})"
25,تقديم 104 آلاف جرعة من لقاح كورونا خلال 24 ساعة  ,1354778391921061896,2021-01-28 13:08:33,0,0,"Place(_api=<tweepy.api.API object at 0x7f9eb81bdcd0>, id='001907e868d06e24', url='https://api.twitter.com/1.1/geo/id/001907e868d06e24.json', place_type='admin', name='Dubai', full_name='Dubai, United Arab Emirates', country_code='AE', country='United Arab Emirates', contained_within=[], bounding_box=BoundingBox(_api=<tweepy.api.API object at 0x7f9eb81bdcd0>, type='Polygon', coordinates=[[[54.8939725, 24.6182526], [56.2083722, 24.6182526], [56.2083722, 25.3686719], [54.8939725, 25.3686719]]]), attributes={})"
26,و غير ها، ماكان في حجر حق الي يوصلون عن طريق دبي  بوظبي مطبقين قرارات شديده من بدت الازمه الحمدلله,1354774680918519809,2021-01-28 12:53:49,0,0,"Place(_api=<tweepy.api.API object at 0x7f9eb81bdcd0>, id='00f24ae701a1207b', url='https://api.twitter.com/1.1/geo/id/00f24ae701a1207b.json', place_type='admin', name='Abu Dhabi', full_name='Abu Dhabi, United Arab Emirates', country_code='AE', country='United Arab Emirates', contained_within=[], bounding_box=BoundingBox(_api=<tweepy.api.API object at 0x7f9eb81bdcd0>, type='Polygon', coordinates=[[[51.2938738, 22.6261387], [56.0175464, 22.6261387], [56.0175464, 25.1639588], [51.2938738, 25.1639588]]]), attributes={})"
27,اطعمة ممنوعة على مرضي فيروس كورونا الجديد  ,1354774514916155397,2021-01-28 12:53:09,0,0,"Place(_api=<tweepy.api.API object at 0x7f9eb81bdcd0>, id='001907e868d06e24', url='https://api.twitter.com/1.1/geo/id/001907e868d06e24.json', place_type='admin', name='Dubai', full_name='Dubai, United Arab Emirates', country_code='AE', country='United Arab Emirates', contained_within=[], bounding_box=BoundingBox(_api=<tweepy.api.API object at 0x7f9eb81bdcd0>, type='Polygon', coordinates=[[[54.8939725, 24.6182526], [56.2083722, 24.6182526], [56.2083722, 25.3686719], [54.8939725, 25.3686719]]]), attributes={})"
28,تجربة تدريس المختبرات في ظل جائحة كورونا. . . . ,1354774356426186753,2021-01-28 12:52:31,1,0,"Place(_api=<tweepy.api.API object at 0x7f9eb81bdcd0>, id='00ecb59b0dad186e', url='https://api.twitter.com/1.1/geo/id/00ecb59b0dad186e.json', place_type='admin', name='Sharjah', full_name='Sharjah, United Arab Emirates', country_code='AE', country='United Arab Emirates', contained_within=[], bounding_box=BoundingBox(_api=<tweepy.api.API object at 0x7f9eb81bdcd0>, type='Polygon', coordinates=[[[55.0091271, 24.7328863], [56.3816989, 24.7328863], [56.3816989, 25.8997649], [55.0091271, 25.8997649]]]), attributes={})"
29,الإمارات تقدم 2.868.645 مليون جرعة من اللقاح ضد كورونا حتى اليوم  ,1354771859502292994,2021-01-28 12:42:36,0,0,"Place(_api=<tweepy.api.API object at 0x7f9eb81bdcd0>, id='001907e868d06e24', url='https://api.twitter.com/1.1/geo/id/001907e868d06e24.json', place_type='admin', name='Dubai', full_name='Dubai, United Arab Emirates', country_code='AE', country='United Arab Emirates', contained_within=[], bounding_box=BoundingBox(_api=<tweepy.api.API object at 0x7f9eb81bdcd0>, type='Polygon', coordinates=[[[54.8939725, 24.6182526], [56.2083722, 24.6182526], [56.2083722, 25.3686719], [54.8939725, 25.3686719]]]), attributes={})"
30,تقديم 104200 جرعة من لقاح كورونا في الإمارات خلال الـ 24 ساعة الماضية  ,1354771849591152644,2021-01-28 12:42:34,0,0,"Place(_api=<tweepy.api.API object at 0x7f9eb81bdcd0>, id='001907e868d06e24', url='https://api.twitter.com/1.1/geo/id/001907e868d06e24.json', place_type='admin', name='Dubai', full_name='Dubai, United Arab Emirates', country_code='AE', country='United Arab Emirates', contained_within=[], bounding_box=BoundingBox(_api=<tweepy.api.API object at 0x7f9eb81bdcd0>, type='Polygon', coordinates=[[[54.8939725, 24.6182526], [56.2083722, 24.6182526], [56.2083722, 25.3686719], [54.8939725, 25.3686719]]]), attributes={})"
31,CNBC-ذكرت ماكدونالدز اليوم الخميس أن مبيعات المتاجر نفسها في الولايات المتحدة قفزت إلى 5.5٪ في الربع الأخير ، لكن جائحة فيروس كورونا لا يزال يضيف تكاليفها ويبطئ التعافي في العديد من أسواقه الدولية. وانخفضت أسهم الشركة بأقل من 1٪ في تداول ما قبل السوق. ,1354767166579630081,2021-01-28 12:23:57,7,1,"Place(_api=<tweepy.api.API object at 0x7f9eb81bdcd0>, id='001907e868d06e24', url='https://api.twitter.com/1.1/geo/id/001907e868d06e24.json', place_type='admin', name='Dubai', full_name='Dubai, United Arab Emirates', country_code='AE', country='United Arab Emirates', contained_within=[], bounding_box=BoundingBox(_api=<tweepy.api.API object at 0x7f9eb81bdcd0>, type='Polygon', coordinates=[[[54.8939725, 24.6182526], [56.2083722, 24.6182526], [56.2083722, 25.3686719], [54.8939725, 25.3686719]]]), attributes={})"
32,بيل غيتس يدعم حصول الدول الفقيرة على لقاحات كورونا مجاناً  ,1354763803913646080,2021-01-28 12:10:35,0,0,"Place(_api=<tweepy.api.API object at 0x7f9eb81bdcd0>, id='001907e868d06e24', url='https://api.twitter.com/1.1/geo/id/001907e868d06e24.json', place_type='admin', name='Dubai', full_name='Dubai, United Arab Emirates', country_code='AE', country='United Arab Emirates', contained_within=[], bounding_box=BoundingBox(_api=<tweepy.api.API object at 0x7f9eb81bdcd0>, type='Polygon', coordinates=[[[54.8939725, 24.6182526], [56.2083722, 24.6182526], [56.2083722, 25.3686719], [54.8939725, 25.3686719]]]), attributes={})"
33,“صحة دبي” توعي بأهمية اللقاح ضد كورونا في تعزيز المناعة  ,1354763446286389252,2021-01-28 12:09:10,0,0,"Place(_api=<tweepy.api.API object at 0x7f9eb81bdcd0>, id='001907e868d06e24', url='https://api.twitter.com/1.1/geo/id/001907e868d06e24.json', place_type='admin', name='Dubai', full_name='Dubai, United Arab Emirates', country_code='AE', country='United Arab Emirates', contained_within=[], bounding_box=BoundingBox(_api=<tweepy.api.API object at 0x7f9eb81bdcd0>, type='Polygon', coordinates=[[[54.8939725, 24.6182526], [56.2083722, 24.6182526], [56.2083722, 25.3686719], [54.8939725, 25.3686719]]]), attributes={})"
34,إسرائيل تسجل 34 حالة وفاة و7668 إصابة جديدة بـ”كورونا”  ,1354758269139468292,2021-01-28 11:48:36,1,0,"Place(_api=<tweepy.api.API object at 0x7f9eb81bdcd0>, id='001907e868d06e24', url='https://api.twitter.com/1.1/geo/id/001907e868d06e24.json', place_type='admin', name='Dubai', full_name='Dubai, United Arab Emirates', country_code='AE', country='United Arab Emirates', contained_within=[], bounding_box=BoundingBox(_api=<tweepy.api.API object at 0x7f9eb81bdcd0>, type='Polygon', coordinates=[[[54.8939725, 24.6182526], [56.2083722, 24.6182526], [56.2083722, 25.3686719], [54.8939725, 25.3686719]]]), attributes={})"
35,روسيا تسجل أكثر من 19 ألف إصابة جديدة بـ “كورونا”  ,1354758262776762368,2021-01-28 11:48:34,1,0,"Place(_api=<tweepy.api.API object at 0x7f9eb81bdcd0>, id='001907e868d06e24', url='https://api.twitter.com/1.1/geo/id/001907e868d06e24.json', place_type='admin', name='Dubai', full_name='Dubai, United Arab Emirates', country_code='AE', country='United Arab Emirates', contained_within=[], bounding_box=BoundingBox(_api=<tweepy.api.API object at 0x7f9eb81bdcd0>, type='Polygon', coordinates=[[[54.8939725, 24.6182526], [56.2083722, 24.6182526], [56.2083722, 25.3686719], [54.8939725, 25.3686719]]]), attributes={})"
36,تم اخذ الجرعه الاولى من شكرا ,1354757145405886466,2021-01-28 11:44:08,4,1,"Place(_api=<tweepy.api.API object at 0x7f9eb81bdcd0>, id='00ecb59b0dad186e', url='https://api.twitter.com/1.1/geo/id/00ecb59b0dad186e.json', place_type='admin', name='Sharjah', full_name='Sharjah, United Arab Emirates', country_code='AE', country='United Arab Emirates', contained_within=[], bounding_box=BoundingBox(_api=<tweepy.api.API object at 0x7f9eb81bdcd0>, type='Polygon', coordinates=[[[55.0091271, 24.7328863], [56.3816989, 24.7328863], [56.3816989, 25.8997649], [55.0091271, 25.8997649]]]), attributes={})"
