,Tweets,id,date,likes,retweets,place
0,As if covid hasn't messed up our lives yet and then you wake up to this. Please Leicester. Just do your job today and get us out of this ugly scenery. ,1330436965645381633,2020-11-22 09:04:25,3,0,"Place(_api=<tweepy.api.API object at 0x7f9846c20790>, id='001907e868d06e24', url='https://api.twitter.com/1.1/geo/id/001907e868d06e24.json', place_type='admin', name='Dubai', full_name='Dubai, United Arab Emirates', country_code='AE', country='United Arab Emirates', contained_within=[], bounding_box=BoundingBox(_api=<tweepy.api.API object at 0x7f9846c20790>, type='Polygon', coordinates=[[[54.8939725, 24.6182526], [56.2083722, 24.6182526], [56.2083722, 25.3686719], [54.8939725, 25.3686719]]]), attributes={})"
1,A country which still has Polio I dont see CoVid going away for a long long time. ,1330398909026496513,2020-11-22 06:33:12,2,0,"Place(_api=<tweepy.api.API object at 0x7f9846c20790>, id='001907e868d06e24', url='https://api.twitter.com/1.1/geo/id/001907e868d06e24.json', place_type='admin', name='Dubai', full_name='Dubai, United Arab Emirates', country_code='AE', country='United Arab Emirates', contained_within=[], bounding_box=BoundingBox(_api=<tweepy.api.API object at 0x7f9846c20790>, type='Polygon', coordinates=[[[54.8939725, 24.6182526], [56.2083722, 24.6182526], [56.2083722, 25.3686719], [54.8939725, 25.3686719]]]), attributes={})"
2,The ERC volunteers participated for the second time in the Sheikh Zayed Festival in organizing the festival and educating the public on the need to adhere to the precautionary and preventive measures against Coronavirus. The festival launched on November 20th.,1330391807700688898,2020-11-22 06:04:59,3,1,"Place(_api=<tweepy.api.API object at 0x7f9846c20790>, id='00f24ae701a1207b', url='https://api.twitter.com/1.1/geo/id/00f24ae701a1207b.json', place_type='admin', name='Abu Dhabi', full_name='Abu Dhabi, United Arab Emirates', country_code='AE', country='United Arab Emirates', contained_within=[], bounding_box=BoundingBox(_api=<tweepy.api.API object at 0x7f9846c20790>, type='Polygon', coordinates=[[[51.2938738, 22.6261387], [56.0175464, 22.6261387], [56.0175464, 25.1639588], [51.2938738, 25.1639588]]]), attributes={})"
3,"The latest edition for the newsletter No 28 highlights the red crescent activities in the Gulf, Covid-19 Stat shows rates of testing, cases and deaths per million population. ",1330384043431649281,2020-11-22 05:34:07,0,0,"Place(_api=<tweepy.api.API object at 0x7f9846c20790>, id='001907e868d06e24', url='https://api.twitter.com/1.1/geo/id/001907e868d06e24.json', place_type='admin', name='Dubai', full_name='Dubai, United Arab Emirates', country_code='AE', country='United Arab Emirates', contained_within=[], bounding_box=BoundingBox(_api=<tweepy.api.API object at 0x7f9846c20790>, type='Polygon', coordinates=[[[54.8939725, 24.6182526], [56.2083722, 24.6182526], [56.2083722, 25.3686719], [54.8939725, 25.3686719]]]), attributes={})"
4,Pre-mature COVID-19,1330381777932836865,2020-11-22 05:25:07,0,0,"Place(_api=<tweepy.api.API object at 0x7f9846c20790>, id='001907e868d06e24', url='https://api.twitter.com/1.1/geo/id/001907e868d06e24.json', place_type='admin', name='Dubai', full_name='Dubai, United Arab Emirates', country_code='AE', country='United Arab Emirates', contained_within=[], bounding_box=BoundingBox(_api=<tweepy.api.API object at 0x7f9846c20790>, type='Polygon', coordinates=[[[54.8939725, 24.6182526], [56.2083722, 24.6182526], [56.2083722, 25.3686719], [54.8939725, 25.3686719]]]), attributes={})"
5,Getting stabbed Getting a COVID-19 blood test,1330375744321687552,2020-11-22 05:01:09,0,0,"Place(_api=<tweepy.api.API object at 0x7f9846c20790>, id='00f24ae701a1207b', url='https://api.twitter.com/1.1/geo/id/00f24ae701a1207b.json', place_type='admin', name='Abu Dhabi', full_name='Abu Dhabi, United Arab Emirates', country_code='AE', country='United Arab Emirates', contained_within=[], bounding_box=BoundingBox(_api=<tweepy.api.API object at 0x7f9846c20790>, type='Polygon', coordinates=[[[51.2938738, 22.6261387], [56.0175464, 22.6261387], [56.0175464, 25.1639588], [51.2938738, 25.1639588]]]), attributes={})"
6,"COVID is catching up with friends and known people now, guess everyone shall be infected one day or other ",1330370329328410624,2020-11-22 04:39:38,1,0,"Place(_api=<tweepy.api.API object at 0x7f9846c20790>, id='001907e868d06e24', url='https://api.twitter.com/1.1/geo/id/001907e868d06e24.json', place_type='admin', name='Dubai', full_name='Dubai, United Arab Emirates', country_code='AE', country='United Arab Emirates', contained_within=[], bounding_box=BoundingBox(_api=<tweepy.api.API object at 0x7f9846c20790>, type='Polygon', coordinates=[[[54.8939725, 24.6182526], [56.2083722, 24.6182526], [56.2083722, 25.3686719], [54.8939725, 25.3686719]]]), attributes={})"
