,Tweets,id,date,likes,retweets,place
111,Is this the nazr free or covid hater free zone,1342475764952948738,2020-12-25 14:22:19,2,0,"Place(_api=<tweepy.api.API object at 0x7fb834b66cd0>, id='001907e868d06e24', url='https://api.twitter.com/1.1/geo/id/001907e868d06e24.json', place_type='admin', name='Dubai', full_name='Dubai, United Arab Emirates', country_code='AE', country='United Arab Emirates', contained_within=[], bounding_box=BoundingBox(_api=<tweepy.api.API object at 0x7fb834b66cd0>, type='Polygon', coordinates=[[[54.8939725, 24.6182526], [56.2083722, 24.6182526], [56.2083722, 25.3686719], [54.8939725, 25.3686719]]]), attributes={})"
112,Christmas: the covid edition ,1342456749450817538,2020-12-25 13:06:45,18,0,"Place(_api=<tweepy.api.API object at 0x7fb834b66cd0>, id='001907e868d06e24', url='https://api.twitter.com/1.1/geo/id/001907e868d06e24.json', place_type='admin', name='Dubai', full_name='Dubai, United Arab Emirates', country_code='AE', country='United Arab Emirates', contained_within=[], bounding_box=BoundingBox(_api=<tweepy.api.API object at 0x7fb834b66cd0>, type='Polygon', coordinates=[[[54.8939725, 24.6182526], [56.2083722, 24.6182526], [56.2083722, 25.3686719], [54.8939725, 25.3686719]]]), attributes={})"
113,lol Covid has made these guys at this 5-star hotel pitching for sachet real estate.,1342430858259673088,2020-12-25 11:23:52,0,0,"Place(_api=<tweepy.api.API object at 0x7fb834b66cd0>, id='001907e868d06e24', url='https://api.twitter.com/1.1/geo/id/001907e868d06e24.json', place_type='admin', name='Dubai', full_name='Dubai, United Arab Emirates', country_code='AE', country='United Arab Emirates', contained_within=[], bounding_box=BoundingBox(_api=<tweepy.api.API object at 0x7fb834b66cd0>, type='Polygon', coordinates=[[[54.8939725, 24.6182526], [56.2083722, 24.6182526], [56.2083722, 25.3686719], [54.8939725, 25.3686719]]]), attributes={})"
114,COVID 20,1342418539806863360,2020-12-25 10:34:55,0,0,"Place(_api=<tweepy.api.API object at 0x7fb834b66cd0>, id='001907e868d06e24', url='https://api.twitter.com/1.1/geo/id/001907e868d06e24.json', place_type='admin', name='Dubai', full_name='Dubai, United Arab Emirates', country_code='AE', country='United Arab Emirates', contained_within=[], bounding_box=BoundingBox(_api=<tweepy.api.API object at 0x7fb834b66cd0>, type='Polygon', coordinates=[[[54.8939725, 24.6182526], [56.2083722, 24.6182526], [56.2083722, 25.3686719], [54.8939725, 25.3686719]]]), attributes={})"
115,"Merry Christmas to all of my colleagues We have all worked tirelessly this year to maintain access to justice, fight for legal aid and most importantly assist with the running of the courts during COVID-19. I hope you are all enjoying a well deserved glass of wine. Love from Dubai ",1342417712388202497,2020-12-25 10:31:38,14,0,"Place(_api=<tweepy.api.API object at 0x7fb834b66cd0>, id='001907e868d06e24', url='https://api.twitter.com/1.1/geo/id/001907e868d06e24.json', place_type='admin', name='Dubai', full_name='Dubai, United Arab Emirates', country_code='AE', country='United Arab Emirates', contained_within=[], bounding_box=BoundingBox(_api=<tweepy.api.API object at 0x7fb834b66cd0>, type='Polygon', coordinates=[[[54.8939725, 24.6182526], [56.2083722, 24.6182526], [56.2083722, 25.3686719], [54.8939725, 25.3686719]]]), attributes={})"
116,Got the Covid vaccine ,1342414214925791232,2020-12-25 10:17:44,5,0,"Place(_api=<tweepy.api.API object at 0x7fb834b66cd0>, id='001907e868d06e24', url='https://api.twitter.com/1.1/geo/id/001907e868d06e24.json', place_type='admin', name='Dubai', full_name='Dubai, United Arab Emirates', country_code='AE', country='United Arab Emirates', contained_within=[], bounding_box=BoundingBox(_api=<tweepy.api.API object at 0x7fb834b66cd0>, type='Polygon', coordinates=[[[54.8939725, 24.6182526], [56.2083722, 24.6182526], [56.2083722, 25.3686719], [54.8939725, 25.3686719]]]), attributes={})"
117,"Then there are those who think that you being single on Christmas day shows that you're a horrible Person. You know, there must be some something else in the air asides covid that can explain this collective foolishness that some people are manifesting.",1342387500061483009,2020-12-25 08:31:35,27,24,"Place(_api=<tweepy.api.API object at 0x7fb834b66cd0>, id='001907e868d06e24', url='https://api.twitter.com/1.1/geo/id/001907e868d06e24.json', place_type='admin', name='Dubai', full_name='Dubai, United Arab Emirates', country_code='AE', country='United Arab Emirates', contained_within=[], bounding_box=BoundingBox(_api=<tweepy.api.API object at 0x7fb834b66cd0>, type='Polygon', coordinates=[[[54.8939725, 24.6182526], [56.2083722, 24.6182526], [56.2083722, 25.3686719], [54.8939725, 25.3686719]]]), attributes={})"
118,And the fuckery over covid. Two fuck ups for the price of one,1342372820442079232,2020-12-25 07:33:15,0,0,"Place(_api=<tweepy.api.API object at 0x7fb834b66cd0>, id='001907e868d06e24', url='https://api.twitter.com/1.1/geo/id/001907e868d06e24.json', place_type='admin', name='Dubai', full_name='Dubai, United Arab Emirates', country_code='AE', country='United Arab Emirates', contained_within=[], bounding_box=BoundingBox(_api=<tweepy.api.API object at 0x7fb834b66cd0>, type='Polygon', coordinates=[[[54.8939725, 24.6182526], [56.2083722, 24.6182526], [56.2083722, 25.3686719], [54.8939725, 25.3686719]]]), attributes={})"
119,The Emirates Red Crescent Authority would like to wish all of our Christian brothers and sisters around the world a peaceful and Merry Christmas.,1342364257736863745,2020-12-25 06:59:13,1,1,"Place(_api=<tweepy.api.API object at 0x7fb834b66cd0>, id='00f24ae701a1207b', url='https://api.twitter.com/1.1/geo/id/00f24ae701a1207b.json', place_type='admin', name='Abu Dhabi', full_name='Abu Dhabi, United Arab Emirates', country_code='AE', country='United Arab Emirates', contained_within=[], bounding_box=BoundingBox(_api=<tweepy.api.API object at 0x7fb834b66cd0>, type='Polygon', coordinates=[[[51.2938738, 22.6261387], [56.0175464, 22.6261387], [56.0175464, 25.1639588], [51.2938738, 25.1639588]]]), attributes={})"
120,"It’s a really ghoulish statement, the corollary being that we should not give a thought to anyone who died of COVID. What an ugly mind",1342335265323552769,2020-12-25 05:04:01,0,0,"Place(_api=<tweepy.api.API object at 0x7fb834b66cd0>, id='001907e868d06e24', url='https://api.twitter.com/1.1/geo/id/001907e868d06e24.json', place_type='admin', name='Dubai', full_name='Dubai, United Arab Emirates', country_code='AE', country='United Arab Emirates', contained_within=[], bounding_box=BoundingBox(_api=<tweepy.api.API object at 0x7fb834b66cd0>, type='Polygon', coordinates=[[[54.8939725, 24.6182526], [56.2083722, 24.6182526], [56.2083722, 25.3686719], [54.8939725, 25.3686719]]]), attributes={})"
121,"I was happy to be a citizen of global Britain, an open and liberal country happy to partner with other allies. Since the Brexit b***is and the COVID catastrophe, it is now me who is leaving. Hope you’re happy UK, this is what you’ve driven young people to. ",1342231736743292929,2020-12-24 22:12:38,17,1,"Place(_api=<tweepy.api.API object at 0x7fb834b66cd0>, id='001907e868d06e24', url='https://api.twitter.com/1.1/geo/id/001907e868d06e24.json', place_type='admin', name='Dubai', full_name='Dubai, United Arab Emirates', country_code='AE', country='United Arab Emirates', contained_within=[], bounding_box=BoundingBox(_api=<tweepy.api.API object at 0x7fb834b66cd0>, type='Polygon', coordinates=[[[54.8939725, 24.6182526], [56.2083722, 24.6182526], [56.2083722, 25.3686719], [54.8939725, 25.3686719]]]), attributes={})"
122,"Christ, you were born today, l thank you for the gift of life and love amidst this tragedy error of Covid-19. Merry Christmas to you all.  ",1342225276160380928,2020-12-24 21:46:57,1,0,"Place(_api=<tweepy.api.API object at 0x7fb834b66cd0>, id='001907e868d06e24', url='https://api.twitter.com/1.1/geo/id/001907e868d06e24.json', place_type='admin', name='Dubai', full_name='Dubai, United Arab Emirates', country_code='AE', country='United Arab Emirates', contained_within=[], bounding_box=BoundingBox(_api=<tweepy.api.API object at 0x7fb834b66cd0>, type='Polygon', coordinates=[[[54.8939725, 24.6182526], [56.2083722, 24.6182526], [56.2083722, 25.3686719], [54.8939725, 25.3686719]]]), attributes={})"
123,Corona life,1342215917485383686,2020-12-24 21:09:46,0,0,"Place(_api=<tweepy.api.API object at 0x7fb834b66cd0>, id='00f24ae701a1207b', url='https://api.twitter.com/1.1/geo/id/00f24ae701a1207b.json', place_type='admin', name='Abu Dhabi', full_name='Abu Dhabi, United Arab Emirates', country_code='AE', country='United Arab Emirates', contained_within=[], bounding_box=BoundingBox(_api=<tweepy.api.API object at 0x7fb834b66cd0>, type='Polygon', coordinates=[[[51.2938738, 22.6261387], [56.0175464, 22.6261387], [56.0175464, 25.1639588], [51.2938738, 25.1639588]]]), attributes={})"
124,"Ok, update - after a nervy 24 hours - Mum is not covid positive  In hospital until at least 29th which obviously sucks but, for now, we’ll take that.",1342212796294041600,2020-12-24 20:57:22,32,0,"Place(_api=<tweepy.api.API object at 0x7fb834b66cd0>, id='001907e868d06e24', url='https://api.twitter.com/1.1/geo/id/001907e868d06e24.json', place_type='admin', name='Dubai', full_name='Dubai, United Arab Emirates', country_code='AE', country='United Arab Emirates', contained_within=[], bounding_box=BoundingBox(_api=<tweepy.api.API object at 0x7fb834b66cd0>, type='Polygon', coordinates=[[[54.8939725, 24.6182526], [56.2083722, 24.6182526], [56.2083722, 25.3686719], [54.8939725, 25.3686719]]]), attributes={})"
125,Midnight Christmas vigil in the times of Covid. ,1342203111847428100,2020-12-24 20:18:53,1,0,"Place(_api=<tweepy.api.API object at 0x7fb834b66cd0>, id='001907e868d06e24', url='https://api.twitter.com/1.1/geo/id/001907e868d06e24.json', place_type='admin', name='Dubai', full_name='Dubai, United Arab Emirates', country_code='AE', country='United Arab Emirates', contained_within=[], bounding_box=BoundingBox(_api=<tweepy.api.API object at 0x7fb834b66cd0>, type='Polygon', coordinates=[[[54.8939725, 24.6182526], [56.2083722, 24.6182526], [56.2083722, 25.3686719], [54.8939725, 25.3686719]]]), attributes={})"
126,"SINIS HEIL  QUI MORITURI TE SALUTANT VOS Heil China  Those about to die salute you  (Die of Covid, of course, China's magnificient gift to the world)",1342175573192433670,2020-12-24 18:29:27,0,0,"Place(_api=<tweepy.api.API object at 0x7fb834b66cd0>, id='001907e868d06e24', url='https://api.twitter.com/1.1/geo/id/001907e868d06e24.json', place_type='admin', name='Dubai', full_name='Dubai, United Arab Emirates', country_code='AE', country='United Arab Emirates', contained_within=[], bounding_box=BoundingBox(_api=<tweepy.api.API object at 0x7fb834b66cd0>, type='Polygon', coordinates=[[[54.8939725, 24.6182526], [56.2083722, 24.6182526], [56.2083722, 25.3686719], [54.8939725, 25.3686719]]]), attributes={})"
127,"Wishing everyone a Merry Xmas Hopefully Santa can find a way around the new curfew imposed and make his way to all the hopeful stockings. For those concerned about Santa being COVID -, don’t be. Dr Fauci said Santa is C-19 neg ",1342175570038284288,2020-12-24 18:29:26,0,1,"Place(_api=<tweepy.api.API object at 0x7fb834b66cd0>, id='001907e868d06e24', url='https://api.twitter.com/1.1/geo/id/001907e868d06e24.json', place_type='admin', name='Dubai', full_name='Dubai, United Arab Emirates', country_code='AE', country='United Arab Emirates', contained_within=[], bounding_box=BoundingBox(_api=<tweepy.api.API object at 0x7fb834b66cd0>, type='Polygon', coordinates=[[[54.8939725, 24.6182526], [56.2083722, 24.6182526], [56.2083722, 25.3686719], [54.8939725, 25.3686719]]]), attributes={})"
128,I am so close now to UAE-Saudi Arabia-Qatar Border. Swabbed one COVID-19 positive patient for his 2nd confirmatory PCR test then driving back to AD. Required mag English. Nag U-Turn ra mi,1342143367564689411,2020-12-24 16:21:29,0,0,"Place(_api=<tweepy.api.API object at 0x7fb834b66cd0>, id='00f24ae701a1207b', url='https://api.twitter.com/1.1/geo/id/00f24ae701a1207b.json', place_type='admin', name='Abu Dhabi', full_name='Abu Dhabi, United Arab Emirates', country_code='AE', country='United Arab Emirates', contained_within=[], bounding_box=BoundingBox(_api=<tweepy.api.API object at 0x7fb834b66cd0>, type='Polygon', coordinates=[[[51.2938738, 22.6261387], [56.0175464, 22.6261387], [56.0175464, 25.1639588], [51.2938738, 25.1639588]]]), attributes={})"
129,For sure Close to the next tier level (not UK Covid tier level ) now  Have a good one and Happy New Year ,1342132154571108352,2020-12-24 15:36:55,1,0,"Place(_api=<tweepy.api.API object at 0x7fb834b66cd0>, id='001907e868d06e24', url='https://api.twitter.com/1.1/geo/id/001907e868d06e24.json', place_type='admin', name='Dubai', full_name='Dubai, United Arab Emirates', country_code='AE', country='United Arab Emirates', contained_within=[], bounding_box=BoundingBox(_api=<tweepy.api.API object at 0x7fb834b66cd0>, type='Polygon', coordinates=[[[54.8939725, 24.6182526], [56.2083722, 24.6182526], [56.2083722, 25.3686719], [54.8939725, 25.3686719]]]), attributes={})"
130,Them Kobe’s was up on GOAT for $400 before they dropped this morning now that they dropped they up to $490 y’all resellers can suck a dick and die from covid and that’s on GOD,1342128069641953280,2020-12-24 15:20:41,0,0,"Place(_api=<tweepy.api.API object at 0x7fb834b66cd0>, id='001907e868d06e24', url='https://api.twitter.com/1.1/geo/id/001907e868d06e24.json', place_type='admin', name='Dubai', full_name='Dubai, United Arab Emirates', country_code='AE', country='United Arab Emirates', contained_within=[], bounding_box=BoundingBox(_api=<tweepy.api.API object at 0x7fb834b66cd0>, type='Polygon', coordinates=[[[54.8939725, 24.6182526], [56.2083722, 24.6182526], [56.2083722, 25.3686719], [54.8939725, 25.3686719]]]), attributes={})"
131,Why in the world would the Speaker try to use unanimous consent rather than making them take a roll call vote against Covid relief  ,1342121444621299715,2020-12-24 14:54:22,37,2,"Place(_api=<tweepy.api.API object at 0x7fb834b66cd0>, id='00f24ae701a1207b', url='https://api.twitter.com/1.1/geo/id/00f24ae701a1207b.json', place_type='admin', name='Abu Dhabi', full_name='Abu Dhabi, United Arab Emirates', country_code='AE', country='United Arab Emirates', contained_within=[], bounding_box=BoundingBox(_api=<tweepy.api.API object at 0x7fb834b66cd0>, type='Polygon', coordinates=[[[51.2938738, 22.6261387], [56.0175464, 22.6261387], [56.0175464, 25.1639588], [51.2938738, 25.1639588]]]), attributes={})"
132,New Corona Virus Terror In United Kingdom  ,1342103540517359617,2020-12-24 13:43:13,0,0,"Place(_api=<tweepy.api.API object at 0x7fb834b66cd0>, id='001907e868d06e24', url='https://api.twitter.com/1.1/geo/id/001907e868d06e24.json', place_type='admin', name='Dubai', full_name='Dubai, United Arab Emirates', country_code='AE', country='United Arab Emirates', contained_within=[], bounding_box=BoundingBox(_api=<tweepy.api.API object at 0x7fb834b66cd0>, type='Polygon', coordinates=[[[54.8939725, 24.6182526], [56.2083722, 24.6182526], [56.2083722, 25.3686719], [54.8939725, 25.3686719]]]), attributes={})"
133,Records had slipped due to Covid-19 ,1342086178678468609,2020-12-24 12:34:14,0,0,"Place(_api=<tweepy.api.API object at 0x7fb834b66cd0>, id='001907e868d06e24', url='https://api.twitter.com/1.1/geo/id/001907e868d06e24.json', place_type='admin', name='Dubai', full_name='Dubai, United Arab Emirates', country_code='AE', country='United Arab Emirates', contained_within=[], bounding_box=BoundingBox(_api=<tweepy.api.API object at 0x7fb834b66cd0>, type='Polygon', coordinates=[[[54.8939725, 24.6182526], [56.2083722, 24.6182526], [56.2083722, 25.3686719], [54.8939725, 25.3686719]]]), attributes={})"
134,Letters to Santa : Corona Edition  What does your child want from this year ,1342067284572073985,2020-12-24 11:19:09,3,0,"Place(_api=<tweepy.api.API object at 0x7fb834b66cd0>, id='001907e868d06e24', url='https://api.twitter.com/1.1/geo/id/001907e868d06e24.json', place_type='admin', name='Dubai', full_name='Dubai, United Arab Emirates', country_code='AE', country='United Arab Emirates', contained_within=[], bounding_box=BoundingBox(_api=<tweepy.api.API object at 0x7fb834b66cd0>, type='Polygon', coordinates=[[[54.8939725, 24.6182526], [56.2083722, 24.6182526], [56.2083722, 25.3686719], [54.8939725, 25.3686719]]]), attributes={})"
135,"I’ve also been astonished at the amount of vaccine skeptics reacting to me getting the shot, who often don’t seem to have even a basic understanding of either COVID or how vaccines work.",1342055554680807424,2020-12-24 10:32:33,1,0,"Place(_api=<tweepy.api.API object at 0x7fb834b66cd0>, id='001907e868d06e24', url='https://api.twitter.com/1.1/geo/id/001907e868d06e24.json', place_type='admin', name='Dubai', full_name='Dubai, United Arab Emirates', country_code='AE', country='United Arab Emirates', contained_within=[], bounding_box=BoundingBox(_api=<tweepy.api.API object at 0x7fb834b66cd0>, type='Polygon', coordinates=[[[54.8939725, 24.6182526], [56.2083722, 24.6182526], [56.2083722, 25.3686719], [54.8939725, 25.3686719]]]), attributes={})"
136,I got the COVID vaccine this week and I feel lucky to be one of the first to get it. On the slow path back to a semblance of normalcy,1342055011224875015,2020-12-24 10:30:23,1,0,"Place(_api=<tweepy.api.API object at 0x7fb834b66cd0>, id='001907e868d06e24', url='https://api.twitter.com/1.1/geo/id/001907e868d06e24.json', place_type='admin', name='Dubai', full_name='Dubai, United Arab Emirates', country_code='AE', country='United Arab Emirates', contained_within=[], bounding_box=BoundingBox(_api=<tweepy.api.API object at 0x7fb834b66cd0>, type='Polygon', coordinates=[[[54.8939725, 24.6182526], [56.2083722, 24.6182526], [56.2083722, 25.3686719], [54.8939725, 25.3686719]]]), attributes={})"
137,"This year has been like no other. As the holidays draw near, we will keep in our hearts and prayers all those families who have been affected by COVID-19 and the Beirut blast. 1/2 ",1342035251456045057,2020-12-24 09:11:52,0,0,"Place(_api=<tweepy.api.API object at 0x7fb834b66cd0>, id='001907e868d06e24', url='https://api.twitter.com/1.1/geo/id/001907e868d06e24.json', place_type='admin', name='Dubai', full_name='Dubai, United Arab Emirates', country_code='AE', country='United Arab Emirates', contained_within=[], bounding_box=BoundingBox(_api=<tweepy.api.API object at 0x7fb834b66cd0>, type='Polygon', coordinates=[[[54.8939725, 24.6182526], [56.2083722, 24.6182526], [56.2083722, 25.3686719], [54.8939725, 25.3686719]]]), attributes={})"
138,"Please do not mess this up The mess is one thing but without our full we can’t recover to be a successful, proud country again. ",1342027940616404994,2020-12-24 08:42:49,89,26,"Place(_api=<tweepy.api.API object at 0x7fb834b66cd0>, id='001907e868d06e24', url='https://api.twitter.com/1.1/geo/id/001907e868d06e24.json', place_type='admin', name='Dubai', full_name='Dubai, United Arab Emirates', country_code='AE', country='United Arab Emirates', contained_within=[], bounding_box=BoundingBox(_api=<tweepy.api.API object at 0x7fb834b66cd0>, type='Polygon', coordinates=[[[54.8939725, 24.6182526], [56.2083722, 24.6182526], [56.2083722, 25.3686719], [54.8939725, 25.3686719]]]), attributes={})"
139,"By March we had 90% immunity. I imagine by now we hv 100%. Immunity isn’t built by staying apart and washing hands. Nor by taking a vaccine for a ‘virus’ that’s not been isolated or purified Also last heard, CDC claimed only 9k lives lost due to COVID OUT OF 250k claimed",1342007795948904450,2020-12-24 07:22:46,0,0,"Place(_api=<tweepy.api.API object at 0x7fb834b66cd0>, id='001907e868d06e24', url='https://api.twitter.com/1.1/geo/id/001907e868d06e24.json', place_type='admin', name='Dubai', full_name='Dubai, United Arab Emirates', country_code='AE', country='United Arab Emirates', contained_within=[], bounding_box=BoundingBox(_api=<tweepy.api.API object at 0x7fb834b66cd0>, type='Polygon', coordinates=[[[54.8939725, 24.6182526], [56.2083722, 24.6182526], [56.2083722, 25.3686719], [54.8939725, 25.3686719]]]), attributes={})"
140,"The truth no one wants to hear is that, you can't have ""your rights to free movement"" and ""fighting covid"" exist side by side.",1342005389123055616,2020-12-24 07:13:12,0,0,"Place(_api=<tweepy.api.API object at 0x7fb834b66cd0>, id='00f24ae701a1207b', url='https://api.twitter.com/1.1/geo/id/00f24ae701a1207b.json', place_type='admin', name='Abu Dhabi', full_name='Abu Dhabi, United Arab Emirates', country_code='AE', country='United Arab Emirates', contained_within=[], bounding_box=BoundingBox(_api=<tweepy.api.API object at 0x7fb834b66cd0>, type='Polygon', coordinates=[[[51.2938738, 22.6261387], [56.0175464, 22.6261387], [56.0175464, 25.1639588], [51.2938738, 25.1639588]]]), attributes={})"
141,May we make money in 2021 like we were before Covid 19 but spend like it’s still 2020,1342000424845504514,2020-12-24 06:53:29,1,0,"Place(_api=<tweepy.api.API object at 0x7fb834b66cd0>, id='001907e868d06e24', url='https://api.twitter.com/1.1/geo/id/001907e868d06e24.json', place_type='admin', name='Dubai', full_name='Dubai, United Arab Emirates', country_code='AE', country='United Arab Emirates', contained_within=[], bounding_box=BoundingBox(_api=<tweepy.api.API object at 0x7fb834b66cd0>, type='Polygon', coordinates=[[[54.8939725, 24.6182526], [56.2083722, 24.6182526], [56.2083722, 25.3686719], [54.8939725, 25.3686719]]]), attributes={})"
142,"2020 has been a tough year for everyone due to COVID-19. On this , I pray for a light that will shine through to all, ease our burdens and remind us that God had it all planned out despite the aches and pains - that He will never abandon and lead His flock astray. ",1341989837226840064,2020-12-24 06:11:24,0,0,"Place(_api=<tweepy.api.API object at 0x7fb834b66cd0>, id='01bb72922e8454b4', url='https://api.twitter.com/1.1/geo/id/01bb72922e8454b4.json', place_type='admin', name='Fujairah', full_name='Fujairah, United Arab Emirates', country_code='AE', country='United Arab Emirates', contained_within=[], bounding_box=BoundingBox(_api=<tweepy.api.API object at 0x7fb834b66cd0>, type='Polygon', coordinates=[[[55.9170692, 25.0871026], [56.3739998, 25.0871026], [56.3739998, 25.6625265], [55.9170692, 25.6625265]]]), attributes={})"
143,"These kids COVID test cleared to travel. Please be safe out there wear that mask, sanitize and social distance we need you a year from today safe and healthy ",1341973410226843649,2020-12-24 05:06:08,19,3,"Place(_api=<tweepy.api.API object at 0x7fb834b66cd0>, id='0fc29969d814c000', url='https://api.twitter.com/1.1/geo/id/0fc29969d814c000.json', place_type='poi', name='Emirates Business Class Lounge', full_name='Emirates Business Class Lounge', country_code='AE', country='United Arab Emirates', contained_within=[], bounding_box=BoundingBox(_api=<tweepy.api.API object at 0x7fb834b66cd0>, type='Polygon', coordinates=[[[55.36133050918579, 25.248538743682897], [55.36133050918579, 25.248538743682897], [55.36133050918579, 25.248538743682897], [55.36133050918579, 25.248538743682897]]]), attributes={})"
144,"Best new headline I’ve read so far “ A COVID LOCKDOWN AND 200,000 UNPLANNED BABIES”",1341928608026271744,2020-12-24 02:08:06,0,0,"Place(_api=<tweepy.api.API object at 0x7fb834b66cd0>, id='001907e868d06e24', url='https://api.twitter.com/1.1/geo/id/001907e868d06e24.json', place_type='admin', name='Dubai', full_name='Dubai, United Arab Emirates', country_code='AE', country='United Arab Emirates', contained_within=[], bounding_box=BoundingBox(_api=<tweepy.api.API object at 0x7fb834b66cd0>, type='Polygon', coordinates=[[[54.8939725, 24.6182526], [56.2083722, 24.6182526], [56.2083722, 25.3686719], [54.8939725, 25.3686719]]]), attributes={})"
145,Compliments of the Season. Celebrate safely. COVID-19 is still out there,1341816789802622976,2020-12-23 18:43:47,0,0,"Place(_api=<tweepy.api.API object at 0x7fb834b66cd0>, id='001907e868d06e24', url='https://api.twitter.com/1.1/geo/id/001907e868d06e24.json', place_type='admin', name='Dubai', full_name='Dubai, United Arab Emirates', country_code='AE', country='United Arab Emirates', contained_within=[], bounding_box=BoundingBox(_api=<tweepy.api.API object at 0x7fb834b66cd0>, type='Polygon', coordinates=[[[54.8939725, 24.6182526], [56.2083722, 24.6182526], [56.2083722, 25.3686719], [54.8939725, 25.3686719]]]), attributes={})"
146,I got my first does of Covid 19 free of cost. Thanks to the visionary leaders of UAE. ,1341800985623203841,2020-12-23 17:40:59,1,0,"Place(_api=<tweepy.api.API object at 0x7fb834b66cd0>, id='00f24ae701a1207b', url='https://api.twitter.com/1.1/geo/id/00f24ae701a1207b.json', place_type='admin', name='Abu Dhabi', full_name='Abu Dhabi, United Arab Emirates', country_code='AE', country='United Arab Emirates', contained_within=[], bounding_box=BoundingBox(_api=<tweepy.api.API object at 0x7fb834b66cd0>, type='Polygon', coordinates=[[[51.2938738, 22.6261387], [56.0175464, 22.6261387], [56.0175464, 25.1639588], [51.2938738, 25.1639588]]]), attributes={})"
147,"Yes Let’s get the jab done is given free to all residents in Just call 800 342 or use the DHA (Dubai Health Authority) app to book an appointment. @ Dubai, United Arab Emirates ",1341800426799296514,2020-12-23 17:38:45,0,0,"Place(_api=<tweepy.api.API object at 0x7fb834b66cd0>, id='001907e868d06e24', url='https://api.twitter.com/1.1/geo/id/001907e868d06e24.json', place_type='admin', name='Dubai', full_name='Dubai, United Arab Emirates', country_code='AE', country='United Arab Emirates', contained_within=[], bounding_box=BoundingBox(_api=<tweepy.api.API object at 0x7fb834b66cd0>, type='Polygon', coordinates=[[[54.8939725, 24.6182526], [56.2083722, 24.6182526], [56.2083722, 25.3686719], [54.8939725, 25.3686719]]]), attributes={})"
