,Tweets,id,date,likes,retweets,place
0,"Visit us On December 16, 4pm - 8pm and meet our Enrolment Advisors Find out how you can avail our 30% COVID-19 Financial Relief* offer for Spring 2021 programs *T&amp;Cs apply BOOK YOUR APPOINTMENT NOW:  . . . ",1338035932872790020,2020-12-13 08:20:00,1,2,"Place(_api=<tweepy.api.API object at 0x7efc5e9f9790>, id='001907e868d06e24', url='https://api.twitter.com/1.1/geo/id/001907e868d06e24.json', place_type='admin', name='Dubai', full_name='Dubai, United Arab Emirates', country_code='AE', country='United Arab Emirates', contained_within=[], bounding_box=BoundingBox(_api=<tweepy.api.API object at 0x7efc5e9f9790>, type='Polygon', coordinates=[[[54.8939725, 24.6182526], [56.2083722, 24.6182526], [56.2083722, 25.3686719], [54.8939725, 25.3686719]]]), attributes={})"
1,Hope people will value and will appreciate their jobs and business more. This is my conviction post Covid 19,1338020352711139329,2020-12-13 07:18:05,0,0,"Place(_api=<tweepy.api.API object at 0x7efc5e9f9790>, id='001907e868d06e24', url='https://api.twitter.com/1.1/geo/id/001907e868d06e24.json', place_type='admin', name='Dubai', full_name='Dubai, United Arab Emirates', country_code='AE', country='United Arab Emirates', contained_within=[], bounding_box=BoundingBox(_api=<tweepy.api.API object at 0x7efc5e9f9790>, type='Polygon', coordinates=[[[54.8939725, 24.6182526], [56.2083722, 24.6182526], [56.2083722, 25.3686719], [54.8939725, 25.3686719]]]), attributes={})"
2,Our fourth race meeting gets underway today 13th December 2020 at 5-00 pm sadly without the public due to COVID-19 protocols good luck to everyone ,1338005276264370179,2020-12-13 06:18:11,2,0,"Place(_api=<tweepy.api.API object at 0x7efc5e9f9790>, id='00f24ae701a1207b', url='https://api.twitter.com/1.1/geo/id/00f24ae701a1207b.json', place_type='admin', name='Abu Dhabi', full_name='Abu Dhabi, United Arab Emirates', country_code='AE', country='United Arab Emirates', contained_within=[], bounding_box=BoundingBox(_api=<tweepy.api.API object at 0x7efc5e9f9790>, type='Polygon', coordinates=[[[51.2938738, 22.6261387], [56.0175464, 22.6261387], [56.0175464, 25.1639588], [51.2938738, 25.1639588]]]), attributes={})"
3,"So all the MPs , and had gathered to have dinner. Are they immune to Covid Have they taken the vaccine What about JVP MPs and MPs",1337999895257550848,2020-12-13 05:56:48,0,0,"Place(_api=<tweepy.api.API object at 0x7efc5e9f9790>, id='001907e868d06e24', url='https://api.twitter.com/1.1/geo/id/001907e868d06e24.json', place_type='admin', name='Dubai', full_name='Dubai, United Arab Emirates', country_code='AE', country='United Arab Emirates', contained_within=[], bounding_box=BoundingBox(_api=<tweepy.api.API object at 0x7efc5e9f9790>, type='Polygon', coordinates=[[[54.8939725, 24.6182526], [56.2083722, 24.6182526], [56.2083722, 25.3686719], [54.8939725, 25.3686719]]]), attributes={})"
4,"Daily coronavirus cases break 1,000 mark for 1st time, toughest distancing under review ",1337961567481188356,2020-12-13 03:24:30,0,0,"Place(_api=<tweepy.api.API object at 0x7efc5e9f9790>, id='001907e868d06e24', url='https://api.twitter.com/1.1/geo/id/001907e868d06e24.json', place_type='admin', name='Dubai', full_name='Dubai, United Arab Emirates', country_code='AE', country='United Arab Emirates', contained_within=[], bounding_box=BoundingBox(_api=<tweepy.api.API object at 0x7efc5e9f9790>, type='Polygon', coordinates=[[[54.8939725, 24.6182526], [56.2083722, 24.6182526], [56.2083722, 25.3686719], [54.8939725, 25.3686719]]]), attributes={})"
5,"Subs needed badly: Leerdam for Roldan Gustav for Jones Move Roldan to the wing and Gustav central And I'm really, really bothered there are fans given the Covid-19 situation in Ohio",1337947364980645889,2020-12-13 02:28:04,56,3,"Place(_api=<tweepy.api.API object at 0x7efc5e9f9790>, id='00f24ae701a1207b', url='https://api.twitter.com/1.1/geo/id/00f24ae701a1207b.json', place_type='admin', name='Abu Dhabi', full_name='Abu Dhabi, United Arab Emirates', country_code='AE', country='United Arab Emirates', contained_within=[], bounding_box=BoundingBox(_api=<tweepy.api.API object at 0x7efc5e9f9790>, type='Polygon', coordinates=[[[51.2938738, 22.6261387], [56.0175464, 22.6261387], [56.0175464, 25.1639588], [51.2938738, 25.1639588]]]), attributes={})"
6,"Efficacy rates for the Pfizer/BioNTech Covid-19 vaccine,by group: ",1337932237044592642,2020-12-13 01:27:57,0,8,"Place(_api=<tweepy.api.API object at 0x7efc5e9f9790>, id='001907e868d06e24', url='https://api.twitter.com/1.1/geo/id/001907e868d06e24.json', place_type='admin', name='Dubai', full_name='Dubai, United Arab Emirates', country_code='AE', country='United Arab Emirates', contained_within=[], bounding_box=BoundingBox(_api=<tweepy.api.API object at 0x7efc5e9f9790>, type='Polygon', coordinates=[[[54.8939725, 24.6182526], [56.2083722, 24.6182526], [56.2083722, 25.3686719], [54.8939725, 25.3686719]]]), attributes={})"
7,"What a crappy year 2020 has been for humanity...let’s just hope 2021 isn’t the same. Maybe if we just run really fast, we can make it through to the other side unharmed  ",1337850069194842114,2020-12-12 20:01:27,1,0,"Place(_api=<tweepy.api.API object at 0x7efc5e9f9790>, id='001907e868d06e24', url='https://api.twitter.com/1.1/geo/id/001907e868d06e24.json', place_type='admin', name='Dubai', full_name='Dubai, United Arab Emirates', country_code='AE', country='United Arab Emirates', contained_within=[], bounding_box=BoundingBox(_api=<tweepy.api.API object at 0x7efc5e9f9790>, type='Polygon', coordinates=[[[54.8939725, 24.6182526], [56.2083722, 24.6182526], [56.2083722, 25.3686719], [54.8939725, 25.3686719]]]), attributes={})"
8,In dis covid people still give smiles,1337832236322877440,2020-12-12 18:50:35,1,0,"Place(_api=<tweepy.api.API object at 0x7efc5e9f9790>, id='001907e868d06e24', url='https://api.twitter.com/1.1/geo/id/001907e868d06e24.json', place_type='admin', name='Dubai', full_name='Dubai, United Arab Emirates', country_code='AE', country='United Arab Emirates', contained_within=[], bounding_box=BoundingBox(_api=<tweepy.api.API object at 0x7efc5e9f9790>, type='Polygon', coordinates=[[[54.8939725, 24.6182526], [56.2083722, 24.6182526], [56.2083722, 25.3686719], [54.8939725, 25.3686719]]]), attributes={})"
