,Tweets,id,date,likes,retweets,place
71,why are the baby pools closed in our community. There is no shade in the larger pools and we want to swim with our baby during the day It’s not covid related because we moved from Damac Hills and theirs are open Shall we just move back there,1377912013033250817,2021-04-02 09:13:18,0,0,"Place(_api=<tweepy.api.API object at 0x7fdb6e9ae7f0>, id='001907e868d06e24', url='https://api.twitter.com/1.1/geo/id/001907e868d06e24.json', place_type='admin', name='Dubai', full_name='Dubai, United Arab Emirates', country_code='AE', country='United Arab Emirates', contained_within=[], bounding_box=BoundingBox(_api=<tweepy.api.API object at 0x7fdb6e9ae7f0>, type='Polygon', coordinates=[[[54.8939725, 24.6182526], [56.2083722, 24.6182526], [56.2083722, 25.3686719], [54.8939725, 25.3686719]]]), attributes={})"
72,"There is nothing more uncommon than common sense. why don't u post p'ple who hv bn torture, castrated and killed by this regime cuz they support Bobi wine. The pain u feel whn u lose a family member due to accident or covid, same as others feel Whn their own killed by the state. ",1377911042034966529,2021-04-02 09:09:27,1,0,"Place(_api=<tweepy.api.API object at 0x7fdb6e9ae7f0>, id='00f24ae701a1207b', url='https://api.twitter.com/1.1/geo/id/00f24ae701a1207b.json', place_type='admin', name='Abu Dhabi', full_name='Abu Dhabi, United Arab Emirates', country_code='AE', country='United Arab Emirates', contained_within=[], bounding_box=BoundingBox(_api=<tweepy.api.API object at 0x7fdb6e9ae7f0>, type='Polygon', coordinates=[[[51.2938738, 22.6261387], [56.0175464, 22.6261387], [56.0175464, 25.1639588], [51.2938738, 25.1639588]]]), attributes={})"
73," Reorient yourself and find holistic solutions  A global virtual conference on World Health Day *April 7th, 202 Changing Paradigms in a Pandemic World 2M+ ATTENDEES 120+ SPEAKERS 90+ COUNTRIES 25+SESSIONS Sign up now &gt;&gt;  ",1377908005887377414,2021-04-02 08:57:23,2,1,"Place(_api=<tweepy.api.API object at 0x7fdb6e9ae7f0>, id='001907e868d06e24', url='https://api.twitter.com/1.1/geo/id/001907e868d06e24.json', place_type='admin', name='Dubai', full_name='Dubai, United Arab Emirates', country_code='AE', country='United Arab Emirates', contained_within=[], bounding_box=BoundingBox(_api=<tweepy.api.API object at 0x7fdb6e9ae7f0>, type='Polygon', coordinates=[[[54.8939725, 24.6182526], [56.2083722, 24.6182526], [56.2083722, 25.3686719], [54.8939725, 25.3686719]]]), attributes={})"
74,What a terrible and inhumane experience. The unintended consequences of zero Covid policies...,1377892314375458818,2021-04-02 07:55:02,2,0,"Place(_api=<tweepy.api.API object at 0x7fdb6e9ae7f0>, id='001907e868d06e24', url='https://api.twitter.com/1.1/geo/id/001907e868d06e24.json', place_type='admin', name='Dubai', full_name='Dubai, United Arab Emirates', country_code='AE', country='United Arab Emirates', contained_within=[], bounding_box=BoundingBox(_api=<tweepy.api.API object at 0x7fdb6e9ae7f0>, type='Polygon', coordinates=[[[54.8939725, 24.6182526], [56.2083722, 24.6182526], [56.2083722, 25.3686719], [54.8939725, 25.3686719]]]), attributes={})"
75,We are in the social distancing times one of the industry which was most hurt due to this pandemic is retail. The how these retailers (fashion&amp;beauty) are driving innovations using AR and VR to attract the customers ,1377887117100081153,2021-04-02 07:34:23,0,0,"Place(_api=<tweepy.api.API object at 0x7fdb6e9ae7f0>, id='001907e868d06e24', url='https://api.twitter.com/1.1/geo/id/001907e868d06e24.json', place_type='admin', name='Dubai', full_name='Dubai, United Arab Emirates', country_code='AE', country='United Arab Emirates', contained_within=[], bounding_box=BoundingBox(_api=<tweepy.api.API object at 0x7fdb6e9ae7f0>, type='Polygon', coordinates=[[[54.8939725, 24.6182526], [56.2083722, 24.6182526], [56.2083722, 25.3686719], [54.8939725, 25.3686719]]]), attributes={})"
76,Covid vaccine ,1377883824374304771,2021-04-02 07:21:18,1,0,"Place(_api=<tweepy.api.API object at 0x7fdb6e9ae7f0>, id='001907e868d06e24', url='https://api.twitter.com/1.1/geo/id/001907e868d06e24.json', place_type='admin', name='Dubai', full_name='Dubai, United Arab Emirates', country_code='AE', country='United Arab Emirates', contained_within=[], bounding_box=BoundingBox(_api=<tweepy.api.API object at 0x7fdb6e9ae7f0>, type='Polygon', coordinates=[[[54.8939725, 24.6182526], [56.2083722, 24.6182526], [56.2083722, 25.3686719], [54.8939725, 25.3686719]]]), attributes={})"
77,"Irish govt are an embarrassment. Add countries to quarantine list, some with the highest % of population vaccinated yet leave countries with 30k cases a day off it. Clueless. ",1377842423334891521,2021-04-02 04:36:47,2,0,"Place(_api=<tweepy.api.API object at 0x7fdb6e9ae7f0>, id='001907e868d06e24', url='https://api.twitter.com/1.1/geo/id/001907e868d06e24.json', place_type='admin', name='Dubai', full_name='Dubai, United Arab Emirates', country_code='AE', country='United Arab Emirates', contained_within=[], bounding_box=BoundingBox(_api=<tweepy.api.API object at 0x7fdb6e9ae7f0>, type='Polygon', coordinates=[[[54.8939725, 24.6182526], [56.2083722, 24.6182526], [56.2083722, 25.3686719], [54.8939725, 25.3686719]]]), attributes={})"
78,"Why not to spread systematically contagious, typical Corona virus strain, having just normal common cold symptoms in the case of symptomatic infection",1377778915826151424,2021-04-02 00:24:26,0,0,"Place(_api=<tweepy.api.API object at 0x7fdb6e9ae7f0>, id='001907e868d06e24', url='https://api.twitter.com/1.1/geo/id/001907e868d06e24.json', place_type='admin', name='Dubai', full_name='Dubai, United Arab Emirates', country_code='AE', country='United Arab Emirates', contained_within=[], bounding_box=BoundingBox(_api=<tweepy.api.API object at 0x7fdb6e9ae7f0>, type='Polygon', coordinates=[[[54.8939725, 24.6182526], [56.2083722, 24.6182526], [56.2083722, 25.3686719], [54.8939725, 25.3686719]]]), attributes={})"
