,Tweets,id,date,likes,retweets,place
0,"For this to happen in 2021, with the Pandemic is a big big positivity in my map; well for me as an ARMY.  THEIR hard work, grit, perseverance, blood, sweat and tears are finally showing great results. And it is good.  Yey",1379104258499432453,2021-04-05 16:10:52,3,0,"Place(_api=<tweepy.api.API object at 0x7fdb6e9ae7f0>, id='001907e868d06e24', url='https://api.twitter.com/1.1/geo/id/001907e868d06e24.json', place_type='admin', name='Dubai', full_name='Dubai, United Arab Emirates', country_code='AE', country='United Arab Emirates', contained_within=[], bounding_box=BoundingBox(_api=<tweepy.api.API object at 0x7fdb6e9ae7f0>, type='Polygon', coordinates=[[[54.8939725, 24.6182526], [56.2083722, 24.6182526], [56.2083722, 25.3686719], [54.8939725, 25.3686719]]]), attributes={})"
1,"دبي, دبي - I had hot pot on a Thursday and woke up running with a fever and diarreah. At first I thought it was Covid but I hadn't lost my sense of taste and... Food Poisoning ",1379060412147175427,2021-04-05 13:16:38,0,0,"Place(_api=<tweepy.api.API object at 0x7fdb6e9ae7f0>, id='001907e868d06e24', url='https://api.twitter.com/1.1/geo/id/001907e868d06e24.json', place_type='admin', name='Dubai', full_name='Dubai, United Arab Emirates', country_code='AE', country='United Arab Emirates', contained_within=[], bounding_box=BoundingBox(_api=<tweepy.api.API object at 0x7fdb6e9ae7f0>, type='Polygon', coordinates=[[[54.8939725, 24.6182526], [56.2083722, 24.6182526], [56.2083722, 25.3686719], [54.8939725, 25.3686719]]]), attributes={})"
2,"I get that, but how many are flying in They need to stay in a quarantine hotel and have a negative test before flying, and 2 while in the hotel",1379050704137027584,2021-04-05 12:38:04,0,0,"Place(_api=<tweepy.api.API object at 0x7fdb6e9ae7f0>, id='001907e868d06e24', url='https://api.twitter.com/1.1/geo/id/001907e868d06e24.json', place_type='admin', name='Dubai', full_name='Dubai, United Arab Emirates', country_code='AE', country='United Arab Emirates', contained_within=[], bounding_box=BoundingBox(_api=<tweepy.api.API object at 0x7fdb6e9ae7f0>, type='Polygon', coordinates=[[[54.8939725, 24.6182526], [56.2083722, 24.6182526], [56.2083722, 25.3686719], [54.8939725, 25.3686719]]]), attributes={})"
3,"Quarantine is still needed for India, and flights are currently suspended to India. Numbers are high, as you say, but not sure how many passengers are coming in from India daily",1379042454318497794,2021-04-05 12:05:17,1,0,"Place(_api=<tweepy.api.API object at 0x7fdb6e9ae7f0>, id='001907e868d06e24', url='https://api.twitter.com/1.1/geo/id/001907e868d06e24.json', place_type='admin', name='Dubai', full_name='Dubai, United Arab Emirates', country_code='AE', country='United Arab Emirates', contained_within=[], bounding_box=BoundingBox(_api=<tweepy.api.API object at 0x7fdb6e9ae7f0>, type='Polygon', coordinates=[[[54.8939725, 24.6182526], [56.2083722, 24.6182526], [56.2083722, 25.3686719], [54.8939725, 25.3686719]]]), attributes={})"
4,"True but tbh the owners ain’t selling up anytime soon. It ain’t happening during a pandemic. Jose was always a gamble, one which looks like back firing. His tram selections are now nothing short of disgraceful.",1379012493578792961,2021-04-05 10:06:13,0,0,"Place(_api=<tweepy.api.API object at 0x7fdb6e9ae7f0>, id='001907e868d06e24', url='https://api.twitter.com/1.1/geo/id/001907e868d06e24.json', place_type='admin', name='Dubai', full_name='Dubai, United Arab Emirates', country_code='AE', country='United Arab Emirates', contained_within=[], bounding_box=BoundingBox(_api=<tweepy.api.API object at 0x7fdb6e9ae7f0>, type='Polygon', coordinates=[[[54.8939725, 24.6182526], [56.2083722, 24.6182526], [56.2083722, 25.3686719], [54.8939725, 25.3686719]]]), attributes={})"
5,He was covid tested Wednesday. Surely to fly into the UK he would have been covid tested. He trained Thursday and Friday. Jose is blatantly lying. His team selection cost us 3 points.,1379009913981186048,2021-04-05 09:55:58,0,0,"Place(_api=<tweepy.api.API object at 0x7fdb6e9ae7f0>, id='001907e868d06e24', url='https://api.twitter.com/1.1/geo/id/001907e868d06e24.json', place_type='admin', name='Dubai', full_name='Dubai, United Arab Emirates', country_code='AE', country='United Arab Emirates', contained_within=[], bounding_box=BoundingBox(_api=<tweepy.api.API object at 0x7fdb6e9ae7f0>, type='Polygon', coordinates=[[[54.8939725, 24.6182526], [56.2083722, 24.6182526], [56.2083722, 25.3686719], [54.8939725, 25.3686719]]]), attributes={})"
6,"Pinarayi led LDF government in Kerala doesn’t deserve a second chance, electing them for a second term is suicidal and giving them a whip to punish us, claiming them providing free kit and food stuff during the pandemic is not their magnanimity, it’s our rigt and frm our own mony",1379005954017087490,2021-04-05 09:40:14,0,0,"Place(_api=<tweepy.api.API object at 0x7fdb6e9ae7f0>, id='001907e868d06e24', url='https://api.twitter.com/1.1/geo/id/001907e868d06e24.json', place_type='admin', name='Dubai', full_name='Dubai, United Arab Emirates', country_code='AE', country='United Arab Emirates', contained_within=[], bounding_box=BoundingBox(_api=<tweepy.api.API object at 0x7fdb6e9ae7f0>, type='Polygon', coordinates=[[[54.8939725, 24.6182526], [56.2083722, 24.6182526], [56.2083722, 25.3686719], [54.8939725, 25.3686719]]]), attributes={})"
7,"Baby vaccines in the morning, COVID vaccine for me in the afternoon. So far I've cried the most.",1378999273237405697,2021-04-05 09:13:41,7,0,"Place(_api=<tweepy.api.API object at 0x7fdb6e9ae7f0>, id='001907e868d06e24', url='https://api.twitter.com/1.1/geo/id/001907e868d06e24.json', place_type='admin', name='Dubai', full_name='Dubai, United Arab Emirates', country_code='AE', country='United Arab Emirates', contained_within=[], bounding_box=BoundingBox(_api=<tweepy.api.API object at 0x7fdb6e9ae7f0>, type='Polygon', coordinates=[[[54.8939725, 24.6182526], [56.2083722, 24.6182526], [56.2083722, 25.3686719], [54.8939725, 25.3686719]]]), attributes={})"
8,Prayers for Both of them to Recovery from Corona  Hope They Will be fit and fine by the Grace Of God ,1378984597451640832,2021-04-05 08:15:22,3,0,"Place(_api=<tweepy.api.API object at 0x7fdb6e9ae7f0>, id='001907e868d06e24', url='https://api.twitter.com/1.1/geo/id/001907e868d06e24.json', place_type='admin', name='Dubai', full_name='Dubai, United Arab Emirates', country_code='AE', country='United Arab Emirates', contained_within=[], bounding_box=BoundingBox(_api=<tweepy.api.API object at 0x7fdb6e9ae7f0>, type='Polygon', coordinates=[[[54.8939725, 24.6182526], [56.2083722, 24.6182526], [56.2083722, 25.3686719], [54.8939725, 25.3686719]]]), attributes={})"
9,How COVID-19 Affects the Brain ,1378978713421889540,2021-04-05 07:52:00,2,1,"Place(_api=<tweepy.api.API object at 0x7fdb6e9ae7f0>, id='00f24ae701a1207b', url='https://api.twitter.com/1.1/geo/id/00f24ae701a1207b.json', place_type='admin', name='Abu Dhabi', full_name='Abu Dhabi, United Arab Emirates', country_code='AE', country='United Arab Emirates', contained_within=[], bounding_box=BoundingBox(_api=<tweepy.api.API object at 0x7fdb6e9ae7f0>, type='Polygon', coordinates=[[[51.2938738, 22.6261387], [56.0175464, 22.6261387], [56.0175464, 25.1639588], [51.2938738, 25.1639588]]]), attributes={})"
10,Got the 2nd dose (@ Covid-19 DHA Vaccination Center in Dubai)  ,1378975799819272200,2021-04-05 07:40:25,0,0,"Place(_api=<tweepy.api.API object at 0x7fdb6e9ae7f0>, id='001907e868d06e24', url='https://api.twitter.com/1.1/geo/id/001907e868d06e24.json', place_type='admin', name='Dubai', full_name='Dubai, United Arab Emirates', country_code='AE', country='United Arab Emirates', contained_within=[], bounding_box=BoundingBox(_api=<tweepy.api.API object at 0x7fdb6e9ae7f0>, type='Polygon', coordinates=[[[54.8939725, 24.6182526], [56.2083722, 24.6182526], [56.2083722, 25.3686719], [54.8939725, 25.3686719]]]), attributes={})"
11,"Playing around with fairy lights and the book case. Such is life in quarantine lol. @ Abu Dhabi, United Arab Emirates ",1378970269222600708,2021-04-05 07:18:26,0,0,"Place(_api=<tweepy.api.API object at 0x7fdb6e9ae7f0>, id='00f24ae701a1207b', url='https://api.twitter.com/1.1/geo/id/00f24ae701a1207b.json', place_type='admin', name='Abu Dhabi', full_name='Abu Dhabi, United Arab Emirates', country_code='AE', country='United Arab Emirates', contained_within=[], bounding_box=BoundingBox(_api=<tweepy.api.API object at 0x7fdb6e9ae7f0>, type='Polygon', coordinates=[[[51.2938738, 22.6261387], [56.0175464, 22.6261387], [56.0175464, 25.1639588], [51.2938738, 25.1639588]]]), attributes={})"
12,Enterprise House in the news again ,1378963559196078080,2021-04-05 06:51:47,1,0,"Place(_api=<tweepy.api.API object at 0x7fdb6e9ae7f0>, id='001907e868d06e24', url='https://api.twitter.com/1.1/geo/id/001907e868d06e24.json', place_type='admin', name='Dubai', full_name='Dubai, United Arab Emirates', country_code='AE', country='United Arab Emirates', contained_within=[], bounding_box=BoundingBox(_api=<tweepy.api.API object at 0x7fdb6e9ae7f0>, type='Polygon', coordinates=[[[54.8939725, 24.6182526], [56.2083722, 24.6182526], [56.2083722, 25.3686719], [54.8939725, 25.3686719]]]), attributes={})"
13,"Be a Corona soldier, always wear the mask, don't let your guard down. let's defeat the virus. Do click down and retweet the video. ",1378939582515982339,2021-04-05 05:16:30,0,0,"Place(_api=<tweepy.api.API object at 0x7fdb6e9ae7f0>, id='001907e868d06e24', url='https://api.twitter.com/1.1/geo/id/001907e868d06e24.json', place_type='admin', name='Dubai', full_name='Dubai, United Arab Emirates', country_code='AE', country='United Arab Emirates', contained_within=[], bounding_box=BoundingBox(_api=<tweepy.api.API object at 0x7fdb6e9ae7f0>, type='Polygon', coordinates=[[[54.8939725, 24.6182526], [56.2083722, 24.6182526], [56.2083722, 25.3686719], [54.8939725, 25.3686719]]]), attributes={})"
14,"Be a Corona soldier, always wear the mask, let's defeat the virus. Do click down and share the video. @ Dubai, United Arab Emirates ",1378937268329648129,2021-04-05 05:07:18,0,0,"Place(_api=<tweepy.api.API object at 0x7fdb6e9ae7f0>, id='001907e868d06e24', url='https://api.twitter.com/1.1/geo/id/001907e868d06e24.json', place_type='admin', name='Dubai', full_name='Dubai, United Arab Emirates', country_code='AE', country='United Arab Emirates', contained_within=[], bounding_box=BoundingBox(_api=<tweepy.api.API object at 0x7fdb6e9ae7f0>, type='Polygon', coordinates=[[[54.8939725, 24.6182526], [56.2083722, 24.6182526], [56.2083722, 25.3686719], [54.8939725, 25.3686719]]]), attributes={})"
15,Country with 1.4 billion population has only approved 1 and a half vaccines. When about 6 worldwide approved vaccines are available. Now on each Corona death is a murder. ,1378933652655116296,2021-04-05 04:52:56,1,1,"Place(_api=<tweepy.api.API object at 0x7fdb6e9ae7f0>, id='001907e868d06e24', url='https://api.twitter.com/1.1/geo/id/001907e868d06e24.json', place_type='admin', name='Dubai', full_name='Dubai, United Arab Emirates', country_code='AE', country='United Arab Emirates', contained_within=[], bounding_box=BoundingBox(_api=<tweepy.api.API object at 0x7fdb6e9ae7f0>, type='Polygon', coordinates=[[[54.8939725, 24.6182526], [56.2083722, 24.6182526], [56.2083722, 25.3686719], [54.8939725, 25.3686719]]]), attributes={})"
16,Rapid Vaccination in all age groups above 18 especially those with any co-morbid conditions and encouraging/enforcing Covid appropriate behavior is the best method to get things under control. ,1378926137129189380,2021-04-05 04:23:04,2,0,"Place(_api=<tweepy.api.API object at 0x7fdb6e9ae7f0>, id='001907e868d06e24', url='https://api.twitter.com/1.1/geo/id/001907e868d06e24.json', place_type='admin', name='Dubai', full_name='Dubai, United Arab Emirates', country_code='AE', country='United Arab Emirates', contained_within=[], bounding_box=BoundingBox(_api=<tweepy.api.API object at 0x7fdb6e9ae7f0>, type='Polygon', coordinates=[[[54.8939725, 24.6182526], [56.2083722, 24.6182526], [56.2083722, 25.3686719], [54.8939725, 25.3686719]]]), attributes={})"
17,"Been a while since I’ve done a ‘WTH are we living through, I hate this global pandemic’ tweet. Who’s with me",1378921682409156609,2021-04-05 04:05:22,15,0,"Place(_api=<tweepy.api.API object at 0x7fdb6e9ae7f0>, id='001907e868d06e24', url='https://api.twitter.com/1.1/geo/id/001907e868d06e24.json', place_type='admin', name='Dubai', full_name='Dubai, United Arab Emirates', country_code='AE', country='United Arab Emirates', contained_within=[], bounding_box=BoundingBox(_api=<tweepy.api.API object at 0x7fdb6e9ae7f0>, type='Polygon', coordinates=[[[54.8939725, 24.6182526], [56.2083722, 24.6182526], [56.2083722, 25.3686719], [54.8939725, 25.3686719]]]), attributes={})"
18,"Let’s not promote alternative testing for coronavirus; -PCR is STILL the gold standard for COVID-19 testing. Spending min. Php1,800 for an “unreliable test” seems unreasonable in this difficult economic time.",1378897821231943683,2021-04-05 02:30:33,2,0,"Place(_api=<tweepy.api.API object at 0x7fdb6e9ae7f0>, id='00f24ae701a1207b', url='https://api.twitter.com/1.1/geo/id/00f24ae701a1207b.json', place_type='admin', name='Abu Dhabi', full_name='Abu Dhabi, United Arab Emirates', country_code='AE', country='United Arab Emirates', contained_within=[], bounding_box=BoundingBox(_api=<tweepy.api.API object at 0x7fdb6e9ae7f0>, type='Polygon', coordinates=[[[51.2938738, 22.6261387], [56.0175464, 22.6261387], [56.0175464, 25.1639588], [51.2938738, 25.1639588]]]), attributes={})"
19,"There’s no sense blaming the government on how to curb the spread of coronavirus, everyone has its own share - yes, the government becomes the source of information, and the people becomes the doer in implementing the minimum health protocol.",1378896064502185984,2021-04-05 02:23:35,5,0,"Place(_api=<tweepy.api.API object at 0x7fdb6e9ae7f0>, id='00f24ae701a1207b', url='https://api.twitter.com/1.1/geo/id/00f24ae701a1207b.json', place_type='admin', name='Abu Dhabi', full_name='Abu Dhabi, United Arab Emirates', country_code='AE', country='United Arab Emirates', contained_within=[], bounding_box=BoundingBox(_api=<tweepy.api.API object at 0x7fdb6e9ae7f0>, type='Polygon', coordinates=[[[51.2938738, 22.6261387], [56.0175464, 22.6261387], [56.0175464, 25.1639588], [51.2938738, 25.1639588]]]), attributes={})"
20,"People in Jordan are fed up with the economic situation, either you cheat the government / people and earn unfairly or you borrow borrow and borrow some more just to a maintain middle class lifestyle. and now w covid the situation is much worse.",1378868308431241219,2021-04-05 00:33:17,0,0,"Place(_api=<tweepy.api.API object at 0x7fdb6e9ae7f0>, id='001907e868d06e24', url='https://api.twitter.com/1.1/geo/id/001907e868d06e24.json', place_type='admin', name='Dubai', full_name='Dubai, United Arab Emirates', country_code='AE', country='United Arab Emirates', contained_within=[], bounding_box=BoundingBox(_api=<tweepy.api.API object at 0x7fdb6e9ae7f0>, type='Polygon', coordinates=[[[54.8939725, 24.6182526], [56.2083722, 24.6182526], [56.2083722, 25.3686719], [54.8939725, 25.3686719]]]), attributes={})"
21,I’ve found the lamp ... what 3 wishes would you wish for  1. To see my friends and family back in the UK   2. Health and happiness for my friends and family  3. Covid can do one  ( Bonus wish: MUFC win everything) ,1378787997924134912,2021-04-04 19:14:10,25,0,"Place(_api=<tweepy.api.API object at 0x7fdb6e9ae7f0>, id='001907e868d06e24', url='https://api.twitter.com/1.1/geo/id/001907e868d06e24.json', place_type='admin', name='Dubai', full_name='Dubai, United Arab Emirates', country_code='AE', country='United Arab Emirates', contained_within=[], bounding_box=BoundingBox(_api=<tweepy.api.API object at 0x7fdb6e9ae7f0>, type='Polygon', coordinates=[[[54.8939725, 24.6182526], [56.2083722, 24.6182526], [56.2083722, 25.3686719], [54.8939725, 25.3686719]]]), attributes={})"
22,Perfect plans aren't workable and assume perfect information Simplistic plans minimise risk and can be tweaked ,1378770239220023298,2021-04-04 18:03:35,0,0,"Place(_api=<tweepy.api.API object at 0x7fdb6e9ae7f0>, id='001907e868d06e24', url='https://api.twitter.com/1.1/geo/id/001907e868d06e24.json', place_type='admin', name='Dubai', full_name='Dubai, United Arab Emirates', country_code='AE', country='United Arab Emirates', contained_within=[], bounding_box=BoundingBox(_api=<tweepy.api.API object at 0x7fdb6e9ae7f0>, type='Polygon', coordinates=[[[54.8939725, 24.6182526], [56.2083722, 24.6182526], [56.2083722, 25.3686719], [54.8939725, 25.3686719]]]), attributes={})"
23,Might suggest to have anti-bodies test. It would also be NOT OK to be vaccinated if you had covid without any test.,1378758940108980226,2021-04-04 17:18:42,0,0,"Place(_api=<tweepy.api.API object at 0x7fdb6e9ae7f0>, id='001907e868d06e24', url='https://api.twitter.com/1.1/geo/id/001907e868d06e24.json', place_type='admin', name='Dubai', full_name='Dubai, United Arab Emirates', country_code='AE', country='United Arab Emirates', contained_within=[], bounding_box=BoundingBox(_api=<tweepy.api.API object at 0x7fdb6e9ae7f0>, type='Polygon', coordinates=[[[54.8939725, 24.6182526], [56.2083722, 24.6182526], [56.2083722, 25.3686719], [54.8939725, 25.3686719]]]), attributes={})"
24,Full article and more interviews here:  ,1378750787203960832,2021-04-04 16:46:18,2,0,"Place(_api=<tweepy.api.API object at 0x7fdb6e9ae7f0>, id='001907e868d06e24', url='https://api.twitter.com/1.1/geo/id/001907e868d06e24.json', place_type='admin', name='Dubai', full_name='Dubai, United Arab Emirates', country_code='AE', country='United Arab Emirates', contained_within=[], bounding_box=BoundingBox(_api=<tweepy.api.API object at 0x7fdb6e9ae7f0>, type='Polygon', coordinates=[[[54.8939725, 24.6182526], [56.2083722, 24.6182526], [56.2083722, 25.3686719], [54.8939725, 25.3686719]]]), attributes={})"
25,2 doses of vaccine for covid done   after so many swab tests Pero let’s still keep safe everyone  ,1378745779276419073,2021-04-04 16:26:24,1,0,"Place(_api=<tweepy.api.API object at 0x7fdb6e9ae7f0>, id='01bb72922e8454b4', url='https://api.twitter.com/1.1/geo/id/01bb72922e8454b4.json', place_type='admin', name='Fujairah', full_name='Fujairah, United Arab Emirates', country_code='AE', country='United Arab Emirates', contained_within=[], bounding_box=BoundingBox(_api=<tweepy.api.API object at 0x7fdb6e9ae7f0>, type='Polygon', coordinates=[[[55.9170692, 25.0871026], [56.3739998, 25.0871026], [56.3739998, 25.6625265], [55.9170692, 25.6625265]]]), attributes={})"
26,"Something is definitely wrong.. I thought time usually slow when you anticipating something, but shii still be running fast and furious. 2021 seems to be in relay race, covid is the baton. ",1378658801226805253,2021-04-04 10:40:47,0,0,"Place(_api=<tweepy.api.API object at 0x7fdb6e9ae7f0>, id='00f24ae701a1207b', url='https://api.twitter.com/1.1/geo/id/00f24ae701a1207b.json', place_type='admin', name='Abu Dhabi', full_name='Abu Dhabi, United Arab Emirates', country_code='AE', country='United Arab Emirates', contained_within=[], bounding_box=BoundingBox(_api=<tweepy.api.API object at 0x7fdb6e9ae7f0>, type='Polygon', coordinates=[[[51.2938738, 22.6261387], [56.0175464, 22.6261387], [56.0175464, 25.1639588], [51.2938738, 25.1639588]]]), attributes={})"
27,"COVID-19 news from Denmark: They have now found out that half of their “rapid” tests give false results. (Remember the UAE flight ban) There’s also a new mutation (E484K), but they can’t link it to travel activity. Still expecting them to blame Dubai at some point, let’s see ",1378655416876478471,2021-04-04 10:27:20,6,1,"Place(_api=<tweepy.api.API object at 0x7fdb6e9ae7f0>, id='001907e868d06e24', url='https://api.twitter.com/1.1/geo/id/001907e868d06e24.json', place_type='admin', name='Dubai', full_name='Dubai, United Arab Emirates', country_code='AE', country='United Arab Emirates', contained_within=[], bounding_box=BoundingBox(_api=<tweepy.api.API object at 0x7fdb6e9ae7f0>, type='Polygon', coordinates=[[[54.8939725, 24.6182526], [56.2083722, 24.6182526], [56.2083722, 25.3686719], [54.8939725, 25.3686719]]]), attributes={})"
28,So the family is temporarily relocating from the UAE to Malaysia. Quarantine beckons.. might pen a style prison diary..sans the prison bit.,1378644228130099205,2021-04-04 09:42:52,0,0,"Place(_api=<tweepy.api.API object at 0x7fdb6e9ae7f0>, id='001907e868d06e24', url='https://api.twitter.com/1.1/geo/id/001907e868d06e24.json', place_type='admin', name='Dubai', full_name='Dubai, United Arab Emirates', country_code='AE', country='United Arab Emirates', contained_within=[], bounding_box=BoundingBox(_api=<tweepy.api.API object at 0x7fdb6e9ae7f0>, type='Polygon', coordinates=[[[54.8939725, 24.6182526], [56.2083722, 24.6182526], [56.2083722, 25.3686719], [54.8939725, 25.3686719]]]), attributes={})"
29,"Move on..... Study while working, Achieve more... Don't let the pandemic to ruin your career ",1378627725276119040,2021-04-04 08:37:18,0,0,"Place(_api=<tweepy.api.API object at 0x7fdb6e9ae7f0>, id='001907e868d06e24', url='https://api.twitter.com/1.1/geo/id/001907e868d06e24.json', place_type='admin', name='Dubai', full_name='Dubai, United Arab Emirates', country_code='AE', country='United Arab Emirates', contained_within=[], bounding_box=BoundingBox(_api=<tweepy.api.API object at 0x7fdb6e9ae7f0>, type='Polygon', coordinates=[[[54.8939725, 24.6182526], [56.2083722, 24.6182526], [56.2083722, 25.3686719], [54.8939725, 25.3686719]]]), attributes={})"
30,Waiting for COVID-19 report.,1378619502640893953,2021-04-04 08:04:37,1,0,"Place(_api=<tweepy.api.API object at 0x7fdb6e9ae7f0>, id='001907e868d06e24', url='https://api.twitter.com/1.1/geo/id/001907e868d06e24.json', place_type='admin', name='Dubai', full_name='Dubai, United Arab Emirates', country_code='AE', country='United Arab Emirates', contained_within=[], bounding_box=BoundingBox(_api=<tweepy.api.API object at 0x7fdb6e9ae7f0>, type='Polygon', coordinates=[[[54.8939725, 24.6182526], [56.2083722, 24.6182526], [56.2083722, 25.3686719], [54.8939725, 25.3686719]]]), attributes={})"
31,Sinopharm vaccine worked for me I developed antibodies to fight the COVID-19 virus ,1378614253125570560,2021-04-04 07:43:46,8,0,"Place(_api=<tweepy.api.API object at 0x7fdb6e9ae7f0>, id='00f24ae701a1207b', url='https://api.twitter.com/1.1/geo/id/00f24ae701a1207b.json', place_type='admin', name='Abu Dhabi', full_name='Abu Dhabi, United Arab Emirates', country_code='AE', country='United Arab Emirates', contained_within=[], bounding_box=BoundingBox(_api=<tweepy.api.API object at 0x7fdb6e9ae7f0>, type='Polygon', coordinates=[[[51.2938738, 22.6261387], [56.0175464, 22.6261387], [56.0175464, 25.1639588], [51.2938738, 25.1639588]]]), attributes={})"
32,"I’m not turning 29 this year, I’m turning 28. Corona year doesn’t count.",1378608796189265941,2021-04-04 07:22:04,3,1,"Place(_api=<tweepy.api.API object at 0x7fdb6e9ae7f0>, id='001907e868d06e24', url='https://api.twitter.com/1.1/geo/id/001907e868d06e24.json', place_type='admin', name='Dubai', full_name='Dubai, United Arab Emirates', country_code='AE', country='United Arab Emirates', contained_within=[], bounding_box=BoundingBox(_api=<tweepy.api.API object at 0x7fdb6e9ae7f0>, type='Polygon', coordinates=[[[54.8939725, 24.6182526], [56.2083722, 24.6182526], [56.2083722, 25.3686719], [54.8939725, 25.3686719]]]), attributes={})"
33,It’s another and a focus on the surprising environmental improvements seen during COVID. Our offer a few suggestions to keep this positive trend. ,1378585519580446722,2021-04-04 05:49:35,0,0,"Place(_api=<tweepy.api.API object at 0x7fdb6e9ae7f0>, id='001907e868d06e24', url='https://api.twitter.com/1.1/geo/id/001907e868d06e24.json', place_type='admin', name='Dubai', full_name='Dubai, United Arab Emirates', country_code='AE', country='United Arab Emirates', contained_within=[], bounding_box=BoundingBox(_api=<tweepy.api.API object at 0x7fdb6e9ae7f0>, type='Polygon', coordinates=[[[54.8939725, 24.6182526], [56.2083722, 24.6182526], [56.2083722, 25.3686719], [54.8939725, 25.3686719]]]), attributes={})"
34,"Happy Easter from the Repair Plus family Remember to “let everything you do, be done in love”. . . . ",1378569180618895364,2021-04-04 04:44:39,0,0,"Place(_api=<tweepy.api.API object at 0x7fdb6e9ae7f0>, id='00f24ae701a1207b', url='https://api.twitter.com/1.1/geo/id/00f24ae701a1207b.json', place_type='admin', name='Abu Dhabi', full_name='Abu Dhabi, United Arab Emirates', country_code='AE', country='United Arab Emirates', contained_within=[], bounding_box=BoundingBox(_api=<tweepy.api.API object at 0x7fdb6e9ae7f0>, type='Polygon', coordinates=[[[51.2938738, 22.6261387], [56.0175464, 22.6261387], [56.0175464, 25.1639588], [51.2938738, 25.1639588]]]), attributes={})"
35,How long before the whole world realize Covid is a scam scheme for wod population reduction,1378568072689287174,2021-04-04 04:40:15,3,0,"Place(_api=<tweepy.api.API object at 0x7fdb6e9ae7f0>, id='001907e868d06e24', url='https://api.twitter.com/1.1/geo/id/001907e868d06e24.json', place_type='admin', name='Dubai', full_name='Dubai, United Arab Emirates', country_code='AE', country='United Arab Emirates', contained_within=[], bounding_box=BoundingBox(_api=<tweepy.api.API object at 0x7fdb6e9ae7f0>, type='Polygon', coordinates=[[[54.8939725, 24.6182526], [56.2083722, 24.6182526], [56.2083722, 25.3686719], [54.8939725, 25.3686719]]]), attributes={})"
