,Tweets,id,date,likes,retweets,place
107,If you have the covid vaccination and don’t post a photo of it on social media then it doesn’t count,1401471171368046597,2021-06-06 09:28:59,2,0,"Place(_api=<tweepy.api.API object at 0x7fe047d417f0>, id='001907e868d06e24', url='https://api.twitter.com/1.1/geo/id/001907e868d06e24.json', place_type='admin', name='Dubai', full_name='Dubai, United Arab Emirates', country_code='AE', country='United Arab Emirates', contained_within=[], bounding_box=BoundingBox(_api=<tweepy.api.API object at 0x7fe047d417f0>, type='Polygon', coordinates=[[[54.8939725, 24.6182526], [56.2083722, 24.6182526], [56.2083722, 25.3686719], [54.8939725, 25.3686719]]]), attributes={})"
108,Online Happiness Program  27 June - 30 June (Sunday to Wednesday)  7:30 pm - 10.00 pm L  Enroll Now with Your Loved Ones to Live Life to the Fullest  Link to Register  ,1401467741735882753,2021-06-06 09:15:22,0,0,"Place(_api=<tweepy.api.API object at 0x7fe047d417f0>, id='001907e868d06e24', url='https://api.twitter.com/1.1/geo/id/001907e868d06e24.json', place_type='admin', name='Dubai', full_name='Dubai, United Arab Emirates', country_code='AE', country='United Arab Emirates', contained_within=[], bounding_box=BoundingBox(_api=<tweepy.api.API object at 0x7fe047d417f0>, type='Polygon', coordinates=[[[54.8939725, 24.6182526], [56.2083722, 24.6182526], [56.2083722, 25.3686719], [54.8939725, 25.3686719]]]), attributes={})"
109,How might gum inflammation affect COVID-19 ,1401454990393282560,2021-06-06 08:24:42,0,0,"Place(_api=<tweepy.api.API object at 0x7fe047d417f0>, id='001907e868d06e24', url='https://api.twitter.com/1.1/geo/id/001907e868d06e24.json', place_type='admin', name='Dubai', full_name='Dubai, United Arab Emirates', country_code='AE', country='United Arab Emirates', contained_within=[], bounding_box=BoundingBox(_api=<tweepy.api.API object at 0x7fe047d417f0>, type='Polygon', coordinates=[[[54.8939725, 24.6182526], [56.2083722, 24.6182526], [56.2083722, 25.3686719], [54.8939725, 25.3686719]]]), attributes={})"
110,Greece on December  Tempting.  via,1401450247985975298,2021-06-06 08:05:51,0,0,"Place(_api=<tweepy.api.API object at 0x7fe047d417f0>, id='00f24ae701a1207b', url='https://api.twitter.com/1.1/geo/id/00f24ae701a1207b.json', place_type='admin', name='Abu Dhabi', full_name='Abu Dhabi, United Arab Emirates', country_code='AE', country='United Arab Emirates', contained_within=[], bounding_box=BoundingBox(_api=<tweepy.api.API object at 0x7fe047d417f0>, type='Polygon', coordinates=[[[51.2938738, 22.6261387], [56.0175464, 22.6261387], [56.0175464, 25.1639588], [51.2938738, 25.1639588]]]), attributes={})"
111,"Covid free, summer plans are on the way ",1401417195163357184,2021-06-06 05:54:31,0,0,"Place(_api=<tweepy.api.API object at 0x7fe047d417f0>, id='001907e868d06e24', url='https://api.twitter.com/1.1/geo/id/001907e868d06e24.json', place_type='admin', name='Dubai', full_name='Dubai, United Arab Emirates', country_code='AE', country='United Arab Emirates', contained_within=[], bounding_box=BoundingBox(_api=<tweepy.api.API object at 0x7fe047d417f0>, type='Polygon', coordinates=[[[54.8939725, 24.6182526], [56.2083722, 24.6182526], [56.2083722, 25.3686719], [54.8939725, 25.3686719]]]), attributes={})"
112,Corona really upped the Dubai taxi experience then. In an immaculate car with card machine and GPS.,1401412171809107969,2021-06-06 05:34:33,7,0,"Place(_api=<tweepy.api.API object at 0x7fe047d417f0>, id='001907e868d06e24', url='https://api.twitter.com/1.1/geo/id/001907e868d06e24.json', place_type='admin', name='Dubai', full_name='Dubai, United Arab Emirates', country_code='AE', country='United Arab Emirates', contained_within=[], bounding_box=BoundingBox(_api=<tweepy.api.API object at 0x7fe047d417f0>, type='Polygon', coordinates=[[[54.8939725, 24.6182526], [56.2083722, 24.6182526], [56.2083722, 25.3686719], [54.8939725, 25.3686719]]]), attributes={})"
113,"I have not given her such a hug since Covid, but we are both vaccinated so I may just do that tomorrow ",1401407086332768260,2021-06-06 05:14:20,6,0,"Place(_api=<tweepy.api.API object at 0x7fe047d417f0>, id='001907e868d06e24', url='https://api.twitter.com/1.1/geo/id/001907e868d06e24.json', place_type='admin', name='Dubai', full_name='Dubai, United Arab Emirates', country_code='AE', country='United Arab Emirates', contained_within=[], bounding_box=BoundingBox(_api=<tweepy.api.API object at 0x7fe047d417f0>, type='Polygon', coordinates=[[[54.8939725, 24.6182526], [56.2083722, 24.6182526], [56.2083722, 25.3686719], [54.8939725, 25.3686719]]]), attributes={})"
114,"We're in the middle of pandemic, your mind should go towards Covid and not attack. But again, you're You.",1401403006428536837,2021-06-06 04:58:08,0,0,"Place(_api=<tweepy.api.API object at 0x7fe047d417f0>, id='00f24ae701a1207b', url='https://api.twitter.com/1.1/geo/id/00f24ae701a1207b.json', place_type='admin', name='Abu Dhabi', full_name='Abu Dhabi, United Arab Emirates', country_code='AE', country='United Arab Emirates', contained_within=[], bounding_box=BoundingBox(_api=<tweepy.api.API object at 0x7fe047d417f0>, type='Polygon', coordinates=[[[51.2938738, 22.6261387], [56.0175464, 22.6261387], [56.0175464, 25.1639588], [51.2938738, 25.1639588]]]), attributes={})"
115,I'm back y'all. Tested positive to CoViD. I'm healthy and fine now. Stay safe guys and what did i miss .,1401387563768758276,2021-06-06 03:56:46,6,0,"Place(_api=<tweepy.api.API object at 0x7fe047d417f0>, id='0dcf66e23155c001', url='https://api.twitter.com/1.1/geo/id/0dcf66e23155c001.json', place_type='poi', name='Rice', full_name='Rice', country_code='AE', country='United Arab Emirates', contained_within=[], bounding_box=BoundingBox(_api=<tweepy.api.API object at 0x7fe047d417f0>, type='Polygon', coordinates=[[[55.457523907728635, 25.309989593269986], [55.457523907728635, 25.309989593269986], [55.457523907728635, 25.309989593269986], [55.457523907728635, 25.309989593269986]]]), attributes={})"
116,Poor had to exit his tournament in a lead for Covid positive results ,1401374844361621511,2021-06-06 03:06:13,1,0,"Place(_api=<tweepy.api.API object at 0x7fe047d417f0>, id='001907e868d06e24', url='https://api.twitter.com/1.1/geo/id/001907e868d06e24.json', place_type='admin', name='Dubai', full_name='Dubai, United Arab Emirates', country_code='AE', country='United Arab Emirates', contained_within=[], bounding_box=BoundingBox(_api=<tweepy.api.API object at 0x7fe047d417f0>, type='Polygon', coordinates=[[[54.8939725, 24.6182526], [56.2083722, 24.6182526], [56.2083722, 25.3686719], [54.8939725, 25.3686719]]]), attributes={})"
