,Tweets,id,date,likes,retweets,place
0,"Pandemic has impacted common man in India and particularly Maharashtra very severely GMBF has joined hands with “Annapoorna” an initiative lead by Dr Manisha Abhijit Sonawane. We call upon in this need of hour of our Brothers and sisters back home , those who can. ",1390276067558977542,2021-05-06 12:03:39,0,0,"Place(_api=<tweepy.api.API object at 0x7f12a08437f0>, id='001907e868d06e24', url='https://api.twitter.com/1.1/geo/id/001907e868d06e24.json', place_type='admin', name='Dubai', full_name='Dubai, United Arab Emirates', country_code='AE', country='United Arab Emirates', contained_within=[], bounding_box=BoundingBox(_api=<tweepy.api.API object at 0x7f12a08437f0>, type='Polygon', coordinates=[[[54.8939725, 24.6182526], [56.2083722, 24.6182526], [56.2083722, 25.3686719], [54.8939725, 25.3686719]]]), attributes={})"
1,"Vaccinated against Remember, it is still important to continue following the standard precautions and safety guidelines even if you are ",1390258522261176322,2021-05-06 10:53:56,1,0,"Place(_api=<tweepy.api.API object at 0x7f12a08437f0>, id='00f24ae701a1207b', url='https://api.twitter.com/1.1/geo/id/00f24ae701a1207b.json', place_type='admin', name='Abu Dhabi', full_name='Abu Dhabi, United Arab Emirates', country_code='AE', country='United Arab Emirates', contained_within=[], bounding_box=BoundingBox(_api=<tweepy.api.API object at 0x7f12a08437f0>, type='Polygon', coordinates=[[[51.2938738, 22.6261387], [56.0175464, 22.6261387], [56.0175464, 25.1639588], [51.2938738, 25.1639588]]]), attributes={})"
2,Government role in pandemic management must be investigated by a Commission. ,1390238887595978754,2021-05-06 09:35:54,0,0,"Place(_api=<tweepy.api.API object at 0x7f12a08437f0>, id='001907e868d06e24', url='https://api.twitter.com/1.1/geo/id/001907e868d06e24.json', place_type='admin', name='Dubai', full_name='Dubai, United Arab Emirates', country_code='AE', country='United Arab Emirates', contained_within=[], bounding_box=BoundingBox(_api=<tweepy.api.API object at 0x7f12a08437f0>, type='Polygon', coordinates=[[[54.8939725, 24.6182526], [56.2083722, 24.6182526], [56.2083722, 25.3686719], [54.8939725, 25.3686719]]]), attributes={})"
3,"Probably true: Countries cannot just ""pick up this patent, read it like a cheesecake recipe, and make this awesome"" mRNA vaccine ",1390237377130532865,2021-05-06 09:29:54,1,0,"Place(_api=<tweepy.api.API object at 0x7f12a08437f0>, id='001907e868d06e24', url='https://api.twitter.com/1.1/geo/id/001907e868d06e24.json', place_type='admin', name='Dubai', full_name='Dubai, United Arab Emirates', country_code='AE', country='United Arab Emirates', contained_within=[], bounding_box=BoundingBox(_api=<tweepy.api.API object at 0x7f12a08437f0>, type='Polygon', coordinates=[[[54.8939725, 24.6182526], [56.2083722, 24.6182526], [56.2083722, 25.3686719], [54.8939725, 25.3686719]]]), attributes={})"
4,Big Salute to all Industriliest and many more who so ever helped India during this pandemic. Industriliest are always a backbone for any country. ,1390231619483668480,2021-05-06 09:07:01,0,0,"Place(_api=<tweepy.api.API object at 0x7f12a08437f0>, id='001907e868d06e24', url='https://api.twitter.com/1.1/geo/id/001907e868d06e24.json', place_type='admin', name='Dubai', full_name='Dubai, United Arab Emirates', country_code='AE', country='United Arab Emirates', contained_within=[], bounding_box=BoundingBox(_api=<tweepy.api.API object at 0x7f12a08437f0>, type='Polygon', coordinates=[[[54.8939725, 24.6182526], [56.2083722, 24.6182526], [56.2083722, 25.3686719], [54.8939725, 25.3686719]]]), attributes={})"
5,This is how kerala managing the Covid- crisis.... ,1390220417789534209,2021-05-06 08:22:31,0,0,"Place(_api=<tweepy.api.API object at 0x7f12a08437f0>, id='001907e868d06e24', url='https://api.twitter.com/1.1/geo/id/001907e868d06e24.json', place_type='admin', name='Dubai', full_name='Dubai, United Arab Emirates', country_code='AE', country='United Arab Emirates', contained_within=[], bounding_box=BoundingBox(_api=<tweepy.api.API object at 0x7f12a08437f0>, type='Polygon', coordinates=[[[54.8939725, 24.6182526], [56.2083722, 24.6182526], [56.2083722, 25.3686719], [54.8939725, 25.3686719]]]), attributes={})"
6,There is no need to wear masks outdoor as long as it is not crowded. Most Covid infections take place indoor. ,1390217342337040386,2021-05-06 08:10:18,0,0,"Place(_api=<tweepy.api.API object at 0x7f12a08437f0>, id='001907e868d06e24', url='https://api.twitter.com/1.1/geo/id/001907e868d06e24.json', place_type='admin', name='Dubai', full_name='Dubai, United Arab Emirates', country_code='AE', country='United Arab Emirates', contained_within=[], bounding_box=BoundingBox(_api=<tweepy.api.API object at 0x7f12a08437f0>, type='Polygon', coordinates=[[[54.8939725, 24.6182526], [56.2083722, 24.6182526], [56.2083722, 25.3686719], [54.8939725, 25.3686719]]]), attributes={})"
7,Let's see if really are for the supporters...they MUST move the final from Turkey in the middle of a pandemic...,1390209415672913922,2021-05-06 07:38:48,1,0,"Place(_api=<tweepy.api.API object at 0x7f12a08437f0>, id='00f24ae701a1207b', url='https://api.twitter.com/1.1/geo/id/00f24ae701a1207b.json', place_type='admin', name='Abu Dhabi', full_name='Abu Dhabi, United Arab Emirates', country_code='AE', country='United Arab Emirates', contained_within=[], bounding_box=BoundingBox(_api=<tweepy.api.API object at 0x7f12a08437f0>, type='Polygon', coordinates=[[[51.2938738, 22.6261387], [56.0175464, 22.6261387], [56.0175464, 25.1639588], [51.2938738, 25.1639588]]]), attributes={})"
8,COVID-19 vaccine formulas shouldn't be shared with India: Bill Gates  via,1390205239299612673,2021-05-06 07:22:12,0,0,"Place(_api=<tweepy.api.API object at 0x7f12a08437f0>, id='001907e868d06e24', url='https://api.twitter.com/1.1/geo/id/001907e868d06e24.json', place_type='admin', name='Dubai', full_name='Dubai, United Arab Emirates', country_code='AE', country='United Arab Emirates', contained_within=[], bounding_box=BoundingBox(_api=<tweepy.api.API object at 0x7f12a08437f0>, type='Polygon', coordinates=[[[54.8939725, 24.6182526], [56.2083722, 24.6182526], [56.2083722, 25.3686719], [54.8939725, 25.3686719]]]), attributes={})"
9,"CM is a star campaigner and had been very much preoccupied with electioneering in West Bengal and Assam.BJP wants votes, common man need oxygen. ",1390195137867812867,2021-05-06 06:42:04,0,0,"Place(_api=<tweepy.api.API object at 0x7f12a08437f0>, id='001907e868d06e24', url='https://api.twitter.com/1.1/geo/id/001907e868d06e24.json', place_type='admin', name='Dubai', full_name='Dubai, United Arab Emirates', country_code='AE', country='United Arab Emirates', contained_within=[], bounding_box=BoundingBox(_api=<tweepy.api.API object at 0x7f12a08437f0>, type='Polygon', coordinates=[[[54.8939725, 24.6182526], [56.2083722, 24.6182526], [56.2083722, 25.3686719], [54.8939725, 25.3686719]]]), attributes={})"
10,looks like some panicking or intentional panicking to cause anxiety for some personal reasons. why not reassure thats all is required from authorities...'Government announces second wave of Covid-19  via,1390190707835613185,2021-05-06 06:24:27,0,0,"Place(_api=<tweepy.api.API object at 0x7f12a08437f0>, id='001907e868d06e24', url='https://api.twitter.com/1.1/geo/id/001907e868d06e24.json', place_type='admin', name='Dubai', full_name='Dubai, United Arab Emirates', country_code='AE', country='United Arab Emirates', contained_within=[], bounding_box=BoundingBox(_api=<tweepy.api.API object at 0x7f12a08437f0>, type='Polygon', coordinates=[[[54.8939725, 24.6182526], [56.2083722, 24.6182526], [56.2083722, 25.3686719], [54.8939725, 25.3686719]]]), attributes={})"
11,Thank God even at this late stage If bio security bubble in failed what hope is there in quarantine facilities for Indian nationals The risk reward matrix is far too great in probability of a breach and its impact,1390186242059407360,2021-05-06 06:06:43,1,0,"Place(_api=<tweepy.api.API object at 0x7f12a08437f0>, id='001907e868d06e24', url='https://api.twitter.com/1.1/geo/id/001907e868d06e24.json', place_type='admin', name='Dubai', full_name='Dubai, United Arab Emirates', country_code='AE', country='United Arab Emirates', contained_within=[], bounding_box=BoundingBox(_api=<tweepy.api.API object at 0x7f12a08437f0>, type='Polygon', coordinates=[[[54.8939725, 24.6182526], [56.2083722, 24.6182526], [56.2083722, 25.3686719], [54.8939725, 25.3686719]]]), attributes={})"
12,Would love to have coffee there once the pandemic gets over and travel is permitted. Youth looks up to people like you for motivation and guidance and you are doing a terrific service for the humanity. All the best and Jai Hind,1390165361115402242,2021-05-06 04:43:44,4,0,"Place(_api=<tweepy.api.API object at 0x7f12a08437f0>, id='001907e868d06e24', url='https://api.twitter.com/1.1/geo/id/001907e868d06e24.json', place_type='admin', name='Dubai', full_name='Dubai, United Arab Emirates', country_code='AE', country='United Arab Emirates', contained_within=[], bounding_box=BoundingBox(_api=<tweepy.api.API object at 0x7f12a08437f0>, type='Polygon', coordinates=[[[54.8939725, 24.6182526], [56.2083722, 24.6182526], [56.2083722, 25.3686719], [54.8939725, 25.3686719]]]), attributes={})"
13,"Right  Oru season nalla aaramichom udane Corona keduthuruchu  But fights from India to here are banned, yeppadi varuvainga ",1390161827657502722,2021-05-06 04:29:42,1,0,"Place(_api=<tweepy.api.API object at 0x7f12a08437f0>, id='001907e868d06e24', url='https://api.twitter.com/1.1/geo/id/001907e868d06e24.json', place_type='admin', name='Dubai', full_name='Dubai, United Arab Emirates', country_code='AE', country='United Arab Emirates', contained_within=[], bounding_box=BoundingBox(_api=<tweepy.api.API object at 0x7f12a08437f0>, type='Polygon', coordinates=[[[54.8939725, 24.6182526], [56.2083722, 24.6182526], [56.2083722, 25.3686719], [54.8939725, 25.3686719]]]), attributes={})"
14,A BIG SALUTE to Biden Administration for Waiving Intellectual Property Protections for Corona Virus Vaccines.,1390144226109837313,2021-05-06 03:19:45,1,0,"Place(_api=<tweepy.api.API object at 0x7f12a08437f0>, id='001907e868d06e24', url='https://api.twitter.com/1.1/geo/id/001907e868d06e24.json', place_type='admin', name='Dubai', full_name='Dubai, United Arab Emirates', country_code='AE', country='United Arab Emirates', contained_within=[], bounding_box=BoundingBox(_api=<tweepy.api.API object at 0x7f12a08437f0>, type='Polygon', coordinates=[[[54.8939725, 24.6182526], [56.2083722, 24.6182526], [56.2083722, 25.3686719], [54.8939725, 25.3686719]]]), attributes={})"
15,Biden goes full populist supporting the TRIPS waiver for Covid vaccines. This will not help getting more vaccines to patients but erode the innovative power of biotech. What a shame the White House supports this. Had hoped for Biden to be a moderate.,1390143656493977601,2021-05-06 03:17:29,8,4,"Place(_api=<tweepy.api.API object at 0x7f12a08437f0>, id='001907e868d06e24', url='https://api.twitter.com/1.1/geo/id/001907e868d06e24.json', place_type='admin', name='Dubai', full_name='Dubai, United Arab Emirates', country_code='AE', country='United Arab Emirates', contained_within=[], bounding_box=BoundingBox(_api=<tweepy.api.API object at 0x7f12a08437f0>, type='Polygon', coordinates=[[[54.8939725, 24.6182526], [56.2083722, 24.6182526], [56.2083722, 25.3686719], [54.8939725, 25.3686719]]]), attributes={})"
16,What a story. The Vaccine Had to Be Used. He Used It. He Was Fired. ,1390072001545465857,2021-05-05 22:32:46,0,0,"Place(_api=<tweepy.api.API object at 0x7f12a08437f0>, id='001907e868d06e24', url='https://api.twitter.com/1.1/geo/id/001907e868d06e24.json', place_type='admin', name='Dubai', full_name='Dubai, United Arab Emirates', country_code='AE', country='United Arab Emirates', contained_within=[], bounding_box=BoundingBox(_api=<tweepy.api.API object at 0x7f12a08437f0>, type='Polygon', coordinates=[[[54.8939725, 24.6182526], [56.2083722, 24.6182526], [56.2083722, 25.3686719], [54.8939725, 25.3686719]]]), attributes={})"
17,Door step oxygen. Useful for patients in home quarantine in and around chennai districts ,1390061526812348426,2021-05-05 21:51:08,0,0,"Place(_api=<tweepy.api.API object at 0x7f12a08437f0>, id='001907e868d06e24', url='https://api.twitter.com/1.1/geo/id/001907e868d06e24.json', place_type='admin', name='Dubai', full_name='Dubai, United Arab Emirates', country_code='AE', country='United Arab Emirates', contained_within=[], bounding_box=BoundingBox(_api=<tweepy.api.API object at 0x7f12a08437f0>, type='Polygon', coordinates=[[[54.8939725, 24.6182526], [56.2083722, 24.6182526], [56.2083722, 25.3686719], [54.8939725, 25.3686719]]]), attributes={})"
18,West Bengal is burning But idiots are busy celebrating Kangna's Twitter Account suspension. They are Vultures they will not help India in Covid rather will let down their own motherland to their illegal Fathers.,1390046803861532674,2021-05-05 20:52:38,0,0,"Place(_api=<tweepy.api.API object at 0x7f12a08437f0>, id='001907e868d06e24', url='https://api.twitter.com/1.1/geo/id/001907e868d06e24.json', place_type='admin', name='Dubai', full_name='Dubai, United Arab Emirates', country_code='AE', country='United Arab Emirates', contained_within=[], bounding_box=BoundingBox(_api=<tweepy.api.API object at 0x7f12a08437f0>, type='Polygon', coordinates=[[[54.8939725, 24.6182526], [56.2083722, 24.6182526], [56.2083722, 25.3686719], [54.8939725, 25.3686719]]]), attributes={})"
19,West Bengal is burning But idiots are busy celebrating Kangna's Twitter Account suspension. They are Vultures they will not help India in Covid rather will let down their own motherland to their illegal Fathers.,1390046603537391616,2021-05-05 20:51:50,0,0,"Place(_api=<tweepy.api.API object at 0x7f12a08437f0>, id='001907e868d06e24', url='https://api.twitter.com/1.1/geo/id/001907e868d06e24.json', place_type='admin', name='Dubai', full_name='Dubai, United Arab Emirates', country_code='AE', country='United Arab Emirates', contained_within=[], bounding_box=BoundingBox(_api=<tweepy.api.API object at 0x7f12a08437f0>, type='Polygon', coordinates=[[[54.8939725, 24.6182526], [56.2083722, 24.6182526], [56.2083722, 25.3686719], [54.8939725, 25.3686719]]]), attributes={})"
20,West Bengal is burning But idiots are busy celebrating Kangna's Twitter Account suspension. They are Vultures they will not help India in Covid rather will let down their own motherland to their illegal Fathers.,1390046274544574465,2021-05-05 20:50:32,0,0,"Place(_api=<tweepy.api.API object at 0x7f12a08437f0>, id='001907e868d06e24', url='https://api.twitter.com/1.1/geo/id/001907e868d06e24.json', place_type='admin', name='Dubai', full_name='Dubai, United Arab Emirates', country_code='AE', country='United Arab Emirates', contained_within=[], bounding_box=BoundingBox(_api=<tweepy.api.API object at 0x7f12a08437f0>, type='Polygon', coordinates=[[[54.8939725, 24.6182526], [56.2083722, 24.6182526], [56.2083722, 25.3686719], [54.8939725, 25.3686719]]]), attributes={})"
21,West Bengal is burning But idiots are busy celebrating Kangna's Twitter Account suspension. They are Vultures they will not help India in Covid rather will let down their own motherland to their illegal Fathers.,1390046191811919874,2021-05-05 20:50:12,1,0,"Place(_api=<tweepy.api.API object at 0x7f12a08437f0>, id='001907e868d06e24', url='https://api.twitter.com/1.1/geo/id/001907e868d06e24.json', place_type='admin', name='Dubai', full_name='Dubai, United Arab Emirates', country_code='AE', country='United Arab Emirates', contained_within=[], bounding_box=BoundingBox(_api=<tweepy.api.API object at 0x7f12a08437f0>, type='Polygon', coordinates=[[[54.8939725, 24.6182526], [56.2083722, 24.6182526], [56.2083722, 25.3686719], [54.8939725, 25.3686719]]]), attributes={})"
22,Shop  Shop   SHEIN ,1390033489379028993,2021-05-05 19:59:44,3,6,"Place(_api=<tweepy.api.API object at 0x7f12a08437f0>, id='001907e868d06e24', url='https://api.twitter.com/1.1/geo/id/001907e868d06e24.json', place_type='admin', name='Dubai', full_name='Dubai, United Arab Emirates', country_code='AE', country='United Arab Emirates', contained_within=[], bounding_box=BoundingBox(_api=<tweepy.api.API object at 0x7f12a08437f0>, type='Polygon', coordinates=[[[54.8939725, 24.6182526], [56.2083722, 24.6182526], [56.2083722, 25.3686719], [54.8939725, 25.3686719]]]), attributes={})"
23,i hope Lahore have safe now these days.,1390032865929355268,2021-05-05 19:57:15,0,0,"Place(_api=<tweepy.api.API object at 0x7f12a08437f0>, id='00f24ae701a1207b', url='https://api.twitter.com/1.1/geo/id/00f24ae701a1207b.json', place_type='admin', name='Abu Dhabi', full_name='Abu Dhabi, United Arab Emirates', country_code='AE', country='United Arab Emirates', contained_within=[], bounding_box=BoundingBox(_api=<tweepy.api.API object at 0x7f12a08437f0>, type='Polygon', coordinates=[[[51.2938738, 22.6261387], [56.0175464, 22.6261387], [56.0175464, 25.1639588], [51.2938738, 25.1639588]]]), attributes={})"
24,"To make the more attractive I suggest all airports make a special lane for those who r fully vaccinated, without a quarantine. For those who aren’t ask them to be in airport at least 5 hours before flight and PCR for all destinations",1390010612726513665,2021-05-05 18:28:49,2,0,"Place(_api=<tweepy.api.API object at 0x7f12a08437f0>, id='001907e868d06e24', url='https://api.twitter.com/1.1/geo/id/001907e868d06e24.json', place_type='admin', name='Dubai', full_name='Dubai, United Arab Emirates', country_code='AE', country='United Arab Emirates', contained_within=[], bounding_box=BoundingBox(_api=<tweepy.api.API object at 0x7f12a08437f0>, type='Polygon', coordinates=[[[54.8939725, 24.6182526], [56.2083722, 24.6182526], [56.2083722, 25.3686719], [54.8939725, 25.3686719]]]), attributes={})"
25,As if corona / covid19 isn't enough oh God ,1390009316082597894,2021-05-05 18:23:40,2,0,"Place(_api=<tweepy.api.API object at 0x7f12a08437f0>, id='00f24ae701a1207b', url='https://api.twitter.com/1.1/geo/id/00f24ae701a1207b.json', place_type='admin', name='Abu Dhabi', full_name='Abu Dhabi, United Arab Emirates', country_code='AE', country='United Arab Emirates', contained_within=[], bounding_box=BoundingBox(_api=<tweepy.api.API object at 0x7f12a08437f0>, type='Polygon', coordinates=[[[51.2938738, 22.6261387], [56.0175464, 22.6261387], [56.0175464, 25.1639588], [51.2938738, 25.1639588]]]), attributes={})"
26," OFFICIAL STATEMENT  Delhi Capitals leg spinner Amit Mishra has tested positive for COVID-19. He has been moved to a designated medical care facility, as per BCCI and IPL guidelines.  ",1389963532121382914,2021-05-05 15:21:44,0,0,"Place(_api=<tweepy.api.API object at 0x7f12a08437f0>, id='07d9f502b7083000', url='https://api.twitter.com/1.1/geo/id/07d9f502b7083000.json', place_type='poi', name='Sharjah Medical Center', full_name='Sharjah Medical Center', country_code='AE', country='United Arab Emirates', contained_within=[], bounding_box=BoundingBox(_api=<tweepy.api.API object at 0x7f12a08437f0>, type='Polygon', coordinates=[[[55.41051442095455, 25.365975902676634], [55.41051442095455, 25.365975902676634], [55.41051442095455, 25.365975902676634], [55.41051442095455, 25.365975902676634]]]), attributes={})"
