,Tweets,id,date,likes,retweets,place
74,The Emirates Red Crescent Authority would like to thank H.E Dr Mubarak Hamad Al Ameri for his generous support of the ERC humanitarian aid work. .,1351444554591969283,2021-01-19 08:21:05,6,6,"Place(_api=<tweepy.api.API object at 0x7f434d05bcd0>, id='00f24ae701a1207b', url='https://api.twitter.com/1.1/geo/id/00f24ae701a1207b.json', place_type='admin', name='Abu Dhabi', full_name='Abu Dhabi, United Arab Emirates', country_code='AE', country='United Arab Emirates', contained_within=[], bounding_box=BoundingBox(_api=<tweepy.api.API object at 0x7f434d05bcd0>, type='Polygon', coordinates=[[[51.2938738, 22.6261387], [56.0175464, 22.6261387], [56.0175464, 25.1639588], [51.2938738, 25.1639588]]]), attributes={})"
75,hello i am a United States Citizen do i need a covid test to return to United States from Dubai,1351440090728443907,2021-01-19 08:03:20,0,0,"Place(_api=<tweepy.api.API object at 0x7f434d05bcd0>, id='001907e868d06e24', url='https://api.twitter.com/1.1/geo/id/001907e868d06e24.json', place_type='admin', name='Dubai', full_name='Dubai, United Arab Emirates', country_code='AE', country='United Arab Emirates', contained_within=[], bounding_box=BoundingBox(_api=<tweepy.api.API object at 0x7f434d05bcd0>, type='Polygon', coordinates=[[[54.8939725, 24.6182526], [56.2083722, 24.6182526], [56.2083722, 25.3686719], [54.8939725, 25.3686719]]]), attributes={})"
76,Since covid started I’ve done 26 tests .. and many more to come ,1351435258059763720,2021-01-19 07:44:08,0,0,"Place(_api=<tweepy.api.API object at 0x7f434d05bcd0>, id='001907e868d06e24', url='https://api.twitter.com/1.1/geo/id/001907e868d06e24.json', place_type='admin', name='Dubai', full_name='Dubai, United Arab Emirates', country_code='AE', country='United Arab Emirates', contained_within=[], bounding_box=BoundingBox(_api=<tweepy.api.API object at 0x7f434d05bcd0>, type='Polygon', coordinates=[[[54.8939725, 24.6182526], [56.2083722, 24.6182526], [56.2083722, 25.3686719], [54.8939725, 25.3686719]]]), attributes={})"
77,"Dzae, the world won’t stop spinning just because you got covid. Dont expect me to be there 24/7. Yes, we are friends but I’m also fighting my own battle. Wag masyado papansin. Annoying na kaayo ",1351425646199775234,2021-01-19 07:05:56,0,0,"Place(_api=<tweepy.api.API object at 0x7f434d05bcd0>, id='001907e868d06e24', url='https://api.twitter.com/1.1/geo/id/001907e868d06e24.json', place_type='admin', name='Dubai', full_name='Dubai, United Arab Emirates', country_code='AE', country='United Arab Emirates', contained_within=[], bounding_box=BoundingBox(_api=<tweepy.api.API object at 0x7f434d05bcd0>, type='Polygon', coordinates=[[[54.8939725, 24.6182526], [56.2083722, 24.6182526], [56.2083722, 25.3686719], [54.8939725, 25.3686719]]]), attributes={})"
78,Mental health disorders were part of the exclusion criteria for getting the COVID vaccine. That is no longer the case in Abu Dhabi. Please pass this information along.,1351424254903001090,2021-01-19 07:00:25,3,0,"Place(_api=<tweepy.api.API object at 0x7f434d05bcd0>, id='00f24ae701a1207b', url='https://api.twitter.com/1.1/geo/id/00f24ae701a1207b.json', place_type='admin', name='Abu Dhabi', full_name='Abu Dhabi, United Arab Emirates', country_code='AE', country='United Arab Emirates', contained_within=[], bounding_box=BoundingBox(_api=<tweepy.api.API object at 0x7f434d05bcd0>, type='Polygon', coordinates=[[[51.2938738, 22.6261387], [56.0175464, 22.6261387], [56.0175464, 25.1639588], [51.2938738, 25.1639588]]]), attributes={})"
79,BBC News - Covid vaccine: WHO warns of 'catastrophic moral failure' ,1351410539780583426,2021-01-19 06:05:55,0,0,"Place(_api=<tweepy.api.API object at 0x7f434d05bcd0>, id='001907e868d06e24', url='https://api.twitter.com/1.1/geo/id/001907e868d06e24.json', place_type='admin', name='Dubai', full_name='Dubai, United Arab Emirates', country_code='AE', country='United Arab Emirates', contained_within=[], bounding_box=BoundingBox(_api=<tweepy.api.API object at 0x7f434d05bcd0>, type='Polygon', coordinates=[[[54.8939725, 24.6182526], [56.2083722, 24.6182526], [56.2083722, 25.3686719], [54.8939725, 25.3686719]]]), attributes={})"
80,Something as simple as COVID-19 test Naija cannot conduct for its citizens Meanwhile its done for free at Dubai Airport and report texted within 24 hours.,1351409957007142915,2021-01-19 06:03:36,4,1,"Place(_api=<tweepy.api.API object at 0x7f434d05bcd0>, id='103146d1ab975002', url='https://api.twitter.com/1.1/geo/id/103146d1ab975002.json', place_type='poi', name='The Walk at JBR / ممشى الجي بي آر', full_name='The Walk at JBR / ممشى الجي بي آر', country_code='AE', country='United Arab Emirates', contained_within=[], bounding_box=BoundingBox(_api=<tweepy.api.API object at 0x7f434d05bcd0>, type='Polygon', coordinates=[[[55.133824, 25.07778], [55.133824, 25.07778], [55.133824, 25.07778], [55.133824, 25.07778]]]), attributes={})"
81,Na wa ooo this covid shit is real ooo wtf,1351403881956335619,2021-01-19 05:39:27,0,0,"Place(_api=<tweepy.api.API object at 0x7f434d05bcd0>, id='001907e868d06e24', url='https://api.twitter.com/1.1/geo/id/001907e868d06e24.json', place_type='admin', name='Dubai', full_name='Dubai, United Arab Emirates', country_code='AE', country='United Arab Emirates', contained_within=[], bounding_box=BoundingBox(_api=<tweepy.api.API object at 0x7f434d05bcd0>, type='Polygon', coordinates=[[[54.8939725, 24.6182526], [56.2083722, 24.6182526], [56.2083722, 25.3686719], [54.8939725, 25.3686719]]]), attributes={})"
82,Universal Design for Learning After COVID-19 | Learning Innovation ,1351394879474118656,2021-01-19 05:03:41,0,0,"Place(_api=<tweepy.api.API object at 0x7f434d05bcd0>, id='001907e868d06e24', url='https://api.twitter.com/1.1/geo/id/001907e868d06e24.json', place_type='admin', name='Dubai', full_name='Dubai, United Arab Emirates', country_code='AE', country='United Arab Emirates', contained_within=[], bounding_box=BoundingBox(_api=<tweepy.api.API object at 0x7f434d05bcd0>, type='Polygon', coordinates=[[[54.8939725, 24.6182526], [56.2083722, 24.6182526], [56.2083722, 25.3686719], [54.8939725, 25.3686719]]]), attributes={})"
83,Italian Company Remodels Plane to Transport Worldwide    ,1351380052601090048,2021-01-19 04:04:46,4,1,"Place(_api=<tweepy.api.API object at 0x7f434d05bcd0>, id='3f63906fc8aa5a7d', url='https://api.twitter.com/1.1/geo/id/3f63906fc8aa5a7d.json', place_type='country', name='United Arab Emirates', full_name='United Arab Emirates', country_code='AE', country='United Arab Emirates', contained_within=[], bounding_box=BoundingBox(_api=<tweepy.api.API object at 0x7f434d05bcd0>, type='Polygon', coordinates=[[[51.2938738, 22.6261387], [56.3816989, 22.6261387], [56.3816989, 26.2823697], [51.2938738, 26.2823697]]]), attributes={})"
84,3 Questions And The Emerging Answers About COVID-19 Vaccine Protection ,1351362753890574340,2021-01-19 02:56:02,0,0,"Place(_api=<tweepy.api.API object at 0x7f434d05bcd0>, id='001907e868d06e24', url='https://api.twitter.com/1.1/geo/id/001907e868d06e24.json', place_type='admin', name='Dubai', full_name='Dubai, United Arab Emirates', country_code='AE', country='United Arab Emirates', contained_within=[], bounding_box=BoundingBox(_api=<tweepy.api.API object at 0x7f434d05bcd0>, type='Polygon', coordinates=[[[54.8939725, 24.6182526], [56.2083722, 24.6182526], [56.2083722, 25.3686719], [54.8939725, 25.3686719]]]), attributes={})"
85,where is the location of Covid-19 vaccion one central,1351361858616373248,2021-01-19 02:52:28,0,0,"Place(_api=<tweepy.api.API object at 0x7f434d05bcd0>, id='001907e868d06e24', url='https://api.twitter.com/1.1/geo/id/001907e868d06e24.json', place_type='admin', name='Dubai', full_name='Dubai, United Arab Emirates', country_code='AE', country='United Arab Emirates', contained_within=[], bounding_box=BoundingBox(_api=<tweepy.api.API object at 0x7f434d05bcd0>, type='Polygon', coordinates=[[[54.8939725, 24.6182526], [56.2083722, 24.6182526], [56.2083722, 25.3686719], [54.8939725, 25.3686719]]]), attributes={})"
86,Covid-19 vaccine issue ,1351264242113114112,2021-01-18 20:24:35,0,0,"Place(_api=<tweepy.api.API object at 0x7f434d05bcd0>, id='00f24ae701a1207b', url='https://api.twitter.com/1.1/geo/id/00f24ae701a1207b.json', place_type='admin', name='Abu Dhabi', full_name='Abu Dhabi, United Arab Emirates', country_code='AE', country='United Arab Emirates', contained_within=[], bounding_box=BoundingBox(_api=<tweepy.api.API object at 0x7f434d05bcd0>, type='Polygon', coordinates=[[[51.2938738, 22.6261387], [56.0175464, 22.6261387], [56.0175464, 25.1639588], [51.2938738, 25.1639588]]]), attributes={})"
87,India Covid vaccine: Health worker dies a day after taking jab in UP ,1351247242213154818,2021-01-18 19:17:02,1,2,"Place(_api=<tweepy.api.API object at 0x7f434d05bcd0>, id='001907e868d06e24', url='https://api.twitter.com/1.1/geo/id/001907e868d06e24.json', place_type='admin', name='Dubai', full_name='Dubai, United Arab Emirates', country_code='AE', country='United Arab Emirates', contained_within=[], bounding_box=BoundingBox(_api=<tweepy.api.API object at 0x7f434d05bcd0>, type='Polygon', coordinates=[[[54.8939725, 24.6182526], [56.2083722, 24.6182526], [56.2083722, 25.3686719], [54.8939725, 25.3686719]]]), attributes={})"
88,"Proud moment TAKE 2 Can’t wait for this one, a trip of a life time Amelia has qualified to play in ANWA at AUGUSTA at the end of March a few days before the Masters She was meant to play in last years event which got cancelled due to covid but here we go again ",1351235426942668805,2021-01-18 18:30:05,3,0,"Place(_api=<tweepy.api.API object at 0x7f434d05bcd0>, id='001907e868d06e24', url='https://api.twitter.com/1.1/geo/id/001907e868d06e24.json', place_type='admin', name='Dubai', full_name='Dubai, United Arab Emirates', country_code='AE', country='United Arab Emirates', contained_within=[], bounding_box=BoundingBox(_api=<tweepy.api.API object at 0x7f434d05bcd0>, type='Polygon', coordinates=[[[54.8939725, 24.6182526], [56.2083722, 24.6182526], [56.2083722, 25.3686719], [54.8939725, 25.3686719]]]), attributes={})"
89,Fuck you Corona,1351231125121888274,2021-01-18 18:12:59,2,1,"Place(_api=<tweepy.api.API object at 0x7f434d05bcd0>, id='001907e868d06e24', url='https://api.twitter.com/1.1/geo/id/001907e868d06e24.json', place_type='admin', name='Dubai', full_name='Dubai, United Arab Emirates', country_code='AE', country='United Arab Emirates', contained_within=[], bounding_box=BoundingBox(_api=<tweepy.api.API object at 0x7f434d05bcd0>, type='Polygon', coordinates=[[[54.8939725, 24.6182526], [56.2083722, 24.6182526], [56.2083722, 25.3686719], [54.8939725, 25.3686719]]]), attributes={})"
90,"after the covid-19 we take great pride to provide our service back as normal and inshallah soon we will reopen our office in Islamabad which we have to close down due to Covid-19.. ""Join today for your better tomorrow"" ",1351206388618375171,2021-01-18 16:34:41,0,0,"Place(_api=<tweepy.api.API object at 0x7f434d05bcd0>, id='001907e868d06e24', url='https://api.twitter.com/1.1/geo/id/001907e868d06e24.json', place_type='admin', name='Dubai', full_name='Dubai, United Arab Emirates', country_code='AE', country='United Arab Emirates', contained_within=[], bounding_box=BoundingBox(_api=<tweepy.api.API object at 0x7f434d05bcd0>, type='Polygon', coordinates=[[[54.8939725, 24.6182526], [56.2083722, 24.6182526], [56.2083722, 25.3686719], [54.8939725, 25.3686719]]]), attributes={})"
91,Althought she is talking about sinovac vaccine its applies to sinopharm vaccine ,1351194877640454145,2021-01-18 15:48:57,0,1,"Place(_api=<tweepy.api.API object at 0x7f434d05bcd0>, id='00f24ae701a1207b', url='https://api.twitter.com/1.1/geo/id/00f24ae701a1207b.json', place_type='admin', name='Abu Dhabi', full_name='Abu Dhabi, United Arab Emirates', country_code='AE', country='United Arab Emirates', contained_within=[], bounding_box=BoundingBox(_api=<tweepy.api.API object at 0x7f434d05bcd0>, type='Polygon', coordinates=[[[51.2938738, 22.6261387], [56.0175464, 22.6261387], [56.0175464, 25.1639588], [51.2938738, 25.1639588]]]), attributes={})"
92,Here is the problem. Staff non covid sickness is out of control in the NHS.,1351188746042036226,2021-01-18 15:24:35,0,0,"Place(_api=<tweepy.api.API object at 0x7f434d05bcd0>, id='001907e868d06e24', url='https://api.twitter.com/1.1/geo/id/001907e868d06e24.json', place_type='admin', name='Dubai', full_name='Dubai, United Arab Emirates', country_code='AE', country='United Arab Emirates', contained_within=[], bounding_box=BoundingBox(_api=<tweepy.api.API object at 0x7f434d05bcd0>, type='Polygon', coordinates=[[[54.8939725, 24.6182526], [56.2083722, 24.6182526], [56.2083722, 25.3686719], [54.8939725, 25.3686719]]]), attributes={})"
93,Covid-19 test kits available for bulk buying. DM if interested ,1351186922954240002,2021-01-18 15:17:20,1,2,"Place(_api=<tweepy.api.API object at 0x7f434d05bcd0>, id='001907e868d06e24', url='https://api.twitter.com/1.1/geo/id/001907e868d06e24.json', place_type='admin', name='Dubai', full_name='Dubai, United Arab Emirates', country_code='AE', country='United Arab Emirates', contained_within=[], bounding_box=BoundingBox(_api=<tweepy.api.API object at 0x7f434d05bcd0>, type='Polygon', coordinates=[[[54.8939725, 24.6182526], [56.2083722, 24.6182526], [56.2083722, 25.3686719], [54.8939725, 25.3686719]]]), attributes={})"
94,"Yes, it would... and if you think Covid is going away anytime soon then you’re very naive. ",1351176045324599302,2021-01-18 14:34:07,3,0,"Place(_api=<tweepy.api.API object at 0x7f434d05bcd0>, id='001907e868d06e24', url='https://api.twitter.com/1.1/geo/id/001907e868d06e24.json', place_type='admin', name='Dubai', full_name='Dubai, United Arab Emirates', country_code='AE', country='United Arab Emirates', contained_within=[], bounding_box=BoundingBox(_api=<tweepy.api.API object at 0x7f434d05bcd0>, type='Polygon', coordinates=[[[54.8939725, 24.6182526], [56.2083722, 24.6182526], [56.2083722, 25.3686719], [54.8939725, 25.3686719]]]), attributes={})"
95,Done with 1st Dose ,1351161438862258187,2021-01-18 13:36:05,0,0,"Place(_api=<tweepy.api.API object at 0x7f434d05bcd0>, id='001907e868d06e24', url='https://api.twitter.com/1.1/geo/id/001907e868d06e24.json', place_type='admin', name='Dubai', full_name='Dubai, United Arab Emirates', country_code='AE', country='United Arab Emirates', contained_within=[], bounding_box=BoundingBox(_api=<tweepy.api.API object at 0x7f434d05bcd0>, type='Polygon', coordinates=[[[54.8939725, 24.6182526], [56.2083722, 24.6182526], [56.2083722, 25.3686719], [54.8939725, 25.3686719]]]), attributes={})"
96,"With that mentality we will be in lockdown until the virus is completely eradicated from the planet, there’s a risk for all viruses, the survival rate of Covid is extremely high. ",1351155859745878020,2021-01-18 13:13:54,7,0,"Place(_api=<tweepy.api.API object at 0x7f434d05bcd0>, id='001907e868d06e24', url='https://api.twitter.com/1.1/geo/id/001907e868d06e24.json', place_type='admin', name='Dubai', full_name='Dubai, United Arab Emirates', country_code='AE', country='United Arab Emirates', contained_within=[], bounding_box=BoundingBox(_api=<tweepy.api.API object at 0x7f434d05bcd0>, type='Polygon', coordinates=[[[54.8939725, 24.6182526], [56.2083722, 24.6182526], [56.2083722, 25.3686719], [54.8939725, 25.3686719]]]), attributes={})"
97,COVID-19 Vaccine Second dose done Make world free again,1351149841032876036,2021-01-18 12:49:59,0,0,"Place(_api=<tweepy.api.API object at 0x7f434d05bcd0>, id='00ecb59b0dad186e', url='https://api.twitter.com/1.1/geo/id/00ecb59b0dad186e.json', place_type='admin', name='Sharjah', full_name='Sharjah, United Arab Emirates', country_code='AE', country='United Arab Emirates', contained_within=[], bounding_box=BoundingBox(_api=<tweepy.api.API object at 0x7f434d05bcd0>, type='Polygon', coordinates=[[[55.0091271, 24.7328863], [56.3816989, 24.7328863], [56.3816989, 25.8997649], [55.0091271, 25.8997649]]]), attributes={})"
98,My wife went down to a clinic in Dubai this morning and got her Sino based vaccine without an appointment. It was very efficient. It was important to have her done as I’m immunosuppressed at the moment and she may have been a vector for COVID to come into the home.,1351115681824182273,2021-01-18 10:34:15,0,0,"Place(_api=<tweepy.api.API object at 0x7f434d05bcd0>, id='001907e868d06e24', url='https://api.twitter.com/1.1/geo/id/001907e868d06e24.json', place_type='admin', name='Dubai', full_name='Dubai, United Arab Emirates', country_code='AE', country='United Arab Emirates', contained_within=[], bounding_box=BoundingBox(_api=<tweepy.api.API object at 0x7f434d05bcd0>, type='Polygon', coordinates=[[[54.8939725, 24.6182526], [56.2083722, 24.6182526], [56.2083722, 25.3686719], [54.8939725, 25.3686719]]]), attributes={})"
99,"Oh, no I got Covid last January. I’m fine now. I’ve just been getting these dull headaches that last for several days every since ",1351085755628662786,2021-01-18 08:35:20,1,0,"Place(_api=<tweepy.api.API object at 0x7f434d05bcd0>, id='001907e868d06e24', url='https://api.twitter.com/1.1/geo/id/001907e868d06e24.json', place_type='admin', name='Dubai', full_name='Dubai, United Arab Emirates', country_code='AE', country='United Arab Emirates', contained_within=[], bounding_box=BoundingBox(_api=<tweepy.api.API object at 0x7f434d05bcd0>, type='Polygon', coordinates=[[[54.8939725, 24.6182526], [56.2083722, 24.6182526], [56.2083722, 25.3686719], [54.8939725, 25.3686719]]]), attributes={})"
100,Thank you I’m gonna look into it. I’ve been having these Covid headaches for months now.,1351074962895998976,2021-01-18 07:52:27,1,0,"Place(_api=<tweepy.api.API object at 0x7f434d05bcd0>, id='001907e868d06e24', url='https://api.twitter.com/1.1/geo/id/001907e868d06e24.json', place_type='admin', name='Dubai', full_name='Dubai, United Arab Emirates', country_code='AE', country='United Arab Emirates', contained_within=[], bounding_box=BoundingBox(_api=<tweepy.api.API object at 0x7f434d05bcd0>, type='Polygon', coordinates=[[[54.8939725, 24.6182526], [56.2083722, 24.6182526], [56.2083722, 25.3686719], [54.8939725, 25.3686719]]]), attributes={})"
101,Came to Headoffice for corona virus vaccination (cinopharm) please pray for me that it get me well:),1351073400261894144,2021-01-18 07:46:15,1,2,"Place(_api=<tweepy.api.API object at 0x7f434d05bcd0>, id='001907e868d06e24', url='https://api.twitter.com/1.1/geo/id/001907e868d06e24.json', place_type='admin', name='Dubai', full_name='Dubai, United Arab Emirates', country_code='AE', country='United Arab Emirates', contained_within=[], bounding_box=BoundingBox(_api=<tweepy.api.API object at 0x7f434d05bcd0>, type='Polygon', coordinates=[[[54.8939725, 24.6182526], [56.2083722, 24.6182526], [56.2083722, 25.3686719], [54.8939725, 25.3686719]]]), attributes={})"
102,The Chinese one use traditional vaccines They introduce a small amount of the virus to make your body produce antibodies and develop immunity The Oxford one uses the covid gene (genetic engineering) to produce the antigens,1351073124499017728,2021-01-18 07:45:09,1,0,"Place(_api=<tweepy.api.API object at 0x7f434d05bcd0>, id='001907e868d06e24', url='https://api.twitter.com/1.1/geo/id/001907e868d06e24.json', place_type='admin', name='Dubai', full_name='Dubai, United Arab Emirates', country_code='AE', country='United Arab Emirates', contained_within=[], bounding_box=BoundingBox(_api=<tweepy.api.API object at 0x7f434d05bcd0>, type='Polygon', coordinates=[[[54.8939725, 24.6182526], [56.2083722, 24.6182526], [56.2083722, 25.3686719], [54.8939725, 25.3686719]]]), attributes={})"
103,The Oxford vaccine smuggles the coronavirus gene into human cells to make the spike protein - the unique signature of COVID-19 - which the immune system builds up a response to if the real virus enters the body.,1351072301979217927,2021-01-18 07:41:53,1,0,"Place(_api=<tweepy.api.API object at 0x7f434d05bcd0>, id='001907e868d06e24', url='https://api.twitter.com/1.1/geo/id/001907e868d06e24.json', place_type='admin', name='Dubai', full_name='Dubai, United Arab Emirates', country_code='AE', country='United Arab Emirates', contained_within=[], bounding_box=BoundingBox(_api=<tweepy.api.API object at 0x7f434d05bcd0>, type='Polygon', coordinates=[[[54.8939725, 24.6182526], [56.2083722, 24.6182526], [56.2083722, 25.3686719], [54.8939725, 25.3686719]]]), attributes={})"
104,"The Senior most doctor of Bargarh Dist.Head Quarter Hospital, Dr. Kamalini Satpathy (Retd. ADMO - FW) taking her first dose of COVISHIELD today. At 69,She is a Frontline healthcare worker of DHH Bargarh,all throughout the Pandemic and a COVID warrior herself. Proud of you Maa ",1351054299065946114,2021-01-18 06:30:20,27,4,"Place(_api=<tweepy.api.API object at 0x7f434d05bcd0>, id='001907e868d06e24', url='https://api.twitter.com/1.1/geo/id/001907e868d06e24.json', place_type='admin', name='Dubai', full_name='Dubai, United Arab Emirates', country_code='AE', country='United Arab Emirates', contained_within=[], bounding_box=BoundingBox(_api=<tweepy.api.API object at 0x7f434d05bcd0>, type='Polygon', coordinates=[[[54.8939725, 24.6182526], [56.2083722, 24.6182526], [56.2083722, 25.3686719], [54.8939725, 25.3686719]]]), attributes={})"
105,"18th Jan: I feel like I’m really growing out of my comfort zone. I also feel older and more mature. Since covid began, I think we are forced to look at another perspective in life. I think that’s good but it ain’t easy. It’s beyond our control but we should manage responsibly.",1351052691871567873,2021-01-18 06:23:57,0,0,"Place(_api=<tweepy.api.API object at 0x7f434d05bcd0>, id='001907e868d06e24', url='https://api.twitter.com/1.1/geo/id/001907e868d06e24.json', place_type='admin', name='Dubai', full_name='Dubai, United Arab Emirates', country_code='AE', country='United Arab Emirates', contained_within=[], bounding_box=BoundingBox(_api=<tweepy.api.API object at 0x7f434d05bcd0>, type='Polygon', coordinates=[[[54.8939725, 24.6182526], [56.2083722, 24.6182526], [56.2083722, 25.3686719], [54.8939725, 25.3686719]]]), attributes={})"
106,"And if you’re already gay, be ready to become even “gayer”...  Orthodox Rabbi Claims COVID-19 Vaccine Will Make You Gay  via",1351040858523639814,2021-01-18 05:36:56,0,0,"Place(_api=<tweepy.api.API object at 0x7f434d05bcd0>, id='001907e868d06e24', url='https://api.twitter.com/1.1/geo/id/001907e868d06e24.json', place_type='admin', name='Dubai', full_name='Dubai, United Arab Emirates', country_code='AE', country='United Arab Emirates', contained_within=[], bounding_box=BoundingBox(_api=<tweepy.api.API object at 0x7f434d05bcd0>, type='Polygon', coordinates=[[[54.8939725, 24.6182526], [56.2083722, 24.6182526], [56.2083722, 25.3686719], [54.8939725, 25.3686719]]]), attributes={})"
107,A glimpse into Sinovac's COVID-19 vaccine work ,1351013314713812992,2021-01-18 03:47:29,0,0,"Place(_api=<tweepy.api.API object at 0x7f434d05bcd0>, id='00f24ae701a1207b', url='https://api.twitter.com/1.1/geo/id/00f24ae701a1207b.json', place_type='admin', name='Abu Dhabi', full_name='Abu Dhabi, United Arab Emirates', country_code='AE', country='United Arab Emirates', contained_within=[], bounding_box=BoundingBox(_api=<tweepy.api.API object at 0x7f434d05bcd0>, type='Polygon', coordinates=[[[51.2938738, 22.6261387], [56.0175464, 22.6261387], [56.0175464, 25.1639588], [51.2938738, 25.1639588]]]), attributes={})"
108,"PFIZER Mayhem FROM THE CDC; 3,150 people vaccinated in ONE DAY are ""unable to perform normal daily activities, unable to work"" after vaccination. This is a massive 2.7% of people who can no longer work after having the Pfizer vaccine.  ",1351011350655496196,2021-01-18 03:39:41,0,0,"Place(_api=<tweepy.api.API object at 0x7f434d05bcd0>, id='001907e868d06e24', url='https://api.twitter.com/1.1/geo/id/001907e868d06e24.json', place_type='admin', name='Dubai', full_name='Dubai, United Arab Emirates', country_code='AE', country='United Arab Emirates', contained_within=[], bounding_box=BoundingBox(_api=<tweepy.api.API object at 0x7f434d05bcd0>, type='Polygon', coordinates=[[[54.8939725, 24.6182526], [56.2083722, 24.6182526], [56.2083722, 25.3686719], [54.8939725, 25.3686719]]]), attributes={})"
109,"on jan 18, 1am, I received a call from ms samiya, bareen call center. ""ms. joanne, your result has just came out. you are COVID-19 positive.""",1351007659118489603,2021-01-18 03:25:01,0,0,"Place(_api=<tweepy.api.API object at 0x7f434d05bcd0>, id='00f24ae701a1207b', url='https://api.twitter.com/1.1/geo/id/00f24ae701a1207b.json', place_type='admin', name='Abu Dhabi', full_name='Abu Dhabi, United Arab Emirates', country_code='AE', country='United Arab Emirates', contained_within=[], bounding_box=BoundingBox(_api=<tweepy.api.API object at 0x7f434d05bcd0>, type='Polygon', coordinates=[[[51.2938738, 22.6261387], [56.0175464, 22.6261387], [56.0175464, 25.1639588], [51.2938738, 25.1639588]]]), attributes={})"
110,offering free vaccination for all residents now ,1350997626825691137,2021-01-18 02:45:09,0,0,"Place(_api=<tweepy.api.API object at 0x7f434d05bcd0>, id='001907e868d06e24', url='https://api.twitter.com/1.1/geo/id/001907e868d06e24.json', place_type='admin', name='Dubai', full_name='Dubai, United Arab Emirates', country_code='AE', country='United Arab Emirates', contained_within=[], bounding_box=BoundingBox(_api=<tweepy.api.API object at 0x7f434d05bcd0>, type='Polygon', coordinates=[[[54.8939725, 24.6182526], [56.2083722, 24.6182526], [56.2083722, 25.3686719], [54.8939725, 25.3686719]]]), attributes={})"
