,Tweets,id,date,likes,retweets,place
0,"Ok if you say so Today India has 16.3 million people with covid and 333000 new cases a day...a new horrific world record ..was that on indian news anywhere Most agree it's actually worse than that...no space in hospitals, no supplies..good job",1385895865710260225,2021-04-24 09:58:17,0,0,"Place(_api=<tweepy.api.API object at 0x7f8a926a27f0>, id='001907e868d06e24', url='https://api.twitter.com/1.1/geo/id/001907e868d06e24.json', place_type='admin', name='Dubai', full_name='Dubai, United Arab Emirates', country_code='AE', country='United Arab Emirates', contained_within=[], bounding_box=BoundingBox(_api=<tweepy.api.API object at 0x7f8a926a27f0>, type='Polygon', coordinates=[[[54.8939725, 24.6182526], [56.2083722, 24.6182526], [56.2083722, 25.3686719], [54.8939725, 25.3686719]]]), attributes={})"
1,"As of 23 April 2021, there have been 13,50,501 confirmed cases, test positivity rate is at an alarming all time high of 21.78% (8.87% cumulative), (more than the national average) ",1385895776019263488,2021-04-24 09:57:56,0,0,"Place(_api=<tweepy.api.API object at 0x7f8a926a27f0>, id='001907e868d06e24', url='https://api.twitter.com/1.1/geo/id/001907e868d06e24.json', place_type='admin', name='Dubai', full_name='Dubai, United Arab Emirates', country_code='AE', country='United Arab Emirates', contained_within=[], bounding_box=BoundingBox(_api=<tweepy.api.API object at 0x7f8a926a27f0>, type='Polygon', coordinates=[[[54.8939725, 24.6182526], [56.2083722, 24.6182526], [56.2083722, 25.3686719], [54.8939725, 25.3686719]]]), attributes={})"
2,Corona Is Out Of Control In India May Allah Have The Mercy On The Indian Citizen And Put An End To This Virus. Ameen,1385882301070970880,2021-04-24 09:04:23,1,0,"Place(_api=<tweepy.api.API object at 0x7f8a926a27f0>, id='0b9be7632c153000', url='https://api.twitter.com/1.1/geo/id/0b9be7632c153000.json', place_type='poi', name='The Philippine  School-Dubai, Muhaisnah 2', full_name='The Philippine  School-Dubai, Muhaisnah 2', country_code='AE', country='United Arab Emirates', contained_within=[], bounding_box=BoundingBox(_api=<tweepy.api.API object at 0x7f8a926a27f0>, type='Polygon', coordinates=[[[55.418905, 25.257777], [55.418905, 25.257777], [55.418905, 25.257777], [55.418905, 25.257777]]]), attributes={})"
3,How many Covid ICU bed there ,1385876654631817216,2021-04-24 08:41:57,0,0,"Place(_api=<tweepy.api.API object at 0x7f8a926a27f0>, id='001907e868d06e24', url='https://api.twitter.com/1.1/geo/id/001907e868d06e24.json', place_type='admin', name='Dubai', full_name='Dubai, United Arab Emirates', country_code='AE', country='United Arab Emirates', contained_within=[], bounding_box=BoundingBox(_api=<tweepy.api.API object at 0x7f8a926a27f0>, type='Polygon', coordinates=[[[54.8939725, 24.6182526], [56.2083722, 24.6182526], [56.2083722, 25.3686719], [54.8939725, 25.3686719]]]), attributes={})"
4,"Be the reason behind the joy of the children by providing Eid clothing to quench their thirst, rejoice their children, and support their elderly  . .",1385873849531568132,2021-04-24 08:30:48,0,0,"Place(_api=<tweepy.api.API object at 0x7f8a926a27f0>, id='00f24ae701a1207b', url='https://api.twitter.com/1.1/geo/id/00f24ae701a1207b.json', place_type='admin', name='Abu Dhabi', full_name='Abu Dhabi, United Arab Emirates', country_code='AE', country='United Arab Emirates', contained_within=[], bounding_box=BoundingBox(_api=<tweepy.api.API object at 0x7f8a926a27f0>, type='Polygon', coordinates=[[[51.2938738, 22.6261387], [56.0175464, 22.6261387], [56.0175464, 25.1639588], [51.2938738, 25.1639588]]]), attributes={})"
5,For telephonic guidance on Covid-19 from 4 to 8 pm - Dr N Zaveri. 9321489748 Dr S Ansari. 7045720278 Dr L Kedia. 9321470560 Dr B Shukla. 9321489060 Dr S Halwai. 9867379346 Dr M Kotian. 8928650290,1385868727242174466,2021-04-24 08:10:27,0,0,"Place(_api=<tweepy.api.API object at 0x7f8a926a27f0>, id='01a4aba930967a19', url='https://api.twitter.com/1.1/geo/id/01a4aba930967a19.json', place_type='admin', name='Ajman', full_name='Ajman, United Arab Emirates', country_code='AE', country='United Arab Emirates', contained_within=[], bounding_box=BoundingBox(_api=<tweepy.api.API object at 0x7f8a926a27f0>, type='Polygon', coordinates=[[[55.4228459, 24.7422387], [56.1015028, 24.7422387], [56.1015028, 25.4513274], [55.4228459, 25.4513274]]]), attributes={})"
6,"Quite right but again, wasn't my point about and other media not reporting the truth about the horrific pandemic response by the Indian government, thus making it far worse",1385867112527405056,2021-04-24 08:04:02,0,0,"Place(_api=<tweepy.api.API object at 0x7f8a926a27f0>, id='001907e868d06e24', url='https://api.twitter.com/1.1/geo/id/001907e868d06e24.json', place_type='admin', name='Dubai', full_name='Dubai, United Arab Emirates', country_code='AE', country='United Arab Emirates', contained_within=[], bounding_box=BoundingBox(_api=<tweepy.api.API object at 0x7f8a926a27f0>, type='Polygon', coordinates=[[[54.8939725, 24.6182526], [56.2083722, 24.6182526], [56.2083722, 25.3686719], [54.8939725, 25.3686719]]]), attributes={})"
7,is the only one telling the truth about the pandemic in India which is why so many sane Indians get their news from it,1385866494739943427,2021-04-24 08:01:35,0,0,"Place(_api=<tweepy.api.API object at 0x7f8a926a27f0>, id='001907e868d06e24', url='https://api.twitter.com/1.1/geo/id/001907e868d06e24.json', place_type='admin', name='Dubai', full_name='Dubai, United Arab Emirates', country_code='AE', country='United Arab Emirates', contained_within=[], bounding_box=BoundingBox(_api=<tweepy.api.API object at 0x7f8a926a27f0>, type='Polygon', coordinates=[[[54.8939725, 24.6182526], [56.2083722, 24.6182526], [56.2083722, 25.3686719], [54.8939725, 25.3686719]]]), attributes={})"
8,Isn’t this make more sense  then gathering crowd in this pandemic situation  ,1385862989182611463,2021-04-24 07:47:39,0,0,"Place(_api=<tweepy.api.API object at 0x7f8a926a27f0>, id='001907e868d06e24', url='https://api.twitter.com/1.1/geo/id/001907e868d06e24.json', place_type='admin', name='Dubai', full_name='Dubai, United Arab Emirates', country_code='AE', country='United Arab Emirates', contained_within=[], bounding_box=BoundingBox(_api=<tweepy.api.API object at 0x7f8a926a27f0>, type='Polygon', coordinates=[[[54.8939725, 24.6182526], [56.2083722, 24.6182526], [56.2083722, 25.3686719], [54.8939725, 25.3686719]]]), attributes={})"
9,"Dear PM IK, plz reach out to help our neighbours and provide as much oxygen as we can to our friends across the borders. Dear Indians, stay strong. We will beat COVID together. Prayers from Pakistan ",1385851069033447429,2021-04-24 07:00:17,0,0,"Place(_api=<tweepy.api.API object at 0x7f8a926a27f0>, id='001907e868d06e24', url='https://api.twitter.com/1.1/geo/id/001907e868d06e24.json', place_type='admin', name='Dubai', full_name='Dubai, United Arab Emirates', country_code='AE', country='United Arab Emirates', contained_within=[], bounding_box=BoundingBox(_api=<tweepy.api.API object at 0x7f8a926a27f0>, type='Polygon', coordinates=[[[54.8939725, 24.6182526], [56.2083722, 24.6182526], [56.2083722, 25.3686719], [54.8939725, 25.3686719]]]), attributes={})"
10,India would never have eliminated Polio if people had to buy polio vaccines. Same logic applies to the Covid vaccine.,1385834687524913153,2021-04-24 05:55:11,0,0,"Place(_api=<tweepy.api.API object at 0x7f8a926a27f0>, id='00f24ae701a1207b', url='https://api.twitter.com/1.1/geo/id/00f24ae701a1207b.json', place_type='admin', name='Abu Dhabi', full_name='Abu Dhabi, United Arab Emirates', country_code='AE', country='United Arab Emirates', contained_within=[], bounding_box=BoundingBox(_api=<tweepy.api.API object at 0x7f8a926a27f0>, type='Polygon', coordinates=[[[51.2938738, 22.6261387], [56.0175464, 22.6261387], [56.0175464, 25.1639588], [51.2938738, 25.1639588]]]), attributes={})"
11,20 COVID patients died in Jaipur Golden Hospital last night due to shortage of Oxygen. Shameless SC and Bodbe. ,1385833371830525959,2021-04-24 05:49:58,0,1,"Place(_api=<tweepy.api.API object at 0x7f8a926a27f0>, id='001907e868d06e24', url='https://api.twitter.com/1.1/geo/id/001907e868d06e24.json', place_type='admin', name='Dubai', full_name='Dubai, United Arab Emirates', country_code='AE', country='United Arab Emirates', contained_within=[], bounding_box=BoundingBox(_api=<tweepy.api.API object at 0x7f8a926a27f0>, type='Polygon', coordinates=[[[54.8939725, 24.6182526], [56.2083722, 24.6182526], [56.2083722, 25.3686719], [54.8939725, 25.3686719]]]), attributes={})"
12,"Odisha Artist couple Jagannath and Pranati Panda are suffering from COVID for many weeks. They are severely ill. Oxygen level is going down. Hospitals r denying4 admission. Urgent help. They are in Palm Spring, Sector 53, Gurgaon. Pls help",1385832035491659779,2021-04-24 05:44:39,0,1,"Place(_api=<tweepy.api.API object at 0x7f8a926a27f0>, id='00ecb59b0dad186e', url='https://api.twitter.com/1.1/geo/id/00ecb59b0dad186e.json', place_type='admin', name='Sharjah', full_name='Sharjah, United Arab Emirates', country_code='AE', country='United Arab Emirates', contained_within=[], bounding_box=BoundingBox(_api=<tweepy.api.API object at 0x7f8a926a27f0>, type='Polygon', coordinates=[[[55.0091271, 24.7328863], [56.3816989, 24.7328863], [56.3816989, 25.8997649], [55.0091271, 25.8997649]]]), attributes={})"
13,"Would somebody care to to highlight this news now India is fighting the pandemic just as any other developed country in the world, perhaps in a better fashion considering the population and the percentage of population that is infected. JaI Hind ",1385830237586481154,2021-04-24 05:37:30,0,0,"Place(_api=<tweepy.api.API object at 0x7f8a926a27f0>, id='001907e868d06e24', url='https://api.twitter.com/1.1/geo/id/001907e868d06e24.json', place_type='admin', name='Dubai', full_name='Dubai, United Arab Emirates', country_code='AE', country='United Arab Emirates', contained_within=[], bounding_box=BoundingBox(_api=<tweepy.api.API object at 0x7f8a926a27f0>, type='Polygon', coordinates=[[[54.8939725, 24.6182526], [56.2083722, 24.6182526], [56.2083722, 25.3686719], [54.8939725, 25.3686719]]]), attributes={})"
14,As a humanity please pray for India  •Covid tsunami hits India reported 3Lacs cases and 2100+ deaths in one day and makes extreme to extremest shortage of beds and oxygen cylinders  ,1385808228743852032,2021-04-24 04:10:03,2,0,"Place(_api=<tweepy.api.API object at 0x7f8a926a27f0>, id='00ecb59b0dad186e', url='https://api.twitter.com/1.1/geo/id/00ecb59b0dad186e.json', place_type='admin', name='Sharjah', full_name='Sharjah, United Arab Emirates', country_code='AE', country='United Arab Emirates', contained_within=[], bounding_box=BoundingBox(_api=<tweepy.api.API object at 0x7f8a926a27f0>, type='Polygon', coordinates=[[[55.0091271, 24.7328863], [56.3816989, 24.7328863], [56.3816989, 25.8997649], [55.0091271, 25.8997649]]]), attributes={})"
15,"CORONA (Covid 19) Origin is from Wuhan,china. But china name is in the green list. What is the idea behind this. ",1385803210837929985,2021-04-24 03:50:07,0,0,"Place(_api=<tweepy.api.API object at 0x7f8a926a27f0>, id='00f24ae701a1207b', url='https://api.twitter.com/1.1/geo/id/00f24ae701a1207b.json', place_type='admin', name='Abu Dhabi', full_name='Abu Dhabi, United Arab Emirates', country_code='AE', country='United Arab Emirates', contained_within=[], bounding_box=BoundingBox(_api=<tweepy.api.API object at 0x7f8a926a27f0>, type='Polygon', coordinates=[[[51.2938738, 22.6261387], [56.0175464, 22.6261387], [56.0175464, 25.1639588], [51.2938738, 25.1639588]]]), attributes={})"
16,Ante daggarollaki corona vaste fans FL enjoy cheyyaleru anemo...,1385756823492366336,2021-04-24 00:45:47,0,0,"Place(_api=<tweepy.api.API object at 0x7f8a926a27f0>, id='00f24ae701a1207b', url='https://api.twitter.com/1.1/geo/id/00f24ae701a1207b.json', place_type='admin', name='Abu Dhabi', full_name='Abu Dhabi, United Arab Emirates', country_code='AE', country='United Arab Emirates', contained_within=[], bounding_box=BoundingBox(_api=<tweepy.api.API object at 0x7f8a926a27f0>, type='Polygon', coordinates=[[[51.2938738, 22.6261387], [56.0175464, 22.6261387], [56.0175464, 25.1639588], [51.2938738, 25.1639588]]]), attributes={})"
17, Two Nuclear Powers . PAKISTAN - Don't have COVID VACCINE INDIA - Don't have OXYGEN . why you both investing on Nuclear Programs and billion of billions Dollar buying Weapons from west and US . Weather you don't have basic facilities for health,1385748877853265925,2021-04-24 00:14:13,6,2,"Place(_api=<tweepy.api.API object at 0x7f8a926a27f0>, id='001907e868d06e24', url='https://api.twitter.com/1.1/geo/id/001907e868d06e24.json', place_type='admin', name='Dubai', full_name='Dubai, United Arab Emirates', country_code='AE', country='United Arab Emirates', contained_within=[], bounding_box=BoundingBox(_api=<tweepy.api.API object at 0x7f8a926a27f0>, type='Polygon', coordinates=[[[54.8939725, 24.6182526], [56.2083722, 24.6182526], [56.2083722, 25.3686719], [54.8939725, 25.3686719]]]), attributes={})"
18,"Indian hospitals at its worst. Covid is uncontrollable. Plsss stay home, wear masks and Avoid outings Plsss   May Allah bless us. Ameen  ",1385738644263251972,2021-04-23 23:33:33,10,5,"Place(_api=<tweepy.api.API object at 0x7f8a926a27f0>, id='00f24ae701a1207b', url='https://api.twitter.com/1.1/geo/id/00f24ae701a1207b.json', place_type='admin', name='Abu Dhabi', full_name='Abu Dhabi, United Arab Emirates', country_code='AE', country='United Arab Emirates', contained_within=[], bounding_box=BoundingBox(_api=<tweepy.api.API object at 0x7f8a926a27f0>, type='Polygon', coordinates=[[[51.2938738, 22.6261387], [56.0175464, 22.6261387], [56.0175464, 25.1639588], [51.2938738, 25.1639588]]]), attributes={})"
19,Rebellion is the biggest pandemic that the church is facing today. ,1385733364330733568,2021-04-23 23:12:34,0,0,"Place(_api=<tweepy.api.API object at 0x7f8a926a27f0>, id='001907e868d06e24', url='https://api.twitter.com/1.1/geo/id/001907e868d06e24.json', place_type='admin', name='Dubai', full_name='Dubai, United Arab Emirates', country_code='AE', country='United Arab Emirates', contained_within=[], bounding_box=BoundingBox(_api=<tweepy.api.API object at 0x7f8a926a27f0>, type='Polygon', coordinates=[[[54.8939725, 24.6182526], [56.2083722, 24.6182526], [56.2083722, 25.3686719], [54.8939725, 25.3686719]]]), attributes={})"
20,"Isa pa yon Ms Angel intention is for good naman, she already seek for a lifetime forgiveness. Infact too many lives are now buried due to EJKs and Covid in this admin. Let us see who really is the bad one.",1385727941242351619,2021-04-23 22:51:01,0,0,"Place(_api=<tweepy.api.API object at 0x7f8a926a27f0>, id='00f24ae701a1207b', url='https://api.twitter.com/1.1/geo/id/00f24ae701a1207b.json', place_type='admin', name='Abu Dhabi', full_name='Abu Dhabi, United Arab Emirates', country_code='AE', country='United Arab Emirates', contained_within=[], bounding_box=BoundingBox(_api=<tweepy.api.API object at 0x7f8a926a27f0>, type='Polygon', coordinates=[[[51.2938738, 22.6261387], [56.0175464, 22.6261387], [56.0175464, 25.1639588], [51.2938738, 25.1639588]]]), attributes={})"
21,"When Nations and the entire globe have been defeated and crippled with Covid-19,people have and are dieing in their millions now at only 40% lung damage .BUT ON THIS OTHER SIDE 96% LUNG DAMAGED PATIENT WALKS AWAY WITH BRAND NEW LUNGS. THE MIRACLES OF THE CROSS",1385724090393169926,2021-04-23 22:35:43,5,1,"Place(_api=<tweepy.api.API object at 0x7f8a926a27f0>, id='001907e868d06e24', url='https://api.twitter.com/1.1/geo/id/001907e868d06e24.json', place_type='admin', name='Dubai', full_name='Dubai, United Arab Emirates', country_code='AE', country='United Arab Emirates', contained_within=[], bounding_box=BoundingBox(_api=<tweepy.api.API object at 0x7f8a926a27f0>, type='Polygon', coordinates=[[[54.8939725, 24.6182526], [56.2083722, 24.6182526], [56.2083722, 25.3686719], [54.8939725, 25.3686719]]]), attributes={})"
22,What a power-packed revival right in the middle of corona-virus judgement ,1385721528898228227,2021-04-23 22:25:32,1,0,"Place(_api=<tweepy.api.API object at 0x7f8a926a27f0>, id='001907e868d06e24', url='https://api.twitter.com/1.1/geo/id/001907e868d06e24.json', place_type='admin', name='Dubai', full_name='Dubai, United Arab Emirates', country_code='AE', country='United Arab Emirates', contained_within=[], bounding_box=BoundingBox(_api=<tweepy.api.API object at 0x7f8a926a27f0>, type='Polygon', coordinates=[[[54.8939725, 24.6182526], [56.2083722, 24.6182526], [56.2083722, 25.3686719], [54.8939725, 25.3686719]]]), attributes={})"
23,"Nationalist means extreme right wing . Nothing wrong with being Hindu. I don't think Jacinda is religious but that's not my point , it's about the media report facts and not twisting the truth which so why the death toll and covid response is worse ..",1385708331877154821,2021-04-23 21:33:06,1,0,"Place(_api=<tweepy.api.API object at 0x7f8a926a27f0>, id='001907e868d06e24', url='https://api.twitter.com/1.1/geo/id/001907e868d06e24.json', place_type='admin', name='Dubai', full_name='Dubai, United Arab Emirates', country_code='AE', country='United Arab Emirates', contained_within=[], bounding_box=BoundingBox(_api=<tweepy.api.API object at 0x7f8a926a27f0>, type='Polygon', coordinates=[[[54.8939725, 24.6182526], [56.2083722, 24.6182526], [56.2083722, 25.3686719], [54.8939725, 25.3686719]]]), attributes={})"
24,"The answer they give me is very flat that they are not working due to a pandemic As I told you before, I am in Dubai and I was in the Pakistani embassy, ​​they told me that they can help me if they send the application to this embassy.",1385695643688128512,2021-04-23 20:42:41,0,0,"Place(_api=<tweepy.api.API object at 0x7f8a926a27f0>, id='001907e868d06e24', url='https://api.twitter.com/1.1/geo/id/001907e868d06e24.json', place_type='admin', name='Dubai', full_name='Dubai, United Arab Emirates', country_code='AE', country='United Arab Emirates', contained_within=[], bounding_box=BoundingBox(_api=<tweepy.api.API object at 0x7f8a926a27f0>, type='Polygon', coordinates=[[[54.8939725, 24.6182526], [56.2083722, 24.6182526], [56.2083722, 25.3686719], [54.8939725, 25.3686719]]]), attributes={})"
25,"Delighted to reconnect with my alma matter and to discuss global careers, particularly during the pandemic. Please listen in to the series and join the discussion ",1385682720261607431,2021-04-23 19:51:19,2,2,"Place(_api=<tweepy.api.API object at 0x7f8a926a27f0>, id='001907e868d06e24', url='https://api.twitter.com/1.1/geo/id/001907e868d06e24.json', place_type='admin', name='Dubai', full_name='Dubai, United Arab Emirates', country_code='AE', country='United Arab Emirates', contained_within=[], bounding_box=BoundingBox(_api=<tweepy.api.API object at 0x7f8a926a27f0>, type='Polygon', coordinates=[[[54.8939725, 24.6182526], [56.2083722, 24.6182526], [56.2083722, 25.3686719], [54.8939725, 25.3686719]]]), attributes={})"
26,The way covid cases again surging across the world shouldn’t be an alarming situation or we just take it lightly when this all started as some country left it loose. What is world leadership going to do to save human lives.,1385673230409666564,2021-04-23 19:13:37,0,0,"Place(_api=<tweepy.api.API object at 0x7f8a926a27f0>, id='001907e868d06e24', url='https://api.twitter.com/1.1/geo/id/001907e868d06e24.json', place_type='admin', name='Dubai', full_name='Dubai, United Arab Emirates', country_code='AE', country='United Arab Emirates', contained_within=[], bounding_box=BoundingBox(_api=<tweepy.api.API object at 0x7f8a926a27f0>, type='Polygon', coordinates=[[[54.8939725, 24.6182526], [56.2083722, 24.6182526], [56.2083722, 25.3686719], [54.8939725, 25.3686719]]]), attributes={})"
27,Stop politics now I beg everyone to come together save our country save our people. It’s not the time to debate on failure or achievements of government but a strong will required to defeat this covid.,1385670541177143303,2021-04-23 19:02:56,0,0,"Place(_api=<tweepy.api.API object at 0x7f8a926a27f0>, id='001907e868d06e24', url='https://api.twitter.com/1.1/geo/id/001907e868d06e24.json', place_type='admin', name='Dubai', full_name='Dubai, United Arab Emirates', country_code='AE', country='United Arab Emirates', contained_within=[], bounding_box=BoundingBox(_api=<tweepy.api.API object at 0x7f8a926a27f0>, type='Polygon', coordinates=[[[54.8939725, 24.6182526], [56.2083722, 24.6182526], [56.2083722, 25.3686719], [54.8939725, 25.3686719]]]), attributes={})"
28,Rakesh Tikait Iftaar party at Delhi border with 1000 others during corona time,1385666874579501056,2021-04-23 18:48:22,0,0,"Place(_api=<tweepy.api.API object at 0x7f8a926a27f0>, id='001907e868d06e24', url='https://api.twitter.com/1.1/geo/id/001907e868d06e24.json', place_type='admin', name='Dubai', full_name='Dubai, United Arab Emirates', country_code='AE', country='United Arab Emirates', contained_within=[], bounding_box=BoundingBox(_api=<tweepy.api.API object at 0x7f8a926a27f0>, type='Polygon', coordinates=[[[54.8939725, 24.6182526], [56.2083722, 24.6182526], [56.2083722, 25.3686719], [54.8939725, 25.3686719]]]), attributes={})"
29,Use myCodeANNand get 15%off at ,1385665042427830276,2021-04-23 18:41:05,1,2,"Place(_api=<tweepy.api.API object at 0x7f8a926a27f0>, id='001907e868d06e24', url='https://api.twitter.com/1.1/geo/id/001907e868d06e24.json', place_type='admin', name='Dubai', full_name='Dubai, United Arab Emirates', country_code='AE', country='United Arab Emirates', contained_within=[], bounding_box=BoundingBox(_api=<tweepy.api.API object at 0x7f8a926a27f0>, type='Polygon', coordinates=[[[54.8939725, 24.6182526], [56.2083722, 24.6182526], [56.2083722, 25.3686719], [54.8939725, 25.3686719]]]), attributes={})"
30,kindly think and utilize our cricket stadiums. and make the arrangements for the covid patients before it get too late coming days it will become worst if it’s not tackle it .. utilize the Army support if required .,1385663399955255297,2021-04-23 18:34:33,0,0,"Place(_api=<tweepy.api.API object at 0x7f8a926a27f0>, id='001907e868d06e24', url='https://api.twitter.com/1.1/geo/id/001907e868d06e24.json', place_type='admin', name='Dubai', full_name='Dubai, United Arab Emirates', country_code='AE', country='United Arab Emirates', contained_within=[], bounding_box=BoundingBox(_api=<tweepy.api.API object at 0x7f8a926a27f0>, type='Polygon', coordinates=[[[54.8939725, 24.6182526], [56.2083722, 24.6182526], [56.2083722, 25.3686719], [54.8939725, 25.3686719]]]), attributes={})"
31,"Arey Bhai is hisab se agar koi country test krta hi nhi to wahan pe to zero cases report hongey, even though wahan covid +ve patients hongay. Ye serious issue hai or ye srf India k lye hi nhi bal k puri duniya k lye concerning hai. Please see the covid positivity rate of India",1385656134019788806,2021-04-23 18:05:41,0,0,"Place(_api=<tweepy.api.API object at 0x7f8a926a27f0>, id='01a4aba930967a19', url='https://api.twitter.com/1.1/geo/id/01a4aba930967a19.json', place_type='admin', name='Ajman', full_name='Ajman, United Arab Emirates', country_code='AE', country='United Arab Emirates', contained_within=[], bounding_box=BoundingBox(_api=<tweepy.api.API object at 0x7f8a926a27f0>, type='Polygon', coordinates=[[[55.4228459, 24.7422387], [56.1015028, 24.7422387], [56.1015028, 25.4513274], [55.4228459, 25.4513274]]]), attributes={})"
32,"Beds availability: Sardar Patel COVID Centre, Delhi - 1500 oxygen and ventilator beds available Verified. Delhi bed available 011-26655959; 011-26655969 Try this pls",1385655596066689034,2021-04-23 18:03:32,0,0,"Place(_api=<tweepy.api.API object at 0x7f8a926a27f0>, id='001907e868d06e24', url='https://api.twitter.com/1.1/geo/id/001907e868d06e24.json', place_type='admin', name='Dubai', full_name='Dubai, United Arab Emirates', country_code='AE', country='United Arab Emirates', contained_within=[], bounding_box=BoundingBox(_api=<tweepy.api.API object at 0x7f8a926a27f0>, type='Polygon', coordinates=[[[54.8939725, 24.6182526], [56.2083722, 24.6182526], [56.2083722, 25.3686719], [54.8939725, 25.3686719]]]), attributes={})"
33,"With enough supplies, Israel looks to re-route AstraZeneca COVID-19 vaccine delivery  Perhaps procure these ready stocks",1385652322202697731,2021-04-23 17:50:32,0,0,"Place(_api=<tweepy.api.API object at 0x7f8a926a27f0>, id='001907e868d06e24', url='https://api.twitter.com/1.1/geo/id/001907e868d06e24.json', place_type='admin', name='Dubai', full_name='Dubai, United Arab Emirates', country_code='AE', country='United Arab Emirates', contained_within=[], bounding_box=BoundingBox(_api=<tweepy.api.API object at 0x7f8a926a27f0>, type='Polygon', coordinates=[[[54.8939725, 24.6182526], [56.2083722, 24.6182526], [56.2083722, 25.3686719], [54.8939725, 25.3686719]]]), attributes={})"
34,The current COVID situation in India is heart breaking my prayers for all who are suffering .. if the govt of India had invested in health care rather than defence spendings things would have been much better ... prayers from Pakistan  may ALLAH be with you,1385647334046973953,2021-04-23 17:30:43,0,0,"Place(_api=<tweepy.api.API object at 0x7f8a926a27f0>, id='00f24ae701a1207b', url='https://api.twitter.com/1.1/geo/id/00f24ae701a1207b.json', place_type='admin', name='Abu Dhabi', full_name='Abu Dhabi, United Arab Emirates', country_code='AE', country='United Arab Emirates', contained_within=[], bounding_box=BoundingBox(_api=<tweepy.api.API object at 0x7f8a926a27f0>, type='Polygon', coordinates=[[[51.2938738, 22.6261387], [56.0175464, 22.6261387], [56.0175464, 25.1639588], [51.2938738, 25.1639588]]]), attributes={})"
