,Tweets,id,date,likes,retweets,place
0,I actually told them to keep hold of it... covid and all ,1387054088538398720,2021-04-27 14:40:39,1,0,"Place(_api=<tweepy.api.API object at 0x7f9c460427f0>, id='001907e868d06e24', url='https://api.twitter.com/1.1/geo/id/001907e868d06e24.json', place_type='admin', name='Dubai', full_name='Dubai, United Arab Emirates', country_code='AE', country='United Arab Emirates', contained_within=[], bounding_box=BoundingBox(_api=<tweepy.api.API object at 0x7f9c460427f0>, type='Polygon', coordinates=[[[54.8939725, 24.6182526], [56.2083722, 24.6182526], [56.2083722, 25.3686719], [54.8939725, 25.3686719]]]), attributes={})"
1,"The Emirates Red Crescent Authority flew a third plane to Damascus, to limit the spread of Covid-19, as part of the UAE's initiatives and its global response to limit the spread of Covid-19 pandemic in the Syria",1387039862956515335,2021-04-27 13:44:07,0,0,"Place(_api=<tweepy.api.API object at 0x7f9c460427f0>, id='00f24ae701a1207b', url='https://api.twitter.com/1.1/geo/id/00f24ae701a1207b.json', place_type='admin', name='Abu Dhabi', full_name='Abu Dhabi, United Arab Emirates', country_code='AE', country='United Arab Emirates', contained_within=[], bounding_box=BoundingBox(_api=<tweepy.api.API object at 0x7f9c460427f0>, type='Polygon', coordinates=[[[51.2938738, 22.6261387], [56.0175464, 22.6261387], [56.0175464, 25.1639588], [51.2938738, 25.1639588]]]), attributes={})"
2,The annual Quran competition under way led by and Thank you to all participants and to the hard work of the team for making this a reality during Covid times. ,1387031568435326976,2021-04-27 13:11:10,2,0,"Place(_api=<tweepy.api.API object at 0x7f9c460427f0>, id='001907e868d06e24', url='https://api.twitter.com/1.1/geo/id/001907e868d06e24.json', place_type='admin', name='Dubai', full_name='Dubai, United Arab Emirates', country_code='AE', country='United Arab Emirates', contained_within=[], bounding_box=BoundingBox(_api=<tweepy.api.API object at 0x7f9c460427f0>, type='Polygon', coordinates=[[[54.8939725, 24.6182526], [56.2083722, 24.6182526], [56.2083722, 25.3686719], [54.8939725, 25.3686719]]]), attributes={})"
3,"govt can bring the law as an ordinance and get it passed during COVID-19 but farmers can’t protest for repeal of the same law. Also, why not repeal and they will go back  ",1387030572162293763,2021-04-27 13:07:12,0,0,"Place(_api=<tweepy.api.API object at 0x7f9c460427f0>, id='001907e868d06e24', url='https://api.twitter.com/1.1/geo/id/001907e868d06e24.json', place_type='admin', name='Dubai', full_name='Dubai, United Arab Emirates', country_code='AE', country='United Arab Emirates', contained_within=[], bounding_box=BoundingBox(_api=<tweepy.api.API object at 0x7f9c460427f0>, type='Polygon', coordinates=[[[54.8939725, 24.6182526], [56.2083722, 24.6182526], [56.2083722, 25.3686719], [54.8939725, 25.3686719]]]), attributes={})"
4,"People are fleeing India because of covid,sad to watch. ",1387011043881259009,2021-04-27 11:49:36,0,0,"Place(_api=<tweepy.api.API object at 0x7f9c460427f0>, id='001907e868d06e24', url='https://api.twitter.com/1.1/geo/id/001907e868d06e24.json', place_type='admin', name='Dubai', full_name='Dubai, United Arab Emirates', country_code='AE', country='United Arab Emirates', contained_within=[], bounding_box=BoundingBox(_api=<tweepy.api.API object at 0x7f9c460427f0>, type='Polygon', coordinates=[[[54.8939725, 24.6182526], [56.2083722, 24.6182526], [56.2083722, 25.3686719], [54.8939725, 25.3686719]]]), attributes={})"
5,Still couldn't move on from our staycation at Pullman Hotel previously known as Steigenberger Hotel in Dubai. It left such a great memory during this pandemic. This is by far the best hotel we've been. ,1387006416121212934,2021-04-27 11:31:13,0,0,"Place(_api=<tweepy.api.API object at 0x7f9c460427f0>, id='001907e868d06e24', url='https://api.twitter.com/1.1/geo/id/001907e868d06e24.json', place_type='admin', name='Dubai', full_name='Dubai, United Arab Emirates', country_code='AE', country='United Arab Emirates', contained_within=[], bounding_box=BoundingBox(_api=<tweepy.api.API object at 0x7f9c460427f0>, type='Polygon', coordinates=[[[54.8939725, 24.6182526], [56.2083722, 24.6182526], [56.2083722, 25.3686719], [54.8939725, 25.3686719]]]), attributes={})"
6,"Please stop being a idiot cheerleader shaking your pompoms for the Goat with the 56 Chati. His criminal complacency and negligence when Covid nos had dropped, complete stupidity in not listening to experts, have led to us to this.",1387005986913796100,2021-04-27 11:29:31,0,0,"Place(_api=<tweepy.api.API object at 0x7f9c460427f0>, id='001907e868d06e24', url='https://api.twitter.com/1.1/geo/id/001907e868d06e24.json', place_type='admin', name='Dubai', full_name='Dubai, United Arab Emirates', country_code='AE', country='United Arab Emirates', contained_within=[], bounding_box=BoundingBox(_api=<tweepy.api.API object at 0x7f9c460427f0>, type='Polygon', coordinates=[[[54.8939725, 24.6182526], [56.2083722, 24.6182526], [56.2083722, 25.3686719], [54.8939725, 25.3686719]]]), attributes={})"
7,Quarantine mode is on and i’m off,1386997278158712837,2021-04-27 10:54:54,0,0,"Place(_api=<tweepy.api.API object at 0x7f9c460427f0>, id='00f24ae701a1207b', url='https://api.twitter.com/1.1/geo/id/00f24ae701a1207b.json', place_type='admin', name='Abu Dhabi', full_name='Abu Dhabi, United Arab Emirates', country_code='AE', country='United Arab Emirates', contained_within=[], bounding_box=BoundingBox(_api=<tweepy.api.API object at 0x7f9c460427f0>, type='Polygon', coordinates=[[[51.2938738, 22.6261387], [56.0175464, 22.6261387], [56.0175464, 25.1639588], [51.2938738, 25.1639588]]]), attributes={})"
8,One of main causes of which is people violating COVID-19 SOPs,1386981777345032193,2021-04-27 09:53:19,0,4,"Place(_api=<tweepy.api.API object at 0x7f9c460427f0>, id='00f24ae701a1207b', url='https://api.twitter.com/1.1/geo/id/00f24ae701a1207b.json', place_type='admin', name='Abu Dhabi', full_name='Abu Dhabi, United Arab Emirates', country_code='AE', country='United Arab Emirates', contained_within=[], bounding_box=BoundingBox(_api=<tweepy.api.API object at 0x7f9c460427f0>, type='Polygon', coordinates=[[[51.2938738, 22.6261387], [56.0175464, 22.6261387], [56.0175464, 25.1639588], [51.2938738, 25.1639588]]]), attributes={})"
9,Pakistan is in an alarming situation ever since a new wave of pandemic hit the country. ,1386980695721975811,2021-04-27 09:49:01,4,5,"Place(_api=<tweepy.api.API object at 0x7f9c460427f0>, id='00f24ae701a1207b', url='https://api.twitter.com/1.1/geo/id/00f24ae701a1207b.json', place_type='admin', name='Abu Dhabi', full_name='Abu Dhabi, United Arab Emirates', country_code='AE', country='United Arab Emirates', contained_within=[], bounding_box=BoundingBox(_api=<tweepy.api.API object at 0x7f9c460427f0>, type='Polygon', coordinates=[[[51.2938738, 22.6261387], [56.0175464, 22.6261387], [56.0175464, 25.1639588], [51.2938738, 25.1639588]]]), attributes={})"
10,"India's COVID-19 death count has now risen to 1,92,311. The 2,767 new fatalities include 676 from Maharashtra, 357 from Delhi, 222 from Uttar Pradesh, 218 from Chhattisgarh, 208 from Karnataka, 152 from Gujarat and 110 from Jharkhand and 104 from Madhya Pradesh. ",1386980525416411142,2021-04-27 09:48:20,1,2,"Place(_api=<tweepy.api.API object at 0x7f9c460427f0>, id='00f24ae701a1207b', url='https://api.twitter.com/1.1/geo/id/00f24ae701a1207b.json', place_type='admin', name='Abu Dhabi', full_name='Abu Dhabi, United Arab Emirates', country_code='AE', country='United Arab Emirates', contained_within=[], bounding_box=BoundingBox(_api=<tweepy.api.API object at 0x7f9c460427f0>, type='Polygon', coordinates=[[[51.2938738, 22.6261387], [56.0175464, 22.6261387], [56.0175464, 25.1639588], [51.2938738, 25.1639588]]]), attributes={})"
11,India in its battle against an aggressive second wave of the coronavirus pandemic. ,1386980220817661952,2021-04-27 09:47:08,2,2,"Place(_api=<tweepy.api.API object at 0x7f9c460427f0>, id='00f24ae701a1207b', url='https://api.twitter.com/1.1/geo/id/00f24ae701a1207b.json', place_type='admin', name='Abu Dhabi', full_name='Abu Dhabi, United Arab Emirates', country_code='AE', country='United Arab Emirates', contained_within=[], bounding_box=BoundingBox(_api=<tweepy.api.API object at 0x7f9c460427f0>, type='Polygon', coordinates=[[[51.2938738, 22.6261387], [56.0175464, 22.6261387], [56.0175464, 25.1639588], [51.2938738, 25.1639588]]]), attributes={})"
12,"For a fourth day in a row, India has set an unwelcome world record for the number of new coronavirus infections with an increase of further 349,691 cases in the past 24 hours. ",1386979909063430144,2021-04-27 09:45:53,1,2,"Place(_api=<tweepy.api.API object at 0x7f9c460427f0>, id='00f24ae701a1207b', url='https://api.twitter.com/1.1/geo/id/00f24ae701a1207b.json', place_type='admin', name='Abu Dhabi', full_name='Abu Dhabi, United Arab Emirates', country_code='AE', country='United Arab Emirates', contained_within=[], bounding_box=BoundingBox(_api=<tweepy.api.API object at 0x7f9c460427f0>, type='Polygon', coordinates=[[[51.2938738, 22.6261387], [56.0175464, 22.6261387], [56.0175464, 25.1639588], [51.2938738, 25.1639588]]]), attributes={})"
13,"There have been 190,000 deaths attributed to Covid in India since the start of the pandemic. ",1386979710417178625,2021-04-27 09:45:06,1,1,"Place(_api=<tweepy.api.API object at 0x7f9c460427f0>, id='00f24ae701a1207b', url='https://api.twitter.com/1.1/geo/id/00f24ae701a1207b.json', place_type='admin', name='Abu Dhabi', full_name='Abu Dhabi, United Arab Emirates', country_code='AE', country='United Arab Emirates', contained_within=[], bounding_box=BoundingBox(_api=<tweepy.api.API object at 0x7f9c460427f0>, type='Polygon', coordinates=[[[51.2938738, 22.6261387], [56.0175464, 22.6261387], [56.0175464, 25.1639588], [51.2938738, 25.1639588]]]), attributes={})"
14,"In India alone, almost 350,000 COVID-19 cases were reported in a day and 2700 deaths - bringing the total number of cases to 16.5 million, second only to the US. ",1386979309798137856,2021-04-27 09:43:30,2,1,"Place(_api=<tweepy.api.API object at 0x7f9c460427f0>, id='00f24ae701a1207b', url='https://api.twitter.com/1.1/geo/id/00f24ae701a1207b.json', place_type='admin', name='Abu Dhabi', full_name='Abu Dhabi, United Arab Emirates', country_code='AE', country='United Arab Emirates', contained_within=[], bounding_box=BoundingBox(_api=<tweepy.api.API object at 0x7f9c460427f0>, type='Polygon', coordinates=[[[51.2938738, 22.6261387], [56.0175464, 22.6261387], [56.0175464, 25.1639588], [51.2938738, 25.1639588]]]), attributes={})"
15,The actual number of people dying of Covid is two to three times higher than what the government is reporting. ,1386979154613215235,2021-04-27 09:42:53,4,9,"Place(_api=<tweepy.api.API object at 0x7f9c460427f0>, id='00f24ae701a1207b', url='https://api.twitter.com/1.1/geo/id/00f24ae701a1207b.json', place_type='admin', name='Abu Dhabi', full_name='Abu Dhabi, United Arab Emirates', country_code='AE', country='United Arab Emirates', contained_within=[], bounding_box=BoundingBox(_api=<tweepy.api.API object at 0x7f9c460427f0>, type='Polygon', coordinates=[[[51.2938738, 22.6261387], [56.0175464, 22.6261387], [56.0175464, 25.1639588], [51.2938738, 25.1639588]]]), attributes={})"
16,"These bleak official statistics are seriously underestimating the scale of the country’s tragedy. The figures on Covid infections that the government is releasing are actually an underestimate,Dr Manas Gumta,  ",1386978999918809088,2021-04-27 09:42:17,0,3,"Place(_api=<tweepy.api.API object at 0x7f9c460427f0>, id='00f24ae701a1207b', url='https://api.twitter.com/1.1/geo/id/00f24ae701a1207b.json', place_type='admin', name='Abu Dhabi', full_name='Abu Dhabi, United Arab Emirates', country_code='AE', country='United Arab Emirates', contained_within=[], bounding_box=BoundingBox(_api=<tweepy.api.API object at 0x7f9c460427f0>, type='Polygon', coordinates=[[[51.2938738, 22.6261387], [56.0175464, 22.6261387], [56.0175464, 25.1639588], [51.2938738, 25.1639588]]]), attributes={})"
17,"has helped me on many fronts, especially in mastering the areas of research that I have chosen.Despite the pandemic we are living in, I will walk with my head high knowing that my learning journey never stopped. ",1386974151492079616,2021-04-27 09:23:01,0,0,"Place(_api=<tweepy.api.API object at 0x7f9c460427f0>, id='001907e868d06e24', url='https://api.twitter.com/1.1/geo/id/001907e868d06e24.json', place_type='admin', name='Dubai', full_name='Dubai, United Arab Emirates', country_code='AE', country='United Arab Emirates', contained_within=[], bounding_box=BoundingBox(_api=<tweepy.api.API object at 0x7f9c460427f0>, type='Polygon', coordinates=[[[54.8939725, 24.6182526], [56.2083722, 24.6182526], [56.2083722, 25.3686719], [54.8939725, 25.3686719]]]), attributes={})"
18,"It's shameful and shows the capability your government and positions, No ICU or ICU with ventilator beds option in covid 19 helpline portal. Act now ",1386958913371885569,2021-04-27 08:22:28,0,0,"Place(_api=<tweepy.api.API object at 0x7f9c460427f0>, id='00ecb59b0dad186e', url='https://api.twitter.com/1.1/geo/id/00ecb59b0dad186e.json', place_type='admin', name='Sharjah', full_name='Sharjah, United Arab Emirates', country_code='AE', country='United Arab Emirates', contained_within=[], bounding_box=BoundingBox(_api=<tweepy.api.API object at 0x7f9c460427f0>, type='Polygon', coordinates=[[[55.0091271, 24.7328863], [56.3816989, 24.7328863], [56.3816989, 25.8997649], [55.0091271, 25.8997649]]]), attributes={})"
19,: PM Modi must live up to constitutional duty of saving lives - Mumbai Mirror ,1386945706213117952,2021-04-27 07:29:59,10,2,"Place(_api=<tweepy.api.API object at 0x7f9c460427f0>, id='001907e868d06e24', url='https://api.twitter.com/1.1/geo/id/001907e868d06e24.json', place_type='admin', name='Dubai', full_name='Dubai, United Arab Emirates', country_code='AE', country='United Arab Emirates', contained_within=[], bounding_box=BoundingBox(_api=<tweepy.api.API object at 0x7f9c460427f0>, type='Polygon', coordinates=[[[54.8939725, 24.6182526], [56.2083722, 24.6182526], [56.2083722, 25.3686719], [54.8939725, 25.3686719]]]), attributes={})"
20,Shop   . ,1386941034773377025,2021-04-27 07:11:25,1,4,"Place(_api=<tweepy.api.API object at 0x7f9c460427f0>, id='001907e868d06e24', url='https://api.twitter.com/1.1/geo/id/001907e868d06e24.json', place_type='admin', name='Dubai', full_name='Dubai, United Arab Emirates', country_code='AE', country='United Arab Emirates', contained_within=[], bounding_box=BoundingBox(_api=<tweepy.api.API object at 0x7f9c460427f0>, type='Polygon', coordinates=[[[54.8939725, 24.6182526], [56.2083722, 24.6182526], [56.2083722, 25.3686719], [54.8939725, 25.3686719]]]), attributes={})"
21,Remdesevir is GREAT. CURES Covid COMPLETELY. The 56 CHATI SAGE has SAID SO. The 56 PETI SAGE'S TAIL has SAID SO. DON'T YOU DARE to say otherwise. Yer,1386940230847115264,2021-04-27 07:08:13,0,0,"Place(_api=<tweepy.api.API object at 0x7f9c460427f0>, id='001907e868d06e24', url='https://api.twitter.com/1.1/geo/id/001907e868d06e24.json', place_type='admin', name='Dubai', full_name='Dubai, United Arab Emirates', country_code='AE', country='United Arab Emirates', contained_within=[], bounding_box=BoundingBox(_api=<tweepy.api.API object at 0x7f9c460427f0>, type='Polygon', coordinates=[[[54.8939725, 24.6182526], [56.2083722, 24.6182526], [56.2083722, 25.3686719], [54.8939725, 25.3686719]]]), attributes={})"
22,"4 major Indian religions cremate their dead. Arial shots of cremation grounds look ghoulish even on a normal day, esp to those who bury their dead. Any pre Covid pix of Varanasi's burning ghats for eg looks 'better' than the pix now in circulation. And these are not normal days",1386939069180125186,2021-04-27 07:03:36,1,0,"Place(_api=<tweepy.api.API object at 0x7f9c460427f0>, id='001907e868d06e24', url='https://api.twitter.com/1.1/geo/id/001907e868d06e24.json', place_type='admin', name='Dubai', full_name='Dubai, United Arab Emirates', country_code='AE', country='United Arab Emirates', contained_within=[], bounding_box=BoundingBox(_api=<tweepy.api.API object at 0x7f9c460427f0>, type='Polygon', coordinates=[[[54.8939725, 24.6182526], [56.2083722, 24.6182526], [56.2083722, 25.3686719], [54.8939725, 25.3686719]]]), attributes={})"
23,"HOW I SURVIVED COVID-19 | My CORONAVIRUS recovery, symptoms and self iso...  via",1386932422776926209,2021-04-27 06:37:12,0,0,"Place(_api=<tweepy.api.API object at 0x7f9c460427f0>, id='00f24ae701a1207b', url='https://api.twitter.com/1.1/geo/id/00f24ae701a1207b.json', place_type='admin', name='Abu Dhabi', full_name='Abu Dhabi, United Arab Emirates', country_code='AE', country='United Arab Emirates', contained_within=[], bounding_box=BoundingBox(_api=<tweepy.api.API object at 0x7f9c460427f0>, type='Polygon', coordinates=[[[51.2938738, 22.6261387], [56.0175464, 22.6261387], [56.0175464, 25.1639588], [51.2938738, 25.1639588]]]), attributes={})"
24,"Unfortunately, that’s a result of the abandonment of the international stakeholders. The developing and boor countries didn’t get the needed support in the fight against the pandemic That’s always an easy way for Russia and China to make stronger friendships ",1386919322522693640,2021-04-27 05:45:08,0,0,"Place(_api=<tweepy.api.API object at 0x7f9c460427f0>, id='001907e868d06e24', url='https://api.twitter.com/1.1/geo/id/001907e868d06e24.json', place_type='admin', name='Dubai', full_name='Dubai, United Arab Emirates', country_code='AE', country='United Arab Emirates', contained_within=[], bounding_box=BoundingBox(_api=<tweepy.api.API object at 0x7f9c460427f0>, type='Polygon', coordinates=[[[54.8939725, 24.6182526], [56.2083722, 24.6182526], [56.2083722, 25.3686719], [54.8939725, 25.3686719]]]), attributes={})"
25,Not enough championships due covid since early 2020,1386906636313317376,2021-04-27 04:54:44,1,0,"Place(_api=<tweepy.api.API object at 0x7f9c460427f0>, id='001907e868d06e24', url='https://api.twitter.com/1.1/geo/id/001907e868d06e24.json', place_type='admin', name='Dubai', full_name='Dubai, United Arab Emirates', country_code='AE', country='United Arab Emirates', contained_within=[], bounding_box=BoundingBox(_api=<tweepy.api.API object at 0x7f9c460427f0>, type='Polygon', coordinates=[[[54.8939725, 24.6182526], [56.2083722, 24.6182526], [56.2083722, 25.3686719], [54.8939725, 25.3686719]]]), attributes={})"
26,Covid-19 tips for patients who cannot get to a hospital in India. ,1386902100555206659,2021-04-27 04:36:42,0,0,"Place(_api=<tweepy.api.API object at 0x7f9c460427f0>, id='001907e868d06e24', url='https://api.twitter.com/1.1/geo/id/001907e868d06e24.json', place_type='admin', name='Dubai', full_name='Dubai, United Arab Emirates', country_code='AE', country='United Arab Emirates', contained_within=[], bounding_box=BoundingBox(_api=<tweepy.api.API object at 0x7f9c460427f0>, type='Polygon', coordinates=[[[54.8939725, 24.6182526], [56.2083722, 24.6182526], [56.2083722, 25.3686719], [54.8939725, 25.3686719]]]), attributes={})"
27,People in India and across the world in less wealthy states need Covid vaccines desperately. But the US and its pharmaceutical companies are refusing to relax parents on US made mRNA vaccines. Those actions are creating unnecessary excess death.,1386893782004768768,2021-04-27 04:03:39,32,4,"Place(_api=<tweepy.api.API object at 0x7f9c460427f0>, id='00f24ae701a1207b', url='https://api.twitter.com/1.1/geo/id/00f24ae701a1207b.json', place_type='admin', name='Abu Dhabi', full_name='Abu Dhabi, United Arab Emirates', country_code='AE', country='United Arab Emirates', contained_within=[], bounding_box=BoundingBox(_api=<tweepy.api.API object at 0x7f9c460427f0>, type='Polygon', coordinates=[[[51.2938738, 22.6261387], [56.0175464, 22.6261387], [56.0175464, 25.1639588], [51.2938738, 25.1639588]]]), attributes={})"
28,UAE landmarks light up in support for India during COVID-19 crisis ,1386888202787737601,2021-04-27 03:41:29,0,0,"Place(_api=<tweepy.api.API object at 0x7f9c460427f0>, id='0fc3aa0967547000', url='https://api.twitter.com/1.1/geo/id/0fc3aa0967547000.json', place_type='poi', name='Sheikh Khalifa Medical City (SKMC)', full_name='Sheikh Khalifa Medical City (SKMC)', country_code='AE', country='United Arab Emirates', contained_within=[], bounding_box=BoundingBox(_api=<tweepy.api.API object at 0x7f9c460427f0>, type='Polygon', coordinates=[[[54.3664026260376, 24.47004118242158], [54.3664026260376, 24.47004118242158], [54.3664026260376, 24.47004118242158], [54.3664026260376, 24.47004118242158]]]), attributes={})"
29,", India’s sovereignty cannot be compromised. External forces can be spectators but not participants. Indians know India and should decide for India. Let's remain united as a nation with corona virus .",1386843215802904578,2021-04-27 00:42:43,1,1,"Place(_api=<tweepy.api.API object at 0x7f9c460427f0>, id='00f24ae701a1207b', url='https://api.twitter.com/1.1/geo/id/00f24ae701a1207b.json', place_type='admin', name='Abu Dhabi', full_name='Abu Dhabi, United Arab Emirates', country_code='AE', country='United Arab Emirates', contained_within=[], bounding_box=BoundingBox(_api=<tweepy.api.API object at 0x7f9c460427f0>, type='Polygon', coordinates=[[[51.2938738, 22.6261387], [56.0175464, 22.6261387], [56.0175464, 25.1639588], [51.2938738, 25.1639588]]]), attributes={})"
30,Pray For india There is Situations Covid-19 Is To Bad,1386836649909358597,2021-04-27 00:16:38,1,0,"Place(_api=<tweepy.api.API object at 0x7f9c460427f0>, id='001907e868d06e24', url='https://api.twitter.com/1.1/geo/id/001907e868d06e24.json', place_type='admin', name='Dubai', full_name='Dubai, United Arab Emirates', country_code='AE', country='United Arab Emirates', contained_within=[], bounding_box=BoundingBox(_api=<tweepy.api.API object at 0x7f9c460427f0>, type='Polygon', coordinates=[[[54.8939725, 24.6182526], [56.2083722, 24.6182526], [56.2083722, 25.3686719], [54.8939725, 25.3686719]]]), attributes={})"
31,"Virginia Immigrants Hit Hard By Pandemic Fear Eviction, Housing Squeeze.. ",1386827527583408133,2021-04-26 23:40:23,0,0,"Place(_api=<tweepy.api.API object at 0x7f9c460427f0>, id='00ecb59b0dad186e', url='https://api.twitter.com/1.1/geo/id/00ecb59b0dad186e.json', place_type='admin', name='Sharjah', full_name='Sharjah, United Arab Emirates', country_code='AE', country='United Arab Emirates', contained_within=[], bounding_box=BoundingBox(_api=<tweepy.api.API object at 0x7f9c460427f0>, type='Polygon', coordinates=[[[55.0091271, 24.7328863], [56.3816989, 24.7328863], [56.3816989, 25.8997649], [55.0091271, 25.8997649]]]), attributes={})"
32,BBC News - India Covid: Anger as Twitter ordered to remove critical virus posts ,1386788181207666692,2021-04-26 21:04:02,0,0,"Place(_api=<tweepy.api.API object at 0x7f9c460427f0>, id='001907e868d06e24', url='https://api.twitter.com/1.1/geo/id/001907e868d06e24.json', place_type='admin', name='Dubai', full_name='Dubai, United Arab Emirates', country_code='AE', country='United Arab Emirates', contained_within=[], bounding_box=BoundingBox(_api=<tweepy.api.API object at 0x7f9c460427f0>, type='Polygon', coordinates=[[[54.8939725, 24.6182526], [56.2083722, 24.6182526], [56.2083722, 25.3686719], [54.8939725, 25.3686719]]]), attributes={})"
33,i finish quarantine in 4 days so you bitches enjoy being it till i’m done ,1386788011015237632,2021-04-26 21:03:21,0,0,"Place(_api=<tweepy.api.API object at 0x7f9c460427f0>, id='00f24ae701a1207b', url='https://api.twitter.com/1.1/geo/id/00f24ae701a1207b.json', place_type='admin', name='Abu Dhabi', full_name='Abu Dhabi, United Arab Emirates', country_code='AE', country='United Arab Emirates', contained_within=[], bounding_box=BoundingBox(_api=<tweepy.api.API object at 0x7f9c460427f0>, type='Polygon', coordinates=[[[51.2938738, 22.6261387], [56.0175464, 22.6261387], [56.0175464, 25.1639588], [51.2938738, 25.1639588]]]), attributes={})"
34,Allahamdulillah got first COVID-19 VACCINE DOSE 1,1386781062727041028,2021-04-26 20:35:45,0,0,"Place(_api=<tweepy.api.API object at 0x7f9c460427f0>, id='001907e868d06e24', url='https://api.twitter.com/1.1/geo/id/001907e868d06e24.json', place_type='admin', name='Dubai', full_name='Dubai, United Arab Emirates', country_code='AE', country='United Arab Emirates', contained_within=[], bounding_box=BoundingBox(_api=<tweepy.api.API object at 0x7f9c460427f0>, type='Polygon', coordinates=[[[54.8939725, 24.6182526], [56.2083722, 24.6182526], [56.2083722, 25.3686719], [54.8939725, 25.3686719]]]), attributes={})"
35,"Despite Covid restrictions, Maharashtra earns 15,090 crore through excise revenue ",1386760977425764354,2021-04-26 19:15:56,0,0,"Place(_api=<tweepy.api.API object at 0x7f9c460427f0>, id='001907e868d06e24', url='https://api.twitter.com/1.1/geo/id/001907e868d06e24.json', place_type='admin', name='Dubai', full_name='Dubai, United Arab Emirates', country_code='AE', country='United Arab Emirates', contained_within=[], bounding_box=BoundingBox(_api=<tweepy.api.API object at 0x7f9c460427f0>, type='Polygon', coordinates=[[[54.8939725, 24.6182526], [56.2083722, 24.6182526], [56.2083722, 25.3686719], [54.8939725, 25.3686719]]]), attributes={})"
36,India is really going through it with the 2nd wave of COVID ,1386760220156731394,2021-04-26 19:12:55,1,0,"Place(_api=<tweepy.api.API object at 0x7f9c460427f0>, id='001907e868d06e24', url='https://api.twitter.com/1.1/geo/id/001907e868d06e24.json', place_type='admin', name='Dubai', full_name='Dubai, United Arab Emirates', country_code='AE', country='United Arab Emirates', contained_within=[], bounding_box=BoundingBox(_api=<tweepy.api.API object at 0x7f9c460427f0>, type='Polygon', coordinates=[[[54.8939725, 24.6182526], [56.2083722, 24.6182526], [56.2083722, 25.3686719], [54.8939725, 25.3686719]]]), attributes={})"
