,Tweets,id,date,likes,retweets,place
0,A panel discussion on interprofessional management of COVID patients   ,1368648613002436610,2021-03-07 19:43:52,0,0,"Place(_api=<tweepy.api.API object at 0x7f725a61dcd0>, id='01a4aba930967a19', url='https://api.twitter.com/1.1/geo/id/01a4aba930967a19.json', place_type='admin', name='Ajman', full_name='Ajman, United Arab Emirates', country_code='AE', country='United Arab Emirates', contained_within=[], bounding_box=BoundingBox(_api=<tweepy.api.API object at 0x7f725a61dcd0>, type='Polygon', coordinates=[[[55.4228459, 24.7422387], [56.1015028, 24.7422387], [56.1015028, 25.4513274], [55.4228459, 25.4513274]]]), attributes={})"
1,"Horror story from Latin America: ""The longer the disease is left to fester, the greater the chance new variants will emerge that reduce the effectiveness of Covid-19 vaccines"" ",1368567760960315394,2021-03-07 14:22:35,3,0,"Place(_api=<tweepy.api.API object at 0x7f725a61dcd0>, id='001907e868d06e24', url='https://api.twitter.com/1.1/geo/id/001907e868d06e24.json', place_type='admin', name='Dubai', full_name='Dubai, United Arab Emirates', country_code='AE', country='United Arab Emirates', contained_within=[], bounding_box=BoundingBox(_api=<tweepy.api.API object at 0x7f725a61dcd0>, type='Polygon', coordinates=[[[54.8939725, 24.6182526], [56.2083722, 24.6182526], [56.2083722, 25.3686719], [54.8939725, 25.3686719]]]), attributes={})"
2,"We are here for the Astrazeneca COVID-19 Vaccination at Dialysis Center Al Barsha Dubai, United Arab Emirates. Jab done ",1368552040130052102,2021-03-07 13:20:07,1,0,"Place(_api=<tweepy.api.API object at 0x7f725a61dcd0>, id='001907e868d06e24', url='https://api.twitter.com/1.1/geo/id/001907e868d06e24.json', place_type='admin', name='Dubai', full_name='Dubai, United Arab Emirates', country_code='AE', country='United Arab Emirates', contained_within=[], bounding_box=BoundingBox(_api=<tweepy.api.API object at 0x7f725a61dcd0>, type='Polygon', coordinates=[[[54.8939725, 24.6182526], [56.2083722, 24.6182526], [56.2083722, 25.3686719], [54.8939725, 25.3686719]]]), attributes={})"
3,All of our employees have received the COVID-19 vaccine.,1368523880344809473,2021-03-07 11:28:13,0,0,"Place(_api=<tweepy.api.API object at 0x7f725a61dcd0>, id='001907e868d06e24', url='https://api.twitter.com/1.1/geo/id/001907e868d06e24.json', place_type='admin', name='Dubai', full_name='Dubai, United Arab Emirates', country_code='AE', country='United Arab Emirates', contained_within=[], bounding_box=BoundingBox(_api=<tweepy.api.API object at 0x7f725a61dcd0>, type='Polygon', coordinates=[[[54.8939725, 24.6182526], [56.2083722, 24.6182526], [56.2083722, 25.3686719], [54.8939725, 25.3686719]]]), attributes={})"
4,Perhaps the best ever weekend since covid. And i wish it never ended. Staycation at the Sapitan’s with and the furry friends. ,1368478730016980992,2021-03-07 08:28:48,5,0,"Place(_api=<tweepy.api.API object at 0x7f725a61dcd0>, id='12a6e21415146000', url='https://api.twitter.com/1.1/geo/id/12a6e21415146000.json', place_type='poi', name='Brunch & Cake The Pointe', full_name='Brunch & Cake The Pointe', country_code='AE', country='United Arab Emirates', contained_within=[], bounding_box=BoundingBox(_api=<tweepy.api.API object at 0x7f725a61dcd0>, type='Polygon', coordinates=[[[55.12103763709092, 25.127175295123074], [55.12103763709092, 25.127175295123074], [55.12103763709092, 25.127175295123074], [55.12103763709092, 25.127175295123074]]]), attributes={})"
5,I received the two doses of the COVID-19 vaccine. 28 days had passed and Still I did not receive the (E) letter/ Vaccinated status on Al Hosn app. What do I do”,1368460686334906368,2021-03-07 07:17:07,0,0,"Place(_api=<tweepy.api.API object at 0x7f725a61dcd0>, id='00f24ae701a1207b', url='https://api.twitter.com/1.1/geo/id/00f24ae701a1207b.json', place_type='admin', name='Abu Dhabi', full_name='Abu Dhabi, United Arab Emirates', country_code='AE', country='United Arab Emirates', contained_within=[], bounding_box=BoundingBox(_api=<tweepy.api.API object at 0x7f725a61dcd0>, type='Polygon', coordinates=[[[51.2938738, 22.6261387], [56.0175464, 22.6261387], [56.0175464, 25.1639588], [51.2938738, 25.1639588]]]), attributes={})"
6,2.6 million deaths from COVID-19 world wide,1368456655613100034,2021-03-07 07:01:06,7,1,"Place(_api=<tweepy.api.API object at 0x7f725a61dcd0>, id='00f24ae701a1207b', url='https://api.twitter.com/1.1/geo/id/00f24ae701a1207b.json', place_type='admin', name='Abu Dhabi', full_name='Abu Dhabi, United Arab Emirates', country_code='AE', country='United Arab Emirates', contained_within=[], bounding_box=BoundingBox(_api=<tweepy.api.API object at 0x7f725a61dcd0>, type='Polygon', coordinates=[[[51.2938738, 22.6261387], [56.0175464, 22.6261387], [56.0175464, 25.1639588], [51.2938738, 25.1639588]]]), attributes={})"
7,If only covid impaired our sense of hearing  Only joshing - great to have you back. Dubai is not the same without you. Quiz soon,1368411786689515524,2021-03-07 04:02:48,2,0,"Place(_api=<tweepy.api.API object at 0x7f725a61dcd0>, id='001907e868d06e24', url='https://api.twitter.com/1.1/geo/id/001907e868d06e24.json', place_type='admin', name='Dubai', full_name='Dubai, United Arab Emirates', country_code='AE', country='United Arab Emirates', contained_within=[], bounding_box=BoundingBox(_api=<tweepy.api.API object at 0x7f725a61dcd0>, type='Polygon', coordinates=[[[54.8939725, 24.6182526], [56.2083722, 24.6182526], [56.2083722, 25.3686719], [54.8939725, 25.3686719]]]), attributes={})"
8,Scientists want to know if mouthwash can stop you spreading coronavirus. ,1368403328376438788,2021-03-07 03:29:11,1,0,"Place(_api=<tweepy.api.API object at 0x7f725a61dcd0>, id='001907e868d06e24', url='https://api.twitter.com/1.1/geo/id/001907e868d06e24.json', place_type='admin', name='Dubai', full_name='Dubai, United Arab Emirates', country_code='AE', country='United Arab Emirates', contained_within=[], bounding_box=BoundingBox(_api=<tweepy.api.API object at 0x7f725a61dcd0>, type='Polygon', coordinates=[[[54.8939725, 24.6182526], [56.2083722, 24.6182526], [56.2083722, 25.3686719], [54.8939725, 25.3686719]]]), attributes={})"
9,Be aware that knows there are others ways to pass this $15 rate and you need to pick your battles as the covid package was beyond super urgent ...he's been on office 43 days Calm down,1368279631799988233,2021-03-06 19:17:40,1,0,"Place(_api=<tweepy.api.API object at 0x7f725a61dcd0>, id='001907e868d06e24', url='https://api.twitter.com/1.1/geo/id/001907e868d06e24.json', place_type='admin', name='Dubai', full_name='Dubai, United Arab Emirates', country_code='AE', country='United Arab Emirates', contained_within=[], bounding_box=BoundingBox(_api=<tweepy.api.API object at 0x7f725a61dcd0>, type='Polygon', coordinates=[[[54.8939725, 24.6182526], [56.2083722, 24.6182526], [56.2083722, 25.3686719], [54.8939725, 25.3686719]]]), attributes={})"
10,"You are cheating Shobhaa, how come you got COVID-19 jab at 40, I am 43 ",1368233896236748805,2021-03-06 16:15:56,0,0,"Place(_api=<tweepy.api.API object at 0x7f725a61dcd0>, id='00f24ae701a1207b', url='https://api.twitter.com/1.1/geo/id/00f24ae701a1207b.json', place_type='admin', name='Abu Dhabi', full_name='Abu Dhabi, United Arab Emirates', country_code='AE', country='United Arab Emirates', contained_within=[], bounding_box=BoundingBox(_api=<tweepy.api.API object at 0x7f725a61dcd0>, type='Polygon', coordinates=[[[51.2938738, 22.6261387], [56.0175464, 22.6261387], [56.0175464, 25.1639588], [51.2938738, 25.1639588]]]), attributes={})"
11,"Another example why we need a rational informed debate. Large cohort of MD’s around the world who argue, based on medical studies for increased dosages of Vitamin D to counteract Covid by strengthening immune system. Yet this report doesn’t mention any and simply suggests 400 IUD ",1368164239718940677,2021-03-06 11:39:08,0,0,"Place(_api=<tweepy.api.API object at 0x7f725a61dcd0>, id='00f24ae701a1207b', url='https://api.twitter.com/1.1/geo/id/00f24ae701a1207b.json', place_type='admin', name='Abu Dhabi', full_name='Abu Dhabi, United Arab Emirates', country_code='AE', country='United Arab Emirates', contained_within=[], bounding_box=BoundingBox(_api=<tweepy.api.API object at 0x7f725a61dcd0>, type='Polygon', coordinates=[[[51.2938738, 22.6261387], [56.0175464, 22.6261387], [56.0175464, 25.1639588], [51.2938738, 25.1639588]]]), attributes={})"
12,"These numbers tell a very different story than the conventional one that we all hear. Disconcertingly, both sides of this important debate are speaking past each other. Can’t we have some kind of Covid Forum where these stats are discussed rationally ",1368139780337377282,2021-03-06 10:01:57,1,0,"Place(_api=<tweepy.api.API object at 0x7f725a61dcd0>, id='00f24ae701a1207b', url='https://api.twitter.com/1.1/geo/id/00f24ae701a1207b.json', place_type='admin', name='Abu Dhabi', full_name='Abu Dhabi, United Arab Emirates', country_code='AE', country='United Arab Emirates', contained_within=[], bounding_box=BoundingBox(_api=<tweepy.api.API object at 0x7f725a61dcd0>, type='Polygon', coordinates=[[[51.2938738, 22.6261387], [56.0175464, 22.6261387], [56.0175464, 25.1639588], [51.2938738, 25.1639588]]]), attributes={})"
13,Increase in Diagnosis of Node-Positive and Stage III Breast Cancer After Screening Interruption Due to the COVID-19 Pandemic - ,1368126649867247619,2021-03-06 09:09:46,4,1,"Place(_api=<tweepy.api.API object at 0x7f725a61dcd0>, id='001907e868d06e24', url='https://api.twitter.com/1.1/geo/id/001907e868d06e24.json', place_type='admin', name='Dubai', full_name='Dubai, United Arab Emirates', country_code='AE', country='United Arab Emirates', contained_within=[], bounding_box=BoundingBox(_api=<tweepy.api.API object at 0x7f725a61dcd0>, type='Polygon', coordinates=[[[54.8939725, 24.6182526], [56.2083722, 24.6182526], [56.2083722, 25.3686719], [54.8939725, 25.3686719]]]), attributes={})"
14,Two young moms passed away due to covid. My heart breaks over their children.. to lose their mothers so early. One is even an infant who probably never got to be in his mother’s arms.,1368086322796257281,2021-03-06 06:29:31,0,0,"Place(_api=<tweepy.api.API object at 0x7f725a61dcd0>, id='00ecb59b0dad186e', url='https://api.twitter.com/1.1/geo/id/00ecb59b0dad186e.json', place_type='admin', name='Sharjah', full_name='Sharjah, United Arab Emirates', country_code='AE', country='United Arab Emirates', contained_within=[], bounding_box=BoundingBox(_api=<tweepy.api.API object at 0x7f725a61dcd0>, type='Polygon', coordinates=[[[55.0091271, 24.7328863], [56.3816989, 24.7328863], [56.3816989, 25.8997649], [55.0091271, 25.8997649]]]), attributes={})"
15,Why couldn't the nurse ATLEAST be on her Full PPEs SADLY NO hand groves either I thought it's a norm pre and post covid when giving injection to have latex gloves on  Or it's because it's no need to protect both himself and the nurse ,1368074608616878080,2021-03-06 05:42:58,0,0,"Place(_api=<tweepy.api.API object at 0x7f725a61dcd0>, id='001907e868d06e24', url='https://api.twitter.com/1.1/geo/id/001907e868d06e24.json', place_type='admin', name='Dubai', full_name='Dubai, United Arab Emirates', country_code='AE', country='United Arab Emirates', contained_within=[], bounding_box=BoundingBox(_api=<tweepy.api.API object at 0x7f725a61dcd0>, type='Polygon', coordinates=[[[54.8939725, 24.6182526], [56.2083722, 24.6182526], [56.2083722, 25.3686719], [54.8939725, 25.3686719]]]), attributes={})"
16,"Yes, cause there is no other option, and their chances if they got hit with COVID is way lesser than younger ages, in addition no harm comes from taking the Vaccine and it was proven by experience in lots of countries.",1367968067687309312,2021-03-05 22:39:37,1,0,"Place(_api=<tweepy.api.API object at 0x7f725a61dcd0>, id='00f24ae701a1207b', url='https://api.twitter.com/1.1/geo/id/00f24ae701a1207b.json', place_type='admin', name='Abu Dhabi', full_name='Abu Dhabi, United Arab Emirates', country_code='AE', country='United Arab Emirates', contained_within=[], bounding_box=BoundingBox(_api=<tweepy.api.API object at 0x7f725a61dcd0>, type='Polygon', coordinates=[[[51.2938738, 22.6261387], [56.0175464, 22.6261387], [56.0175464, 25.1639588], [51.2938738, 25.1639588]]]), attributes={})"
17,Be turning up inside Covid sho gbo ,1367954452553097218,2021-03-05 21:45:31,0,0,"Place(_api=<tweepy.api.API object at 0x7f725a61dcd0>, id='001907e868d06e24', url='https://api.twitter.com/1.1/geo/id/001907e868d06e24.json', place_type='admin', name='Dubai', full_name='Dubai, United Arab Emirates', country_code='AE', country='United Arab Emirates', contained_within=[], bounding_box=BoundingBox(_api=<tweepy.api.API object at 0x7f725a61dcd0>, type='Polygon', coordinates=[[[54.8939725, 24.6182526], [56.2083722, 24.6182526], [56.2083722, 25.3686719], [54.8939725, 25.3686719]]]), attributes={})"
18,I Ask Onething to Everyone I Have One Doubt We Were Wearing The Corona Mask Only Covered  Only But Not Cover Ear. Ear Too Having Two Holes Is There Why Corona Virus Not Going Through Ear. Let's Think About  it,1367931276796305408,2021-03-05 20:13:25,1,0,"Place(_api=<tweepy.api.API object at 0x7f725a61dcd0>, id='001907e868d06e24', url='https://api.twitter.com/1.1/geo/id/001907e868d06e24.json', place_type='admin', name='Dubai', full_name='Dubai, United Arab Emirates', country_code='AE', country='United Arab Emirates', contained_within=[], bounding_box=BoundingBox(_api=<tweepy.api.API object at 0x7f725a61dcd0>, type='Polygon', coordinates=[[[54.8939725, 24.6182526], [56.2083722, 24.6182526], [56.2083722, 25.3686719], [54.8939725, 25.3686719]]]), attributes={})"
19,"We got to be super careful still .... pls everyone make sure to wear mask and avoid public gatherings , PDM has taken big step to prevent spread of Covid and have decided not to come in NA session ",1367931066217029642,2021-03-05 20:12:35,2,0,"Place(_api=<tweepy.api.API object at 0x7f725a61dcd0>, id='001907e868d06e24', url='https://api.twitter.com/1.1/geo/id/001907e868d06e24.json', place_type='admin', name='Dubai', full_name='Dubai, United Arab Emirates', country_code='AE', country='United Arab Emirates', contained_within=[], bounding_box=BoundingBox(_api=<tweepy.api.API object at 0x7f725a61dcd0>, type='Polygon', coordinates=[[[54.8939725, 24.6182526], [56.2083722, 24.6182526], [56.2083722, 25.3686719], [54.8939725, 25.3686719]]]), attributes={})"
20,"Don’t see plummeting education standards, highest drug-related deaths in Europe, COVID care homes catastrophe, and the like on those stairs. It’s amazing the ways you can spin things to make yourself sound good if you try.",1367910091723276289,2021-03-05 18:49:15,0,0,"Place(_api=<tweepy.api.API object at 0x7f725a61dcd0>, id='001907e868d06e24', url='https://api.twitter.com/1.1/geo/id/001907e868d06e24.json', place_type='admin', name='Dubai', full_name='Dubai, United Arab Emirates', country_code='AE', country='United Arab Emirates', contained_within=[], bounding_box=BoundingBox(_api=<tweepy.api.API object at 0x7f725a61dcd0>, type='Polygon', coordinates=[[[54.8939725, 24.6182526], [56.2083722, 24.6182526], [56.2083722, 25.3686719], [54.8939725, 25.3686719]]]), attributes={})"
21,"WE’RE BRINGING A UNIQUE GAMING EXPERIENCE TO DUBAI⁣ ⁣ Dubai EStars is the first gaming event of its kind in the region We’re hosting a Fortnite Solo’s tournament, with a unique twist ⁣ ⁣ Meet our special guests and compete in a covid safe environment. ",1367887175665205248,2021-03-05 17:18:11,0,0,"Place(_api=<tweepy.api.API object at 0x7f725a61dcd0>, id='001907e868d06e24', url='https://api.twitter.com/1.1/geo/id/001907e868d06e24.json', place_type='admin', name='Dubai', full_name='Dubai, United Arab Emirates', country_code='AE', country='United Arab Emirates', contained_within=[], bounding_box=BoundingBox(_api=<tweepy.api.API object at 0x7f725a61dcd0>, type='Polygon', coordinates=[[[54.8939725, 24.6182526], [56.2083722, 24.6182526], [56.2083722, 25.3686719], [54.8939725, 25.3686719]]]), attributes={})"
22,friends during covid are like leaves in the fall,1367886507323707393,2021-03-05 17:15:32,0,0,"Place(_api=<tweepy.api.API object at 0x7f725a61dcd0>, id='00ecb59b0dad186e', url='https://api.twitter.com/1.1/geo/id/00ecb59b0dad186e.json', place_type='admin', name='Sharjah', full_name='Sharjah, United Arab Emirates', country_code='AE', country='United Arab Emirates', contained_within=[], bounding_box=BoundingBox(_api=<tweepy.api.API object at 0x7f725a61dcd0>, type='Polygon', coordinates=[[[55.0091271, 24.7328863], [56.3816989, 24.7328863], [56.3816989, 25.8997649], [55.0091271, 25.8997649]]]), attributes={})"
23,"He missed one game in two seasons for Wolves, played superb stuff there. Unfortunately he started poor at spurs, got Covid and hasn’t rediscovered the form from wolves. He also played RWB in a back 5 there..clearly his confidence is shot, but there is a very good player in there",1367846516975632386,2021-03-05 14:36:37,0,0,"Place(_api=<tweepy.api.API object at 0x7f725a61dcd0>, id='001907e868d06e24', url='https://api.twitter.com/1.1/geo/id/001907e868d06e24.json', place_type='admin', name='Dubai', full_name='Dubai, United Arab Emirates', country_code='AE', country='United Arab Emirates', contained_within=[], bounding_box=BoundingBox(_api=<tweepy.api.API object at 0x7f725a61dcd0>, type='Polygon', coordinates=[[[54.8939725, 24.6182526], [56.2083722, 24.6182526], [56.2083722, 25.3686719], [54.8939725, 25.3686719]]]), attributes={})"
24, Subscribe to our channel for more interesting videos,1367778955923689473,2021-03-05 10:08:09,0,0,"Place(_api=<tweepy.api.API object at 0x7f725a61dcd0>, id='00ecb59b0dad186e', url='https://api.twitter.com/1.1/geo/id/00ecb59b0dad186e.json', place_type='admin', name='Sharjah', full_name='Sharjah, United Arab Emirates', country_code='AE', country='United Arab Emirates', contained_within=[], bounding_box=BoundingBox(_api=<tweepy.api.API object at 0x7f725a61dcd0>, type='Polygon', coordinates=[[[55.0091271, 24.7328863], [56.3816989, 24.7328863], [56.3816989, 25.8997649], [55.0091271, 25.8997649]]]), attributes={})"
25,Thank God sense has prevailed. The rest of the world unsubscribed to the corona nonsense a while back.,1367736317887545344,2021-03-05 07:18:44,3,0,"Place(_api=<tweepy.api.API object at 0x7f725a61dcd0>, id='001907e868d06e24', url='https://api.twitter.com/1.1/geo/id/001907e868d06e24.json', place_type='admin', name='Dubai', full_name='Dubai, United Arab Emirates', country_code='AE', country='United Arab Emirates', contained_within=[], bounding_box=BoundingBox(_api=<tweepy.api.API object at 0x7f725a61dcd0>, type='Polygon', coordinates=[[[54.8939725, 24.6182526], [56.2083722, 24.6182526], [56.2083722, 25.3686719], [54.8939725, 25.3686719]]]), attributes={})"
26,team up on vaccine distribution | Article [AMP] | Reuters ,1367734564030910464,2021-03-05 07:11:46,0,0,"Place(_api=<tweepy.api.API object at 0x7f725a61dcd0>, id='001907e868d06e24', url='https://api.twitter.com/1.1/geo/id/001907e868d06e24.json', place_type='admin', name='Dubai', full_name='Dubai, United Arab Emirates', country_code='AE', country='United Arab Emirates', contained_within=[], bounding_box=BoundingBox(_api=<tweepy.api.API object at 0x7f725a61dcd0>, type='Polygon', coordinates=[[[54.8939725, 24.6182526], [56.2083722, 24.6182526], [56.2083722, 25.3686719], [54.8939725, 25.3686719]]]), attributes={})"
27,"""The W.H.O. mission, as with everything involving China and the coronavirus, has been political from the start"" ",1367728722128863232,2021-03-05 06:48:33,1,0,"Place(_api=<tweepy.api.API object at 0x7f725a61dcd0>, id='001907e868d06e24', url='https://api.twitter.com/1.1/geo/id/001907e868d06e24.json', place_type='admin', name='Dubai', full_name='Dubai, United Arab Emirates', country_code='AE', country='United Arab Emirates', contained_within=[], bounding_box=BoundingBox(_api=<tweepy.api.API object at 0x7f725a61dcd0>, type='Polygon', coordinates=[[[54.8939725, 24.6182526], [56.2083722, 24.6182526], [56.2083722, 25.3686719], [54.8939725, 25.3686719]]]), attributes={})"
28,School Closures Have Failed America’s Children ,1367720785847189505,2021-03-05 06:17:01,0,0,"Place(_api=<tweepy.api.API object at 0x7f725a61dcd0>, id='001907e868d06e24', url='https://api.twitter.com/1.1/geo/id/001907e868d06e24.json', place_type='admin', name='Dubai', full_name='Dubai, United Arab Emirates', country_code='AE', country='United Arab Emirates', contained_within=[], bounding_box=BoundingBox(_api=<tweepy.api.API object at 0x7f725a61dcd0>, type='Polygon', coordinates=[[[54.8939725, 24.6182526], [56.2083722, 24.6182526], [56.2083722, 25.3686719], [54.8939725, 25.3686719]]]), attributes={})"
29,No surprises here - COVID vaccine Hunger Games have began. ,1367685298855890951,2021-03-05 03:56:00,0,0,"Place(_api=<tweepy.api.API object at 0x7f725a61dcd0>, id='001907e868d06e24', url='https://api.twitter.com/1.1/geo/id/001907e868d06e24.json', place_type='admin', name='Dubai', full_name='Dubai, United Arab Emirates', country_code='AE', country='United Arab Emirates', contained_within=[], bounding_box=BoundingBox(_api=<tweepy.api.API object at 0x7f725a61dcd0>, type='Polygon', coordinates=[[[54.8939725, 24.6182526], [56.2083722, 24.6182526], [56.2083722, 25.3686719], [54.8939725, 25.3686719]]]), attributes={})"
30,"Hidden coronavirus toll: ""the longer a crisis lasts, the higher the chances potential births never happen"" in advanced countries ",1367560661962735619,2021-03-04 19:40:44,0,0,"Place(_api=<tweepy.api.API object at 0x7f725a61dcd0>, id='001907e868d06e24', url='https://api.twitter.com/1.1/geo/id/001907e868d06e24.json', place_type='admin', name='Dubai', full_name='Dubai, United Arab Emirates', country_code='AE', country='United Arab Emirates', contained_within=[], bounding_box=BoundingBox(_api=<tweepy.api.API object at 0x7f725a61dcd0>, type='Polygon', coordinates=[[[54.8939725, 24.6182526], [56.2083722, 24.6182526], [56.2083722, 25.3686719], [54.8939725, 25.3686719]]]), attributes={})"
31,Can’t remember the last time I’ve been to a proper restaurant.,1367537921193050114,2021-03-04 18:10:22,0,0,"Place(_api=<tweepy.api.API object at 0x7f725a61dcd0>, id='00f24ae701a1207b', url='https://api.twitter.com/1.1/geo/id/00f24ae701a1207b.json', place_type='admin', name='Abu Dhabi', full_name='Abu Dhabi, United Arab Emirates', country_code='AE', country='United Arab Emirates', contained_within=[], bounding_box=BoundingBox(_api=<tweepy.api.API object at 0x7f725a61dcd0>, type='Polygon', coordinates=[[[51.2938738, 22.6261387], [56.0175464, 22.6261387], [56.0175464, 25.1639588], [51.2938738, 25.1639588]]]), attributes={})"
32,New thing is an optional COVID statement in portfolios for tenure/reappointment review.,1367511126292918276,2021-03-04 16:23:54,3,0,"Place(_api=<tweepy.api.API object at 0x7f725a61dcd0>, id='00f24ae701a1207b', url='https://api.twitter.com/1.1/geo/id/00f24ae701a1207b.json', place_type='admin', name='Abu Dhabi', full_name='Abu Dhabi, United Arab Emirates', country_code='AE', country='United Arab Emirates', contained_within=[], bounding_box=BoundingBox(_api=<tweepy.api.API object at 0x7f725a61dcd0>, type='Polygon', coordinates=[[[51.2938738, 22.6261387], [56.0175464, 22.6261387], [56.0175464, 25.1639588], [51.2938738, 25.1639588]]]), attributes={})"
33,Covid: What Chinese officials knew about coronavirus... and what they to...  via,1367492047301709835,2021-03-04 15:08:05,0,0,"Place(_api=<tweepy.api.API object at 0x7f725a61dcd0>, id='001907e868d06e24', url='https://api.twitter.com/1.1/geo/id/001907e868d06e24.json', place_type='admin', name='Dubai', full_name='Dubai, United Arab Emirates', country_code='AE', country='United Arab Emirates', contained_within=[], bounding_box=BoundingBox(_api=<tweepy.api.API object at 0x7f725a61dcd0>, type='Polygon', coordinates=[[[54.8939725, 24.6182526], [56.2083722, 24.6182526], [56.2083722, 25.3686719], [54.8939725, 25.3686719]]]), attributes={})"
