,Tweets,id,date,likes,retweets,place
0,My husband has decided to use the 10 day uk hotel quarantine to stop smoking. There better be a mini bar,1399309805593022468,2021-05-31 10:20:30,1,0,"Place(_api=<tweepy.api.API object at 0x7fda63b507f0>, id='001907e868d06e24', url='https://api.twitter.com/1.1/geo/id/001907e868d06e24.json', place_type='admin', name='Dubai', full_name='Dubai, United Arab Emirates', country_code='AE', country='United Arab Emirates', contained_within=[], bounding_box=BoundingBox(_api=<tweepy.api.API object at 0x7fda63b507f0>, type='Polygon', coordinates=[[[54.8939725, 24.6182526], [56.2083722, 24.6182526], [56.2083722, 25.3686719], [54.8939725, 25.3686719]]]), attributes={})"
1,member of Mensa so above my head . Your point on the date  saying it’s ridiculous to wear mask when you feel more comfortable and might get close to others  Had my 2nd jab Jan. Caught Covid March . Can’t think but possibly from touching surface and then face . Was quite sick,1399304122290089985,2021-05-31 09:57:55,0,0,"Place(_api=<tweepy.api.API object at 0x7fda63b507f0>, id='001907e868d06e24', url='https://api.twitter.com/1.1/geo/id/001907e868d06e24.json', place_type='admin', name='Dubai', full_name='Dubai, United Arab Emirates', country_code='AE', country='United Arab Emirates', contained_within=[], bounding_box=BoundingBox(_api=<tweepy.api.API object at 0x7fda63b507f0>, type='Polygon', coordinates=[[[54.8939725, 24.6182526], [56.2083722, 24.6182526], [56.2083722, 25.3686719], [54.8939725, 25.3686719]]]), attributes={})"
2,"Be safe today, for a safer tomorrow. Even if lockdown is being relaxed. seriously take care of, Covid Appropriate Behaviour. If you follow these measures, there shall be no third wave. Take vaccination at your first opportunity. All the best.",1399300901416865796,2021-05-31 09:45:07,0,0,"Place(_api=<tweepy.api.API object at 0x7fda63b507f0>, id='07d9f6930b480000', url='https://api.twitter.com/1.1/geo/id/07d9f6930b480000.json', place_type='poi', name='Garhoud Park', full_name='Garhoud Park', country_code='AE', country='United Arab Emirates', contained_within=[], bounding_box=BoundingBox(_api=<tweepy.api.API object at 0x7fda63b507f0>, type='Polygon', coordinates=[[[55.34918009160051, 25.24084950616856], [55.34918009160051, 25.24084950616856], [55.34918009160051, 25.24084950616856], [55.34918009160051, 25.24084950616856]]]), attributes={})"
3,Scroll to 9 mins and see the affect of Covid on a healthy 45 year old who is now in a coma. Get the vaccine. - watch this and let me know what you think. ,1399298394795958274,2021-05-31 09:35:09,1,2,"Place(_api=<tweepy.api.API object at 0x7fda63b507f0>, id='001907e868d06e24', url='https://api.twitter.com/1.1/geo/id/001907e868d06e24.json', place_type='admin', name='Dubai', full_name='Dubai, United Arab Emirates', country_code='AE', country='United Arab Emirates', contained_within=[], bounding_box=BoundingBox(_api=<tweepy.api.API object at 0x7fda63b507f0>, type='Polygon', coordinates=[[[54.8939725, 24.6182526], [56.2083722, 24.6182526], [56.2083722, 25.3686719], [54.8939725, 25.3686719]]]), attributes={})"
4,"The corporate world has never been so different. As we continue to optimize and orient ourselves to the new-normal, instigated by covid, adapting to the processes which have changed is important. What would you work for in a ",1399293688161861633,2021-05-31 09:16:27,0,0,"Place(_api=<tweepy.api.API object at 0x7fda63b507f0>, id='001907e868d06e24', url='https://api.twitter.com/1.1/geo/id/001907e868d06e24.json', place_type='admin', name='Dubai', full_name='Dubai, United Arab Emirates', country_code='AE', country='United Arab Emirates', contained_within=[], bounding_box=BoundingBox(_api=<tweepy.api.API object at 0x7fda63b507f0>, type='Polygon', coordinates=[[[54.8939725, 24.6182526], [56.2083722, 24.6182526], [56.2083722, 25.3686719], [54.8939725, 25.3686719]]]), attributes={})"
5,of sharing best practices in to get out of and manage the ,1399289423762800641,2021-05-31 08:59:30,1,0,"Place(_api=<tweepy.api.API object at 0x7fda63b507f0>, id='001907e868d06e24', url='https://api.twitter.com/1.1/geo/id/001907e868d06e24.json', place_type='admin', name='Dubai', full_name='Dubai, United Arab Emirates', country_code='AE', country='United Arab Emirates', contained_within=[], bounding_box=BoundingBox(_api=<tweepy.api.API object at 0x7fda63b507f0>, type='Polygon', coordinates=[[[54.8939725, 24.6182526], [56.2083722, 24.6182526], [56.2083722, 25.3686719], [54.8939725, 25.3686719]]]), attributes={})"
